해석례일련번호,구분,문장번호,내용
328579,질의요지,1,"「건축법」이 2019년 4월 23일 법률 제16380호로 개정(이하 “개정 건축법”이라 함)되면서 소규모주택1)1)「건축법」 제80조제1항 각 호 외의 부분 단서에 따라 이행강제금의 감경 대상이 되는 건축물을 말하며, 이하 같음.에 대한 이행강제금의 총 부과 횟수를 5회의 범위에서 조례로 정할 수 있도록 한 종전의 제80조제5항 단서 부분이 삭제되었는바, 개정 건축법 제80조제5항이 시행된 2019년 4월 23일부터 소규모주택에 대한 이행강제금의 총 부과 횟수를 제한하던 지방자치단체의 조례가 개정되어 시행된 날까지의 기간 중에 소규모주택에 대해 최초로 부과된 이행강제금의 경우 총 부과 횟수가 제한되는지?2)2)개정 건축법 시행 후에도 소규모주택에 대한 이행강제금의 총 부과 횟수를 제한하는 종전 조례 규정이 상당기간 계속 시행되다가 나중에 개정 건축법의 내용과 동일하게 조례가 개정된 경우를 전제함."
328579,질의요지,2,< 질의 배경 >
328579,질의요지,3,민원인은 위 질의요지에 대해 국토교통부로부터 개정 건축법 시행 후에 최초로 이행강제금이 부과되었으므로 총 부과 횟수가 제한되지 않는다는 답변을 받자 이에 이견이 있어 법제처에 법령해석을 요청함.
328579,회답,4,이 사안의 경우 이행강제금의 총 부과 횟수가 제한되지 않습니다.
328579,이유,5,"2019년 4월 23일 법률 제16380호로 개정되기 전의 「건축법」(이하 “구 건축법”이라 함)제80조제5항에서는 허가권자는 최초의 시정명령이 있었던 날을 기준으로 1년에 2회 이내의 범위에서 조례로 정하는 횟수만큼 그 시정명령이 이행될 때까지 반복하여 같은 조 제1항 및 제2항에 따른 이행강제금을 부과&8228;징수할 수 있도록 하면서(본문), 같은 조 제1항 각 호 외의 부분 단서에 해당하면 총 부과 횟수가 5회를 넘지 않는 범위에서 조례로 부과 횟수를 따로 정할 수 있도록 규정하여(단서), 소규모주택에 대해서는 이행강제금의 총 부과 횟수를 5회를 넘지 않는 범위에서 조례로 정할 수 있도록 위임하고 있었습니다."
328579,이유,6,"그런데 소규모주택에 대한 이행강제금의 수위가 낮아 불법 건축물의 건축주등3)3)건축물의 건축주ㆍ공사시공자ㆍ현장관리인ㆍ소유자ㆍ관리자 또는 점유자를 말하며, 이하 같음.이 시정명령을 이행하기보다 이행강제금을 내며 위법 상태를 지속하는 문제가 있자,4)4)「건축법」이 2019.4.23."
328579,이유,7,법률 제16380호로 개정될 당시 국회 국토교통위원회 검토보고서(의안번호 제2015532호 관련)참조
328579,이유,8,"「건축법」이 2019년 4월 23일 법률 제16380호로 개정되면서 제80조제1항 각 호 외의 부분 단서에 따른 소규모주택의 규모를 축소하고, 소규모주택에 대한 이행강제금의 총 부과 횟수를 제한하던 구 건축법 제80조제5항 단서를 삭제하여 소규모주택에 대해서도 시정명령이 이행될 때까지 이행강제금을 총 부과 횟수의 제한 없이 계속 부과할 수 있도록 하였으며, 부칙 제3조에서는 이미 구 건축법 규정에 따라 이행강제금을 부과 받던 대상자의 신뢰를 보호하고자5)5)「건축법」이 2019.4.23."
328579,이유,9,법률 제16380호로 개정될 당시 국회 법제사법위원회 체계자구검토보고서 참조
328579,이유,10,같은 법 시행 전 종전의 규정에 따라 부과되고 있는 이행강제금에 대해 제80조제5항의 개정규정에도 불구하고 종전의 규정에 따르도록 경과규정을 두었습니다.
328579,이유,11,"그렇다면 이 사안과 같이 2019년 4월 23일 이후에 최초로 부과된 이행강제금은 개정 건축법 부칙 제3조의 경과규정의 적용 대상에 해당하지 않는 것이 문언상 명백하므로, 이행강제금 부과 처분 당시 시행 중인 개정 건축법 제80조제5항에 따라 이행강제금의 총 부과 횟수가 제한되지 않습니다."
328579,이유,12,"또한 개정 건축법 제80조제5항에서는 건축물 종류의 제한 없이 “시정명령이 이행될 때까지” 반복하여 이행강제금을 부과&8228;징수할 수 있도록 하면서 1년에 2회 이내의 범위에서 부과할 수 있는 이행강제금의 횟수에 대해서만 조례에 위임하고 있을 뿐이므로, 이 사안과 같이 개정 건축법이 시행되었음에도 불구하고 구 건축법 제80조제5항 단서에 따라 소규모주택에 대한 이행강제금의 총 부과 횟수를 제한하던 조례가 개정되지 않은 경우 해당 조례의 규정은 법률의 위임이 없는 사항을 정한 것6)6)대법원 2012.11.22."
328579,이유,13,"선고 2010두19270 판결례 참조.인바, 이를 근거로 이행강제금의 총 부과 횟수가 제한된다고 볼 수는 없습니다."
328579,이유,14,구 「건축법」(2019.4.23.
328579,이유,15,"법률 제16380호로 개정되기 전의 것을 말함)제80조(이행강제금)① 허가권자는 제79조제1항에 따라 시정명령을 받은 후 시정기간 내에 시정명령을 이행하지 아니한 건축주등에 대하여는 그 시정명령의 이행에 필요한 상당한 이행기한을 정하여 그 기한까지 시정명령을 이행하지 아니하면 다음 각 호의 이행강제금을 부과한다.다만, 연면적(공동주택의 경우에는 세대 면적을 기준으로 한다)이 85제곱미터 이하인 주거용 건축물과 제2호 중 주거용 건축물로서 대통령령으로 정하는 경우에는 다음 각 호의 어느 하나에 해당하는 금액의 2분의 1의 범위에서 해당 지방자치단체의 조례로 정하는 금액을 부과한다.1.～ 2.(생  략)② ～ ④ (생  략)⑤ 허가권자는 최초의 시정명령이 있었던 날을 기준으로 하여 1년에 2회 이내의 범위에서 해당 지방자치단체의 조례로 정하는 횟수만큼 그 시정명령이 이행될 때까지 반복하여 제1항 및 제2항에 따른 이행강제금을 부과ㆍ징수할 수 있다.다만, 제1항 각 호 외의 부분 단서에 해당하면 총 부과 횟수가 5회를 넘지 아니하는 범위에서 해당 지방자치단체의 조례로 부과 횟수를 따로 정할 수 있다.⑥&8228;⑦ (생  략)"
328579,이유,16,개정 「건축법」(2019.4.23.
328579,이유,17,"법률 제16380호로 개정된 것을 말함)제80조(이행강제금)① 허가권자는 제79조제1항에 따라 시정명령을 받은 후 시정기간 내에 시정명령을 이행하지 아니한 건축주등에 대하여는 그 시정명령의 이행에 필요한 상당한 이행기한을 정하여 그 기한까지 시정명령을 이행하지 아니하면 다음 각 호의 이행강제금을 부과한다.다만, 연면적(공동주택의 경우에는 세대 면적을 기준으로 한다)이 60제곱미터 이하인 주거용 건축물과 제2호 중 주거용 건축물로서 대통령령으로 정하는 경우에는 다음 각 호의 어느 하나에 해당하는 금액의 2분의 1의 범위에서 해당 지방자치단체의 조례로 정하는 금액을 부과한다.1.～ 2.(생  략)② &12316; ④ (생  략)⑤ 허가권자는 최초의 시정명령이 있었던 날을 기준으로 하여 1년에 2회 이내의 범위에서 해당 지방자치단체의 조례로 정하는 횟수만큼 그 시정명령이 이행될 때까지 반복하여 제1항 및 제2항에 따른 이행강제금을 부과·징수할 수 있다.⑥&8228;⑦ (생  략)"
328579,이유,18,"부  칙  <제16380호, 2019.4.23.>"
328579,이유,19,"제1조(시행일)이 법은 공포 후 6개월이 경과한 날부터 시행한다.다만, 제80조제1항ㆍ제2항 및 제5항의 개정규정은 공포한 날부터 시행하고, 제79조제1항ㆍ제5항 및 제6항의 개정규정은 공포 후 1년이 경과한 날부터 시행한다.제3조(이행강제금 부과에 관한 경과조치)이 법 시행 전 종전의 규정에 따라 부과되고 있는 이행강제금에 대하여는 제80조제1항ㆍ제2항 및 제5항의 개정규정에도 불구하고 종전의 규정에 따른다.<관계 법령>"
