해석례일련번호,구분,문장번호,내용
327503,질의요지,1,"갑과 을이 각각 소유하는 토지에 대해 「국토의 계획 및 이용에 관한 법률」(이하 “국토계획법”이라 함)제56조제1항에 따라 갑과 을의 공동명의로 하나의 개발행위허가를 받았으나 을이 공동명의를 단독명의로 변경하고 갑 소유의 토지를 제외하는 내용으로 개발행위허가를 받은 사항을 변경하기 위해 같은 조 제2항 본문에 따른 허가를 받으려는 경우, 을은 갑의 동의를 받아야 하는지?"
327503,질의요지,2,< 질의 배경 >
327503,질의요지,3,국토교통부에서는 위 질의요지에 대한 민원이 지속적으로 제기되자 이를 명확히 하기 위해 법제처에 법령해석을 요청함.
327503,회답,4,이 사안의 경우 을은 갑의 동의를 받아야 합니다.
327503,이유,5,"국토계획법 제56조제1항에서는 건축물의 건축 및 토지의 형질변경 등 각 호의 개발행위를 하려는 자는 특별시장ㆍ광역시장ㆍ특별자치시장ㆍ특별자치도지사ㆍ시장 또는 군수로부터 개발행위허가를 받아야 한다고 규정하고 있고, 같은 조 제2항 본문에서는 개발행위허가를 받은 사항을 변경하는 경우에는 같은 조 제1항을 준용한다고 규정하고 있는바, 개발행위허가의 변경은 개발행위허가를 받은 자가 허가 받은 사항을 변경하려는 것이므로 변경허가를 받으려는 주체는 허가를 받은 주체와 동일할 것이 전제됩니다."
327503,이유,6,그리고 국토계획법 제56조제1항에 따라 공동명의로 받은 하나의 개발행위허가는 개발행위라는 단일한 목적을 달성하기 위한 것으로서 그 허가를 받은 지위의 분할은 불가능1)1)대법원 2015.9.10.
327503,이유,7,선고 2012다23863 판결례 참조
327503,이유,8,"하고, 해당 개발행위허가의 효과가 공동명의를 구성하는 개인이나 토지별로 분리되어 각각 독립적으로 존재하는 것이라고 볼 수는 없습니다."
327503,이유,9,"또한 개발행위허가를 받은 사항을 변경하면 행정청 및 기존 개발행위허가를 받은 자 사이에 형성된 권리ㆍ의무 관계에 영향을 미치게 되는데, 만약 공동명의로 받은 개발행위허가의 변경이 기존 개발행위허가를 받은 자 전원의 동의 없이 일부의 신청만으로 가능하다고 본다면 개발행위허가의 변경에 동의하지 않은 자는 자신의 의사와 무관하게 개발행위허가를 받은 지위를 상실하는 등의 불합리한 결과가 초래됩니다."
327503,이유,10,"그렇다면 국토계획법 제56조제1항에 따른 개발행위허가를 공동명의로 받은 경우 그 허가 받은 내용을 변경하기 위해서는 개발행위허가를 받은 자 전원의 동의가 있어야 한다고 보아야 하는바, 이 사안과 같이 개발행위허가를 받은 사항 중 갑과 을의 공동명의를 단독명의로 변경하고 갑 소유 토지를 제외하는 내용으로 변경하는 경우에도 을은 갑의 동의를 받아야 합니다.<관계 법령>"
327503,이유,11,국토의 계획 및 이용에 관한 법률
327503,이유,12,"제56조(개발행위의 허가)① 다음 각 호의 어느 하나에 해당하는 행위로서 대통령령으로 정하는 행위(이하 “개발행위”라 한다)를 하려는 자는 특별시장·광역시장·특별자치시장·특별자치도지사·시장 또는 군수의 허가(이하 “개발행위허가”라 한다)를 받아야 한다.다만, 도시·군계획사업에 의한 행위는 그러하지 아니하다.1.건축물의 건축 또는 공작물의 설치"
327503,이유,13,2.토지의 형질 변경(경작을 위한 경우로서 대통령령으로 정하는 토지의 형질 변경은 제외한다)3.토석의 채취
327503,이유,14,4.토지 분할(건축물이 있는 대지의 분할은 제외한다)5.녹지지역·관리지역 또는 자연환경보전지역에 물건을 1개월 이상 쌓아놓는 행위
327503,이유,15,"② 개발행위허가를 받은 사항을 변경하는 경우에는 제1항을 준용한다.다만, 대통령령으로 정하는 경미한 사항을 변경하는 경우에는 그러하지 아니하다.③·④ (생  략)제57조(개발행위허가의 절차)① 개발행위를 하려는 자는 그 개발행위에 따른 기반시설의 설치나 그에 필요한 용지의 확보, 위해(危害) 방지, 환경오염 방지, 경관, 조경 등에 관한 계획서를 첨부한 신청서를 개발행위허가권자에게 제출하여야 한다.이 경우 개발밀도관리구역 안에서는 기반시설의 설치나 그에 필요한 용지의 확보에 관한 계획서를 제출하지 아니한다.다만, 제56조제1항제1호의 행위 중 「건축법」의 적용을 받는 건축물의 건축 또는 공작물의 설치를 하려는 자는 「건축법」에서 정하는 절차에 따라 신청서류를 제출하여야 한다.② ∼ ④ (생  략)"
