해석례일련번호,구분,문장번호,내용
313065,질의요지,1,「지방공무원임용령」 제27조제1항의 전보제한기간내에 있는 공무원(교육공무원)을 인사위원회의 심의를 거쳐 전보한 경우 인사위원회 심의에 상정되었던 당해 공무원과 관련한 회의관련자료(안건)가 「공공기관의 정보공개에 관한 법률」 제9조제1항제5호의 비공개대상정보인지 여부
313065,회답,2,"인사위원회에 상정되었던 당해 공무원과 관련한 회의관련자료(안건)는  「공공기관의 정보공개에 관한 법률」에 의한 비공개대상정보 중 제9조제1항제5호의 인사관리에 관한 사항 및 의사결정과정에 준하는 사항에는 해당하나, 이러한 정보가 공개될 경우 업무의 공정한 수행에 현저한 지장을 초래한다고 인정할 만한 상당한 이유가 있는지 여부는 구체적인 사안마다 비공개에 의하여 보호되는 심의의 충실화와 내실화, 업무수행의 공정성 등의 이익과 공개에 의하여 보호되는 국민의 알권리의 보장 및 인사행정의 투명성 확보 등의 이익을 비교ㆍ형량하여 당해 정보를 보유ㆍ관리하는 공공기관이 개별적으로 판단하여야 합니다."
313065,이유,3,"○ 「공공기관의 정보공개에 관한 법률」 제9조제1항 각호외의 부분의 규정에 의하면 “공공기관이 보유ㆍ관리하는 정보는 공개대상이 된다”고 규정하면서 다만, 동항 각호에 해당하는 경우에는 이를 공개하지 아니할 수 있다고 규정하고 있는바, 이는 동법이 국민의 알권리 충족을 위하여 공공기관이 보유ㆍ관리하는 모든 정보에 대하여 공개를 원칙으로 하고 있음을 말하는 것입니다.○ 「공공기관의 정보공개에 관한 법률」 제9조제1항제5호에서는 감사ㆍ감독ㆍ검사ㆍ시험ㆍ규제ㆍ입찰계약ㆍ기술개발ㆍ인사관리ㆍ의사결정과정 또는 내부검토과정에 있는 사항 등으로서 공개될 경우 업무의 공정한 수행이나 연구ㆍ개발에 현저한 지장을 초래한다고 인정할 만한 상당한 이유가 있는 정보를 비공개대상정보로 규정하고 있고, 동조 제2항에서는 공공기관은 제1항 각호의 1에 해당하는 정보가 기간의 경과 등으로 인하여 비공개의 필요성이 없어진 경우에는 당해 정보를 공개대상으로 하여야 한다고 규정하고 있습니다.○ 이와 관련하여 「지방공무원임용령」 제27조제1항의 전보제한기간내에 있는 공무원을 인사위원회의 심의를 거쳐 전보한 경우 인사위원회에 상정되었던 당해 공무원과 관련한 회의관련자료(안건)는  「공공기관의 정보공개에 관한 법률」 제9조제1항제5호의 인사관리에 관한 사항임과 동시에 인사위원회의 심의를 위하여 그 의사결정과정에 제공된 것으로 이미 의사결정이 이루어져 의사결정과정에 있는 사항 그 자체라고 할 수는 없으나 의사결정과정에 준하는 사항에 해당하는 것으로 볼 수 있습니다(대법원 2003.8.22."
313065,이유,4,선고 2002두12946 판결 참조).
313065,이유,5,"○ 그런데, 공공기관이 동법 제9조제1항제5호을 근거로 당해 정보를 공개하지 아니할 수 있기 위하여서는 동호에서 열거하고 있는 사항에 해당하여야 할 뿐만 아니라 “공개될 경우 업무의 공정한 수행에 현저한 지장을 초래한다고 인정할 만한 상당한 이유가 있는 정보”에 해당하여야 하는바, 이는 공개될 경우 업무의 공정한 수행이 객관적으로 현저하게 지장을 받을 것이라는 고도의 개연성이 존재하는 정보를 말하는 것으로서 이러한 정보에 해당하는지 여부는 일률적으로 판단하기 곤란하고 구체적인 사안마다 비공개에 의하여 보호되는 심의의 충실화와 내실화, 업무수행의 공정성 등의 이익과 공개에 의하여 보호되는 국민의 알권리의 보장 및 인사행정의 투명성 확보 등의 이익을 비교ㆍ형량하여 당해 정보를 보유ㆍ관리하는 공공기관이 개별적으로 판단하여야 할 것입니다."
