해석례일련번호,구분,문장번호,내용
324867,질의요지,1,"「옥외광고물 등 관리법」 제8조제4호에서는 표시ㆍ설치 기간이 30일 이내인 비영리 목적의 광고물등이 “단체나 개인이 적법한 정치활동을 위한 행사 또는 집회 등에 사용하기 위하여 표시ㆍ설치하는 경우”에는 광고물등의 허가ㆍ신고에 관한 같은 법 제3조 및 금지ㆍ제한 등에 관한 같은 법 제4조를 적용하지 아니한다고 규정하고 있는바,"
324867,질의요지,2,"「집회 및 시위에 관한 법률」 제6조제1항에 따라 집회 신고를 한 후에 「옥외광고물 등 관리법」 제8조제4호에 따라 집회에 사용하기 위하여 해당 집회에서 표현하고자 하는 정치활동의 내용을 표시한 현수막을 표시ㆍ설치하려는 경우, 집회 신고 기간 중 실제 집회가 열리는 기간에만 현수막을 표시·설치할 수 있는지, 아니면 집회 신고를 한 신고 기간 동안 현수막을 표시·설치할 수 있는지?"
324867,회답,3,"「집회 및 시위에 관한 법률」 제6조제1항에 따라 집회 신고를 한 후에 「옥외광고물 등 관리법」 제8조제4호에 따라 집회에 사용하기 위하여 해당 집회에서 표현하고자 하는 정치활동의 내용을 표시한 현수막을 표시ㆍ설치하려는 경우, 집회 신고 기간 중 실제 집회가 열리는 기간에만 현수막을 표시·설치할 수 있다고 할 것입니다."
324867,이유,4,"「옥외광고물 등 관리법」은 옥외광고물의 질적 향상을 위한 기반을 조성하고, 옥외광고물의 표시ㆍ설치 등에 관한 사항을 정하여 아름다운 경관과 미풍양속을 보존하고 공중에 대한 위해를 방지하며 건강하고 쾌적한 생활환경을 조성함을 목적으로 하는 법으로(제1조), 같은 법 제2조제1호에서 “옥외광고물”이란 공중에게 항상 또는 일정 기간 계속 노출되어 공중이 자유로이 통행하는 장소에서 볼 수 있는 것(대통령령으로 정하는 교통시설 또는 교통수단에 표시되는 것을 포함함)으로서 간판ㆍ입간판ㆍ현수막(懸垂幕)ㆍ벽보ㆍ전단(傳單)과 그 밖에 이와 유사한 것을 말하고, 같은 법 제3조에 따르면 도시지역 등에 대통령령으로 정하는 광고물등(옥외광고물 또는 게시시설을 말하며, 이하 같음)을 표시하거나 설치하려는 자는 허가를 받거나 신고를 하여야 하며, 같은 법 제4조에서는 대통령령으로 정하는 지역ㆍ장소 또는 물건에는 광고물등을 표시하거나 설치해서는 아니 된다고 규정하고 있습니다."
324867,이유,5,"그런데, 「옥외광고물 등 관리법」 제8조에서는 표시ㆍ설치 기간이 30일 이내인 비영리 목적의 광고물등이 각 호의 어느 하나에 해당하면 허가ㆍ신고에 관한 같은 법 제3조 및 금지ㆍ제한 등에 관한 같은 법 제4조에 따른 규정을 적용하지 않는다고 하면서 같은 법 제8조제4호에서 “단체나 개"
324867,이유,6,"인이 적법한 정치활동을 위한 행사 또는 집회 등에 사용하기 위하여 표시ㆍ설치하는 경우”를 규정하고 있는바, 이 사안에서는 「집회 및 시위에 관한 법률」 제6조제1항에 따라 집회 신고를 한 후에 「옥외광고물 등 관리법」 제8조제4호에 따라 집회에 사용하기 위하여 해당 집회에서 표현하고자 하는 정치활동의 내용을 표시한 현수막을 표시ㆍ설치하려는 경우, 집회 신고 기간 중 실제 집회가 열리는 기간에만 현수막을 표시·설치할 수 있는지, 아니면 집회 신고를 한 신고 기간 동안 현수막을 표시·설치할 수 있는지가 문제될 수 있습니다."
324867,이유,7,"먼저, 「옥외광고물 등 관리법」 제8조제4호의 문언상 같은 법 제3조 및 제4조가 적용되지 않는 대상으로서 광고물등이 적법한 정치활동을 위한 집회 등에 사용하기 위하여 표시ㆍ설치하는 경우를 정하고 있는데, 여기서 집회란 특정 또는 불특정 다수인이 공동의 의견을 형성하여 이를 대외적으로 표명할 목적 아래 일시적으로 일정한 장소에 모이는 것을 말하고(대법원 2009.7.9."
324867,이유,8,"선고 2007도1649 판결례 등 참조), 이러한 집회는 「집회 및 시위에 관한 법률」 제6조에 따라 신고하여야 하는바, 집회 신고는 특정 일시 및 장소에서 집회를 개최하겠다는 것이지, 집회 신고만으로 집회를 개최하는 것이 아님은 당연하며, 다수인이"
324867,이유,9,"일시적으로 일정한 장소에 모이는 것이 집회의 본질 중 하나인 점에 비추어 “집회에 사용하기 위하여 표시ㆍ설치”한다 함은 집회 신고를 한 해당 집회가 개최되어 그 집회에서 실제 사용하는 것을 의미한다고 할 것이므로, 「옥외광고물 등 관리법」 제8조제4호에 따라 현수막을 표시ㆍ설치하는 경우는 실제 집회가 개최되는 그 일시에 사용하는 경우에 적용한다는 의미라고 할 것입니다."
324867,이유,10,"또한, 「옥외광고물 등 관리법」 제8조의 취지는 원칙적으로 광고물등의 설치ㆍ표시는 같은 법 제3조에 따른 허가나 신고, 제4조에 따른 금지ㆍ제한 규정의 적용을 받지만, 표시ㆍ설치 기간이 30일 이내이고 비영리 목적의 광고물등으로서 같은 법의 목적인 아름다운 경관과 미풍양속을 보존하고 공중에 대한 위해를 방지하며 건강하고 쾌적한 생활환경의 조성에 반할 우려가 적은 광고물등의 경우에는 같은 법에 따른 규제를 배제하려는 것으로 볼 수 있는바, 같은 법 제8조제4호는 실제 집회가 개최되는 그 일시에 사용하는 경우로 한정하여 해석하는 것이 일정 요건에 해당하면 같은 법 제3조 및 제4조의 규정을 배제하도록 하는 입법취지에 부합한다 할 것이고, 만약 집회 신고 기간이라는 이유로 같은 법 제8조제4호에 따라 광고물등을 표시ㆍ설치할 수 있다고 한다면 실제 집회를 하지 않는 때에도 같은"
324867,이유,11,법 제3조 및 제4조의 제한을 받지 않으면서 광고물등이 표시ㆍ설치되는 결과가 되어 같은 법의 입법목적에 반하는 결과를 초래할 수도 있을 것입니다.
324867,이유,12,"따라서, 「집회 및 시위에 관한 법률」 제6조제1항에 따라 집회 신고를 한 후에 「옥외광고물 등 관리법」 제8조제4호에 따라 집회에 사용하기 위하여 해당 집회에서 표현하고자 하는 정치활동의 내용을 표시한 현수막을 표시ㆍ설치하려는 경우, 집회 신고 기간 중 실제 집회가 열리는 기간에만 현수막을 표시·설치할 수 있다고 할 것입니다."
