해석례일련번호,구분,문장번호,내용
311651,질의요지,1,"「학교용지 확보 등에 관한 특례법」 제3조 및 제4조제2항에 따라 학교용지를 공급해야 하는 도시개발사업으로서, 「도시개발법」 제11조제2항에 따라 기초지방자치단체가 사업시행자로 지정되어 환지방식으로 도시개발사업을 시행하는 경우에, 「학교용지 확보 등에 관한 특례법」 제4조제3항제1호를 적용하여 학교용지를 무상으로 공급하여야 하는지?"
311651,회답,2,"「학교용지 확보 등에 관한 특례법」 제3조 및 제4조제2항에 따라 학교용지를 공급해야 하는 도시개발사업으로서, 「도시개발법」 제11조제2항에 따라 기초지방자치단체가 사업시행자로 지정되어 환지방식으로 도시개발사업을 시행하는 경우에는 「학교용지 확보 등에 관한 특례법」 제4조제3항제1호를 적용하여 학교용지를 무상으로 공급하여야 합니다."
311651,이유,3,"「학교용지 확보 등에 관한 특례법」 제2조제2호에서는 “개발사업”이란 「건축법」, 「도시개발법」, 「도시 및 주거환경정비법」, 「주택법」, 「택지개발촉진법」 및 「산업입지 및 개발에 관한 법률」에 따라 시행하는 사업 중 100가구 규모 이상의 주택건설용 토지를 조성·개발하는 사업 등을 말한다고 하고 있고, 「학교용지 확보 등에 관한 특례법」 제3조제1항에서는 300가구 규모 이상의 개발사업을 시행하는 자(이하 “개발사업시행자”라 한다)는 개발사업을 시행하기 위하여 수립하는 계획에 학교용지의 조성ㆍ개발에 관한 사항을 포함시키도록 하고 있습니다.또한, 「학교용지 확보 등에 관한 특례법」 제4조제1항 및 제2항에서는 시·도인 개발사업시행자는 학교용지를 확보하도록 하고 있고, 시·도 외의 개발사업시행자는 학교용지를 시·도에 공급하도록 하고 있으며, 같은 조 제3항제1호에서는 같은 조 제1항 및 제2항에 따른 학교용지의 공급가액은 국가 또는 지방자치단체(가목), 공공기관(나목), 지방직영기업(다목)등의 개발사업시행자가 개발사업을 하는 경우에는 학교용지를 무상(「도시 및 주거환경정비법」에 따른 정비사업의 경우 2천가구 규모 이상은 초등학교와 중학교는 학교용지 조성원가의 100분의 50, 고등학교는 학교용지 조성원가의 100분의 70으"
311651,이유,4,"로 하고, 2천가구 규모 미만인 경우에는 조성원가)으로 공급하도록 하고 있고, 같은 조 제3항제2호에서는 제1호 각 목의 개발사업시행자 외의 개발사업시행자가 공급하는 학교용지의 공급가액은 「부동산 가격공시 및 감정평가에 관한 법률」 제2조제7호에 따른 감정평가에 의한 가액으로 하도록 하고 있습니다."
311651,이유,5,"우선, 「학교용지 확보 등에 관한 특례법」 제4조제3항제1호가목에서는 학교용지를 무상공급하여야 하는 대상을 지방자치단체가 개발사업시행자로서 개발사업을 시행하는 경우로 규정하고 있을 뿐, 해당 지방자치단체의 사업 시행이 실질적으로는 토지소유자나 조합을 대행하거나 위탁받아 시행하는 것으로 볼 수 있는 경우를 제외하도록 하는 등의 예외를 규정하고 있지 않으므로, 지방자치단체의 사업 시행이 실질적으로 대행이나 위탁의 성격을 갖고 있다 하더라도, 법령 규정상 지방자치단체가 개발사업시행자로 사업을 시행하는 경우라면 학교용지를 무상으로 공급하여야 할 것입니다."
311651,이유,6,"이에 따라, 「도시개발법」 제11조제1항 단서에서는 도시개발구역의 지정권자는 도시개발구역의 전부를 환지방식으로 시행하는 경우에는 토지소유자나 토지소유자가 설립한 조합을 도시개발사업의 시행자로 지정하도록 하고 있고, 같은 조 제2항에서는 지정권자는 제1항 단서에도 불구하고 도시개발구역의"
311651,이유,7,"국공유지를 제외한 토지면적의 2분의 1 이상에 해당하는 토지소유자 등이 동의한 경우 등에는 지방자치단체 등을 사업시행자로 지정할 수 있도록 하고 있는바, 위 제11조제2항에 따라 예외적으로 지방자치단체가 환지방식으로 시행하는 도시개발사업의 시행자로 지정이 되었다면, 비록 해당 지방자치단체의 개발사업 시행이 실질적으로는 토지소유자 또는 조합을 대행하거나 위탁받아 시행하는 등의 성격을 갖는다 하더라도, 해당 법령 규정에 따른 개발사업시행자는 지정권자로부터 사업시행자로 지정된 지방자치단체라 할 것입니다."
311651,이유,8,"한편, 「학교용지 확보 등에 관한 특례법」 제4조제3항제1호에서는 다른 개발사업과 비교해 사업시행자의 수익발생의 여지가 적고, 저소득 주민의 분양가 부담으로 이어질 수 있다는 우려에 따라 「도시 및 주거환경정비법」에 따른 정비사업의 경우에는 학교용지를 유상공급하도록 하는 예외규정을 두고 있는바, 이 사안의 「도시개발법」 제11조제2항에 따라 지방자치단체가 사업시행자로 지정되어 환지방식으로 도시개발사업을 시행하는 경우에도 동일한 문제가 발생할 것이 예상되었다면, 위와 같은 예외 규정을 별도로 두었어야 할 것이며, 이러한 예외 규정 없이 해당 사업이 개발이익이 발생하지 않는다는 이유만으로 명문 규정에 반하는 해석을 할 수는 없다 할 것입니다."
311651,이유,9,"또한, 위와 같이 무상공급의 불합리성이 지적되어 예외 규정을 두고 있는 「도시 및 주거환경정비법」에 따른 정비사업의 경우 학교용지를 사업규모에 따라 조성원가의 100분의 50, 100분의 70 또는 조성원가로 각각 공급하도록 하고 있음에도 불구하고, 아무런 예외규정을 두고 있지 않은 환지방식의 도시개발사업에 대하여 「학교용지 확보 등에 관한 특례법」 제4조제3항제2호를 적용하여 「부동산 가격공시 및 감정평가에 관한 법률」 제2조제7호에 따른 감정평가에 의한 가액으로 하도록 하는 것은 별도의 예외규정을 둔 사업보다 더 높은 학교용지 공급가격을 적용하게 되어 불합리한 결과를 초래한다 할 것입니다."
311651,이유,10,"따라서, 「학교용지 확보 등에 관한 특례법」 제3조 및 제4조제2항에 따라 학교용지를 공급해야 하는 도시개발사업으로서, 「도시개발법」 제11조제2항에 따라 기초지방자치단체가 사업시행자로 지정되어 환지방식으로 도시개발사업을 시행하는 경우에는 「학교용지 확보 등에 관한 특례법」 제4조제3항제1호를 적용하여 학교용지를 무상으로 공급하여야 합니다."
