해석례일련번호,구분,문장번호,내용
314942,질의요지,1,"「건축법」 제79조제1항에서는 허가권자는 대지나 건축물이 이 법 또는 이 법에 따른 명령이나 처분에 위반되면 이 법에 따른 허가 또는 승인을 취소하거나 건축주등에게 공사의 중지 등 시정명령을 명할 수 있다고 규정하고 있는바, “이 법 또는 이 법에 따른 명령이나 처분의 위반”에 같은 법 제12조제1항에 따른 관계 법령인 「주차장법」 제19조 위반이 포함되는지?"
314942,질의요지,2,※ 질의배경
314942,질의요지,3,"○ A는 제천시에서 병원건물(시설물)의 소유자로서 적법하게 부설주차장을 설치하고 건축허가와 사용승인을 받았으나, 그 후 A가 부설주차장의 부지를 매각하여 시설물의 소유자와 부지의 소유자가 달라져 「주차장법」 제19조제3항 및 같은 법 시행령 별표 1 위반이 발생함."
314942,질의요지,4,"○ 제천시에서는 위와 같은 경우가 「주차장법」 위반은 물론, 「건축법」 제79조 위반에도 해당한다고 주장하였으나 국토교통부가 이와 반대되는 회신을 하자 제천시가 법령해석을 요청함."
314942,회답,5,「건축법」 제79조제1항의 “이 법 또는 이 법에 따른 명령이나 처분의 위반”에는 같은 법 제12조제1항에 따른 관계 법령인 「주차장법」 제19조 위반은 포함되지 않는다고 할 것입니다.
314942,이유,6,"「건축법」 제79조제1항에서는 허가권자는 대지나 건축물이 이 법 또는 이 법에 따른 명령이나 처분에 위반되면 이 법에 따른 허가 또는 승인을 취소하거나 건축주등에게 공사의 중지 등 시정명령을 명할 수 있다고 규정하고 있고, 같은 법 제12조제1항 및 같은 법 시행령 제10조제1항제11호에서는 허가권자는 제11조에 따라 허가를 하려면 해당 용도ㆍ규모 또는 형태의 건축물을 건축하려는 대지에 건축하는 것이 「주차장법」 제19조에 맞는지를 확인하기 위하여 건축복합민원 일괄협의회를 개최하여야 한다고 규정하고 있습니다.그리고 「주차장법」 제19조제1항에서는 주차수요를 유발하는 시설물을 건축하거나 설치하려는 자는 부설주차장을 설치하여야 한다고 규정하고 있으며, 같은 조 제3항과 같은 법 시행령 제6조 및 별표 1의 비고 제3호에서는 시설물의 소유자는 부설주차장의 부지의 소유권을 취득하여 이를 주차장 전용으로 제공해야 한다고 규정하고 있는바,"
314942,이유,7,"이 사안은 「건축법」 제79조제1항에서 규정하는 “이 법 또는 이 법에 따른 명령이나 처분의 위반”에 「건축법」 위반만이 포함되는지, 아니면 같은 법 제12조제1항에 따른 관계 법령인 「주차장법」 제19조 위반도 포함되는지에 관한 것이라 하겠습니다."
314942,이유,8,"먼저, 법률의 본칙에서 관형사 “이”를 붙여"
314942,이유,9,"“이 법”이라고 지칭하면 문언적으로 해당 법률 그 자체를 가리키는 것으로 해석되므로 「건축법」 제79조제1항의 “이 법”이란 일단 「건축법」 자체를 가리키는 것으로 볼 수밖에 없는 것이고, 이러한 점은 같은 법 제12조제1항에서 「건축법」 이외의 법률에 대해서는 해당 법률의 제명을 직접 밝히거나 “관계 법령”이라는 표현으로 대신하고 있다는 점에서도 나타난다고 할 것입니다."
314942,이유,10,"그리고 「건축법」 제12조제1항에서 규정하는 건축복합민원 일괄협의회는 민원인의 편의를 위하여 복합민원과 관련된 모든 민원서류를 일괄하여 제출하게 하는 절차일 뿐, 이러한 협의회를 개최한다고 하여 다른 법률의 요건이 「건축법」에 따른 요건으로 전환되는 것이 아니므로 「주차장법」 제19조 위반을 「건축법」 제79조제1항에서 규정하는 “이 법 또는 이 법에 따른 명령이나 처분의 위반”으로 볼 수는 없을 것입니다."
314942,이유,11,"이상과 같은 점을 종합해 볼 때, 「건축법」 제79조제1항의 “이 법 또는 이 법에 따른 명령이나 처분의 위반”에는 같은 법 제12조제1항에 따른 관계 법령인 「주차장법」 제19조 위반은 포함되지 않는다고 할 것입니다."
