해석례일련번호,구분,문장번호,내용
313950,질의요지,1,"전기용품의 설계, 원자재의 선정 및 구매, 제품의 판매 등은 자신의 책임으로 직접 하지만 제3자에게 제품의 생산만 위탁하면서 자신의 상표를 붙이도록 하는 주문자상표부착생산 방식으로 전기용품의 제조를 위탁하는 자가 「전기용품안전 관리법」 제3조제1항에 따른 제조업자에 포함되는지?"
313950,회답,2,"전기용품의 설계, 원자재의 선정 및 구매, 제품의 판매 등은 자신의 책임으로 직접 하지만 제3자에게 제품의 생산만 위탁하면서 자신의 상표를 붙이도록 하는 주문자상표부착생산 방식으로 전기용품의 제조를 위탁하는 자는 「전기용품안전 관리법」 제3조제1항에 따른 제조업자에 포함되지 않는다고 할 것입니다."
313950,이유,3,"「전기용품안전 관리법」 제2조제2호에 따르면 “안전인증”이란 안전인증기관이 판매하거나 대여할 목적으로 생산ㆍ조립 또는 가공(이하 “제조”라 함)된 전기용품을 시험(이하 “제품시험”이라 함)하고 제조설비ㆍ검사설비ㆍ기술능력 및 제조체제를 평가(이하 “공장심사”라 함)하여 전기용품에 대한 안전성을 인증하는 것을 말하고, 같은 법 제3조제1항에서는 안전인증대상전기용품의 제조를 업으로 하거나 외국에서 제조하여 대한민국으로 수출하려는 자(이하 “제조업자”라 함)는 안전인증기관으로부터 안전인증을 받아야 한다고 규정하고 있으며, 같은 법 제7조제1항에서는 안전인증의 표시 등이 없는 안전인증대상전기용품을 판매ㆍ대여 등을 할 수 없도록 하고 있습니다."
313950,이유,4,"그리고, 「전기용품안전 관리법」 제6조제1항에서는 제조업자 또는 수입업자는 산업통상자원부령으로 정하는 바에 따라 해당 전기용품과 그 포장에 안전인증을 표시하여야 하고, 그 위임에 따라 같은 법 시행규칙 별표 7 제1호나목4)에서는 안전인증의 표지 외에 기술표준원장이 정하는 사항을 부기하도록 하였으며, 이에 따라 「전기용품 안전관리 운용요령」(기술표준원고시 제2013-196호로 2013.6.14."
313950,이유,5,개정되어 2013.7.1.
313950,이유,6,시행된 것)제29조 및 별표 6 제5호에서는 “제조업체명(외국 소재 제
313950,이유,7,"조업체인 경우에만 제조국명 표시를 추가)”을 규정하고 있는바,"
313950,이유,8,"이 사안에서는 전기용품의 설계, 원자재의 선정 및 구매, 제품의 판매 등은 자신의 책임으로 직접 하지만 제3자에게 제품의 생산만 위탁하면서 자신의 상표를 붙이도록 하는 주문자상표부착생산 방식으로 전기용품의 제조를 위탁하는 자가 「전기용품안전 관리법」 제3조제1항에서의 “제조업자”에 포함되는지 문제될 수 있습니다."
313950,이유,9,"먼저, 안전인증은 판매하거나 대여할 목적으로 제조된 전기용품에 대해 제품시험과 공장심사를 하여 안전성을 인증하는 것을 말하는데, 그 내용을 살펴보면, “제조를 업으로 하는 자” 또는 “외국에서 제조하여 수출하려는 자”, 즉, 국내 또는 외국의 제조업자로 하여금 제조 단계에서부터 안전인증을 받도록 하고(「전기용품안전 관리법」 제3조제1항 본문), 안전인증기관은 산업통상자원부장관이 정하여 고시하는 안전기준과 공장심사기준에 적합한 경우 안정인증을 하여야 하며(같은 법 제3조제3항 본문), 안전인증기관은 안전인증을 받은 안전인증대상안전제품이 계속하여 안전을 유지하고 있는지를 확인하기 위하여 안전인증대상전기용품 제조설비ㆍ검사설비 및 기술능력에 대하여 1년에 한 번 이상 정기검사를 실시하여야 하는 한편(같은 법 제4조), 안전인증기관이 공장심사를 할 때에는 해당 전기"
313950,이유,10,"용품의 제조업자, 즉, 안전인증을 신청한 전기용품을 제조하는 공장에 대하여 그 제조설비ㆍ검사설비ㆍ기술능력 및 제조ㆍ검사업무를 수행하는 인력을 갖추고 있는지를 평가(같은 법 시행규칙 제6조제1항 및 별표 4 제1호)하여야 합니다."
313950,이유,11,"이처럼 안전인증대상전기용품의 제조업자에 대해서는 「전기용품안전 관리법」상의 자율안전확인대상전기용품 등과는 달리 제품시험 외에 공장심사를 거치도록 하고 있는데, 이는 제조된 전기용품의 안전성 뿐만 아니라 실제 전기용품을 제조하는 과정도 평가를 받도록 한 것이고, 그렇다면 공장심사는 실제 제조하는 자의 제조설비ㆍ검사설비 및 기술능력을 대상으로 하는 것인바, 전기용품의 설계, 원자재의 선정 및 구매, 제품의 판매 등은 자신의 책임으로 직접 하였다 하더라도 별도의 제조설비 등을 갖춘 독립된 제조업자인 제3자에게 제작을 위탁한 자는 실제 제조는 직접 하지 않기 때문에 공장심사의 당사자가 될 수 없으므로 이를 제조업자로 볼 수 없을 것입니다."
313950,이유,12,"한편, 제3자에게 제품의 생산을 위탁했더라도 전기용품의 설계, 원자재의 선정 및 구매, 제품의 판매 등은 자신의 책임으로 직접 하고 자신의 상표를 붙이도록 하는 형태의 제조위탁자라면 전기용품안전 관리법령에 따른 제조업자에 포함된다는 주장이 있을 수 있으나, 위에서 살펴본"
313950,이유,13,"바와 같이 실제 제조를 하지 않는 제조위탁자는 공장심사의 당사자가 될 수 없고, 제조를 위탁받은 자에 대해 실시한 공장심사를 제조위탁자의 공장심사로 갈음할 수 있다는 명문의 법적 근거가 없는 이상 이를 해석으로 인정하는 것은 법령해석의 한계를 벗어난 것으로 보입니다."
313950,이유,14,"또한, 제조위탁자는 위탁의 행태나 정도가 매우 다양할 수 있어서 제조 위탁의 행태나 제조위탁자의 관리 및 책임의 정도에 따라 제조위탁자를 제조업자로 볼 수 있는지 여부가 달라질 수 있을 것인바, 그렇다면 누가 제조업자인지에 대한 판단은 구체적인 사안마다 달라질 수 있어서, 「전기용품안전 관리법」에 따라 안전인증의 의무가 있고 의무 위반 시 벌칙의 대상이 되는 제조업자에 대해 행정의 일관되고 통일성 있는 기준이 적용되어야 한다는 점에서 볼 때, 제조업자로 인정될 수 있는 제조위탁자의 범위에 대한 명시적 입법이 없이 법령해석만으로 이를 인정하는 것은 어렵다고 할 것입니다."
313950,이유,15,"따라서, 전기용품의 설계, 원자재의 선정 및 구매, 제품의 판매 등은 자신의 책임으로 직접 하지만 제3자에게 제품의 생산만 위탁하면서 자신의 상표를 붙이도록 하는 주문자상표부착생산 방식으로 전기용품의 제조를 위탁하는 자는 「전기용품안전 관리법」 제3조제1항에 따른 제조업자에 포함되지 않는다고 할 것입"
313950,이유,16,니다.
