해석례일련번호,구분,문장번호,내용
312086,질의요지,1,"주택과 그 부속시설이 있는 대지 중 일부를 텃밭으로 사용하는 경우, 그 텃밭을 「농지법」 제2조제1호의 규정에 의한 농지라고 할 수 있는지 여부"
312086,회답,2,"주택과 그 부속시설이 있는 대지 중 일부를 텃밭으로 사용하는 경우, 그 텃밭은 「농지법」 제2조제1호의 규정에 의한 농지라고 할 수 없습니다."
312086,이유,3,"○ 「농지법」 제2조제1항가목에서는 “농지”를 ‘전·답 또는 과수원 기타 그 법적 지목 여하에 불구하고 실제의 토지현상이 농작물의 경작 또는 다년성식물재배지로 이용되는 토지’로 규정하고 있어 농작물을 경작하기만 하면 농지로 볼 수 있는 것으로 해석할 여지도 있으나, 농지를 효율적으로 이용·관리하여 농업인의 경영안정 및 생산성향상을 기하고자 한 「농지법」의 취지를 고려할 때, ‘실제의 토지현상이 농작물의 경작에 이용’되어야 한다는 것은 당해 토지가 실질적으로 농작물의 경작 등을 위해 사용되는 것을 의미한다고 보아야 할 것입니다.그런데 「지적법 시행령」 제6조에서 필지마다 하나의 지목을 설정하여야 하고, 1필지가 2 이상의 용도로 활용되는 경우에는 주된 용도에 따라 지목을 설정하여야 한다고 규정한 것을 고려하면, ‘농지’가 비록 「지적법」상의 ‘지목’은 아니라고 하여도 농지도 토지의 한 종류이므로, 특정 토지가 농지에 해당하는지 여부 즉, 토지가 실질적으로 농작물의 경작에 사용되는지 여부를 판단함에 있어서 당해 토지의 주된 용도가 무엇인지는 주요한 기준의 하나가 된다고 할 것입니다."
312086,이유,4,○ 그리고 「농지법」 제2조제1항가목 단서 및 동법 시행령 제2조제2항제1호에서 ‘「지적법」에 의한 지목이 전·답·과수원이 아닌 토지로서 농작물의 경작이나 다년성식물의 재배지로 계속하여 이용되는 기간이 3년 미만인 토지’는 농지에서 제외하고 있는 것으로 보아 「농지법」의 취지는 전·답이 아닌 토지는 농작물의 경작에 이용되더라도 어느 정도 항구성이 인정되는 경우에만 농지로 보겠다는 것임을 알 수 있습니다.
312086,이유,5,○ 따라
312086,이유,6,"서 「농지법」상의 농지이기 위해서는 당해 토지의 주된 용도가 농작물의 경작에 이용되어야 하고, 그 농작물의 경작이 일정 기간 계속적인 것이어서 어느 정도 항구성이 인정되어야 할 것입니다.그런데 주택이 있는 대지 중 일부를 텃밭으로 사용하는 경우는 일반적으로 일정한 규모로 구획되어 주거용 건물과 부속시설이 건축되어 있는 토지, 즉 사회통념상 주거생활 공간으로 인정되는 토지의 일부분을 농작물의 경작이나 식물의 재배에 이용하는 것을 의미하므로 이 경우 그 토지의 주된 용도는 당해 건축물과 부대시설의 부지라고 보아야 할 것입니다.그러므로 그 대지의 일부가 텃밭으로 이용되고 있다 하더라도 이는 대지의 부수적이고 잠정적인 용도에 지나지 않는 것이어서 농지에 해당한다고 보기는 어렵습니다."
