해석례일련번호,구분,문장번호,내용
330421,질의요지,1,"「지방자치단체를 당사자로 하는 계약에 관한 법률 시행령」(이하 “지방계약법 시행령”이라 함)제39조제4항 본문에서는 입찰참가의 자격이 없는 자가 참가한 입찰이나 그 밖에 행정자치부령으로 정하는 사유에 해당하는 입찰은 무효로 한다고 규정하고 있고, 그 위임에 따른 「지방자치단체를 당사자로 하는 계약에 관한 법률 시행규칙」(이하 “지방계약법 시행규칙”이라 함)제42조제5호나목에서는 입찰무효사유의 하나로 같은 규칙 제15조제1항에 따라 등록된 사항 중 “대표자의 성명”을 변경등록하지 아니하고 입찰서를 제출한 입찰을 규정하고 있으며, 같은 규칙 제15조제1항에서는 지방자치단체의 장 또는 계약담당자는 입찰업무를 효율적으로 집행하기 위하여 미리 입찰 참가자격을 등록하게 할 수 있고(전단), 등록된 사항이 변경된 경우에도 또한 같다(후단)고 규정하고 있는바,"
330421,질의요지,2,대표자의 변경 없이 그 성명이 개명(改名)으로 인해 변경되었으나 지방계약법 시행규칙 제15조제1항 후단에 따라 대표자의 성명을 변경등록하지 아니하고 입찰서를 제출한 경우는 같은 규칙 제42조제5호나목에 따른 입찰무효사유에 해당하는지?
330421,질의요지,3,< 질의 배경 >
330421,질의요지,4,"○ 민원인은 토목공사업 등을 수행하는 회사로서, 서울시가 공고한 도로파손 긴급복구공사 입찰에 참여하여 낙찰되었는데, 민원인의 대표자의 성명이 개명되었음에도 입찰 참가자격 변경등록을 하지 않고 입찰서를 제출하였음이 확인되자, 서울시 내부적으로 위 입찰이 지방계약법 시행규칙 제42조제5호나목에 따라 무효라는 의견이 제기됨.민원인은 이러한 입찰이 무효인지 행정자치부에 질의하였고, 무효라는 회신을 받자, 이러한 회신이 타당한지에 대하여 법제처에 법령해석을 요청함."
330421,회답,5,"대표자의 변경 없이 그 성명이 개명으로 인해 변경되었으나 지방계약법 시행규칙 제15조제1항 후단에 따라 대표자의 성명을 변경등록하지 아니하고 입찰서를 제출한 경우는 같은 규칙 제42조제5호나목에 따른 입찰무효사유에 해당하므로, 입찰자에게 책임이 없는 사유로 변경등록이 불가능한 경우가 아니라면 그 입찰은 무효입니다."
330421,이유,6,"지방계약법 시행령 제39조제4항 본문에서는 입찰참가의 자격이 없는 자가 참가한 입찰이나 그 밖에 행정자치부령으로 정하는 사유에 해당하는 입찰은 무효로 한다고 규정하고 있고, 지방계약법 시행규칙 제42조제5호나목에서는 입찰무효사유의 하나로 같은 규칙 제15조제1항에 따라 등록된 사항 중 “대표자의 성명”을 변경등록하지 아니하고 입찰서를 제출한 입찰을 규정하면서, 입찰자에게 책임이 없는 사유로 변경등록이 불가능한 경우에는 그러하지 아니하다고 규정하고 있으며, 같은 규칙 제15조제1항에서는 지방자치단체의 장 또는 계약담당자는 입찰업무를 효율적으로 집행하기 위하여 미리 입찰 참가자격을 등록하게 할 수 있고(전단), 등록된 사항이 변경된 경우에도 같다(후단)고 규정하고 있는바,"
330421,이유,7,이 사안은 대표자의 변경 없이 그 성명이 개명으로 인해 변경되었으나 지방계약법 시행규칙 제15조제1항 후단에 따라 대표자의 성명을 변경등록하지 아니하고 입찰서를 제출한 경우가 같은 규칙 제42조제5호나목에 따른 입찰무효사유에 해당하는지에 관한 것이라 하겠습니다.
330421,이유,8,"먼저, 지방계약법 시행규칙 제42조제5호나목에서는 같은 규칙 제15조제1항에 따라 등록된 사항 중 “대표자의 성명”을 변경등록하지 아니하고 입찰서를 제출한 입찰을 무효로 한다고 규정하고 있는바, 해당 규정의 문언상 “대표자의 성명을 변경등록하지 아니하고 입찰서를 제출한 경우”란 “대표자 성명의 변경에도 불구하고 변경등록하지 않고 입찰서를 제출한 경우”를 의미한다고 할 것이고, 여기서 “대표자 성명의 변경”이란 대표자가 다른 사람으로 변경됨으로 인하여 대표자의 성명이 변경된 경우뿐만 아니라 대표자의 변경 없이 대표자가 개명을 하여 성명을 변경한 경우도 포함된다고 할 것입니다."
330421,이유,9,"그리고, 지방계약법 시행규칙 제42조제5호나목에서 입찰참가자격 등록 후 대표자의 성명이 변경되었음에도 변경등록을 하지 않고 입찰서를 제출한 경우 해당 입찰을 무효로 하도록 규정한 입법 취지는 대표자를 실제 현황대로 정확히 변경등록하게 하고 그 변경등록 여부를 엄격하게 판단하여 입찰이 유효한지 여부를 가리도록 함으로써 입찰 이후 후속절차에서 대표자 권한의 적법한 행사나 그 효력에 관한 다툼이 발생할 위험을 차단하기 위함이라 할 것인데(대법원 2012.9.20."
330421,이유,10,"선고 2012마1097 판결례 참조), 대표자의 성명이 개명으로 인하여 변경되었음에도 개명 전의 성명으로 입찰하는 것을 허용한다면 입찰 이후의 후속절차에서 혼란이 초래되고, 대표자 권한의 행사의 적법 여부 및 효력 등에 대한 다툼이 발생할 수 있으며, 해당 규정을 충실히 준수한 자의 입찰 참가가 제한되는 결과가 되어 입찰의 공정성에 대한 문제가 제기될 여지도 있다고 할 것이므로, 대표자가 다른 사람으로 변경된 경우 뿐 아니라 대표자의 변경 없이 성명만 개명된 경우에도 같은 규칙 제15조제1항 후단에 따른 입찰참가자격 변경등록을 해야 한다고 할 것이고, 그러한 변경등록을 하지 않고 입찰서를 제출한 경우는 같은 규칙 제42조제5호나목에 따른 입찰 무효사유에 해당한다고 보아야 할 것입니다."
330421,이유,11,"다만, 지방계약법 시행규칙 제42조제5호 각 목 외의 부분 단서에서는 입찰자에게 책임이 없는 사유로 변경등록이 불가능한 경우에는 그 입찰을 무효로 하지 않는다고 규정하고 있으므로, 대표자의 성명을 변경등록하지 아니한 것이 입찰자에게 책임이 없는 사유로 변경등록이 불가능했기 때문이라고 인정되는 경우에는 해당 입찰은 무효가 아니라고 할 것입니다."
330421,이유,12,"따라서, 대표자의 변경 없이 그 성명이 개명으로 인해 변경되었으나 지방계약법 시행규칙 제15조제1항 후단에 따라 대표자의 성명을 변경등록하지 아니하고 입찰서를 제출한 경우는 같은 규칙 제42조제5호나목에 따른 입찰무효사유에 해당하므로, 입찰자에게 책임이 없는 사유로 변경등록이 불가능한 경우가 아니라면 그 입찰은 무효라고 할 것입니다."
