해석례일련번호,구분,문장번호,내용
314896,질의요지,1,종전에 구 「사설강습소에 관한 법률」에 따라 인가받았던 사설강습소가 구 「학원의 설립ㆍ운영에 관한 법률」(1995.8.4.
314896,질의요지,2,법률 제4964호로 전부개정되어 1996.1.1.
314896,질의요지,3,"시행된 것)부칙 제3조의 경과조치에 의하여 개정법에 따라 등록한 학원으로 인정되었다면, 종전에 인가받은 교습과정이 현행법의 교습과정 분류에는 규정되어 있지 않더라도 새로운 교습과정을 추가하는 변경등록을 할 수 있는지?"
314896,질의요지,4,※ 질의배경
314896,질의요지,5,"○ ○○신학원은 1981년 구 「사설강습소에 관한 법률」에 따라 “종교” 교습과정을 가르치는 사설강습소로 인가받았는데, 이후 해당 법률이 구 「학원의 설립ㆍ운영에 관한 법률」(1995.8.4."
314896,질의요지,6,법률 제4964호로 전부개정되어 1996.1.1.
314896,질의요지,7,시행된 것)로 개정됨에 따라 그 경과조치에 따라 등록한 학원으로 인정되었고 현재까지 운영을 계속하고 있음.
314896,질의요지,8,"○ ○○신학원은 현행법에 규정된 다른 교습과정(대학 편입)을 추가하여 학원을 운영하고자 학원의 변경등록을 신청하였으나, 관할 교육청에서 현행법의 교습과정 분류에서 “종교”가 제외되었음에도 불구하고 ○○신학원의 교습과정 변경등록이 가능한지 여부를 교육부에 문의하였고, 교육부 내부에서 의견이 나뉘어 교육부에서 법령해석을 요청함."
314896,회답,9,종전에 구 「사설강습소에 관한 법률」에 따라 인가받았던 사설강습소가 구 「학원의 설립ㆍ운영에 관한 법률」(1995.8.4.
314896,회답,10,법률 제4964호로 전부개정되어 1996.1.1.
314896,회답,11,"시행된 것)부칙 제3조의 경과조치에 의하여 개정법에 따라 등록한 학원으로 인정되었다면, 종전에 인가받은 교습과정이 현행법의 교습과정 분류에는 규정되어 있지 않더라도 새로운 교습과정을 추가하는 변경등록을 할 수 있다고 할 것입니다."
314896,이유,12,"구 「사설강습소에 관한 법률」에서는 사설강습소의 인가에 관하여 규정하였는데, 이 법이 구 「학원의 설립ㆍ운영에 관한 법률」(1989.6.16."
314896,이유,13,"법률 제4133호로 일부개정되어 시행된 것)로 개정됨에 따라 종전에 인가된 사설강습소는 모두 인가된 학원이 되었고, 이후 구 「학원의 설립ㆍ운영에 관한 법률」(1995.8.4."
314896,이유,14,법률 제4964호로 전부개정되어 1996.1.1.
314896,이유,15,"시행된 것을 말하며, 이하 “개정 학원법”이라 함)에서는 종전의 학원의 인가·등록이 학원의 등록으로 일원화됨에 따라, 개정 학원법 부칙 제3조에서 종전의 제5조의 규정에 의하여 학원의 설립에 관하여 등록하거나 인가받은 자는 제6조의 규정에 의하여 학원의 설립ㆍ운영에 관한 등록을 한 자로 본다는 경과조치를 두어 학원을 계속 운영할 수 있도록 하였습니다."
314896,이유,16,"한편, 종전에 사설강습소 및 학원의 교습과정에는 “종교”가 분류되어 왔으나, 구 「학원의 설립ㆍ운영에 관한 법률 시행령」(1995.12.30."
314896,이유,17,대통령령 제14883호로 전부개정되어 1996.1.1.
314896,이유,18,"시행된 것을 말하며, 이하 “개정 학원법 시행령”이라 함)별표 1의 교습과정의 분류에서부터는 제외되었고, 같은 영 부칙 제2항에서는 이 영 시행당시 등록된 학원의 교습과정은 별표 1의 규정에 의한 교습과정"
314896,이유,19,중 종전의 교습과정과 동일하거나 유사한 교습과정으로 등록된 것으로 본다는 경과조치를 규정하여 현재까지 이르고 있습니다.
314896,이유,20,"이 사안은 종전에 구 「사설강습소에 관한 법률」에 따라 인가받았던 사설강습소가 개정 학원법 부칙 제3조의 경과조치에 의하여 개정법에 따라 등록한 학원으로 인정되었다면, 종전에 인가받은 교습과정이 현행법의 교습과정 분류에는 규정되어 있지 않더라도 새로운 교습과정을 추가하는 변경등록을 할 수 있는지에 관한 것이라 하겠습니다."
314896,이유,21,"먼저, 개정 학원법 부칙 제3조에서 “본다”라는 문언은 “간주(看做)한다”는 것으로서 일정한 사실이 그렇지 않은 경우라도 법적으로 그렇다고 여기겠다는 의미인바, 이와 같은 명시적 규정을 통하여 종전에 등록하거나 인가받은 학원은 이 법에 따라 등록한 학원과 동등한 법적 지위를 부여받는다고 할 것입니다.또한, 개정 학원법의 부칙에서 경과조치에 의해 인정된 학원의 변경등록을 제한하는 규정을 두지 아니한 것은 개정 전 법령에 따라 인가·등록한 학원에 대하여 그 운영의 안정성을 지속적으로 보장함으로써 개정 전 법령에 대한 국민의 신뢰를 두텁게 보호하려는 의도를 갖는다고 할 것입니다."
314896,이유,22,"그리고, 개정 학원법 시행령 부칙 제2항에서는 이 영 시행 당시 등록된 학원의 교습과정은 별표 1의 규정에"
314896,이유,23,"의한 교습과정 중 종전의 교습과정과 동일하거나 유사한 교습과정으로 등록된 것으로 본다고 규정하고 있는바, 종전의 교습과정과 동일한 교습과정이 개정 법령에는 분류되어 있지 않더라도 경과조치를 통하여 종전의 교습과정은 유사한 교습과정으로 편입된다고 할 것입니다.즉, 개정 법령에서 제외된 교습과정을 교습하는 학원은 이러한 경과조치에 의하여 개정 법령에 규정된 교습과정을 교습하는 것으로 취급받는다고 할 것입니다."
314896,이유,24,"아울러, 개정 학원법의 취지는 국민의 편의를 도모하고 학원 설립ㆍ운영의 경쟁체제를 유도하고자 종전에 등록과 인가로 나뉘어져 있던 학원 제도를 등록제로 일원화하는 것인데(개정 학원법 제ㆍ개정이유서 참조), 경과조치에 의하여 등록한 학원으로 인정된 학원은 기존의 교습과정에 한하여만 운영할 수 있다고 해석한다면, 법률 개정 이후 등록한 학원과 그 본질이 동일함에도 불구하고 차별하는 것으로서 형평에 맞지 아니할 뿐만 아니라 행정규제를 완화함으로써 학원의 운영을 더욱 자유롭고 광범위하게 인정하고자 한 개정 학원법의 취지에도 부합하지 않는다고 할 것입니다."
314896,이유,25,"이상과 같은 점을 종합해 볼 때, 종전에 구 「사설강습소에 관한 법률」에 따라 인가받았던 사설강습소가 개정 학원법 부칙 제3조의 경과조치에 의하여 개정법에 따라 등록한 학원으로 인정"
314896,이유,26,"되었다면, 종전에 인가받은 교습과정이 현재의 교습과정 분류에는 규정되어 있지 않더라도 새로운 교습과정을 추가하는 변경등록을 할 수 있다고 할 것입니다."
