해석례일련번호,구분,문장번호,내용
330267,질의요지,1,"건축주가 「문화예술진흥법 시행령」 제12조제1항 각 호의 서로 다른 용도에 해당하는 여러 개의 시설을 하나의 건축물로 건축하려는 경우, 그 각 용도별 시설의 바닥면적은 각각 1만 제곱미터 미만이지만 각 용도별 시설의 바닥면적을 합한 전체 연면적이 1만 제곱미터 이상이라면 「문화예술진흥법」 제9조제1항에 따라 미술작품을 설치하는 데에 건축비용의 일정 비율에 해당하는 금액을 사용해야 하는지?"
330267,질의요지,2,< 질의 배경 >
330267,질의요지,3,"민원인은 업무시설(면적 9000㎡)과 근린생활시설(면적 2000㎡)을 하나의 건축물로 건축하려는 경우 건축비용의 일정 비율에 해당하는 금액을 미술작품을 설치하는데 사용하여야 하는지 여부에 대해 문화체육관광부에 질의하였는데, 그 회신에 이견이 있어 법제처에 법령해석을 요청함."
330267,회답,4,"건축주가 「문화예술진흥법 시행령」 제12조제1항 각 호의 서로 다른 용도에 해당하는 여러 개의 시설을 하나의 건축물로 건축하려는 경우, 그 각 용도별 시설의 바닥면적은 각각 1만 제곱미터 미만이지만 각 용도별 시설의 바닥면적을 합한 전체 연면적이 1만 제곱미터 이상이라면 「문화예술진흥법」 제9조제1항에 따라 미술작품을 설치하는 데에 건축비용의 일정 비율에 해당하는 금액을 사용해야 합니다."
330267,이유,5,"「문화예술진흥법」 제9조제1항에서는 대통령령으로 정하는 종류 또는 규모 이상의 건축물을 건축하려는 자(이하 “건축주”라 함)는 건축 비용의 일정 비율에 해당하는 금액을 회화ㆍ조각ㆍ공예 등 미술작품의 설치에 사용해야 한다고 규정하고 있고, 그 위임에 따라 같은 법 시행령 제12조제1항 각 호 외의 부분 본문에서는 「문화예술진흥법」 제9조제1항에 따라 미술작품을 설치하는 데에 건축비용의 일정 비율에 해당하는 금액을 사용해야 할 건축물은 「건축법 시행령」 별표 1에 따른 용도별 건축물 중 같은 항 각 호의 어느 하나에 해당되는 건축물로서 연면적[「건축법 시행령」 제119조제1항제4호에 따른 연면적을 말하며, 주차장ㆍ기계실ㆍ전기실ㆍ변전실ㆍ발전실 및 공조실(空調室)의 면적은 제외하며, 이하 같음]이 1만 제곱미터(증축하는 경우에는 증축되는 부분의 연면적이 1만 제곱미터)이상인 것으로 한다고 규정하고 있는바,"
330267,이유,6,"이 사안은 건축주가 「문화예술진흥법 시행령」 제12조제1항 각 호의 서로 다른 용도에 해당하는 여러 개의 시설을 하나의 건축물로 건축하려는 경우, 그 각 용도별 시설의 바닥면적은 각각 1만 제곱미터 미만이지만 각 용도별 시설의 바닥면적을 합한 전체 연면적이 1만 제곱미터 이상이라면 「문화예술진흥법」 제9조제1항에 따라 미술작품을 설치하는 데에 건축비용의 일정 비율에 해당하는 금액을 사용해야 하는지에 관한 것이라 하겠습니다."
330267,이유,7,"먼저, 「문화예술진흥법」 제9조제1항에 따른 건축물 미술작품 설치 제도는 일정 기준에 해당하는 건축물을 건축하려는 건축주에게 건축 비용의 일정 비율에 해당하는 금액을 미술작품 설치에 사용해야 할 의무를 부과하는 것으로서, 해당 규정 및 그 위임에 따른 같은 법 시행령 제12조제1항에서는 미술작품 설치 의무의 대상인 건축물을 “「건축법 시행령」 별표 1에 따른 용도별 건축물 중 다음 각 호의 어느 하나에 해당되는 건축물로서 연면적이 1만 제곱미터 이상인 것”이라고 규정하여 일정 규모 이상이면서 특정 용도인 건축물에 대해서만 미술작품 설치의무를 부과하고 있습니다(법제처 2016.10.12."
330267,이유,8,회신 16-0385 해석례 참조).
330267,이유,9,"그런데, 「문화예술진흥법 시행령」 제12조제1항에서는 건축물의 “용도” 및 “연면적”과 관련된 내용은 건축법령상의 개념과 기준에 따르도록 규정하고 있는바, 여러 용도의 시설이 함께 있는 건축물의 연면적의 산정 방법 또한 건축물의 구조ㆍ설비 기준 및 용도 등을 정하고 있는 건축법령에 따라 통일적으로 적용되어야 할 것이고, 「건축법 시행령」 제119조제1항제4호에 따르면 연면적이란 “하나의 건축물 각 층의 바닥면적의 합계”이므로 연면적은 특정 용도별로 각각 산정되는 것이 아니라 하나의 건축물 전체를 기준으로 하여 산정되는 면적이라고 할 것인바, 하나의 건축물에 「문화예술진흥법 시행령」 제12조제1항 각 호의 서로 다른 용도에 해당하는 여러 개의 시설이 있는 경우라고 하더라도 미술작품 설치 시 일정한 금액을 사용해야 하는 건축물인지 여부를 판단할 때에는 건축법령상 연면적의 개념 및 산정 기준에 따라 「문화예술진흥법 시행령」 제12조제1항 각 호의 용도에 해당하는 시설의 바닥면적을 합한 전체 연면적이 1만 제곱미터 이상인지 여부를 살펴보아야 할 것입니다."
330267,이유,10,"한편, 건축물의 각 용도별 시설을 단위로 하여 미술작품 설치 대상의 기준이 되는 “연면적 1만 제곱미터 이상”을 산정하기 위해 「문화예술진흥법 시행령」 제12조제1항 각 호에서는 용도별 건축물의 종류를 각각 구분하여 규정하고 있으므로, 해당 규정의 연면적이란 하나의 건축물 전체를 기준으로 산정되는 면적이 아니라는 의견이 있을 수 있으나, 「문화예술진흥법 시행령」 제12조제1항에서 각 호를 두어 용도별 건축물의 종류를 규정하고 있는 취지는 건축물에 각 호 외의 용도로 사용되는 시설이 있는 경우 그 바닥면적을 연면적 산정 시 포함시키지 않기 위한 것이지, 각 용도별로 1만 제곱미터 이상이라는 면적 기준을 적용하기 위한 것은 아니라는 점(법제처 2016.10.12."
330267,이유,11,"회신 16-0385 해석례 참조), 그리고 건축법령상 연면적이란 건축물 전체의 규모를 파악하기 위한 개념으로서, 만약 특정 용도로 사용되는 부분의 면적을 각각 산정하려는 경우에는 “용도별 바닥면적” 등으로 표현하였을 것이라는 점을 함께 고려하였을 때(법제처 2015.12.24."
330267,이유,12,"회신 15-0682 해석례 참조), 그러한 의견은 타당하지 않다고 할 것입니다."
330267,이유,13,"이상과 같은 점을 종합해 볼 때, 「문화예술진흥법 시행령」 제12조제1항 각 호의 서로 다른 용도에 해당하는 여러 개의 시설을 하나의 건축물로 건축하려는 경우, 그 각 용도별 시설의 바닥면적은 각각 1만 제곱미터 미만이지만 각 용도별 시설의 바닥면적을 합한 전체 연면적이 1만 제곱미터 이상이라면 「문화예술진흥법」 제9조제1항에 따라 미술작품을 설치하는 데에 건축비용의 일정 비율에 해당하는 금액을 사용해야 할 것입니다."
