해석례일련번호,구분,문장번호,내용
315434,질의요지,1,"「화물자동차 운수사업법 시행령」 제9조제1호에서는 이사화물운송주선사업은 이사화물을 취급(포장 및 보관 등 부대서비스를 포함함)하는 운송주선사업으로 규정하고 있는바, 이사화물운송주선사업자가 취급하는 이사화물은 거소(居所) 이전에 따른 가정이사화물로 제한되는지?"
315434,질의요지,2,< 질의 배경 >
315434,질의요지,3,"○ 「화물차동차운수사업법」상 화물자동차 운송주선사업은 그 종류가 이사화물운송주선사업과 일반화물운송주선사업으로 구분되는데, 이사화물에 대한 정의가 구체적으로 명시되어 있지 않아 국토교통부 내부에서 이사화물운송주선사업자와 일반화물운송주선사업자의 사업범위에 대하여 의견이 나뉘자 이를 명확히 하기 위하여 법제처에 법령해석을 요청한 사안임."
315434,회답,4,「화물자동차법 운수사업법 시행령」 제9조제1호에 따른 이사화물운송주선사업자가 취급하는 이사화물은 거소 이전에 따른 가정이사화물로 제한되는 것은 아닙니다.
315434,이유,5,"「화물자동차 운수사업법」(이하 “화물자동차법”이라 함)제24조제1항 본문에서는 화물자동차 운송주선사업을 경영하려는 자는 국토교통부령으로 정하는 바에 따라 국토교통부장관의 허가를 받아야 한다고 규정하고 있고, 같은 조 제3항에서는 화물자동차 운송주선사업의 종류를 대통령령으로 정하도록 규정하고 있으며, 이에 따라 「화물자동차 운수사업법 시행령」(이하 “화물자동차법 시행령”이라 함)제9조에서는 화물자동차 운송주선사업의 종류를 이사화물을 취급(포장 및 보관 등 부대서비스를 포함함)하는 이사화물운송주선사업과 이사화물이 아닌 화물을 취급하는 일반화물운송주선사업으로 구분하여 규정하고 있는바,"
315434,이유,6,이 사안은 화물자동차법 시행령 제9조제1호에 따른 이사화물운송주선사업자가 취급하는 이사화물은 거소 이전에 따른 가정이사화물로 제한되는지에 관한 것이라 하겠습니다.
315434,이유,7,"먼저, 법령에서 사용되는 용어의 의미는 법적 안정성과 예측가능성을 확보하기 위하여 명확하게 정의되어 있어야 할 것이지만, 해당 법령에서 용어의 의미를 별도로 정의하거나 의미와 내용을 제한ㆍ확대하여야 할 특별한 규정을 두고 있지 않는 등 그 용어의 의미가 불명확한 경우에는 그 법령의 규정 내용과 입법 취지, 사회에서 일반적으로 통용되는 의미 등을 종합적으로 고려하여 보충될 수 있는 것으로 보아야 할 것입니다(법제처 2014.10.10."
315434,이유,8,회신 14-0572 해석례 참조).
315434,이유,9,"그런데, 화물자동차법령상 이사화물운송주선사업자가 취급하는 “이사화물”의 의미에 관하여 별도로 정의하거나 그 범위 및 종류 등에 관하여는 특별한 규정을 두고 있지 않으나, 일반적으로 “이사(移徙)”는 사는 곳을 다른 데로 옮긴다는 의미로서(국립국어원 표준국어대사전 참조), 사회에서 통용되는 “이사”의 의미는 반드시 거소 이전에 따른 가정이사로 제한되어 사용되고 있는 것은 아니고, 사무실의 이전 등도 이사에 포함되는 것으로 보아야 할 것입니다."
315434,이유,10,"그리고, 화물자동차법령에서는 이사화물운송주선사업에 대해서, 일반화물운송주선사업과는 달리, 포장 및 보관 등 부대서비스를 포함하여 화물을 취급할 수 있도록 하면서(화물자동차법 시행령 제9조제1호), 이사화물업의 등록기준으로 상용인부 2명 이상을 갖추도록 하고 있고, 적재물배상보험에 의무적으로 가입하도록 규정하고 있는 점 등에 비추어 볼 때(「화물자동차 운수사업법 시행규칙」 제38조, 제41조의13, 별표 4), 이사화물운송사업자가 취급할 수 있는 이사화물이 반드시 거소 이전에 따른 가정이사화물로만 제한된다고 볼 법적 근거는 없다고 할 것입니다."
315434,이유,11,"따라서, 화물자동차법 시행령 제9조제1호에 따른 이사화물운송주선사업자가 취급하는 이사화물은 거소 이전에 따른 가정이사화물로 제한되지는 않는다 할 것입니다."
