해석례일련번호,구분,문장번호,내용
315285,질의요지,1,"객실이 설치된 오피스텔을 대여하면서 청소 등 룸서비스나 모닝콜 등 부대서비스를 제공하는 이른바 서비스드 레지던스(Serviced Residences)가 「학교보건법」 제6조제1항제13호에 따라 학교환경위생 정화구역에서 금지되는 “호텔, 여관, 여인숙”에 포함되는지?"
315285,회답,2,"객실이 설치된 오피스텔을 대여하면서 청소 등 룸서비스나 모닝콜 등 부대서비스를 제공하는 이른바 서비스드 레지던스는 「학교보건법」 제6조제1항제13호에 따라 학교환경위생 정화구역에서 금지되는 “호텔, 여관, 여인숙”에 포함됩니다."
315285,이유,3,"「학교보건법」 제6조제1항제13호에서는 학교환경위생 정화구역에서 금지되는 시설로 “호텔, 여관, 여인숙”을 규정하고 있고, 「공중위생관리법」 제2조제1항제2호에서는 숙박업을 “손님이 잠을 자고 머물 수 있도록 시설 및 설비등의 서비스를 제공하는 영업”이라고 규정하고 있는바,"
315285,이유,4,"이 사안은 객실이 설치된 오피스텔을 대여하면서 청소 등 룸서비스나 모닝콜 등 부대서비스를 제공하는 이른바 서비스드 레지던스가 「학교보건법」 제6조제1항제13호에 따라 학교환경위생 정화구역에서 금지되는 시설인 “호텔, 여관, 여인숙”에 포함되는지에 관한 것이라 하겠습니다."
315285,이유,5,"먼저, 「학교보건법」 제6조제1항제13호의 입법연혁을 살펴보면, 해당 조문은 1981년 2월 28일 법률 제3374호로 신설되면서 학교환경위생 정화구역 내 금지 시설 중의 하나로 “호텔, 여관, 여인숙”을 규정하였는데, 이 규정의 신설 당시 구 「숙박업법」(1986.5.10."
315285,이유,6,"법률 제3822호 공중위생법 부칙 제2조제1항제2호로 폐지되기 전의 것)제2조제1항에서는 “숙박업”을 “호텔영업, 여관영업 및 여인숙영업”의 세 가지 유형으로만 구분하여 정의하고 있었습니다.그리고, 학교환경위생 정화구역 안에서 호텔 등의 시설의 설치를 금지하고 있는 것은 정화구역 안에서 숙박업인 호텔 등의 시설과 영업을 못하게 함으로써 호텔 안에서 은밀하게 이루어질 수 있는 윤락행위 등으로 인한 각종 유해환경으로부터 학생들을 차단ㆍ보호하여 학생들의 건전한 육성과 학교 교육의 능률화를 기하고자 하는 취지입니다(대법원 2012.6.28."
315285,이유,7,선고 2012아35 결정례 참조).
315285,이유,8,"위와 같은 「학교보건법」 제6조제1항제13호의 입법연혁과 규정취지에 비추어 보면, 「학교보건법」 제6조제1항제13호에서는 비록 “호텔, 여관, 여인숙”이라는 표현을 사용하여 금지되는 시설을 열거하는 방식으로 규정하고 있으나, 그 취지는 숙박업에 해당하는 시설과 영업 일반을 가리키는 것으로 이해되는바, 어떠한 시설이나 영업이 그 실질에 비추어 숙박업에 해당하는 경우에는 그 명칭 여하에 불구하고 「학교보건법」 제6조제1항제13호에 따른 “호텔, 여관, 여인숙”에 포함되는 것으로 보아야 할 것입니다."
315285,이유,9,"한편, 현행 「공중위생관리법」 제2조제1항제2호에서는 숙박업을 “손님이 잠을 자고 머물 수 있도록 시설 및 설비등의 서비스를 제공하는 영업”이라고 규정하고 있고, 같은 법 시행령 제4조제1호에서는 숙박업을 세분하여 “손님이 잠을 자고 머물 수 있는 시설(취사시설은 제외함)및 설비 등의 서비스를 제공하는 영업”인 일반숙박업(가목)과 “손님이 잠을 자고 머물 수 있는 시설(취사시설을 포함함)및 설비 등의 서비스를 제공하는 영업”인 생활숙박업(나목)으로 구분하고 있는바, 서비스드 레지던스는 그 중 생활숙박업에 해당합니다(법제처 2007.4.13."
315285,이유,10,회신 07-0071 해석례 참조).
315285,이유,11,"그렇다면, 객실이 설치된 오피스텔을 대여하면서 청소 등 룸서비스나 모닝콜 등 부대서비스를 제공하는 이른바 서비스드 레지던스는 「학교보건법」 제6조제1항제13호에서 금지하는 행위 및 시설인 ‘호텔, 여인숙, 여관’에 포함된다고 할 것입니다."
315285,이유,12,※ 법령정비 권고의견
315285,이유,13,"○ 「학교보건법」 제6조제1항제13호는 학교환경위생 정화구역에서 금지되는 행위 및 시설로서 “호텔, 여관, 여인숙”을 규정하고 있는데, 그 범위와 관련하여 이 사안의 경우와 같이 해석상 혼란이 있으므로 이를 보다 명확하게 규정하는 방안을 검토할 필요가 있습니다."
