해석례일련번호,구분,문장번호,내용
337671,질의요지,1,"「야생생물 보호 및 관리에 관한 법률」(이하 “야생생물법”이라 함)제44조제1항에서는 수렵장에서 수렵동물을 수렵하려는 사람은 대통령령으로 정하는 바에 따라 그 주소지를 관할하는 시장·군수·구청장으로부터 수렵면허를 받아야 한다고 규정하고 있고, 같은 조 제3항에서는 같은 조 제1항에 따른 수렵면허(이하 “수렵면허”라 함)를 받은 사람은 5년마다 수렵면허를 갱신해야 한다고 규정하고 있으며, 같은 법 시행규칙 제52조제1항제3호가목 및 같은 조 제2항제1호가목에서는 각각 수렵면허를 받거나 갱신하려는 사람이 수렵면허 신청서 또는 갱신신청서에 첨부해야 하는 최근 1년 이내에 발급된 서류 중 하나로 신체검사서1)1)「의료법」 제3조제2항제3호가목에 따른 병원 또는 같은 호 바목에 따른 종합병원에서 발급된 것으로 한정하며, 이하 같음.를 규정하면서(본문), 운전면허2)2)「도로교통법」 제80조에 따른 운전면허를 말하며, 이하 같음.를 받은 사람은 운전면허증 사본으로 갈음할 수 있다고 규정하고 있는바(단서),"
337671,질의요지,2,"야생생물법 시행규칙 제52조제1항제3호가목 단서 및 같은 조 제2항제1호가목 단서에 따라 운전면허증 사본으로 신체검사서를 갈음하려는 경우 그 운전면허증은 최근 1년 이내에 발급3)3)「도로교통법」 제85조에 따른 운전면허증 발급 또는 같은 법 제87조에 따른 운전면허증 갱신 발급을 말하며, 이하 같음.된 것으로 한정되는지?"
337671,회답,3,야생생물법 시행규칙 제52조제1항제3호가목 단서 및 같은 조 제2항제1호가목 단서에 따라 운전면허증 사본으로 신체검사서를 갈음하려는 경우 그 운전면허증은 최근 1년 이내에 발급된 것으로 한정됩니다.
337671,이유,4,"먼저 야생생물법 시행규칙 제52조제1항제3호 각 목 외의 부분 본문 및 같은 조 제2항제1호 각 목 외의 부분 본문에서는 수렵면허 신청서 또는 수렵면허 갱신신청서에 첨부해야 하는 서류 중 하나로 “최근 1년 이내에 발급된 다음 각 목의 서류”를 규정하여, 같은 조 제1항제3호 각 목 및 같은 조 제2항제1호 각 목에 규정된 서류는 모두 ‘최근 1년 이내에 발급된 것’으로 제한하고 있고, 같은 규칙 제52조제1항제3호가목 및 같은 조 제2항제1호가목에서는 수렵면허 신청서 또는 갱신신청서에 첨부해야 하는 서류 중 하나로 ‘신체검사서’를 규정하면서(본문)운전면허를 받은 사람은 운전면허증 사본으로 갈음할 수 있다고 규정하고 있는데(단서), 입법기술적으로 단서는 ‘해당 규정의 본문’에서 규정하고 있는 주된 내용에 대한 예외를 정하는 부분1)1)법제처, 알기쉬운법령정비기준 p140"
337671,이유,5,"으로서, 그 단서에서 규정하고 있는 운전면허증 사본으로 갈음할 수 있다는 내용은 각각 그 본문에서 수렵면허 신청서 또는 갱신신청서에 ‘신체검사서를 첨부하도록 규정한 것에 대한 예외’를 정한 것일 뿐, 같은 규칙 제52조제1항제3호 각 목 외의 부분 본문 및 같은 조 제2항제1호 각 목 외의 부분 본문에서 규정하고 있는 ‘첨부해야 할 서류가 최근 1년 이내에 발급된 서류일 것이라는 점에 대한 예외’까지 정한 것으로 보기는 어려우므로, 신체검사서를 갈음하여 운전면허증 사본을 첨부하려는 경우 해당 운전면허증도 신체검사서와 마찬가지로 최근 1년 이내에 발급된 것이어야 합니다."
337671,이유,6,"또한 야생생물법 시행규칙 제52조제1항 및 제2항에서 수렵면허 신청서 또는 갱신신청서에 최근 1년 이내에 발급된 신체검사서를 첨부하도록 하고 있는 취지는 수렵에 총기, 활, 그물 등의 수렵도구가 사용되어 수렵과정에서 다른 사람의 생명·신체 또는 재산에 피해를 줄 위험이 있어, 수렵면허를 받거나 갱신하려는 사람이 수렵도구를 안전하게 사용할 수 있는 신체능력을 갖추었는지를 최근에 발급된 신체검사서로 확인하려는 것으로 보아야 하고, 운전면허증의 확인으로 이를 대체할 수 있도록 한 것은 「도로교통법」 제83조, 제87조 및 같은 법 시행령 제45조에 따르면 운전면허를 취득 또는 갱신할 때에는 적성검사를 받아야 하고, 적성검사 기준을 충족하는지 여부를 판정하기 위해 운전면허 발급기관이 신체검사서 등을 확인하도록 규정하고 있기 때문이라고 할 것인바, 이러한 규정취지 및 관계 법령과의 체계에 비추어 볼 때 야생생물법 시행규칙 제52조제1항제3호가목 본문 및 같은 조 제2항제1호가목 본문에 따른 신체검사서가 최근 1년 이내에 발급된 것으로 한정되는 것과의 균형상 해당 신체검사서 대신 제출할 수 있는 운전면허증의 사본도 그 운전면허증이 최근 1년 이내에 발급된 것이어야 한다고 보는 것이 타당하다고 할 것입니다."
337671,이유,7,"만약 이와 달리 운전면허증이 발급된 지 1년이 지난 후 그 사본으로 신체검사서를 갈음할 수 있다고 본다면, 운전면허증은 발급 후 최대 10년까지 갱신하지 않고 사용할 수 있어(「도로교통법」 제87조제1항), 최근 10년 내에 발급받은 운전면허증이라면 그 사본을 제출하는 것도 가능하게 되어 위와 같은 야생생물법 시행규칙 제52조제1항 및 제2항의 규정 취지가 형해화될 우려가 있습니다."
337671,이유,8,따라서 야생생물법 시행규칙 제52조제1항제3호가목 단서 및 같은 조 제2항제1호가목 단서에 따라 운전면허증 사본으로 신체검사서를 갈음하려는 경우 그 운전면허증은 최근 1년 이내에 발급된 것으로 한정됩니다.
337671,이유,9,야생생물 보호 및 관리에 관한 법률
337671,이유,10,제44조(수렵면허)① 수렵장에서 수렵동물을 수렵하려는 사람은 대통령령으로 정하는 바에 따라 그 주소지를 관할하는 시장·군수·구청장으로부터 수렵면허를 받아야 한다.② 수렵면허의 종류는 다음 각 호와 같다.1.제1종 수렵면허: 총기를 사용하는 수렵
337671,이유,11,2.제2종 수렵면허: 총기 외의 수렵 도구를 사용하는 수렵
337671,이유,12,③ 제1항에 따라 수렵면허를 받은 사람은 환경부령으로 정하는 바에 따라 5년마다 수렵면허를 갱신하여야 한다.④ (생  략)
337671,이유,13,야생생물 보호 및 관리에 관한 법률 시행령
337671,이유,14,"제30조(수렵면허의 신청)법 제44조제1항에 따라 수렵면허를 받으려는 사람은 법 제45조에 따른 수렵면허시험에 합격하고, 법 제47조에 따른 수렵 강습을 이수한 후 환경부령으로 정하는 바에 따라 주소지를 관할하는 시장·군수·구청장에게 수렵면허를 신청하여야 한다."
337671,이유,15,야생생물 보호 및 관리에 관한 법률 시행규칙
337671,이유,16,제52조(수렵면허의 신청 등)① 법 제44조제1항 및 영 제30조에 따라 수렵면허를 받으려는 사람은 별지 제49호서식의 수렵면허 신청서에 다음 각 호의 서류를 첨부하여 시장·군수·구청장에게 제출해야 한다.1.수렵면허시험 합격증
337671,이유,17,"2.수렵 강습 이수증(최근 1년 이내에 수렵강습기관에서 강습을 받은 것만 해당한다)3.최근 1년 이내에 발급된 다음 각 목의 서류.다만, 「총포·도검·화약류 등의 안전관리에 관한 법률」 제12조에 따른 총포 소지허가를 받은 사람은 총포 소지허가증 사본으로 갈음할 수 있다.가.신체검사서(「의료법」 제3조제2항제3호가목에 따른 병원 또는 같은 호 바목에 따른 종합병원에서 발급된 것으로 한정한다)."
337671,이유,18,"다만,「도로교통법」 제80조에 따른 운전면허를 받은 사람은 운전면허증 사본으로 갈음할 수 있다.나.총기 소지의 적정 여부에 대한 정신건강의학과 전문의 의견이 기재된 진단서 또는 소견서(법 제44조제2항제1호에 따른 제1종 수렵면허를 받으려는 경우만 해당한다)4.증명사진 1장"
337671,이유,19,"② 법 제44조제3항에 따라 수렵면허를 갱신하려는 사람은 수렵면허의 갱신기간(수렵면허의 유효기간이 끝나는 날의 3개월 전부터 수렵면허의 유효기간이 끝나는 날까지를 말한다.이하 같다)내에 별지 제50호서식의 수렵면허 갱신신청서에 다음 각 호의 서류를 첨부하여 시장·군수·구청장에게 제출해야 한다.(단서 생략)1.최근 1년 이내에 발급된 다음 각 목의 서류.다만, 「총포·도검·화약류 등의 안전관리에 관한 법률」 제12조에 따른 총포 소지허가를 받은 사람은 총포 소지허가증 사본으로 갈음할 수 있다.가.신체검사서(「의료법」 제3조제2항제3호가목에 따른 병원 또는 같은 호 바목에 따른 종합병원에서 발급된 것으로 한정한다)."
337671,이유,20,"다만,「도로교통법」 제80조에 따른 운전면허를 받은 사람은 운전면허증 사본으로 갈음할 수 있다.나.총기 소지의 적정 여부에 대한 정신건강의학과 전문의 의견이 기재된 진단서 또는 소견서(법 제44조제2항제1호에 따른 제1종 수렵면허를 갱신하려는 경우만 해당한다)2.증명사진 1장"
337671,이유,21,3.수렵면허증
337671,이유,22,4.수렵 강습 이수증(최근 1년 이내에 수렵강습기관에서 강습을 받은 것만 해당한다)③ (생  략)<관계 법령>
