해석례일련번호,구분,문장번호,내용
312573,질의요지,1,전문대학 또는 이와 동등 이상의 학력이 있다고 교육인적자원부 장관이 인정하는 학교에서 「공중위생관리법 시행규칙 제14조」의 규정에 의한 미용사의 업무범위에 해당하는 파마·머리카락모양내기·머리피부손질 등 미용관련 과목을 교수하는 학과를 졸업한 자가 「공중위생관리법 제6조제1항제1호」의 규정에 따라 미용사면허시험에 합격하지 아니하고 미용사면허를 취득할 수 있는지 여부.
312573,회답,2,전문대학 또는 이와 동등 이상의 학력이 있다고 교육인적자원부장관이 인정하는 학교에서 「공중위생관리법 시행규칙 제14조」의 규정에 의한 미용사의 업무범위에 해당하는 파마·머리카락모양내기·머리피부손질 등 미용관련 과목을 교수하는 학과를 졸업한 자는 미용사면허시험과 관계없이 「공중위생관리법 제6조제1항제1호」의 규정에 따라 미용사면허를 취득할 수 있습니다.
312573,이유,3,"○ 「공중위생관리법 제6조제1항」의 규정에 의하면, 전문대학 등의 학교에서 미용에 관한 학과를 졸업한 자, 고등기술학교에서 미용에 관한 소정의 과정을 이수한 자, 「국가기술자격법」에 의한 미용사의 자격을 취득한 자 등은 시장·군수·구청장으로부터 미용사 면허를 받을 수 있도록 되어 있고,"
312573,이유,4,"○ 또한, 동항제1호의 규정에 의하면, 전문대학 또는 이와 동등 이상의 학력이 있다고 교육인적자원부장관이 인정하는 학교에서 이용 또는 미용에 관한 학과를 졸업한 자에 대하여는 이용사 또는 미용사의 면허를 받을 수 있도록 되어 있으며, 「동법시행규칙 제14조」의 규정에 의하면, 미용사의 업무범위는 파마·머리카락 자르기·머리카락모양내기·머리피부손질·머리카락염색·머리감기, 손톱의 손질 및 화장, 피부미용(의료기구나 의약품을 사용하지 아니하는 순수한 피부미용을 말한다), 얼굴의 손질 및 화장으로 되어 있습니다.○ 더구나, 전문대학 또는 이와 동등 이상의 학력이 있다고 교육인적자원부장관이 인정하는 학교에서 미용에 관한 학과를 졸업한 자로 인정되기 위해서는 전문대학 또는 이와 동등 이상의 학력이 있다고 교육인적자원부장관이 인정하는 학교의 미용에 관한 학과에서 미용에 관한 과목을 전공과목으로 하여 졸업에 필요한 일정 학점 이상을 이수하고 졸업할 것이 요구된다 할 것이고, 그 구체적인 과목 및 학점 등은 소관 행정기관에서 정하여야 할 것입니다.○ 미용사면허"
312573,이유,5,"를 취득하기 위하여 전문대학 또는 이와 동등 이상의 학력이 있다고 교육인적자원부장관이 인정하는 학교에서 이수하여야 할 미용에 관한 과목의 구체적인 내용이 정해지지 아니한 현실에서는 전문대학 또는 이와 동등 이상의 학력이 있다고 교육인적자원부장관이 인정하는 학교에서 「공중위생관리법 시행규칙 제14조」의 규정에 의하여 미용사의 업무범위에 해당하는 파마·머리카락모양내기·머리피부손질 등 미용에 해당하는 과목을 교수하는 학과에서 미용을 전공으로 하여 그 학과를 졸업한 자는 전문대학 또는 이와 동등 이상의 학력이 있다고 인정되는 학교에서 미용에 관한 학과를 졸업한 자로 볼 수 있을 것이고, 따라서 「국가기술자격법」에 의하여 미용사의 자격을 취득하지 아니하고 미용사의 면허를 취득할 수 있습니다."
