해석례일련번호,구분,문장번호,내용
338299,질의요지,1,"「신문 등의 진흥에 관한 법률」(이하 “신문법”이라 함)제18조제1항에서는 「독점규제 및 공정거래에 관한 법률」(이하 “공정거래법”이라 함)제2조제11호에 따른 기업집단 중 자산총액 등 대통령령으로 정하는 기준에 해당하는 기업집단에 속하는 회사(이하 “대기업”이라 함)와 그 계열회사(대통령령으로 정하는 특수한 관계에 있는 자를 포함함)는 일반일간신문을 경영하는 법인(이하 “일반일간신문법인”이라 함)이 발행한 주식 또는 지분(이하 “주식등”이라 함)의 2분의 1을 초과하여 취득 또는 소유할 수 없다고 규정하고 있는바,"
338299,질의요지,2,"일반일간신문법인 A가 대기업과 그 계열회사(이하 “대기업등”이라 함)B에 속하는 경우, 신문법 제18조제1항에 따라 대기업등 B가 일반일간신문법인 A가 발행한 주식등의 2분의 1을 초과하여 소유하는지 여부를 판단할 때, ‘일반일간신문법인 A가 소유한 자기주식1)1)자기주식의 소유란 주식을 발행한 회사 자신이 그 발행주식을 취득하여 주주가 되는 것을 말함(「상법」 제341조 및 제341조의2 참조)’이 ‘대기업등 B가 소유하는 일반일간신문법인 A의 발행 주식’에 포함되는지?2)2)‘일반일간신문법인이 소유한 자기주식’이 신문법 제18조제1항에 따른 ‘일반일간신문법인이 발행한 주식’에 포함됨을 전제로 함."
338299,회답,3,"이 사안의 경우, 신문법 제18조제1항에 따라 대기업등 B가 일반일간신문법인 A가 발행한 주식등의 2분의 1을 초과하여 소유하는지 여부를 판단할 때 ‘일반일간신문법인 A가 소유한 자기주식’은 ‘대기업등 B가 소유하는 일반일간신문법인 A의 발행 주식’에 포함됩니다."
338299,이유,4,"먼저 신문법 제18조제1항에서는 대기업등은 일반일간신문법인이 발행한 주식등의 2분의 1을 초과하여 취득 또는 소유할 수 없다고 규정하고 있을 뿐, 일반일간신문법인이 발행한 주식등의 2분의 1을 초과하여 취득 또는 소유할 수 없는 ‘대기업등’의 범위에서 해당 대기업등에 속하는 ‘일반일간신문법인’을 제외하고 있지 않고, 주식을 발행한 회사 자신이 주주가 되는 ‘자기주식’도 의결권이 없는1)1)「상법」 제369조제2항 참조"
338299,이유,5,"등의 특수성이 있을 뿐 ‘주식’에 해당하며, 달리 신문법령에서 ‘대기업등이 소유하는 일반일간신문법인의 발행 주식등’이 일반일간신문법인이 발행한 주식등의 2분의 1을 초과하는지를 산정할 때 ‘일반일간신문법인 소유의 자기주식’이나 ‘의결권 없는 주식’을 제외한다는 내용을 명시하고 있지도 않으므로, 이 사안의 경우 ‘일반일간신문법인 A가 소유한 자기주식’도 ‘대기업등 B가 소유하는 일반일간신문법인 A의 발행 주식’에 포함되는 것으로 보는 것이 신문법 제18조제1항의 문언에 부합하는 해석입니다."
338299,이유,6,그리고 신문법 제18조제1항에서 대기업등이 일반일간신문법인이 발행한 주식 또는 지분을 취득하거나 소유하는 것을 제한하고 있는 취지는 대기업등이 일반일간신문법인에 대한 지배적인 소유권을 획득함으로써 자본의 이익에 따라 언론의 공공성이 훼손되거나 여론의 다양성이 저해되는 것을 방지하기 위한 것이라 할 것2)2)2008.12.26.
338299,이유,7,의안번호 제1803214호로 발의된 신문등의자유와기능보장에관한법률 전부개정법률안에 대한 국회문화체육관광방송통신위원회 검토보고서 참조
338299,이유,8,"인데, 자기주식의 경우 의결권이 없어 대기업등에 속하는 일반일간신문법인이 소유한 자기주식으로는 해당 일간신문법인의 의사결정에 직접적으로 참여할 수는 없다고 할 것이나, 대기업등에 속하는 일반일간신문법인이 자기주식을 소유하는 경우 그렇지 않은 경우에 비해 ‘일반일간신문법인이 발행한 주식 중 의결권이 있는 전체 주식’ 대비 ‘대기업등이 소유한 의결권 있는 주식’의 비율이 상승함으로써 일반일간신문법인에 대한 대기업등의 영향력이 커질 수 있는바, 이 사안과 같이 일반일간신문법인 A가 대기업등 B에 속하는 경우에 ‘일반일간신문법인 A가 소유한 자기주식’은 ‘대기업등 B가 소유하는 일반일간신문법인 A의 발행 주식’에서 제외된다고 해석하는 것은 신문법 제18조제1항의 입법 취지에도 부합하지 않는다고 할 것입니다."
338299,이유,9,"따라서 이 사안의 경우, 신문법 제18조제1항에 따라 대기업등 B가 일반일간신문법인 A가 발행한 주식등의 2분의 1을 초과하여 소유하는지 여부를 판단할 때 ‘일반일간신문법인 A가 소유한 자기주식’은 ‘대기업등 B가 소유하는 일반일간신문법인 A의 발행 주식’에 포함됩니다.<관계 법령>"
338299,이유,10,신문 등의 진흥에 관한 법률
338299,이유,11,제18조(대기업의 일반일간신문 소유제한 등)① 「독점규제 및 공정거래에 관한 법률」 제2조제11호에 따른 기업집단 중 자산총액 등 대통령령으로 정하는 기준에 해당하는 기업집단에 속하는 회사(이하 “대기업”이라 한다)와 그 계열회사(대통령령으로 정하는 특수한 관계에 있는 자를 포함한다)는 일반일간신문을 경영하는 법인이 발행한 주식 또는 지분의 2분의 1을 초과하여 취득 또는 소유할 수 없다.② (생  략)제19조(소유제한 위반 시 조치 등)① 제18조를 위반하여 주식 또는 지분을 취득 또는 소유한 자는 그 초과분에 대한 의결권을 행사할 수 없다.② 시·도지사는 제18조를 위반하여 주식 또는 지분을 취득 또는 소유한 자에 대하여 6개월 이내의 기간을 정하여 이를 시정할 것을 명하여야 한다.③ (생  략)
338299,이유,12,상법
338299,이유,13,제369조(의결권)① 의결권은 1주마다 1개로 한다.② 회사가 가진 자기주식은 의결권이 없다.③ (생  략)
