해석례일련번호,구분,문장번호,내용
330693,질의요지,1,"「민간임대주택에 관한 특별법」(이하 “민간임대주택법”이라 함)제52조제1항에 따라 임차인대표회의를 구성하는 민간임대주택1)1)민간임대주택법 제2조제1호에 따른 민간임대주택을 말하며, 이하 같음.에 입주하는 임차인은 해당 민간임대주택 입주예정자의 과반수가 입주해야 임차인대표회의를 구성할 수 있는지?"
330693,질의요지,2,< 질의 배경 >
330693,질의요지,3,민원인은 위 질의요지에 대해 국토교통부에 문의하였으나 회신내용에 이견이 있어 법제처에 법령해석을 요청함.
330693,회답,4,이 사안의 경우 임차인은 해당 민간임대주택 입주예정자의 과반수가 입주해야 임차인대표회의를 구성할 수 있습니다.
330693,이유,5,"민간임대주택법 제52조제1항에서는 임대사업자가 20세대 이상의 민간임대주택을 공급하는 공동주택단지에 입주하는 임차인은 임차인대표회의를 구성할 수 있다고 규정하고 있고(본문), 임대사업자가 150세대 이상의 민간임대주택을 공급하는 공동주택 중 대통령령으로 정하는 공동주택단지에 입주하는 임차인은 임차인대표회의를 구성해야 한다(단서)고 규정하고 있으며, 같은 조 제2항에서는 입주예정자의 과반수가 입주한 때에는 과반수가 입주한 날부터 30일 이내에 입주현황과 임차인대표회의를 구성할 수 있다는 사실 또는 구성하여야 한다는 사실을 입주한 임차인에게 통지할 의무를 임대사업자에게 부여하고 있으나, 임차인대표회의를 언제 구성해야 하는지에 대해서는 명확히 규정하고 있지 않습니다."
330693,이유,6,"그러나 민간임대주택법 제52조제4항에 따르면 임차인대표회의가 구성된 경우 임대사업자는 민간임대주택 관리규약의 제정ㆍ개정(제1호), 관리비(제2호) 및 임대료 증감(제4호) 등에 관하여 임차인대표회의와 협의해야 하는바, 이러한 사항들은 임차인 전체에 영향을 미치는 사항이므로 임차인대표회의는 다수 임차인의 의사를 대표할 수 있어야 한다는 점을 고려하여 입주예정자의 과반수가 입주한 후에 구성될 수 있다고 보는 것이 법령에 따른 임차인대표회의의 기능에 부합하는 해석입니다."
330693,이유,7,"그리고 민간임대주택법 제51조제4항 및 같은 법 시행령 제41조제5항에서는 임대사업자가 민간임대주택을 공동으로 관리하기 위한 요건으로 임차인대표회의의 서면동의 또는 임차인 과반수의 서면동의를 받을 것을 규정하면서 임차인 과반수의 서면동의는 임차인대표회의를 구성하지 않은 경우만 해당한다고 규정하고 있는바, 이는 입주예정자의 과반수가 입주해야 임차인대표회의를 구성할 수 있다는 것을 전제하고 있다고 보는 것이 타당합니다."
330693,이유,8,"만약 이와 달리 민간임대주택의 입주예정자 과반수가 입주하지 않은 경우에도 민간임대주택법 제52조제4항에 따라 임대사업자와 협의할 권한이 있는 임차인대표회의를 구성할 수 있다고 본다면, 소수의 임차인만 입주한 상황에서도 임차인대표회의가 구성될 수 있어 임차인대표회의가 구성된 이후에 입주하는 다수 임차인의 의사가 임차인대표회의를 구성한 동별 대표자의 임기 동안에는 대표되지 못하게 되는 문제가 발생할 뿐 아니라 입주한 임차인의 수가 계속 변동되어 임차인대표회의를 구성할 수 있는 시기를 확정할 수 없게 되는 문제가 있다는 점도 이 사안을 해석할 때 고려해야 합니다.< 관계 법령>"
330693,이유,9,민간임대주택에 관한 특별법
330693,이유,10,"제52조(임차인대표회의)① 임대사업자가 20세대 이상의 범위에서 대통령령으로 정하는 세대 이상의 민간임대주택을 공급하는 공동주택단지에 입주하는 임차인은 임차인대표회의를 구성할 수 있다.다만, 임대사업자가 150세대 이상의 민간임대주택을 공급하는 공동주택단지 중 대통령령으로 정하는 공동주택단지에 입주하는 임차인은 임차인대표회의를 구성하여야 한다.② 임대사업자는 입주예정자의 과반수가 입주한 때에는 과반수가 입주한 날부터 30일 이내에 입주현황과 임차인대표회의를 구성할 수 있다는 사실 또는 구성하여야 한다는 사실을 입주한 임차인에게 통지하여야 한다.다만, 임대사업자가 본문에 따른 통지를 하지 아니하는 경우 시장ㆍ군수ㆍ구청장이 임차인대표회의를 구성하도록 임차인에게 통지할 수 있다.③ ～ ⑤ (생  략)"
330693,이유,11,민간임대주택에 관한 특별법 시행령
330693,이유,12,"제42조(임차인대표회의)① 법 제52조제1항 본문에서 ""대통령령으로 정하는 세대""란 20세대를 말한다.② 법 제52조제1항 단서에서 ""대통령령으로 정하는 공동주택단지""란 다음 각 호의 어느 하나에 해당하는 공동주택단지를 말한다.1.300세대 이상의 공동주택단지"
330693,이유,13,2.제41조제3항제2호 또는 제3호에 해당하는 공동주택으로서 150세대 이상인 공동주택단지
330693,이유,14,③ 임대사업자는 법 제52조제3항에 따라 같은 조 제1항 단서에 따른 임차인이 임차인대표회의를 구성하지 않는 경우에 임차인대표회의를 구성해야 한다는 사실과 같은 조 제4항에 따른 협의사항 및 이 조에 따른 임차인대표회의의 구성ㆍ운영에 관한 사항을 반기 1회 이상 임차인에게 통지해야 한다.④ ～ ⑪ (생  략)
