판례일련번호,구분,문장번호,내용
345924,판례내용,135,동의하지 않는다면 그 이유와 근거는 무엇인지요?
345924,판례내용,136,원고의 상병에 대한 급성 외상이 아닌 만성적인 퇴행성 병변이라는 자문의의 영상의학적 소견과 일반적인 근무시간과 근무기간에 근거한 원고의 신청 상병에 대한 업무상질병판정위원회와 재심사위원회의 판단에 부동의하지 않는다.
345924,판례내용,137,"더구나 재활치료만 1일 2-2.5시간(수행업무비율 80% 이상), 주 10-12.5시간 가량 수행한 것이 아닌 피고의 주장대로 원고의 재활치료 시간이 1일 30분(수행업무비율 20% 적용), 1주 2.5시간인 경우로 제한된다면 그 가능성은 낮다고 판단하였다."
345924,판례내용,138,"그러나 원고가 종사한 기간과 시간 외에 업무의 양과 강도, 업무수행 자세와 속도, 업무 수행 장소의 구조 등을 고려하여 판단할 때 근골격계의 신체부담이 ‘높은’ 업무라 볼 수 있다."
345924,판례내용,139,주관절 외상과염은 외상으로 인해 발병되는 것인가요?
345924,판례내용,140,영상에서 확인되는 원고의 '주관절 외상과염'은 외상성인가요?
345924,판례내용,141,외상과염은 강력한 일회의 외상이 아니라 반복적인 과사용으로 발생하는 것으로 알려져 있음.
345924,판례내용,142,영상에서 총신전근의 급성 파열을 시사하는 소견은 관찰되지 않음.
345924,판례내용,143,총신전건 부분파열은 급성외상성 상병으로 확인되는지요?
345924,판례내용,144,아니면 주관절 외상과염에 따른 시간에 따른 진행 결과로 발생한 것으로 볼 수 있겠는지요?
345924,판례내용,145,"영상에서 급성 파열의 징후(출혈, 혈종, 부종 등)는 관찰되지 않음.총신전건 부분파열은 외상과염의 악화로 인한 것으로 생각됨."
345924,판례내용,146,"이 사건 상병인 '주관절 외상과염, 주관절 총신전건 및 외측 측부 인대파열'은 급성 외상의 형태로 단기간에 발생한 것인가요?"
345924,판례내용,147,아니면 오랜기간 동 부위의 퇴행성 변화로 인한 것인가요?
345924,판례내용,148,"2019년 12월 19일 H병원에서 촬영된 좌측 주관절 MRI를 참고함.총신전건의 음영의 증가가 있어 부분파열의 소견이 있고, 외측 측부 인대 일부의 음영이 증가되어 있어 부분파열이 의심됨."
345924,판례내용,149,"하지만, 급성 파열의 징후는 저명하지 않음.오랜 기간 퇴행성 병변이 악화된 소견으로 생각됨."
345924,판례내용,150,"‘주관절 외상과염, 주관절 총신전건 및 외측 측부 인대파열'의 발병 원인, 경과 등 일반적 발병기전 및 유병률에 대하여 설명하여 주시기 바랍니다."
345924,판례내용,151,"이 사건 신청상병인 '주관절 외상과염, 주관절 총신전건 및 외측 측부 인대파열'은 직업력이 확인되지 않는 고연령의 가정주부의 가사활동을 통해서도 흔히 진단되는 상병인가요?"
345924,판례내용,152,외상과염은 팔의 과사용과 신전 근육의 손상으로 발생할 수 있다.
345924,판례내용,153,주된 원인은 손과 손목을 펴고 올리는 데 사용하는 팔뚝 근육의 반복적인 수축이다.
345924,판례내용,154,조직에 반복되는 움직임과 스트레스는 팔꿈치 외측에 근육이 부착하는 힘줄에 퇴행성 변화를 야기할 수 있음.
345924,판례내용,155,"원인으로는 연령의 증가, 팔을 반복적으로 사용하는 직업, 팔을 주로 사용하는 운동 등이 있음."
345924,판례내용,156,임상 증상은 손 등을 위로 향한 상태에서 물건을 들거나 비트는 동작에서 통증이 있음.
345924,판례내용,157,총신전건과 총굴곡건의 부분파열은 외측 상과염과 내측 상과염에서 진행된 상태로 이에 대한 유병율은 조사되지 않았음.
345924,판례내용,158,"2013년 발간된 여성 외상과염의 위험인자에 관한 논문에 의하면, 30~49세는 30세 미만에 비해 약 5배, 50세 이상에서 8.7배, 하루에 2시간 이상 반복적으로 팔꿈치에 부하가 가해지는 노동에 종사하는 경우 2.46배, 하루에 2시간 이상 반복적으로 손목이 꺾이는 노동에 종사하는 경우 1.98배 증가한다고 보고되었다."
345924,판례내용,159,"원고에게 적용하면 노동력보다 연령의 증가가 가장 큰 요인이며, 외상과염, 총수근 신전건 부분 파열은 흔히 동반될 수 있고, 측부인대 부분파열은 정도의 차이가 있으나, 원고 정도의 측부인대의 음영증가 소견은 흔히 발견될 수 있을 것으로 예상할 수 있음."
345924,판례내용,160,원고는 2019.6.이후 재활치료업무로 인해 이 사건 상병이 발병하였다는 주장입니다.
345924,판례내용,161,원고의 진술에 따른 업무관련성 특별진찰 소견서에 따르면 하루 업무시간(2시간) 중 재활치료업무 소요시간은 일 30분입니다.
345924,판례내용,162,근무기간을 6개월(주4.5일 근무로 확인되나 주 5일로 가정)로 계산하더라도 총 10시간입니다.
345924,판례내용,163,"한편, 원고는 이 사건 소에서 근무시간 중 모든 시간을 재활치료업무를 했다는 주장도 하고 있습니다."
345924,판례내용,164,이러한 주장으로 일 2시간을 모두 부담작업으로 보더라도 240시간 일 8시간 근무자로 치면 30일 근무량입니다.
345924,판례내용,165,각각 원고의 업무시간이 이 사건 상병 모두를 일으킬 정도로 평가되는지요?
345924,판례내용,166,2013년 발간된 여성 외상과염의 위험인자에 관한 논문에서도 보고된 바와 같이 일일 2시간 이내의 반복적인 팔꿈치와 손목을 사용하는 노동은 외상과염의 위험 인자에 포함되지 않아 상병을 일으킬 정도의 업무는 아니었다고 판단됨.
345924,판례내용,167,원고의 건강보험수진내역을 살펴보면 소외 사업장 입사 이전 아래와 같은 수진내역이 확인됩니다[수진내역 생략].
345924,판례내용,168,원고는 이 사건 입사 이전(2016.3.)부터 업무와 무관한 만성적인 손의 사용에 따른 병변이 있었다고 봄이 타당한가요?
345924,판례내용,169,주관절 외상과염 및 이 사건 상병의 발병에 있어 만성적인 손의 잦은 사용도 영향을 미치는 원인이 될 수 있는지요?
345924,판례내용,170,"2013년 발간된 여성 외상과염의 위험인자에 관한 논문에 의하면 상지의 근골격계 질환(회전근 개 병변, 척골관 증후군, 수근관증후군, 손목 건초염, 드꿰브뱅 병 등)이 병발한 경우, 외상과염의 발병율이 8.52배 증가한다고 보고되었다."
345924,판례내용,171,"이전 진료기록에서 손, 팔꿈치 주변의 질환이 진행되고 있다고 판단됨."
345924,판례내용,172,"원고의 성별, 연령, 개인질환, 일상 생활 등 사적인 요소에서의 가사활동과 돌봄 노동을 배제하였을 때, 즉 이 사건 상병의 발병에 업무만이 미치는 기여도만을 산정한다면 업무가 이 사건 상병에 상당한 정도로 기여하였다고 볼 수 있겠는지요?"
345924,판례내용,173,"원고의 외상과염의 발병은 본 사건의 업무보다는 기존의 퇴행성 병변, 연령의 증가 등이 주된 원인으로 판단됨."
345924,판례내용,174,공단의 업무상질병판정위원회 및 재심사위원회는 이 사건 신청상병과 업무관련성에 대한 판단에 동의하시는지요?
345924,판례내용,175,위 판정에 동의함.
345924,판례내용,176,나.판단
345924,판례내용,177,"1)산업재해보상보험법 제5조 제1호의 업무상 재해라 함은 근로자가 업무수행 중 그 업무에 기인하여 발생한 재해를 말하므로 업무와 재해 사이에 상당인과관계가 있어야 하고, 이 경우 근로자의 업무와 재해 사이의 인과관계에 관하여는 이를 주장하는 측에서 증명하여야 한다."
345924,판례내용,178,"업무와 재해 사이의 상당인과관계의 유무는 보통 평균인이 아니라 해당 근로자의 건강과 신체조건을 기준으로 하여 판단하여야 하며, 인과관계의 증명 정도에 관하여도 반드시 의학적ㆍ자연과학적으로 명백히 증명하여야 하는 것은 아니고 제반 사정을 고려할 때 업무와 재해 사이에 상당인과관계가 있다고 추단되는 경우에도 그 증명이 있다."
345924,판례내용,179,"다만, 이러한 정도에 이르지 못한 채 막연히 과로나 스트레스가 일반적으로 질병의 발생ㆍ악화에 한 원인이 될 수 있다고 하여 현대의학상 그 발병 및 악화의 원인 등이 반드시 업무에 관련된 것뿐 아니라 사적인 생활에 속하는 요인이 관여하고 있어 그 업무에 내재하는 위험이 현실화된 것으로 볼 수 없는 경우까지 곧바로 그 인과관계가 있다고 추단하기는 어렵다(대법원 2002.2.5."
345924,판례내용,180,선고 2001두7725 판결 등 참조).
345924,판례내용,181,"2)위 법리에 비추어 살피건대, 앞서 본 사실관계 및 변론 전체의 취지에 의하면, 원고가 약 4년 4개월 동안 방문요양보호사 업무에 종사하면서 손목과 팔꿈치에 부담이 되는 자세를 반복적으로 취하였던 사정은 인정되나, 앞서 본 사실관계, 앞서 든 각 증거들 및 변론 전체의 취지에 의하여 인정되는 다음과 같은 사정들에 비추어 보면, 원고의 주장 및 제출된 증거들만으로는 이 사건 각 상병의 발생 또는 악화와 원고의 업무수행 사이에 상당인과관계가 있다고 추단하기 부족하고, 달리 이를 인정할 증거가 없다."
345924,판례내용,182,따라서 이 사건 처분은 적법하고 원고의 주장은 받아들일 수 없다.
345924,판례내용,183,"가)이 법원 진료기록감정의(정형외과)는 「원고의 MRI 영상에서 총신전건 및 외측 측부 인대파열 부분파열이 의심되나, 급성파열을 시사하는 소견이 관찰되지 않고, 오랜 기간 퇴행성 병변이 악화된 소견으로 판단된다, 원고의 외상과염의 발병은 본 사건의 업무보다는 기존의 퇴행성 병변, 연령의 증가 등이 주된 원인으로 판단되고, 총신전건 부분파열은 외상과염의 악화로 인한 것으로 생각되며, 원고 정도의 측부인대 부분파열 소견은 흔히 발견수 있을 것으로 예상한다, 피고의 업무상질병판정위원회 및 산업재해보상재심사위원회의 업무관련성에 대한 판단에 동의한다」는 의학적 소견을 제시하였다."
345924,판례내용,184,"나)이 법원 진료기록감정의(정형외과)의 위와 같은 의학적 소견은, 「총신전건 부분파열 소견이 있으나 이는 외상이 아닌 외상과염의 결과로 발생한 병변으로, 만성적인 손의 사용에 따른 퇴행성 병변으로 보는 것이 타당하고, 업무력, 업무기간, 일일 업무량을 고려할 때 업무로 인한 발병으로 보기 어렵다」는 피고 자문의의 의학적 소견과 일치하고, 이 사건 각 상병과 업무와의 상당인과관계가 인정되지 않는다는 피고 업무상질병판정위원회 및 산업재해보상보험재심사위원회 심의결과와도 부합한다."
345924,판례내용,185,"다)또다른 이 법원 진료기록감정의(직업환경의학과)는 「피고의 주장과 같이 원고가 1일 30분, 1주 2시간 30분 정도만 재활작업을 하였다면 이 사건 각 상병의 발병 가능성은 낮아지겠다, 이 사건 각 상병이 급성 외상이 아닌 만성적인 퇴행성 병변이라는 피고 자문의의 의학적 소견과 일반적인 근무시간과 근무기간에 근거한 피고 업무상 질병판정위원회와 산업재해보상보험재심사위원회의 판단에 부동의하지 않는다」는 의학적 소견을 제시하였다."
345924,판례내용,186,"라)① 한편, 이 법원 진료기록감정의(직업환경의학과)는 ‘원고가 3년 8개월간 고령의 수급자를 상대로 재활치료를 하였고, 특히 이 사건 각 상병 발병전 6개월 동안 1일 2시간 내지 2시간 30분 동안 무릎인공관절수술환자의 재활작업을 도와주었다면, 손목과 팔꿈치의 비틀림 및 꺾인 자세로 인하여 이 사건 각 상병이 발생하였을 가능성이 높다’는 의학적 소견을 제시하였으나, 위 의학적 소견은 원고가 주장하는 것과 같이 원고가 이 사건 각 상병 발병 직전 6개월 동안 1일 2시간 이상 무릎인공관절수술환자의 재활운동을 보조하는 신체부담작업 등을 수행하였음을 전제로 한 판단에 불과한데, 원고의 주장 및 현재까지 제출된 자료들만으로는 원고가 그 주장 내용의 1일 2시간 이상의 신체부담작업을 수행하였다고 인정하기 부족하고, 달리 이를 인정할 자료가 없는 점, 오히려 원고는 피고 인천병원의 업무관련성 특별진찰 결과 당시 ’1일 30분 정도의 재활운동 보조작업을 수행하였다‘는 취지로 진술한 점 등에 비추어 보면, 위 의학적 소견의 전제와 같이 원고가 1일 2시간 이상 무릎인공관절수술환자의 재활운동을 보조하는 신체부담작업을 수행하였다고 보기 어려우므로, 위 의학적 소견만으로 원고의 업무로 인하여 이 사건 각 상병이 발병 내지 악화된 것이라 단정하기는 어렵다."
345924,판례내용,187,"② 또한 이 법원 진료기록감정의(직업환경의학과)가 「피고의 주장과 같이 원고가 1일 30분, 1주 2시간 30분 정도만 재활작업을 하였다면 그 가능성은 낮아지겠지만, 그 외의 시간에도 청소작업, 식사준비 및 설거지 작업, 빨래 작업으로 어깨, 손/손목 및 팔꿈치 등 상지의 근골격계 질환의 위험에 노출된다고 볼 수 있다」는 의학적 소견도 제시하였으나, 위 소견 내용에 비추어 보면, 위 감정의가 원고의 업무가 이 사건 각 상병을 유발할 수 있는 업무에 해당한다는 것을 넘어 이 사건 각 상병의 발병 및 악화와 원고의 업무 사이에 상당인과관계가 인정된다는 소견을 확정적으로 제시한 것으로 보이지 않으므로, 위 의학적 소견만으로 원고의 업무로 인하여 이 사건 각 상병이 발병하거나 악화된 것이라 단정하기도 어렵다."
345924,판례내용,188,"마)위와 같은 사정들에, 원고에게 진단된 이 사건 각 상병이 동일한 연령대의 퇴행성 변화에 비하여 악화되었다고 볼 자료는 없는바, 연령의 증가에 따른 퇴행성 변화만으로도 충분히 현재의 이 사건 각 상병을 초래하였을 여지가 있는 점, 원고의 주장에 의하더라도 원고가 방문요양보호사로 근로한 시간은 1일 3시간, 1주 15시간이라는 것으로 그 근무시간이 비교적 단기간인 점 등을 함께 고려하여 보면, 원고가 요양 보호사로서 수행한 신체부담업무가 이 사건 각 상병의 발생 또는 악화에 어느 정도 영향을 미쳤을 가능성이 있다는 점을 참작하여 보더라도, 업무상 재해로서의 상당인과관계를 인정할 정도로 업무 기여도가 크다고 단정할 수 없다."
345924,판례내용,189,4.결론
345924,판례내용,190,"그렇다면, 원고의 이 사건 청구는 이유 없으므로 이를 기각하기로 하여 주문과 같이 판결한다."
345924,판례내용,191,판사 장○
