판례일련번호,구분,문장번호,내용
206249,판례내용,1,【원    고】 삼성전자 주식회사 (소송대리인 법무법인 광장 담당변호사 이○ 외 2인)
206249,판례내용,2,【피    고】 동수원세무서장 (소송대리인 법무법인(유한)세한 담당변호사 강○ 외 1인)
206249,판례내용,3,【변론종결】2015.4.16.
206249,판례내용,4,【주    문】
206249,판례내용,5,1.피고가 2012.3.20.
206249,판례내용,6,"원고에 대하여 한 2010년 사업연도 법인세 64,230,150,000원의 징수처분 및 가산세 6,423,015,000원의 부과처분을 모두 취소한다."
206249,판례내용,7,2.소송비용은 피고가 부담한다.
206249,판례내용,8,【청구취지】  주문과 같다.
206249,판례내용,9,"【이    유】이하에서는 아래와 같은 약어를 사용한다.1.Intellectual Ventures Management, L.L.C."
206249,판례내용,10,"→ IV  2.Invention Investment Fund Ⅰ, L.P. → IIF1  3.Invention Investment Fund Ⅱ, L.L.C."
206249,판례내용,11,"→ IIF2  4.Intellectual Ventures Global Licensing, L.L.C."
206249,판례내용,12,→ IV US  5.Senarodos Limited → Senarodos  6.Intellectual Ventures International Licensing → IV IL  7.아일랜드 공화국 → 아일랜드  8.키프로스 공화국 → 키프로스  9.미합중국 → 미국 10.대한민국과 아일랜드간의 소득 및 양도소득에 대한 조세의 이중과세 회피와 탈세방지를 위한 협약 → 한·아일랜드 조세협약 11.대한민국과 미합중국간의 소득에 관한 조세의 이중과세 회피와 탈세방지 및 국제무역과 투자의 증진을 위한 협약 → 한·미 조세협약
206249,판례내용,13,1.기초 사실
206249,판례내용,14,"가.IV, IV US, IV IL의 설립 목적 및 지배구조 등"
206249,판례내용,15,"(1)IV는 IIF1, IIF2 등 5개의 펀드로부터 그들이 보유한 특허권의 관리를 위임받아 처리하는 미국에 거주하는 특허관리전문기업으로 2000년경 설립되었다."
206249,판례내용,16,(2)IV IL은 2010.6.21.
206249,판례내용,17,"아일랜드의 법률에 따라 설립되었는데, 키프로스의 법률에 따라 설립된 Senarodos가 IV IL의 지분 전부를 보유하고 있다.한편 미국 델라웨어주의 법률에 따라 2010.5.21."
206249,판례내용,18,"설립된 IV US가 Senarodos의 지분 전부를 보유하고 있는데, IV US는 IIF1, IIF2 등이 지분 전부를 투자하여 자신들이 보유한 특허권을 관리할 목적으로 설립된 기업이다(갑 제6, 55호증 참조)."
206249,판례내용,19,(3)IV US는 2010.6.29.
206249,판례내용,20,"Senarodos와 IIF1과 IIF2가 보유한 특허권의 재허여 계약을 체결하였고(갑 제4호증 참조), Senarodos는 2010.6.30."
206249,판례내용,21,IV IL과 위 특허권의 재허여 계약을 체결하였다가 2010.9.22.
206249,판례내용,22,이를 해지하였다(갑 제1호증 참조).
206249,판례내용,23,(4)IV US는 2010.11.8.
206249,판례내용,24,"IV IL과 IIF1, IIF2가 보유한 특허권의 재허여 계약을 체결하였다(갑 제2호증 참조)."
206249,판례내용,25,나.이 사건 계약의 체결 등
206249,판례내용,26,(1)원고는 2010.9.17.
206249,판례내용,27,"IV IL과 IIF1, IIF2가 보유한 특허권의 사용에 관한 양해각서를 체결하였다(갑 제11호증 참조)."
206249,판례내용,28,(2)① 원고는 2010.11.11.
206249,판례내용,29,"IV IL과 IIF1, IIF2가 보유한 총 32,819개의 특허권(이하 ‘이 사건 특허권’이라 한다)의 침해에 따른 손해배상 및 특허권의 허여에 관한 계약(이하 ‘이 사건 계약’이라 한다)을 체결하고, 2010.11.30."
206249,판례내용,30,"IV IL에게 계약체결일 이전까지의 이 사건 특허권의 침해 및 사용에 대한 대가로 3억 7,000만 미국달러(이하 ‘이 사건 사용료’라 한다)를 지급하였다(갑 제3, 27, 28, 56호증, 을 제5호증 각 참조)."
206249,판례내용,31,"② 이 사건 특허권 중 국내에 등록된 특허권은 1,902개로 그 비율이 약 5.7%(=1,902개/32,819개×100, 소수점 둘째짜리 이하 버림)]이다(갑 제66호증 참조)."
206249,판례내용,32,(3)IV IL은 IV US에게 원고로부터부터 지급받은 이 사건 사용료 소득 중에서 2010.12.21.
206249,판례내용,33,"339,073,075미국달러를, 2011.6.29."
206249,판례내용,34,"1,207,373미국달러를 각 지급하였고, IV US는 IV IL로부터 받은 사용료를 곧바로 IIF1, IIF2에게 지급하였다."
206249,판례내용,35,다.이 사건 처분의 경위
206249,판례내용,36,"(1)피고는, IV IL은 조세회피를 목적으로 설립된 도관회사(Conduit Company)에 불과할 뿐 이 사건 사용료 소득의 수익적 소유자(beneficial owner)가 아니어서 한·아일랜드 조세협약이 적용될 수 없으므로 원고로서는 구 법인세법(2010.12.30."
206249,판례내용,37,"법률 제10423호로 개정되기 전의 것, 이하 같다.) 제98조 제1항 제3호 본문에 따라 이 사건 사용료를 지급하면서 외국법인의 국내원천소득에 대한 법인세를 징수했어야 함에도 그러하지 않았다고 보아 2012.3.20."
206249,판례내용,38,"구 법인세법 제98조 제3항에 의하여 원고에 대하여 2010년 사업연도 법인세 94,204,220,000원(= 본세 85,640,200,000원 + 원천징수불이행가산세 8,564,020,000원)을 징수 및 부과하는 처분(이하 ‘이 사건 처분’이라 한다)을 하였다(갑 제4호증 참조)."
206249,판례내용,39,(2)원고는 이 사건 처분에 불복하여 2012.6.19.
206249,판례내용,40,"조세심판원에 심판청구를 하였고, 조세심판원은 2013.6.4."
206249,판례내용,41,"‘피고가 원고에게 한 이 사건 처분은, 1.원고가 2010.11.30."
206249,판례내용,42,"IV IL에 특허권 침해 및 허여 대가로 지급한 3억 7,000만 미국달러의 수익적 소유자와 관련하여 동 대가가 IV US 내지 IIF1 및 IIF2의 최종투자자 등에게 귀속되었는지 여부와 수익적 소유자의 거주지국에 대하여 재조사하여 그 결과에 따라 세액을 경정하고, 2.나머지 청구는 이를 기각한다.’는 결정을 하였다(갑 제5호증 참조)."
206249,판례내용,43,"(3)피고는 위 조세심판원의 결정 취지에 따라 재조사를 하여 이 사건 사용료 소득의 수익적 소유자는 IIF1, IIF2 및 그 투자자이고, 이들 대부분의 거주지가 미국이므로 한·미 조세협약 제14조 제1항에서 정한 원천세율(15%)이 적용되어야 한다고 보아 징수 및 부과세액을 70,653,165,000원(= 본세 64,230,150,000원 + 원천징수불이행가산세  6,423,015,000원)으로 감액하는 경정처분을 하였다(을 제1호증의 1, 2 참조)."
206249,판례내용,44,"【인정 근거】 다툼 없는 사실, 위 각 거시 증거, 변론 전체의 취지"
206249,판례내용,45,2.원고의 주장 및 관계 법령
206249,판례내용,46,가.원고의 주장
206249,판례내용,47,이 사건 처분은 아래와 같은 점에서 위법하므로 취소되어야 한다.
206249,판례내용,48,"① IV IL은 물적·인적 시설을 갖추고 실질적인 사업활동을 수행하고 있는 아일랜드 거주자이자 이 사건 사용료 소득의 수익적 소유자이므로, 한·아일랜드 조세협약 제12조 제1항에 따라 이 사건 사용료 소득은 국내원천소득에 해당하지 아니하고, 따라서 원고에게 법인세 원천징수의무가 없다."
206249,판례내용,49,"② 피고가 주장하는 것처럼 이 사건 사용료 소득의 수익적 소유자를 IV US 또는 IIF1, IIF2의 투자자로 보아야 한다면, 이 사건 사용료 소득과 관련하여서는 한·미 조세협약이 적용되어야 할 것인데, 한·미 조세협약 제6조 제3항에 의하면, 미국 거주자가 국내 거주자로부터 국내에 등록되지 않은 특허권의 사용에 대한 대가로서 받은 지급금은 국내원천소득에 해당하지 아니한다.따라서 원고가 이 사건 특허권 중 국내에 등록되어 있지 않은 부분에 대한 사용의 대가로 지급한 금원은 국내원천소득에 해당하지 아니한다."
206249,판례내용,50,"③ 설령 IV IL이 도관회사라 하더라도 IV IL과 특수관계에 있지 아니한 원고로서는 이를 알 수 있는 위치에 있지 아니하였고, 이 사건 사용료 소득의 수익적 소유자를 확인하기 위한 주의의무를 다하였으므로, 원고에 대한 원천징수불이행가산세 부과처분은 부당하다."
206249,판례내용,51,나.관계 법령
206249,판례내용,52,별지 기재와 같다.
206249,판례내용,53,3.IV IL이 조세회피를 목적으로 설립된 도관회사인지 여부에 관한 판단
206249,판례내용,54,가.실질과세원칙과 수익적 소유자
206249,판례내용,55,"한·아일랜드 조세협약 제12조 제1항에서는 일방체약국내의 원천으로부터 발생하는 사용료에 대하여 타방국에서만 과세되기 위한 요건으로 그 사용료를 받은 자가 타방체약국의 ‘거주자’이어야 할 뿐만 아니라 ‘수익적 소유자’일 것을 요구하고 있다.한·아일랜드 조세협약에서는 ‘수익적 소유자’의 의미에 관하여 따로 정의하고 있지 아니하나, 위 협약 제3조 제2항에 의하면, 협약에서 정의되지 아니한 용어는 - 문맥에 따라 달리 해석되지 아니하는 한 - 일방체약국의 국내법에 따른 의미를 가지게 되므로, ‘수익적 소유자’의 의미를 국내법상의 실질과세원칙을 통해 파악해 보기로 한다."
206249,판례내용,56,"국세기본법 제14조 제1항과 구 법인세법 제4조 제1항에서 규정하는 실질과세의 원칙은 소득이나 수익, 재산, 거래 등의 과세대상에 관하여 그 귀속 명의와 달리 실질적으로 귀속되는 자가 따로 있는 경우에는 형식이나 외관을 이유로 그 귀속 명의자를 납세의무자로 삼을 것이 아니라 실질적으로 귀속되는 자를 납세의무자로 삼겠다는 것이므로, 재산의 귀속 명의자는 이를 지배·관리할 능력이 없고, 그 명의자에 대한 지배권 등을 통하여 실질적으로 이를 지배·관리하는 자가 따로 있으며, 그와 같은 명의와 실질의 괴리가 조세를 회피할 목적에서 비롯된 경우에는, 그 재산에 관한 소득은 그 재산을 실질적으로 지배·관리하는 자에게 귀속된 것으로 보아 그를 납세의무자로 삼아야 할 것이고, 이러한 원칙은 법률과 같은 효력을 가지는 조세조약의 해석과 적용에 있어서도 이를 배제하는 특별한 규정이 없는 한 그대로 적용된다(대법원 2012.4.26."
206249,판례내용,57,선고 2010두11948 판결 등 참조).
206249,판례내용,58,"이 사건의 경우, 위에서 본 것처럼 한·아일랜드 조세협약 제12조 제1항에서 아일랜드 거주자가 국내 거주자로부터 받은 사용료 소득에 관하여 자국에서만 조세부담을 지기 위한 요건으로 아일랜드 거주자가 ‘수익적 소유자’일 것을 요구하는 취지는 조세회피 및 탈세를 방지하기 위한 것으로 이해되고, 이는 실질과세원칙과 그 맥락을 같이 하는 것으로 볼 수 있다."
206249,판례내용,59,"따라서 위에서 본 실질과세원칙의 법리와 한·아일랜드 조세협약 제12조 제1항에서 수익적 소유자일 것을 요구하는 취지에 비추어 보면, 한·아일랜드 조세협약 제12조 제1항에서 말하는 ‘수익적 소유자’라 함은 ‘실질과세원칙을 적용한 결과 소득이 실질적으로 귀속된 것으로 평가되는 자’라고 봄이 상당하다."
206249,판례내용,60,나.입증책임
206249,판례내용,61,소득의 귀속이 명목뿐이고 사실상 그 소득을 얻은 자가 따로 있다는 점은 이를 주장하는 자에게 입증책임이 있으므로(대법원 1984.12.11.
206249,판례내용,62,"선고 84누505 판결 참조), IV IL이 조세회피를 목적으로 설립된 도관회사로서 이 사건 계약의 형식상 거래당사자에 불과하고, 이 사건 사용료 소득의 수익적 소유자가 따로 있으므로 이 사건 계약에 관하여 한·아일랜드 조세협약이 적용될 수 없다는 점에 관하여는 이를 주장하는 피고에게 입증책임이 있다고 봄이 타당하다."
206249,판례내용,63,"이에 대하여 피고는 이 사건 사용료 소득의 수익적 소유자가 IV IL이고, 따라서 이 사건 계약에 관하여 한·아일랜드 조세협약이 적용되어야 하며, 그 결과 원고에게는 법인세 원천징수의무가 없다는 점을 원고가 주장·입증하여야 한다고 주장한다."
206249,판례내용,64,"살○, 구 법인세법 제98조 제1항, 제93조 제9호 가목, 제98조의4, 구 법인세법 시행령(2010.12.30."
206249,판례내용,65,"대통령령 22577호로 개정되기 전의 것)제138조의4의 각 규정에 의하면, 과세관청으로서는 외국법인이 국내에서 지급받은 특허권 사용의 대가에 대한 법인세의 과세요건 사실로 그 대가를 받은 자가 외국법인 즉, 국내에 본점 또는 주사무소를 두지 아니한 법인이라는 점을 주장·입증함으로써 충분하고, 더 나아가 그 외국법인의 주된 사무소가 구체적으로 어느 곳인지까지 확정하여야 하는 것은 아니므로, IV IL이 아일랜드 거주자로서 한·아일랜드 조세협약이 적용된다는 점에 관하여는 원고가 이를 적극적으로 입증해야 할 것이지만, 갑 제21, 29, 30, 57호증의 각 기재에 변론 전체의 취지를 더하면, 원고는 IV IL로부터 아일랜드 과세당국이 발행한 거주자증명서 등을 받아 피고에게 비과세·면제신청을 한 사실을 인정할 수 있으므로, 원고로서는 IV IL이 아일랜드 거주자라는 점을 충분히 입증하였다고 할 것이고, 그럼에도 불구하고 IV IL이 오로지 조세회피만을 목적으로 설립된 도관회사에 불과하여 이 사건 사용료 소득의 수익적 소유자로 볼 수 없다는 특별한 사정은 피고에게 그 입증책임이 있다고 봄이 타당하다."
206249,판례내용,66,따라서 피고의 위 주장은 받아들이지 아니한다.
206249,판례내용,67,다.도관회사 여부를 판단하는 기준
206249,판례내용,68,"외관상 과세의 근거가 되는 거래행위로 인한 소득이 거래 명의자에게 귀속된 경우 그 소득의 귀속이 명목뿐이어서 도관에 해당하고, 실질적으로 그 소득을 얻은 자 즉 수익적 소유자가 따로 있는지 여부를 판단하기 위해서는, 도관으로 지목된 명의자가 법인인 경우 그 설립 목적과 설립 경위, 사업활동 내역, 그 임직원 및 사무소의 소재를 비롯한 인적·물적 시설, 문제된 당해 거래행위와 관련한 의사결정 과정, 거래행위의 대가로 지급된 자금의 이동 내역 등 제반 사정을 고려하여야 하고, 특히 설립 목적과 관련하여서는 조세회피의 목적이 주된 것인지 여부를 중점적으로 살펴보아야 할 것이다.이하에서는 위에서 든 기준을 적용하여 이 사건의 경우 IV IL이 도관회사인지 여부를 개별적으로 검토한다."
206249,판례내용,69,라.IV IL의 설립 경위 및 사업 활동 내역
206249,판례내용,70,"(1)아일랜드는 2010년경 부동산 경기침체로 촉발된 금융위기를 극복하기 위한 노력의 일환으로 외국 기업의 투자를 유치하기 위해 법인세율을 인하하는 등 조세부담을 줄이는 조치를 취하였고, 그러한 노력의 결과로 2013.7.에는 미국 경제전문지 포보스가 선정한 기업하기 좋은 나라 1위에 선정되기도 하였다(갑 제36, 제37호증 참조)."
206249,판례내용,71,"이러한 아일랜드의 적극적인 기업우대조치에 호응하여 다수의 다국적 기업이 아일랜드에 자회사를 설립하였는데, 이는 영리를 추구하는 다국적 기업이 조세부담을 줄이기 위하여 취한 당연한 노력으로 평가할 수 있을지언정 조세회피라고 단정할 수는 없다."
206249,판례내용,72,(2)2010.9.16.
206249,판례내용,73,"개최된 IV IL의 이사회에서 참석자들은 지역 고객관리 지원, 지역 IP ecosystem의 개발과 함께 유럽 및 아시아 법인을 상대로 IV가 보유하는 상품을 적극적으로 마케팅하는 것이 IV IL의 주요 목적임을 확인하고, 재무관리인 및 사무실관리인을 우선 채용하는 것을 포함하여 8명의 직원을 고용하기로 결의하였는데(갑 제7호증 참조), 이는 IV IL이 설립 당시부터 지주회사라고 볼 수 있는 IV US와는 구별되는 사업목적과 별개의 인적 구성원을 보유하고 있었다는 점을 의미하는 것으로 볼 수 있다."
206249,판례내용,74,"(3)실제로 IV IL은 이 사건 계약을 체결하기 이전에도 핀란드 소재 법인인 NOKIA, 프랑스 소재 법인인 THALES ALENIA를 상대로 매출을 올린 것으로 보이고(갑 제26, 27호증 참조), 원고와 이 사건 계약을 체결한 이후에도 독일연방공화국 거주자인 Infineon Technologies AG와, 일본국 거주자인 Olympus Corporation과 특허권 허여계약을 체결하였을 뿐만 아니라 캐나다 법인으로 보이는 Research In Motion Limited와도 특허권 허여계약을 체결하는 등 계속적으로 사업활동을 해오고 있는 것으로 보인다(갑 제58, 59, 60호증 참조)."
206249,판례내용,75,"이 점에서 IV IL은 주식취득 및 양도 외에는 영업활동이 없거나 매각 차익을 실현한 후 청산과정을 밟는 통상의 도관회사들과는 그 태양을 달리하고 있으므로, IV IL이 이 사건 계약의 체결을 위해 급조된 일회성 회사라고는 할 수 없다."
206249,판례내용,76,"또한, IV IL은 이 중 일본국 거주자인 Olympus Corporation과 특허권 허여계약을 체결하고 받은 특허사용료에 대하여 아일랜드와 일본 사이에 체결된 조세조약 제13조 제2항에 따라 일본 과세당국에 법인세(세율 10%)를납부하였는데, 만약 IV US가 IV IL을 통하지 않고 직접 일본국 거주자인 Olympus Corporation과 특허권 허여계약을 체결하고 특허사용료를 받았을 경우를 가정해 보면, IV US는 일본 정부와 미국 사이에 체결된 조세조약 제12조 제1항에 따라 일본국에게 법인세를 납부할 의무가 없다(갑 제53, 64, 65호증 참조)는 점에서 IV IL의 숨은 설립 목적이 조세조약을 이용한 조세회피(Treaty Shopping)에 있다고 보기는 어렵다."
206249,판례내용,77,마.IV IL의 인적·물적 시설
206249,판례내용,78,"IV IL은 회사 설립 직후 IV, IV US 등 관련 회사와는 특별한 관계가 없었던 것으로 보이는 사람들(소외 2, 소외 3, 소외 4, 소외 5, 소외 6, 소외 7, 소외 8, 소외 9 등)을 임직원으로 채용하였는데, 그들 중 상당수는 아일랜드 거주자였고, 이들에 대한 임금 지급에 따른 소득세를 원천징수하였다(갑 제10호증의 1, 2, 3, 제15, 16, 40, 78, 79, 80호증 참조)."
206249,판례내용,79,"또한 별도의 사무실(Regus House Harcourt Centre Harcourt Road Dublin 2, 1st Floor Block E, Iveagh Court Harcourt Road Dublin 2)을 임차하여 사용하였고(갑 제17, 18호증, 제19호증의 1, 2, 3, 제41호증의 1 내지 6, 제68, 69, 70, 73호증, 제74호증의 1, 2, 제75, 77호증 참조), 수시로 의자, 컴퓨터, 프린터 등 필요한 비품들을 구매하였다(갑 제42호증의 1에서 18 참조)."
206249,판례내용,80,"위와 같은 점에 비추어 보면, IV IL은 피고가 수익적 소유자라고 의심하는 IV US와는 독립된 인적·물적 시설을 갖추고 있는 것으로 볼 수 있고, 이 점에서 인적 구성원이 없거나 모회사의 임직원이 겸직하는 통상의 도관회사와는 그 태양을 달리한다."
206249,판례내용,81,바.이 사건 계약의 의사결정 과정
206249,판례내용,82,"(1)IV IL이 설립되기 훨씬 이전인 2004년경부터 IV가 원고와 특허권 침해에 대한 손해배상 및 특허권 허여에 관한 협상을 진행해 온 사실은 원고도 이를 다투지 아니한다.그리고 2010년 IV US가 설립된 이후에는 IV US가 협상을 담당한 것으로 보이고, IV IL이 설립된 2010.6.21."
206249,판례내용,83,이후로는 IV IL이 협상을 주도하여 IV IL의 명의로 2010.9.17.
206249,판례내용,84,"원고와 양해각서를 작성하고, 2010.11.11."
206249,판례내용,85,"이 사건 계약을 체결하기에 이르렀는데, 그 과정에서 IV IL의 2010.9.16."
206249,판례내용,86,"이사회에 IV의 직원들이 참석하였고, 그 회의록에는 IV IL이 앞으로 IV US가 세운 계획에 따라 운영될 것이며, 같은 날 오전에 원고에 대한 특허권 허여와 관련한 일부 사항에 대한 합의가 이루어졌다는 내용이 기재되어 있으며(갑 제7호증), IV IL이 이 사건 계약 3일 전인 2010.11.8.이 되어서야 IV US로부터 특허권 재허여를 받은 사실은 인정된다(다툼 없음)."
206249,판례내용,87,"(2)그러나 어떤 법률행위의 주체가 그 법률행위에 이르게 된 의사결정 과정에서 제3자의 영향력을 받았다 하더라도 그러한 사정만으로 곧 그 법률행위로 인한 소득의 지배·관리·처분권이 제3자에게 귀속된다고 볼 수는 없고, 이는 지주회사(Holding Company)가 자회사를 설립하여 자회사에 대하여 실질적인 지배권을 행사하는 경우에도 마찬가지이다."
206249,판례내용,88,"지주회사는 자회사의 지배주주로서 자회사의 의사결정에 영향력을 행사하는데 필요한 정도의 인적·물적 조직을 갖추고, 통합적이고 장기적인 관점에서 자회사를 지배하는 역할을 수행하는 것을 그 특징으로 하므로, 자회사가 법률행위를 함에 있어 그 의사결정에 영향력을 행사하는 지위에 있지만, 자회사가 독립한 법인격체로서 독립적인 사업 활동을 하는 이상 자회사의 사업 활동으로 인한 이익 및 손실은 원칙적으로 그 자회사에 귀속되는 것이고, 지주회사가 그 자회사의 주주로서 배당을 받는 등 이익을 분배받는 경우에 비로소 그 지주회사의 이익으로 귀속될 수 있는 것이다."
206249,판례내용,89,"이러한 관점에서 볼 때, 다국적 기업이 조세부담이 적은 나라에 자회사를 설립하고, 그 자회사를 통해 거래하였다고 하여 쉽사리 그 자회사를 도관회사로 단정할 수는 없다.조세부담을 낮추려는 노력은 경제적 이윤추구를 주목적으로 하는 기업의 본질상 당연하기 때문이다."
206249,판례내용,90,"따라서 다국적 기업이 특정 국가에 설립한 회사가 도관회사에 불과하다고 하기 위해서는, 그 회사가 소재한 국가가 해외원천소득에 대하여 저율과세 또는 비과세하는 등 그 국가에 조세피난처(Tax Haven)적 요소가 있다는 점만으로는 부족하고, 그 회사가 조세조약을 이용한 조세회피(Treaty Shopping)를 주된 목적으로 하여 미리 설계한 투자구조 및 지배구조에 따라 형식적으로 만들어졌다는 사정이 인정되어야 한다."
206249,판례내용,91,"(3)이 사건에서, IV IL이 설립된 후 원고와 막바지 협상을 거쳐 그 명의로 이 사건 계약을 체결한 것은 미국 외 시장에 대한 사업을 위해 설립된 IV IL이 그 설립 목적에 따라 자신의 명의로 사업 활동을 한 것으로 볼 수 있으므로, 앞서 본 사정만으로 IV IL이 이 사건 계약의 체결만을 위해 급조된 서류상의 회사 즉 도관에 불과하다고 인정하기에는 부족하다."
206249,판례내용,92,사.IV IL의 매출실적과 법인세 납부
206249,판례내용,93,"IV IL은 2010 사업연도 및 2011 사업연도(상반기)에 원고로부터 지급받은 이 사건 사용료 소득을 포함한 513,325,670 미국달러의 매출을 올린 이래 2011 사업연도(하반기)이후 2013 사업연도까지 합계 5억 미국달러에 가까운 매출을 올렸고(갑 제12, 20, 43호증 참조), 매출에 따른 법인의 사업이익에 대하여 이 사건 사용료 소득의 수수료 부분을 포함하여 매년 아일랜드 과세당국에 법인세를 신고·납부해 오고 있다(갑 제22 내지 25호증 참조)."
206249,판례내용,94,이 점에서도 소득원천지국이나 거주지국에 세금을 납부하지 않는 통상의 도관회사와는 구별된다.
206249,판례내용,95,아.이 사건 사용료 소득의 이동
