판례일련번호,구분,문장번호,내용
206249,판례내용,96,"IV IL은 IV US에게 원고 등으로부터 받은 특허사용료 등의 총수입에서 총수입액에 따라 정한 비율의 금액을 제외한 나머지 돈을 사용료로 지급한 것(갑 제2호증 참조)을 비롯하여 IV IL이 미국 외 지역에서 얻은 순이익의 85% ~ 95%를 IV US에게 지급해 오고 있는데, IV IL이 특허권 재허여 계약 등을 통해 얻은 수입 중 상당 부분을 IV US에 송금하였다 하더라도 이는 양 회사 사이의 특허권 재허여 계약에 따른 것으로 보일 뿐 그 자체로 IV IL이 도관회사라는 징표라 할 수는 없고, IV IL과 IV US가 특수관계에 있음을 고려할 때 IV IL의 이익률(5% ~ 15%)이 IV IL의 독립성을 의심할 정도로 부당하게 과소한 것으로 보기도 어렵다."
206249,판례내용,97,자.IV US가 이 사건 계약을 체결하였을 경우와의 비교
206249,판례내용,98,(1)IV IL이 조세조약을 이용한 조세회피의 목적으로 설립된 법인인지를 판단하기 위해서는 IV IL이 아니라 IV US가 이 사건 계약을 체결하였을 경우에 IV US가 지게 되는 국내 세법상의 조세부담과 비교해 보는 것이 유의미하다.
206249,판례내용,99,"(2)구 법인세법 제93조 제9호 단서 후문은 외국법인이 특허권, 실용신안권, 상표권, 디자인권 등 권리의 행사에 등록이 필요한 권리(이하 ‘특허권 등’이라 한다)를 국외에서 등록하였을 뿐 국내에서 등록하지 아니한 경우라도 특허권 등이 국내에서 제조·판매 등에 사용된 때에는 사용의 대가로 지급받는 소득을 국내원천소득으로 보도록 정하였으나, 국제조세조정에 관한 법률 제28조는 “비거주자 또는 외국법인의 국내원천소득의 구분에 관하여는 소득세법 제119조 및 법인세법 제93조에도 불구하고 조세조약이 우선하여 적용된다.”고 규정하고 있으므로, 국외에서 등록되었을 뿐 국내에는 등록되지 아니한 미국법인의 특허권 등이 국내에서 제조·판매 등에 사용된 경우 미국법인이 사용의 대가로 지급받는 소득을 국내원천소득으로 볼 것인지는 한·미 조세협약에 따라 판단하지 아니할 수 없다.그런데 한·미 조세협약 제6조 제3항, 제14조 제4항은 특허권의 속지주의 원칙상 특허권자가 특허물건을 독점적으로 생산, 사용, 양도, 대여, 수입 또는 전시하는 등의 특허실시에 관한 권리는 특허권이 등록된 국가의 영역 내에서만 효력이 미친다고 보아 미국법인이 국내에 특허권을 등록하여 국내에서 특허실시권을 가지는 경우에 그 특허실시권의 사용대가로 지급받는 소득만을 국내원천소득으로 정하였을 뿐이고, 한미조세협약의 해석상 특허권이 등록된 국가 외에서는 특허권의 침해가 발생할 수 없어 이를 사용하거나 사용의 대가를 지급한다는 것을 관념할 수도 없다.따라서 미국법인이 특허권을 국외에서 등록하였을 뿐 국내에는 등록하지 아니한 경우에는 미국법인이 그와 관련하여 지급받는 소득은 그 사용의 대가가 될 수 없으므로 이를 국내원천소득으로 볼 수 없다(대법원 2014.11.27."
206249,판례내용,100,선고 2012두18356 판결 등 참조).
206249,판례내용,101,"(3)위와 같은 법리에 비추어 볼 때, IV US가 IV IL을 설립하지 아니하고 직접 원고와 이 사건 계약과 같은 내용으로 계약을 체결하고 원고로부터 특허권의 사용에 대한 대가를 받았다고 하더라도 그 대부분은 국내원천소득에 해당하지 아니한다.즉 이 사건 특허권 중 국내에 등록된 특허권은 약 5.7%이고, 이 부분에 해당하는 원천징수액은 13억 8,000여만 원에 불과한데, 이 사건 사용료 소득액과 비교할 때 IV US가 위 정도의 원천징수액을 회피하기 위해 아일랜드에 도관회사인 IV IL을 설립하여 그 명의로 원고와 이 사건 계약을 체결하였다고 보기는 어렵다."
206249,판례내용,102,"(4)이 점과 관련하여 피고는, 원고가 IV IL에게 지급한 이 사건 사용료 소득이 특허권 사용에 대한 대가가 아니라 미등록 특허권의 사실상 사용에 따른 대가라거나, 이 사건 사용료 소득 중 미국 외에 등록된 특허의 사용료에 대해서는 한·미 조세협약이 적용되지 않으므로 국내원천소득으로 과세되어야 한다는 취지로도 주장한다."
206249,판례내용,103,"그러나 이 사건 계약서에 의하면, 특허권의 허여에 관한 계약임이 명시되어 있을 뿐만 아니라 달리 특허권의 사용료와 구분되는 의미에서 사실상 사용에 관한 대가를 지급한 것이라는 점에 부합하는 증거도 없고, 앞서 본 것처럼 미국법인이 특허 사용에 대한 대가로 지급받은 소득이 국내원천소득으로 되기 위해서는 그 특허가 국내에 등록되어야 하므로 특허가 국내에 등록되지 않은 이상 특허 등록국이 미국이든 다른 제3국이든 그 사용에 대한 대가를 국내원천소득으로 볼 수 없다는 점에서는 마찬가지이다."
206249,판례내용,104,따라서 피고의 위 주장들은 모두 이유 없다.
206249,판례내용,105,차.소결론
206249,판례내용,106,"위에서 살펴본 IV IL의 설립 목적과 경위, 사업활동 내역, 인적·물적 시설의 구비 이 사건 계약과 관련한 의사결정 과정, 이 사건 사용료 소득의 이동 내역, IV US가 원고와 이 사건 계약을 체결하였을 경우와의 비교 등을 두루 참작할 때 피고가 제출한 증거만으로는 IV IL이 도관회사로서 이 사건 사용료 소득의 귀속 명의와 실질의 괴리가 있는 경우에 해당한다는 점을 인정하기에 부족하고, 달리 이 점을 인정할 만한 증거가 없으므로, 이와 다른 전제에 선 이 사건 처분은 원고의 나머지 주장에 관하여 살펴볼 필요 없이 위법하므로 취소되어야 한다."
206249,판례내용,107,4.결 론
206249,판례내용,108,"그렇다면, 원고의 이 사건 청구는 이유 있으므로 이를 인용하기로 하여, 주문과 같이 판결한다."
206249,판례내용,109,[별지 생략]
206249,판례내용,110,판사 장○(재판장)정○ 이○
