판례일련번호,구분,문장번호,내용
342731,판례내용,129,2)이에 대하여 서울중앙지방법원은 2015.5.15.
342731,판례내용,130,"‘C노동조합의 위원장이 조합원총회를 거치지 않고 노사합의를 체결한 것은 규약을 위반한 것에 해당하나, 그와 같은 내부적인 절차 규정에 따르지 않고 노사합의를 체결한 것이 노사합의의 효력을 부정할 만큼 현저히 합리성을 결여하였다고 볼 수 없으므로, 노사합의가 무효라고 볼 수 없다."
342731,판례내용,131,"따라서 노사합의를 체결하는 과정에서 발생한 절차위반 행위와 노사합의로 인한 근로조건 저하 내지 그로 인한 정신적 손해 사이에 상당인과관계가 있다고 볼 수 없고, 다만 노사합의의 체결 과정에 참여할 절차적 권한 자체를 침해당함으로써 발생한 정신적 손해의 배상은 구할 수 있다’라는 이유로 1인당 20만 원 내지 30만 원의 위자료를 인정하는 일부인용 판결을 선고하였다(서울중앙지방법원 2014가합35452호)."
342731,판례내용,132,3)이에 대하여 C노동조합 측이 항소하였으나 서울고등법원은 2015.12.16.
342731,판례내용,133,"항소를 기각하였고(서울고등법원 2016다205908호), C노동조합 측이 상고하였으나 대법원은 2018.7.26."
342731,판례내용,134,상고를 기각하여(대법원 2016다205908호) 제1심 판결이 그대로 확정되었다.
342731,판례내용,135,마.이 사건 명예퇴직에 대한 무효확인 소송 경과
342731,판례내용,136,"1)이 사건 명예퇴직으로 퇴직한 8,304명 중 255명은 2018.12.27."
342731,판례내용,137,"서울중앙지방법원에 법원에 원고를 상대로 ‘원고는 부진인력 관리 프로그램의 연장선에서 구조조정을 계획하고, C노동조합과 밀실에서 이 사건 노사합의를 체결한 후 이 사건 명예퇴직을 실시하였는바, 그 과정에서 대상자들을 집중적으로 면담하여 명예퇴직을 종용하는 등 이 사건 명예퇴직은 실질적으로 원고의 강요에 따라 이루어진 해고에 해당하므로, 해고사유 없이 이루어진 이 사건 명예퇴직은 무효이다’라고 주장하며 이 사건 명예퇴직의 무효확인을 구하는 민사소송을 제기하였다(이하 ‘관련 명예퇴직무효확인 소송’이라 한다)."
342731,판례내용,138,2)서울중앙지방법원은 2020.8.20.
342731,판례내용,139,"‘원고가 당시 구조조정이 필요한 상황이라고 판단한 것을 잘못이라고 할 수 없고, 관련 손해배상청구 소송의 판결에서도 절차적 권리 침해를 인정하였을 뿐 노사합의의 유효성을 부정하지 않았으며, 명예퇴직자들로 하여금 어쩔 수 없이 특별명예퇴직을 신청하게 하였다고 볼 수 있을 정도의 강압이나 종용이 있었다고 볼 수 없고, 명예퇴직자들은 별다른 이의 없이 1인당 4,500만 원 내지 3억 2,000만 원의 명예퇴직금을 수령하였다’는 이유로 이 사건 명예퇴직이 실질적인 해고에 해당하지 않는다고 판단하여 청구기각 판결을 선고하였다(서울중앙지방법원 2018가합593550호)."
342731,판례내용,140,"2)일부 명예퇴직자들이 항소하였으나, 서울고등법원은 2021.5.18."
342731,판례내용,141,"항소를 기각하였고(서울고등법원 2020나2029796호), 위 판결은 그 무렵 확정되었다."
342731,판례내용,142,위 항소심 판결의 이유 중 이 사건과 관련된 부분은 아래와 같다.
342731,판례내용,143,"원고가 2004년부터 2009년경까지 부진인력 관리계획을 수립한 후 부진인력 대상자에게 인사고과, 업무분담 등에서 불이익을 주는 차별정책을 시행하였고, 부진인력 대상자들로서 부당한 인사고과를 받거나 부당한 징계를 받은 근로자들이 2009년경 또는 2010년경 부진인력 관리 프로그램에 따라 부당한 징계 또는 인사고과를 받았다고 주장하면서 제기한 관련 임금지급청구 소송 등에서 일부 승소판결이 확정된 사실은 인정되나, 제출된 증거만으로는 위와 같은 소송이 제기되어 패소하였음에도 원고가 이 사건 명예퇴직 무렵 여전히 부진인력을 퇴출시키기 위한 부진인력 관리 프로그램을 운용하고 있었다고 인정하기에 부족하고, 달리 이를 인정할 증거가 없다."
342731,판례내용,144,5.판단
342731,판례내용,145,가.이 사건 진정에 각하 사유가 존재하는지 여부
342731,판례내용,146,1)구 국가인권위원회법 제32조 제1항 제5호 해당 여부
342731,판례내용,147,"구 국가인권위원회법 제32조 제1항 제5호는 ‘진정이 제기될 당시 진정의 원인이 된 사실에 관하여 법원 또는 헌법재판소의 재판, 수사기관의 수사 또는 그 밖의 법률에 따른 권리구제 절차가 진행 중이거나 종결된 경우’에는 피고가 그 진정을 각하한다고 규정하고 있다."
342731,판례내용,148,"그런데 앞서 든 증거들과 을가 제8호증의 기재에 변론 전체의 취지를 더하여 알 수 있는 다음과 같은 사정들, 즉"
342731,판례내용,149,"① 민사집행법 제300조 제2항은 다툼이 있는 권리관계에 대하여 임시의 지위를 정하기 위한 가처분을 할 수 있다고 규정하고 있고, 이 사건 가처분 기각결정은 위와 같은 가처분 신청을 기각한 것인 점,"
342731,판례내용,150,"② 위와 같은 가처분은 본안소송을 전제로 한 것으로서 향후 본안소송에서의 재판 결과에 따라 그 권리관계가 변동될 가능성이 충분한 점,"
342731,판례내용,151,"③ 구 국가인권위원회법 제32조 제1항 제5호는 진정 각하 사유로 ‘진정의 원인이 된 사실에 관하여 법원의 재판이 종결된 경우’를 규정하고 있는바, 본안소송의 제기를 예정하고 있는 가처분 신청에 관한 결정의 경우 위 규정에 해당하지 않는다고 해석하는 것이 문언에 보다 부합하는 점,"
342731,판례내용,152,"④ 가처분 신청은 권리관계의 급박한 위험을 막기 위하여 신속하게 제기되는 경우가 빈번한데, 이러한 가처분 신청 절차에서 기각결정을 받았다는 이유만으로 향후 국가인권위원회법에 따른 진정 제기가 모두 각하되어야 한다고 볼 경우 진정인의 권리를 지나치게 침해할 것으로 보이는 점,"
342731,판례내용,153,⑤ 참가인들이 아닌 다른 전보발령자가 이 사건 전보발령에 관하여 제기한 진정사건에서 피고가 2014.12.2.
342731,판례내용,154,"‘이 사건 가처분 기각결정으로 법원의 재판이 종결된 경우에 해당한다’는 이유로 각하결정을 한 것은 사실이나, 피고는 차별행위에 대한 진정을 조사하고 구제조치 등을 권고할 권한을 가진 독립된 국가기관으로서 시간의 경과, 환경의 변화, 판례의 변경 등 사정변경에 따라 과거의 결정 기준을 스스로 변경할 수 있으므로, 피고가 종전 진정사건에서 취했던 입장을 변경하여 이 사건 진정을 각하하지 않은 것이 그 자체로 신의칙이나 금반언의 원칙에 반하여 위법하다고 보기는 어려운 점 등에 비추어 보면, 이 사건 가처분 기각결정이 있었다는 사정만으로 이 사건 진정에 각하사유가 존재한다고 보기는 어렵다."
342731,판례내용,155,이와 다른 전제에서 한 원고의 이 부분 주장은 이유 없다.
342731,판례내용,156,2)구 국가인권위원회법 제32조 제1항 제4호 해당 여부
342731,판례내용,157,"구 국가인권위원회법 제32조 제1항 제4호 본문은 ‘진정의 원인이 된 사실이 발생한 날부터 1년 이상 지나서 진정한 경우’에는 피고가 그 진정을 각하한다고 규정하면서, 그 단서에서 ‘다만, 진정의 원인이 된 사실에 관하여 공소시효 또는 민사상 시효가 완성되지 아니한 사건으로서 피고가 조사하기로 결정한 경우에는 그러하지 아니하다’고 규정하고 있다."
342731,판례내용,158,"그런데 앞서 든 증거들에 변론 전체의 취지를 더하여 알 수 있는 다음과 같은 사정들, 즉"
342731,판례내용,159,"① 이 사건 진정은 참가인들이 이 사건 전보발령으로 인하여 그 당시부터 이 사건 진정 제기 시까지 지속적인 불이익을 받고 있으므로, 그에 대한 구제조치를 구하는 것인 점,"
342731,판례내용,160,② 따라서 이 사건 진정의 원인이 된 사실은 이 사건 전보발령 당시인 2014.5.12.
342731,판례내용,161,"발생한 것이 사실이나, 만일 이 사건 진정의 내용대로 이 사건 전보발령이 불법행위이고, 그로 인한 참가인들의 피해가 지속되고 있다고 인정될 경우 참가인들의 원고에 대한 손해배상 채권은 이 사건 진정 당시 그 소멸시효가 완성되지 않았다고 볼 여지가 있는 점,"
342731,판례내용,162,"③ 이에 피고는 이 사건 진정에 대하여 조사하기로 결정한 점 등에 비추어 보면, 이 사건 진정에는 구 국가인권위원회법 제32조 제1항 제4호 단서에서 정한 예외사유가 있다고 보이므로, 이 사건 진정에 각하사유가 존재한다고 보기는 어렵다."
342731,판례내용,163,이와 다른 전제에서 한 원고의 이 부분 주장도 이유 없다.
342731,판례내용,164,나.이 사건 전보발령이 차별행위에 해당하는지 여부
342731,판례내용,165,1)관련 규정 및 법리
342731,판례내용,166,"구 국가인권위원회법은 기본적 인권을 보호하고 그 수준을 향상시킴으로써 인간으로서의 존엄과 가치를 실현하려는 목적에서, 합리적인 이유 없이 성별, 종교, 장애, 나이, 사회적 신분, 출신 지역, 출신 국가, 출신 민족, 용모 등 신체 조건, 혼인 여부, 임신 또는 출산, 가족 형태 또는 가족 상황, 인종, 피부색, 사상 또는 정치적 의견, 형의 효력이 실효된 전과(前科), 성적(性的) 지향, 학력, 병력(病歷) 등을 이유로 고용(배치 등을 포함한다)과 관련하여 특정한 사람을 우대․배제․구별하거나 불리하게 대우하는 행위를 ‘평등권 침해의 차별행위’(이하 ‘차별행위’라 한다)중 하나로 규정하고[제2조 제3호 (가)목], 독립된 국가기관으로 국가인권위원회를 설립하여 차별행위에 대한 진정을 조사하고 구제조치 등을 권고하도록 하였다(제1조, 제30조, 제44조)."
342731,판례내용,167,"국가인권위원회법에서 말하는 차별행위란 본질적으로 같은 것을 다르게, 다른 것을 같게 취급하는 것을 말하는 것으로, 본질적으로 동일한 비교집단에 속하는 비교대상과 다르게 대우하는 경우 차별이 존재한다고 볼 수 있고, 그 차별에 합리적인 이유가 없어 실질적인 불평등이 발생한다면 국가인권위원회법이 금지하는 차별행위에 해당한다."
342731,판례내용,168,"국가인권위원회법상 차별금지 사유를 이유로 한 고용 관련 차별에 합리적인 이유가 있는지는 차별의 목적과 경위, 구체적인 차별의 내용과 정도, 다른 합리적인 대안의 존부, 차별을 완화하기 위한 조치의 존부 및 그 적정성 등을 종합적으로 고려하여 판단하여야 한다(대법원 2023.6.29."
342731,판례내용,169,선고 2019두53396 판결 참조).
342731,판례내용,170,2)참가인들에 대한 불리한 대우의 존재 여부
342731,판례내용,171,"앞서 든 증거들과 갑 제10호증의 기재에 변론 전체의 취지를 종합하여 알 수 있는 다음과 같은 사정들, 즉"
342731,판례내용,172,"① 참가인들이 업무지원단으로의 발령을 희망하지 않았음에도 원고가 업무상 필요에 따라 이 사건 전보명령을 한 점,"
342731,판례내용,173,"② 업무지원단은 원고의 구조조정 및 이 사건 명예퇴직 이후 새로 신설된 부서로, 케이블 운영실태 점검, 무선 품질 측정, 임대단말 회수 등의 업무를 수행하였고, 소수 인원이 근무하는 사무실에서 근무하게 되었는바, 참가인들이 자신의 의사에 반하여 기존에 수행하던 업무와 다른 성격의 업무를 수행하고, 다른 직원들과 떨어져 별개의 사무실에서 근무하는 것은 불리한 대우에 해당할 여지가 충분한 점,"
342731,판례내용,174,"③ 실제로 원고는 구조조정 및 명예퇴직 이후 발생한 5,293명의 미보임 직원에 대한 2차례의 TM을 실시하여 4,092명을 재배치하였고, 그런데도 미배치된 잔류인력 1,201명 중 인사고과 등을 평가하여 고득점자 순으로 910명을 기존 부서에 배치한 뒤 최종적으로 남은 291명만을 업무지원단으로 발령한 점,"
342731,판례내용,175,"④ 이 사건 전보발령으로 업무지원단에서 근무하게 된 직원들과 다른 직원들의 급여가 동일하다거나, 종전 근무지와 통근거리에 큰 차이가 없다는 사정만으로는 이 사건 전보발령이 불리한 대우가 아니라고 인정하기에 부족한 점 등을 종합하면, 이 사건 전보발령은 참가인들에 대한 불리한 대우라고 봄이 타당하다."
342731,판례내용,176,이와 다른 전제에서 한 원고의 이 부분 주장도 이유 없다.
342731,판례내용,177,3)B단체 가입 등의 사실이 차별금지 사유에 해당하는지 여부
342731,판례내용,178,"구 국가인권위원회법 제2조 제3호는 합리적인 이유 없이 성별, 종교, 장애, 나이, 사회적 신분, 출신 지역, 출신 국가, 출신 민족, 용모 등 신체 조건, 기혼ㆍ미혼ㆍ별거ㆍ이혼ㆍ사별ㆍ재혼ㆍ사실혼 등 혼인 여부, 임신 또는 출산, 가족 형태 또는 가족 상황, 인종, 피부색, 사상 또는 정치적 의견, 형의 효력이 실효된 전과(前科), 성적(性的) 지향, 학력, 병력(病歷) 등을 이유로 차별하는 것을 금지하고 있다."
342731,판례내용,179,"그런데 위 규정의 문언과 취지, 평등권 침해의 차별행위 양상이 매우 다양하게 나타날 수 있는 점 등에 비추어 보면, 위 규정에서 들고 있는 차별금지 사유들은 평등권 침해의 차별행위를 개념적으로 정의하기 위해 차별금지 사유를 예시하고 있는 것으로 보아야 한다."
342731,판례내용,180,"따라서 위 규정에 예시된 차별금지 사유가 아니라고 하더라도, 그와 유사한 가치와 중요성을 가진 사유로 본질적으로 동일한 비교집단에 속하는 비교대상과 다르게 대우하는 경우 차별행위에 해당한다고 봄이 타당하다."
342731,판례내용,181,"살피건대, 만일 원고가 참가인들이 B단체에 가입하였다는 등의 이유로 참가인들에 대해 이 사건 전보발령을 하였다면, 이는 근로자가 특정 단체에 가입하였다는 이유로 불리한 대우를 한 것이므로, 근로자들의 단결할 권리 또는 헌법상 보장되는 결사의 자유에 의하여 보장되는 권리 행사를 사유로 한 것으로서 구 국가인권위원회법 제2조 제3호에서 예시한 차별금지 사유와 유사한 가치와 중요성을 가진 사유로 불리한 대우를 한 것에 해당한다."
342731,판례내용,182,이와 다른 전제에서 한 원고의 이 부분 주장도 이유 없다.
342731,판례내용,183,4)이 사건 전보발령에 합리적인 이유가 있는지 여부
342731,판례내용,184,"그런데 위 인정사실과 앞서 든 증거들 및 갑 제24호증의 기재에 변론 전체의 취지를 더하여 알 수 있는 다음과 같은 사정을 종합하면, 이 사건 전보발령은 원고가 미배치된 잔류인력을 신규 부서에 발령하여야 하는 불가피한 상황에서 나름대로의 합리적인 기준에 따른 발령을 한 것에 해당하고, 그로 인하여 참가인들이 받은 불리한 대우가 중하다고 보이지 않으며, 이 사건 전보발령보다 명백히 합리적인 대안이 있었다고 보이지도 않는바, 이 사건 전보발령에 따른 차별은 합리적인 이유가 있는 경우에 해당한다."
342731,판례내용,185,이를 지적하는 원고의 이 부분 주장은 이유 있다.
342731,판례내용,186,"가)원고는 2013년에 설립 이래 최대의 당기순손실을 기록하였고, 2014년 1분기에도 여전히 손실이 발생하고 있었으며, 경쟁사에 비하여 인건비가 비용에서 차지하는 비율이 훨씬 높은 반면 1인당 영업이익은 현저히 낮은 상황이었으므로, 당시 원고가 구조조정이 필요한 상황이라고 판단한 것을 잘못이라고 할 수 없다."
342731,판례내용,187,"나)원고는 이 사건 명예퇴직 및 대규모 구조조정을 실시하였고, 그 결과 5,293명의 미보임 직원이 발생하였으며, 이에 대하여 원고는 이 사건 노사합의 및 부속합의를 거치고, 수년간 시행하여 온 인사제도이자 배치 희망자와 수요 부서의 의견을 모두 반영하여 시행하는 TM을 실시하여 4,092명을 기존 부서에 배치하였는바, 위와 같은 원고의 구조조정 과정에 잘못이 있다고 볼 만한 아무런 자료가 없다."
342731,판례내용,188,"다)이후 원고는 미배치된 잔류인력 1,201명에 대하여"
342731,판례내용,189,"① 최근 3년간의 인사고과 60%,"
342731,판례내용,190,"② 과거 징계전력 10%,"
342731,판례내용,191,"③ 평소 근무태도 30%를 점수화한 후 고득점자 순으로 910명을 기존 부서에 배치하였고, 최종적으로 남은 291명에 대하여 이 사건 전보발령을 하였다."
342731,판례내용,192,"그런데 원고가 위 잔류인력 1,201명을 기존 부서에 모두 배치할 수 있었다고 볼 만한 아무런 자료가 없는 이상 업무지원단을 신설하여 기존 부서의 수용한도를 초과하는 인원을 배치한 것이 부당하다고 보기 어렵다.결국 인사권자인 원고로서는 잔류인력 1,201명이 납득할 수 있는 기준을 제시하여 업무지원단 발령자를 선정해야 했고, 이러한 상황에서 인사고과, 징계전력, 근무태도를 기준으로 삼은 것은 나름대로의 합리성과 공정성을 갖춘 것으로서 인사권자의 재량권 범위 내라고 보이고, 위 기준보다 명백히 나은 대안이 있었던 것으로 보이지도 않는다."
342731,판례내용,193,"이에 대하여 피고는, 원고가 과거 부진인력 관리 문건을 생성하여 B단체 가입 등을 이유로 인사고과에 불이익을 주는 등의 행위를 한 전력이 있고, 2011년부터 2014년까지 참가인들이 낮은 인사고과 점수를 받은 이유 역시 원고가 B단체 가입을 이유로 낮은 인사고과 점수를 부여했기 때문이며, 원고 전체 근로자에서 B단체 가입자가 차지하는 비율에 비하여 업무지원단 발령자에서 B단체 가입자가 차지하는 비율이 지나치게 높은 것이 그 근거라고 주장한다."
342731,판례내용,194,"살피건대, 앞서 본 바와 같이 관련 임금지급청구 소송에서 원고가 2005년 경 부진인력 관리 문건을 생성하여 이후 부진인력 대상자의 퇴사를 유도하는 등의 행위를 하였고, 2009년 부진인력 대상자에게 부당하게 낮은 인사고과 점수를 부여한 사실이 인정된 바 있으나, 이는 2009년 인사고과 평가 이전까지의 사정에 불과하고, 2010년 이후에도 원고가 위와 같은 행위를 하였다고 인정할 만한 별다른 자료가 없다."
342731,판례내용,195,특히 부진인력 대상자들은 2010.10.28.
342731,판례내용,196,"법원에 관련 임금지급청구 소송을 제기하였고, 이후 항소심 법원은 원고가 부진인력 대상자에 대하여 부당한 인사고과를 한 사실 등을 인정하기도 하였는바, 이러한 상황에서 원고가 참가인들이 부진인력 대상자였다는 이유로 2011년부터 2014년까지 부당하게 낮은 인사고과 점수를 부여하였다고 단정하기 어렵다."
342731,판례내용,197,이러한 취지에서 관련 명예퇴직무효확인 소송의 항소심 법원은 ‘원고가 이 사건 명예퇴직 무렵 여전히 부진인력을 퇴출시키기 위한 부진인력 관리 프로그램을 운용하고 있었다고 인정하기에 부족하다’고 판단하였다.
342731,판례내용,198,또한 피고는 이 사건 결정에서 ‘B단체 전체 회원 100명 중 약 78명이 이 사건 전보발령 대상에 포함되었다’는 사실을 인정하여 이를 원고가 B단체 회원임을 이유로 참가인들에게 낮은 인사고과를 부여하였다고 판단하는 이유로 삼았다.
342731,판례내용,199,"그러나 피고의 위와 같은 사실인정은 주로 참가인들이 제출한 자료(을가 제9호증의 8 참조)를 근거로 한 것으로 보이는데, 위 자료는 참가인들이 업무지원단 발령자와 B단체 명단을 임의로 정리한 자료로 그 정보의 출처인 원본 자료를 확인할 수 없는바, 위와 같은 숫자 산정의 정확성을 담보할 수 없다."
342731,판례내용,200,"나아가 참가인들이 어떠한 이유로 낮은 인사고과 점수를 받았는지 확인할 수 없는 상황에서, 단순히 이 사건 전보발령 대상자 중 B단체 회원 비율이 높다는 이유만으로 참가인들이 B단체 회원임을 이유로 낮은 인사고과 점수를 받았다고 단정할 수도 없다."
342731,판례내용,201,참가인들 일부(16명)를 포함한 182명의 전보발령자들은 2014.5.12.
342731,판례내용,202,이 사건 전보발령을 받고 18일 후인 2014.5.30.
342731,판례내용,203,"그 효력정지를 구하는 가처분 신청을 하였으나, 2014.8.12."
342731,판례내용,204,이 사건 가처분 기각결정을 받았음에도 별다른 이의를 제기하지 않았고 본안소송도 제기하지 않았다.
342731,판례내용,205,"이후 관련 손해배상청구 소송, 관련 명예퇴직무효 확인 소송 등이 진행되었으나, 참가인들은 약 4년 4개월 동안 이 사건 전보발령에 대하여 별다른 법적 조치를 취하지 않다가 2019년 초에 이르러서야 피고에 이 사건 진정을 제기하였다."
342731,판례내용,206,"만일 참가인들이 이 사건 가처분 기각결정 이후 본안소송을 제기하는 등의 방법으로 이 사건 전보발령의 위법성에 대하여 다투었다면, 원고가 당시 보유하고 있던 2011년 내지 2014년의 인사고과 자료 등을 구체적으로 검토하여 참가인들이 어떠한 이유로 낮은 인사고과 점수를 받은 것인지 판단할 수 있었을 것으로 보이고, 참가인들이 위와 같은 법적 조치를 취하는 데에 법률상․사실상 장애사유가 있었다고 볼 만한 자료도 없다."
342731,판례내용,207,그런데도 참가인들이 장기간 별다른 법적 조치를 취하지 아니하는 동안 참가인들의 2011년 내지 2014년 인사고과 근거자료 등 이 사건 전보발령의 위법 여부를 판단하기 위하여 필요한 자료들이 보존기한을 경과하여 대부분 폐기되었다.
342731,판례내용,208,따라서 이 사건 전보발령 이후 상당한 기간이 지난 시점에서 뒤늦게 제기된 이 사건 진정을 조사함에 있어 전보발령 대상자 중 B단체 회원 비율이 높다는 사정만으로 원고가 B단체 회원임을 이유로 낮은 인사고과 점수를 부여하였다고 판단하는 것은 권리행사를 해태한 사람을 더 두텁게 보호하는 것에 해당하여 부당하다.
342731,판례내용,209,"참가인들이 받은 구체적인 차별의 내용과 정도에 대하여 보더라도, 이 사건 전보발령이 참가인들의 의사에 반하여 이루어진 것은 사실이나, 업무지원단에 근무하는 동안 참가인들에 대한 급여 등 처우는 다른 직원들과 동일하였다고 보이고, 통근거리 등에서 별다른 생활상 불이익이 있었다고 보이지도 않는다."
342731,판례내용,210,따라서 참가인들이 이 사건 전보발령으로 받은 불리한 대우의 내용과 정도가 중하다고 보기는 어렵다.
342731,판례내용,211,"실제로 참가인들은 이 사건 전보발령 이후 상당한 기간 동안 업무지원단에서 근무하였고, 2023.6.기준 참가인들 20명 중 약 12명은 퇴직한 상태인데, 그 중 상당수는 정년퇴직자로 보인다(소장에 첨부된 진정인 명단, 2023.7.6.자 준비서면 전자기록뷰어 기준 제36쪽 참조)."
342731,판례내용,212,"또한 원고는 이 사건 전보발령 이후 직원들의 희망 등에 따라 업무지원단으로의 전입․전출을 시행하고 있는데, 전출된 직원은 31명, 전입한 직원은 29명에 이르고, 2019년 및 2020년에는 업무지원단 선발인원보다 전입 신청 인원이 더 많아 경쟁이 발생하기도 하였는바, 이 사건 전보발령 후 현재까지 업무지원단으로의 발령이 원고의 직원들 사이에서 불이익한 대우로 여겨지고 있다고 단정하기도 어렵다."
342731,판례내용,213,소결
