판례일련번호,구분,문장번호,내용
339501,판례내용,170,"K 성적 학대 사전에 수급자 본인이나 보호자에게 동성 요양보호사 선호 여부의 확인, 이성 요양보호사 서비스 제공에 대한 동의 등을 받지 않고 2022.8.남성요양보호사로부터 기저귀케어와 목욕서비스를 받게 하여 성적 학대에 해당한다고 봄이 타당함.을 제37호증의15의 기재 및 변론 전체의 취지에 의하면, 이 사건 요양원은 이성에 의한 목욕, 기저귀케어 서비스 제공에 대해 보호자 동의를 받지 않았고, 이 사건 전문기관 조사원은 2022.8.24."
339501,판례내용,171,"현장조사 중 생활실(V방)의 배치표상 담당 요양보호사로 남성요양보호사가 배정된 사실을 확인하였던 점이 인정되고, 원고도 이에 대한 반박으로 기저귀케어 사실 자체를 부인하는 것이 아니라 불가피한 상황이라고만 주장하고 있는바, 위 사실과 사정을 종합하면 2022.8.경 수급자 본인 또는 보호자의 동의 없이 남성 요양보호사로부터 기저귀케어를 받게 한 사실이 인정되고, 이러한 행위는 수급자에게 성적 수치심을 주는 행위로서 성적학대에 해당한다고 봄이 타당함.처분사유 인정됨."
339501,판례내용,172,"K 성적 학대 사전에 수급자 본인이나 보호자에게 동성 요양보호사 선호 여부의 확인, 이성 요양보호사 서비스 제공에 대한 동의 등을 받지 않고 2022.8.남성요양보호사로부터 기저귀케어 등을 받게 하여 성적 학대에 해당한다고 봄이 타당함.을 제37호증의16 기재와 영상, 변론 전체의 취지에 의하면, 이 사건 요양원은 이성에 의한 목욕, 기저귀케어 서비스 제공에 대해 본인 또는 보호자 동의를 받지 않았고, 이 사건 전문기관 조사원은 2022.8.24."
339501,판례내용,173,"현장조사 중 생활실(R방)의 배치표상 담당 요양보호사로 남성요양보호사가 배정된 사실과 함께 같은 달 21일 및 31일에 남성요양보호사가 혼자 야간근무를 하였던 근무편성표를 확인하였던바, 이에 비추어 보면, 위 각 일자에 수급자 본인 또는 보호자의 동의 없이 남성 요양보호사로부터 기저귀케어 등을 받게 한 사실이 인정되고, 이러한 행위는 수급자에게 성적 수치심을 주는 행위로서 성적학대에 해당한다고 봄이 타당함.처분사유 인정됨."
339501,판례내용,174,"망 O 신체적 학대 손모아 장갑을 사용하여 신체구속함.을 제37호증의17의 기재와 영상 및 변론 전체의 취지에 의하면, 2022.11.17."
339501,판례내용,175,"이 사건 요양원의 전 사무국장이 망 O이 하루종일 손모아장갑을 끼고 있다는 내용으로 신고하면서 사진을 촬영하여 보냈고, 다음 날 이루어진 현장조사시에도 망 O은 손모아장갑을 착용하고 있었던 사실은 인정됨.그러나 손모아 장갑의 사용에 대해 보호자의 동의를 받았고(갑 제22호증의 16), 망 O은 98세의 고령으로 치매를 앓고 있었는데, 원고는 망 O이 수시로 변을 먹기 때문에 불가피한 조치였다 고 주장하였으며, 이 사건 전문기관 조사원이 2022.11.18."
339501,판례내용,176,"확인한 후 다시 방문하였을 때는 손모아장갑을 착용한 모습을 보지 못하였던 점 등이 인정되므로, 비록 신체구속에 대하여 급여제공기록지에 기록하지 않은 업무처리상 잘못이 있다고 하더라도, 이를 두고 망 O의 신체를 구속하거나 감금하여 신체적 학대를 하였다고 인정하기는 부족하고, 달리 이를 인정할 증거가 없으므로 처분사유 인정되지 않음."
339501,판례내용,177,"K 신체적 학대 손모아장갑을 사용하여 신체구속함.원고는 K이 치매환자로 장루백을 빼고 대변을 수시로 먹기 때문에 부득이하게 사용할 수밖에 없다고 주장하므로 장기적․지속적으로 손모아장갑을 사용한 것으로 보이는데, 을 제37호증의18의 기재와 영상 및 변론 전체의 취지에 의하면, 2022.11.17."
339501,판례내용,178,"이 사건 요양원의 전 사무국장이 망 O이 하루종일 손모아장갑을 끼고 있다는 내용으로 신고하면서 사진을 촬영하여 보냈고, 보호자는 이에 동의한 사실이 없다고 진술하였으며, 달리 동의를 받았다고 볼 자료가 없는 점, 이 사건 요양원에서 사후 정황보고나 일지작성 등 절차를 거쳤던 것으로 보이지도 아니하는 점 등이 인정됨.그럼에도 불구하고 이 사건 요양원은 신체구속의 사유와 그 제한시간 등을 급여제공기록지에 전혀 기재하지 않았으므로, 설령 수급자의 보호를 도모하는 목적이 있었다고 하더라도 이는 ‘억제대로 노인의 신체를 구속하는 행위’로서 신체적 학대에 해당한다고 봄이 타당함.처분사유 인정됨."
339501,판례내용,179,"K 신체적 학대 퇴소한 다른 수급자의 처방약을 복용하게 하여 불필요한 의료처치를 함.을 제37호증의19의 기재 및 영상에 의하면 원래 처방받은 퇴소한 다른 수급자인 K의 이름을 지우고 K의 이름을 기재한 약봉투 사진이 첨부되어 있고, 이 사건 요양원의 전 요양보호사가 ‘G로부터 퇴소한 다른 수급자의 처방약을 K에게 투약하라고 지시를 받은 사실이 있다’고 진술한 사실은 인정되나, 그 진술을 뒷받침할 증거 및 그와 같은 지시를 할 필요가 있었다고 볼 자료도 없으며, K가 실제로 약을 복용하지도 않았던 것으로 보이는 점 등에 비추어 보면, 이 사건 요양원이 퇴소한 다른 수급자의 처방약을 불필요하게 복용하게 하여 신체적 학대를 하였음을 인정하기 부족함.처분사유 인정되지 않음."
339501,판례내용,180,소결 이 사건 각 위반행위 중 일부가 인정되지 않음은 앞서 본 바와 같다.그러나 수 개의 처분사유 중 일부가 적법하지 않다고 하더라도 다른 처분사유로 그 처분의 정당성이 인정되는 경우 그 처분을 위법하다고 할 수 없으므로(대법원 2004.3.25.
339501,판례내용,181,"선고 2003두1264 판결 등 참조), 아래에서는 피고가 이 사건 각 위반행위 중 처분사유가 인정되는 각 위반행위를 근거로 이 사건 처분을 한 것에 재량권의 일탈, 남용 등의 위법이 없어 이 사건 처분의 정당성이 인정되는지에 관하여 살펴본다."
339501,판례내용,182,"나.재량권 일탈․남용 여부 관련 법리 제재적 행정처분이 재량권의 범위를 일탈하였거나 남용하였는지 여부는 처분사유인 위반행위의 내용과 위반의 정도, 처분에 의하여 달성하려는 공익상의 필요와 개인이 입게 될 불이익 및 이에 따르는 제반 사정 등을 객관적으로 심리하여 공익침해의 정도와 처분으로 인하여 개인이 입게 될 불이익을 비교․교량하여 판단하여야 한다.이러한 제재적 행정처분의 기준이 부령 형식으로 규정되어 있더라도 그것은 행정청 내부의 사무처리준칙을 규정한 것에 지나지 않아 대외적으로 국민이나 법원을 기속하는 효력이 없다.따라서 그 처분의 적법 여부는 처분기준만이 아니라 관계 법령의 규정 내용과 취지에 따라 판단하여야 한다(대법원 2022.4.14."
339501,판례내용,183,"선고 2021두60960 판결, 대법원 2018.5.15."
339501,판례내용,184,선고 2016두57984 판결).
339501,판례내용,185,"그러므로 처분기준에 부합한다고 하여 곧바로 처분이 적법한 것이라고 할 수는 없고, 처분기준이 그 자체로 헌법 또는 법률에 합치되지 않거나 그 기준을 적용한 결과가 처분사유인 위반행위의 내용 및 관계 법령의 규정과 취지에 비추어 현저히 부당하다고 인정할 만한 합리적인 이유가 없는 한 섣불리 그 기준에 따른 처분이 재량권의 범위를 일탈하였다거나 재량권을 남용한 것으로 판단해서는 안 되지만, 반대로 그 처분기준에 따른 제재적 행정처분이 그 처분사유가 된 위반행위의 내용 및 관계 법령의 규정 내용과 취지에 비추어 현저히 부당하다고 인정할 만한 합리적인 이유가 있다면, 그 처분은 재량권의 범위를 일탈하였거나 재량권을 남용한 것이라고 판단할 수 있다."
339501,판례내용,186,구체적 판단
339501,판례내용,187,"가)피고는 이 사건 각 위반행위가 노인복지법 제39조의9 제1, 2, 3호 및 노인장기요양보험법 제37조 제1항 제6호의 가, 나, 다목에 각 해당한다고 보고, 각 위반행위에 대한 행정처분의 기준을 정한 이 사건 시행규칙 규정 [별표2] 1.나.1)의 일반기준에 따라 가장 처분기준이 무거운 같은 규정 [별표] 2.가.13)."
339501,판례내용,188,나)에서 정한 ’지정취소‘에 해당하는 이 사건 처분을 하였다.
339501,판례내용,189,"나)그러나 앞서 든 증거들, 갑 제17 내지 21, 25 내지 29호증의 각 기재와 변론 전체의 취지를 종합하여 인정할 수 있는 아래와 같은 사실 내지 사정들을 종합적으로 고려하면, 이 사건 시행규칙 규정에 따른 이 사건 처분은 그 위반행위의 내용, 상위 근거법령인 노인장기요양보험법의 규정 내용과 취지, 이 사건 위반행위로 인한 공익침해의 정도와 이 사건 처분으로 인하여 원고와 이 사건 요양원의 종사자들, 수급자들이 입게 될 불이익의 정도 등에 비추어 현저히 부당하다고 판단되므로, 이 사건 처분에는 재량권을 일탈․ 남용한 위법이 있다고 봄이 타당하다."
339501,판례내용,190,"(1)노인장기요양보험법 제37조 제1항 본문은 “다음 각 호의 어느 하나에 해당하는 경우 그 지정을 취소하거나 6개월의 범위에서 업무정지를 명할 수 있다.”라고 규정하면서 제6호 나목에 ‘장기요양기관의 종사자 등이 수급자에게 성적 수치심을 주는 성폭행, 성희롱 등의 행위’를 거시하고 있는바, 위 위반행위에 대하여 행정청이 재량에 따라 지정취소와 6개월의 범위 내의 업무정지명령 중 적절한 처분을 하도록 규정하고 있다.나아가 노인장기요양보험법 제37조 제1항 단서는 “다만, 제1호, 제2호의2, 제3호의5, 제7호, 또는 제8호에 해당하는 경우에는 지정을 취소하여야 한다.”고 규정함으로써 행정청이 반드시 지정취소 처분을 하여야 하는 위반행위를 제한적으로 열거하고 있는데, 위 제6호 나목의 ‘장기요양기관의 종사자 등이 수급자에게 성적 수치심을 주는 성폭행, 성희롱 등의 행위’는 여기에 포함시키지 않고 있다."
339501,판례내용,191,"그럼에도 불구하고 이 사건 시행규칙 규정은 위 제6호 나목의 ‘장기요양기관의 종사자 등이 수급자에게 성적 수치심을 주는 성폭행, 성희롱 등의 행위’에 대하여는 1차 위반시 곧바로 지정취소를 하도록 정하고 있을 뿐 다른 재량의 여지를 두고 있지 않은바, 이는 상위 근거법령인 노인장기요양보험법 제37조 제1항의 규정과 취지에 부합하지 않는다."
339501,판례내용,192,"노인복지법은 노인의 질환을 사전예방 또는 조기발견하고 질환상태에 따른 적절한 치료․요양으로 심신의 건강을 유지하고, 노후의 생활안정을 위하여 필요한 조치를 강구함으로써 노인의 보건복지증진에 기여함을 목적으로 하고, 노인장기요양보험법은 고령이나 노인성 질병 등의 사유로 일상생활을 혼자서 수행하기 어려운 노인 등에게 제공하는 신체활동 또는 가사활동 지원 등의 장기요양급여에 관한 사항을 규정하여 노후의 건강증진 및 생활안정을 도모하고 그 가족의 부담을 덜어줌으로써 국민의 삶의 질을 향상하도록 함을 목적으로 한다."
339501,판례내용,193,"한편 일반적으로 ‘성희롱’은 성적 언동 등으로 상대방에게 성적 굴욕감이나 혐오감을 느끼게 하는 일체의 행위를 의미하고, 여기에서 성적 언동이란 남녀 간의 육체적 관계나 남성 또는 여성의 신체적 특징과 관련된 육체적, 언어적, 시각적 행위로서 사회 공동체의 건전한 상식과 관행에 비추어 볼 때, 객관적으로 상대방과 같은 처지에 있는 일반적이고도 평균적인 사람으로 하여금 성적 굴욕감이나 혐오감을 느끼게 할 수 있는 행위를 의미하며, 성희롱이 성립하기 위해서는 행위자에게 반드시 성적 동기나 의도가 있어야 하는 것은 아니고, 당사자의 관계, 행위가 행해진 장소 및 상황, 행위에 대한 상대방의 명시적 또는 추정적인 반응의 내용, 행위의 내용 및 정도, 행위가 일회적 또는 단기간의 것인지 아니면 계속적인 것인지 등의 구체적 사정을 참작하여 볼 때, 객관적으로 상대방과 같은 처지에 있는 일반적이고도 평균적인 사람으로 하여금 성적 굴욕감이나 혐오감을 느낄 수 있게 하는 행위가 있으며, 그로 인하여 행위의 상대방이 성적 굴욕감이나 혐오감을 느꼈음이 인정될 경우 성희롱이 성립되는 것으로 본다(양성평등기본법 제3조 제2호에 관한 대법원 2018.4.12."
339501,판례내용,194,선고 2017두74702 판결 등 참조).
339501,판례내용,195,"이와 같은 노인복지법, 노인장기요양보험법의 입법목적과 기본이념, ‘성희롱’의 일반적인 개념과 관련 규정의 내용 등을 종합하면, 노인복지법 제39조의9 제2호, 노인장기요양보험법 제37조 제1항 제6호 나목과 이 사건 시행규칙 규정이 정하는 ‘장기요양기관의 종사자 등이 수급자에게 성적 수치심을 주는 성폭행, 성희롱 등의 행위’에는 강간, 강제추행 등과 같은 중대한 범죄행위뿐만 아니라 그 위반행위의 죄질, 불법성의 정도가 비교적 가볍거나 피해자의 법익 침해의 정도 등이 비교적 작은 매우 다양한 행위까지 포함될 수 있다.그런데 그와 같은 다양하고 광범위한 위반행위 사이의 구체적 인 죄질, 범정, 법익침해의 정도 등을 전혀 고려하지 않은 채 일괄적으로 가장 중한 행정처분인 지정취소 처분을 하도록 할 경우 그 처분으로 달성하려는 공익과 처분 당사자가 입게 될 불이익 사이에 불균형이 발생할 우려가 크다."
339501,판례내용,196,이 사건 시행규칙 규정
339501,판례내용,197,[별표 2]
339501,판례내용,198,"2.가.13)가)는 ‘장기요양기관의 종사자 등이 수급자의 신체에 폭행을 가하거나 상해를 입히는 행위’에 대하여 1차 위반의 경우 업무정지 6개월, 2차 위반의 경우 지정취소 처분을 하도록 정하고 있고, 같은 시행규칙 규정 [별표 2] 2.가.13)다)는 ‘장기요양기관의 종사자 등이 자신의 보호․감독을 받는 수급자를 유기하거나 의식주를 포함한 기본적 보호 및 치료를 소홀히 하는 방임행위’에 대하여 1차 위반의 경우 업무정지 3개월, 2차 위반의 경우 업무정지 6개월, 3차 위반의 경우 지정취소 처분을 하도록 정하고 있다.따라서 이 사건 시행규칙 규정상의 행정처분 기준을 그대로 적용할 경우 ‘수급자에게 성적 수치심을 주는 성희롱 등의 행위’로서 죄질, 범정, 법익침해의 정도 등이 폭행․상해․유기․방임행위보다 가벼운 행위에 대해서도 행정청은 재량의 여지없이 지정취소 처분을 해야 하는바, 각 위반행위의 내용과 그에 대한 제재적 처분 사이에 체계적 정합성이 유지된다고 보기 어렵고, 현실적으로 현저하게 불균형하거나 부당한 결과가 초래될 수 있다."
339501,판례내용,199,이 사건 시행규칙 규정은
339501,판례내용,200,[별표 2]
339501,판례내용,201,"1.라.본문에서 “하나의 위반행위에 대한 행정처분이 업무정지처분에 해당하는 경우는 위반행위의 동기, 내용, 정도 및 결과 등을 고려하여 그 처분기준의 2분의 1의 범위 내에서 감경하여 처분할 수 있다.”라고 정하고 있을 뿐, 이 사건과 같이 행정처분 기준이 ‘지정취소’에 해당하는 경우에 대해서는 처분의 감경에 대하여 명시하지 않고 있다.따라서 이를 기계적으로 적용하기만 할 경우, 죄질, 범정, 법익침해의 정도나 다른 위반행위와의 균형 등 여러 양정 요소를 제대로 반영하여 제재적 처분의 정도를 조절하는 것이 어렵다."
339501,판례내용,202,(2)이 사건 처분의 근거가 된 사회복지사업법 제40조에 관하여 본다.구 사회복지사업법(2023.6.13.
339501,판례내용,203,"법률 제19453호로 개정되기 전의 것, 이하 같다)제40조 제1항 제4호에서는 ‘사회복지시설에서 발생한 회계부정이나 불법행위, 그 밖의 부당행위 등’에 대하여 사회복지시설의 개선, 사업의 정지, 시설의 장의 교체, 시설폐쇄를 할 수 있도록 규정하였다.또한 그 세부적 기준을 정한 동법 시행규칙(2023.7.13."
339501,판례내용,204,"보건복지부령 제950호로 개정되기 전의 것, 이하 같다)제26조의2 [별표4]에서는 ‘시설 거주자에 대한 부당한 체벌, 폭행, 학대 등 인권침해가 발생한 경우’에 대하여 1차 위반의 경우 개선명령, 2차 위반의 경우 시설장 교체, 3차 위반의 경우 시설폐쇄 처분을 하도록 기준을 정하되, 시설거주자에 대한 학대․성폭력 등 중대한 불법행위로 인하여 시설의 정상적인 운영이 불가능하다고 인정되는 경우에는 그 개별기준에도 불구하고 1차 위반시 시설의 폐쇄를 명할 수 있다고 규정하고 있다.이에 비하여 ‘성적 학대’에 대해 불법행위의 정도 및 시설의 정상 운영 가능 여부에 대한 검토 없이 일률적으로 지정취소처분을 하도록 정한 이 사건 시행규칙 규정은 구 사회복지사업법 시행규칙 제26조의2와 비교하여서도 지나치게 균형이 어긋난다.또한 사회복지사업법 제40조를 이 사건 처분의 관련 근거규정으로 하면서도 이 사건 시행규칙 규정에서 정한 기준에만 기대어 일률적으로 이 사건 요양원의 지정취소를 명한 이 사건 처분은 아래의 사정에 비추어 보면 재량권을 일탈․ 남용한 위법이 있다고 봄이 타당하다."
339501,판례내용,205,"(3)이 사건 각 위반행위 중 ‘성적 학대’에 해당하는 내용은 ① 사전 동의를 받지 않고 이성인 남성요양보호사로부터 기저귀 케어, 목욕, 환복 서비스를 제공하도록 한 행위, ② 가림막을 설치하지 않고 수급자의 기저귀 교체를 하거나 성적 부위를 드러내도록 하였다는 내용이다.이러한 각 위반행위는 수급자 본인에게 성적 수치심을 줄 수 있는 행위에는 해당하나, 그 위반행위의 죄질, 불법성의 정도가 고의 범죄인 성폭행, 성희롱 등의 행위에 이르렀다고 볼 수는 없다(이 사건 요양원의 요양보호사나 시설장인 G, 남성요양보호사 등 직원이 위 각 위반행위에 대해 형사처벌을 받지도 않았다는 점)."
339501,판례내용,206,"또한 위 각 위반행위는 이 사건 요양원의 인력 수급, 이 사건 판정지표에 대한 이해부족 등에서 비롯된 것으로 볼 여지가 크다."
339501,판례내용,207,"(4)이 사건 처분으로 달성할 수 있는 직접적인 공익은 이 사건 요양원이 더 이상 운영되지 못하도록 제재함으로써 성적 학대, 방임 학대, 신체적 학대 등의 행위가 재발하지 않도록 하는 것이다.그러나 이 사건 요양원의 지정을 취소하여 폐원시킬 경우, 이 사건 요양원에서 생활하던 수급자들은 다른 요양기관 등으로 거처를 옮기는 등의 부담을 안게 되는바, 앞서 본 노인장기요양보험법의 목적(고령이나 노인성 질병 등의 사유로 일상생활을 혼자서 수행하기 어려운 노인 등에게 제공하는 신체활동 또는 가사활동 지원 등의 장기요양급여에 관한 사항을 규정하여 노후의 건강증진 및 생활안정을 도모하고 그 가족의 부담을 덜어줌으로써 국민의 삶의 질을 향상하도록 함)에 부합하지 않는 불합리한 결과가 발생할 수 있다."
339501,판례내용,208,"(5)원고는 이 사건 처분 이전에 노인장기요양보험법 위반행위로 형사처벌, 행정처분을 받은 사실이 없고[피고는 이 사건 각 위반행위 이외에도 수급자 Y에 대한 경제적 학대, P에 대한 추가 학대 정황 등이 있다고 주장하였으나 이를 뒷받침할 자료는 제출하지 않았고, 원고가 2024.6.5."
339501,판례내용,209,"제출한 참고자료에 의하면 수급자 Y의 계좌에서 돈을 인출한 것에 대해 불송치(혐의없음)결정을 받았던 사실이 확인된다], 촉탁의사와 계약을 체결하여 수급자들에 대한 의료서비스를 제공하였으며, 이 사건 요양원의 시설장 및 직원들을 상대로 노인학대예방교육과 인권교육을 실시하는 등 나름대로는 성실하게 이 사건 요양원을 운영해왔던 것으로 보인다.원고가 지정취소처분을 받게 되면, 노인장기요양보험법 제37조 제8항 제1호에 따라 지정취소처분을 받은 후 3년이 지나기 전까지는 다시 장기요양기관으로 지정받을 수 없고, 원고의 대표자도 동일한 제한을 받게 된다.원고는 노인요양시설을 설치․운영할 수 없게 되어 사회복지법인으로서의 목적을 달성할 수 없게 되는바, 이와 같은 원고의 불이익이 가볍지 아니하다."
339501,판례내용,210,결론
339501,판례내용,211,그렇다면 원고의 청구는 이유 있으므로 이를 인용하기로 하여 주문과 같이 판결한다.
339501,판례내용,212,재판장 판사 박○
339501,판례내용,213,판사 오○
339501,판례내용,214,판사 김○
