판례일련번호,구분,문장번호,내용
343150,판례내용,1,전 주 지 방 법 원
343150,판례내용,2,제 1 행 정 부
343150,판례내용,3,판 결
343150,판례내용,4,사 건 2022구합2852 퇴학처분 취소 청구의 소
343150,판례내용,5,원 고 A
343150,판례내용,6,"미성년자이므로 법정대리인 친권자 부 B, 모 C"
343150,판례내용,7,소송대리인 변호사 박○
343150,판례내용,8,피 고 전라북도남원교육지원청교육장
343150,판례내용,9,소송대리인 법무법인 더쌤 담당변호사 박○
343150,판례내용,10,변 론 종 결 2023.10.19.
343150,판례내용,11,판 결 선 고 2024.1.18.
343150,판례내용,12,주 문
343150,판례내용,13,1.원고의 청구를 기각한다.
343150,판례내용,14,2.소송비용은 원고가 부담한다.
343150,판례내용,15,청 구 취 지
343150,판례내용,16,피고가 2022.5.16.
343150,판례내용,17,원고에 대하여 한 퇴학처분을 취소한다.
343150,판례내용,18,이 유
343150,판례내용,19,1.처분의 경위
343150,판례내용,20,"가.2022년 3월 당시 원고는 D고등학교(이하 ‘이 사건 학교’라 한다)2학년에 재학 중이었고, 피해학생 E, F, G(이하 ‘피해학생들’이라 한다)은 이 사건 학교 1학년에 재학 중이었다."
343150,판례내용,21,당시 원고와 피해학생들은 이 사건 학교에서 운영하는 기숙사(이하 ‘이 사건 기숙사’라 한다)에서 생활하고 있었다.
343150,판례내용,22,나.1)원고의 피해학생들에 대한 폭력을 목격한 학생(이하 ‘목격자’라 한다)은 2022.4.1.
343150,판례내용,23,"이 사건 학교장에게 원고를 학교폭력으로 신고하였고, 이 사건 학교장은 2022.4.6."
343150,판례내용,24,"학교폭력예방 및 대책에 관한 법률(이하 ‘학교폭력예방법’이라 한다)제17조 제4항, 제1항 제2호에 따라 피해학생들에 대한 접촉ㆍ협박 및 보복행위 금지의 긴급조치를 하고 학교폭력전담기구의 심의를 거쳐 2022.4.19."
343150,판례내용,25,학교폭력대책심의위원회의 개최를 요청하였다.
343150,판례내용,26,"2)한편, 이 사건 학교장은 원고가 위 긴급조치 이후에도 피해학생들에게 연락하는 등으로 2차 가해가 계속된다고 판단하여 2022.5.3."
343150,판례내용,27,"원고에게 학교폭력예방법 제17조 제4항, 제1항 제2호에 따라 피해학생들에 대한 접촉ㆍ협박 및 보복행위 금지의 긴급조치를 재차 하였다."
343150,판례내용,28,다.이 사건 학교장의 위 요청에 따라 2022.5.13.
343150,판례내용,29,"학교폭력대책심의위원회(이하 ‘이 사건 심의위원회’라 한다)가 개최되었는데, 이 사건 심의위원회는 원고의 행위를 학교폭력으로 판단하고 원고에 대하여 아래와 같이 조치를 결정하고서, 학교폭력예방법 제17조 제1항에 따라 피고에게 위 조치를 할 것을 요청하였다."
343150,판례내용,30,이에 피고는 2022.5.16.
343150,판례내용,31,이 사건 심의위원회의 아래의 조치 결정에 따라 원고에 대하여 퇴학 처분 조치를 하였다.
343150,판례내용,32,1.가해학생 : 원고
343150,판례내용,33,2.피해학생 : 피해학생들
343150,판례내용,34,3.사안개요 :
343150,판례내용,35,"가.2022.3.중 기숙사에서 원고가 E, F의 손등에 7kg의 아령을 떨어뜨려 폭행하였다."
343150,판례내용,36,나.2022.3.20.
343150,판례내용,37,"강당(체육관)에서 E를 이유없이 배드민턴 채를 사용하여 폭행하였으며, 기숙사 청소 시간 이후 원고, H가 E를 CCTV 사각지대로 데려간 후 원고가 쇠파이프를 사용하여 폭행하였고 H는 방관하였다."
343150,판례내용,38,다.2022.3.30.
343150,판례내용,39,"기숙사에서 E를 옷걸이를 이용하여 폭행하였고, 기숙사 청소 시간에 피해학생들에게 게임을 하게 한 후 게임에서 진 학생을 원고가 배드민턴 채를 사용하여 폭행하였으며, 취침 시간에 F을 빗자루를 이용하여 발바닥을 때렸다."
343150,판례내용,40,라.2022.3.31.
343150,판례내용,41,F에게 전화하여 “신고할 거면 더 해봐”라고 언어적으로 위협하였다.
343150,판례내용,42,마.2022.4.둘째 주 기숙사에서 저녁 점호 후 I을 쇠 재질의 물건을 이용하여 옆구리를 폭행하였다고 학교폭력으로 신고된 건이다.
343150,판례내용,43,4.심의위원회 개최 : 2022.5.13.
343150,판례내용,44,5.의결 및 집행요청 사항
343150,판례내용,45,② 가해학생 선도조치
343150,판례내용,46,"[학교장의 긴급조치 추인] 제17조 제4항 제2호에 따른 피해학생 및 신고ㆍ고발학생에 대한 접촉, 협박 및 보복행위의 금지(2022.4.6.~2022.4.15."
343150,판례내용,47,"), 제2호에 따른 피해학생 및 신고ㆍ고발학생에 대한 접촉, 협박 및 보복행위의 금지(2022.5.3.~2022.5.13.)"
343150,판례내용,48,[원조치] 제9호 퇴학
343150,판례내용,49,"6.결정의 이유 : 이 사건 심의위원회에서 본 사안을 심의한 결과, 피해학생이 신체ㆍ정신상 피해를 호소하고 원고에 의한 2차 피해가 우려되는 점에서 사안이 중하다고 판단됩니다."
343150,판례내용,50,"원고의 경우 기숙학교 특성상 계속해서 생활해야 하는 공간에서 의도적으로 기숙사 방 또는 CCTV 사각지대에서 폭력을 행사하여 고의성과 심각성이 매우 높은 점, 폭력에 대한 감수성이 낮아 학교장의 긴급조치 기간에도 장난을 빙자한 습관적인 폭력을 행사하여 그 기간과 횟수가 매우 많아 지속성이 매우 높고 반성이 없는 점, 폭행에 대한 사과 이후 또 다른 폭력을 행사한 점, 추가 제출된 처벌불원서를 강압적인 분위기에 작성하도록 강요한 점(이하 ‘이 사건 처분’이라 한다)."
343150,판례내용,51,"점, 모든 피해학생들이 2차 피해를 호소하는 등 피해에 대한 회복이 이루어지지 않아 화해에 도달하지 못한 점, 피해학생 측에서 가해학생과의 완벽한 분리를 원하는 점, 폭력에 대한 행위는 정당화될 수 없는 점, 학교폭력 행위는 가해학생과 피해학생의 문제에 그치는 것 아니라 주위 학생들의 전반적인 학습환경을 어지럽힐 수 있다는 점, 건전한 학교문화를 유지하기 위하여 엄정한 대처가 필요한 점, 특수목적 고등학교 특성상 동일 직업군으로 졸업 이후 추가 피해가 우려되는 점 등을 종합적으로 고려하여 위와 같은 조치를 결정하였습니다."
343150,판례내용,52,라.원고는 2022.7.25.
343150,판례내용,53,"이 사건 처분의 취소를 구하는 행정심판을 제기하였는데, 전라북도교육행정심판위원회는 2022.9.14."
343150,판례내용,54,원고의 청구를 기각하였다.
343150,판례내용,55,"[인정근거] 다툼 없는 사실, 갑 제1 내지 3호증, 을 제1, 15 내지 18호증(가지번호 있는 것은 가지번호 포함, 이하 같다)의 각 기재, 변론 전체의 취지"
343150,판례내용,56,2.이 사건 처분의 적법 여부
343150,판례내용,57,가.원고의 주장
343150,판례내용,58,1)절차상의 하자 주장
343150,판례내용,59,"원고는 이 사건 처분의 이유인 사실관계에 관하여 학교폭력을 인정할 수 있는 근거자료를 전혀 제시받지 못하여 해당 학교폭력이 존재하지 않는다는 주장만 할 수 있었을 뿐이고, 해당 학교폭력이 존재한다는 주장이 어떻게 잘못된 것인지 등에 관하여 의견을 진술할 수 없었다."
343150,판례내용,60,"따라서 원고는 처분의 근거자료를 제시받지 못함으로써 방어권을 전혀 보장받지 못하였으므로, 이 사건 처분은 이와 같은 절차적 하자로 위법하다."
343150,판례내용,61,2)사실오인 주장
343150,판례내용,62,"원고는 E, F의 손등에 7kg 아령을 떨어뜨리지 아니하였고, 2022.3.20."
343150,판례내용,63,"피해학생들에게 게임을 하게 한 후 게임에서 진 학생을 배드민턴 채로 폭행한 것이 아니라, 오히려 피해학생들이 먼저 원고를 찾아와 게임을 제안했고, 이들의 부탁으로 게임의 벌칙으로 배드민턴 채로 가볍게 쳤을 뿐이며 피해학생들이 정한 벌칙이 너무 과하여 피해학생들을 말렸고, 또한 2022.4.둘째 주에 이 사건 기숙사에서 F을 쇠 재질의 물건을 이용하여 옆구리를 폭행한 사실도 없다."
343150,판례내용,64,"이 사건 처분의 원인이 된 사실들은 대다수 피해학생들의 진술에만 의존한 것인데, 이들이 공공연하게 ‘원고를 학교폭력으로 보내 뒤통수를 치겠다’고 말을 하고 다닌 점에 비추어 신빙성이 없다."
343150,판례내용,65,결국 이 사건 처분은 사실오인으로 인한 것이어서 위법하다.
343150,판례내용,66,3)재량권의 일탈·남용 주장
343150,판례내용,67,"원고는 2022.3.경 이 사건 기숙사 장의 업무를 대행하면서 피해학생들이 취침시간 이후에 각자의 방에 있지 않거나, 흡연을 하고 청소시간에 청소를 하지 않아 주의를 주는 과정에서 약간의 신체접촉이 있었던 것에 불과하고, 일방적이고 고의적이며 상습적인 학교폭력을 행사한 것이 아니었음에도, 피고는 이러한 경위는 전혀 알아보지 않은 채 원고의 유형력 행사가 있었다는 이유만으로 만연히 원고의 행위를 학교폭력으로 판단하였다."
343150,판례내용,68,"또한 이 사건 심의위원회는 위 조치 결정을 함에 있어 이 사건 처분의 원인된 사실 외에도 실제 사실관계에도 부합하지 않고 단지 피해학생들이 주장하는 내용, 즉 원고가 피해학생들에게 강제로 기절놀이를 시켰다거나, 원고가 강압적으로 피해학생들로부터 처벌불원서를 받았고, 원고가 E를 강제적으로 스크린 골프장에 데려갔거나, E에게 이 사건 심의위원회의 회의내용을 녹취하라고 시켰다는 점을 고려하여 원고에게 불이익을 주는 오류도 범하였다."
343150,판례내용,69,"이와 같은 사정에다가 원고가 원고의 위와 같은 행위에 대하여 반성하는 점, 피해학생들이 원고에 대한 처벌불원의 의사를 밝힌 점 등을 종합하면, 원고가 퇴학 처분에 상응하는 중대한 학교폭력행위를 하였다거나 원고에게 개전의 가능성이 없다는 것 이 명백하다고 할 수 없다."
343150,판례내용,70,따라서 이 사건 처분은 비례의 원칙에 위반하여 재량을 일탈· 남용한 위법이 있다.
343150,판례내용,71,나.관계 법령 등
343150,판례내용,72,별지 관계 법령 등 기재와 같다.
343150,판례내용,73,다.절차상의 하자 주장에 대한 판단
343150,판례내용,74,1)관련법리
343150,판례내용,75,행정절차법 제23조 제1항은 행정청이 처분을 하는 때에는 당사자에게 그 근거와 이유를 제시하도록 규정하고 있다.
343150,판례내용,76,이는 행정청의 자의적 결정을 배제하고 당사자로 하여금 권리구제절차에서 적절히 대처할 수 있도록 하는 데 그 취지가 있다.
343150,판례내용,77,"따라서 처분서에 기재된 내용과 관계 법령 및 당해 처분에 이르기까지의 전체적인 과정 등을 종합적으로 고려하여, 처분 당시 당사자가 어떠한 근거와 이유로 처분이 이루어진 것인지를 충분히 알 수 있어서 그에 불복하여 권리구제절차로 나아가는 데에 별다른 지장이 없었던 것으로 인정되는 경우에는 처분서에 처분의 근거와 이유가 구체적으로 명시되지 않았다고 하더라도 이유제시의무를 위반하여 처분을 취소하여야 할 위법사유라고는 볼 수 없다(대법원 2020.6.11."
343150,판례내용,78,"선고 2019두49359 판결, 대법원 2009.12.10."
343150,판례내용,79,선고 2007두20348 판결 등 참조).
343150,판례내용,80,2)구체적 판단
343150,판례내용,81,"이 사건으로 돌아와 보건대, 위에서 인정된 사실과 앞서 거시한 증거들, 갑 제14 내지 16호증, 을 제5 내지 8호증의 각 기재, 증인 J, K의 각 증언 및 변론 전체의 취지를 종합하여 알 수 있는 다음과 같은 사정 등에 비추어 보면, 원고는 자신의 어떠한 행위들이 학교폭력으로 문제되어 이 사건 처분이 이루어진 것인지 충분히 알 수 있었다고 할 수 있어, 원고가 행정구제절차로 나아가는 데에 지장이 있었다고 보기 어려우므로, 이 사건 처분에 근거자료를 제시하지 않아 원고의 방어권을 침해하는 이유제시의무 위반의 위법이 있다고 할 수 없다."
343150,판례내용,82,따라서 원고의 이 부분 주장은 이유 없다.
343150,판례내용,83,○ 2022.4.1.
343150,판례내용,84,"목격자에 의해 위 학교폭력 신고가 이루어진 후, 당일 이 사건 학교측은 피해학생들과 원고를 상대로 사안 조사를 하였는데, 당시 피해학생들은 대체로 원고로부터 이 사건 처분 원인이 된 폭력을 당한 사실이 있다는 취지의 각 사실확인서를 작성하여 제출하였고, 이에 이 사건 학교측은 원고에게 피해학생들이 주장하는 원고의 폭력행위를 구체적으로 확인시켜주고 이에 대한 원고의 주장과 입장을 담은 사실확인서를 작성하게 한 것으로 보인다."
343150,판례내용,85,○ 원고가 2022.4.13.
343150,판례내용,86,"작성한 사실확인서에는 “피해학생들을 서로 장난치면서 배드민턴 채로 1~2대 때린 적이 있다.대걸레 뒤로 1대 때렸다.E는 빨래 너는 데에서 그러고, F과 G은 방에서 서로 장난치고 게임하면서 그랬다.아령은 E와 F과 위협을 가하고 그런 상황이 아닌, 아령으로 1cm 높이에서 떨어뜨리면서 장난을 쳤다.이 점은 피해학생들에게 사과해서 잘 풀었다”는 등의 내용이 기재되어 있다."
343150,판례내용,87,원고의 위 사실확인서에 의하더라도 원고는 위 학교폭력으로 신고된 원고의 문제되는 학교폭력의 구체적 사실관계에 대하여 충분히 알고 있었다고 할 수 있다.
343150,판례내용,88,"○ 이 사건 심의위원회는 원고가 피해학생들에 대하여 아령이나 배드민턴 채 등 을 이용하여 폭력을 행사한 부분과 관련하여 원고에게 질문을 하였고, 당시 원고와 원고의 아버지는 그 발생 경위 등에 대하여 해명하며 원고측의 입장을 밝혔다."
343150,판례내용,89,"○ 행정절차법은 행정청에게 처분의 근거와 이유를 제시할 의무가 있는데, 위 의무에 처분 사유를 인정한 구체적 자료를 제시하는 것까지 포함된다고 보기 어려우므로, 피고가 이 사건 처분의 사유로 제시된 이 사건 심의위원회의 결정 이유에 학교폭력으로 인정된 원고의 행위에 관한 근거자료까지 구체적으로 기재되어 있지 않았다 하더라도, 이러한 사정만으로 이 사건 처분에 절차적 하자가 있다고 보기 어렵다."
343150,판례내용,90,라.사실오인 주장에 대한 판단
343150,판례내용,91,1)관련 법리
343150,판례내용,92,"학교폭력예방법은 학교폭력의 예방과 대책에 필요한 사항을 규정함으로써 피해학생의 보호, 가해학생의 선도․교육 및 피해학생과 가해학생 간의 분쟁조정을 통하여 학생의 인권을 보호하고 학생을 건전한 사회구성원으로 육성함을 목적으로 한다(제1조)."
343150,판례내용,93,"그리고 같은 법 제2조 제1호는 학교폭력을 ‘학교 내외에서 학생을 대상으로 발생한 상해, 폭행, 감금, 협박, 약취ㆍ유인, 명예훼손ㆍ모욕, 공갈, 강요ㆍ강제적인 심부름 및 성폭력, 따돌림, 사이버 따돌림, 정보통신망을 이용한 음란ㆍ폭력 정보 등에 의하여 신체ㆍ정신 또는 재산상의 피해를 수반하는 행위’라고 정의하고 있다."
343150,판례내용,94,"위 각 규정에 의하면, 학교폭력예방법상 ‘학교폭력’은 제2조 제1호에 열거된 유형에 한정되지 않고 이와 유사하거나 동질의 행위로서 학생의 신체․정신 또는 재산상의 피해를 수반하는 행위를 포함한다 할 것이다."
343150,판례내용,95,2)판단
343150,판례내용,96,가)이 사건 처분의 전제
343150,판례내용,97,"위에서 본 이 사건 심의위원회의 결정 이유에 의하면, 이 사건 처분은 원고가 ① 2022.3.중 기숙사에서 E, F의 손등에 7kg의 아령을 떨어뜨려 폭행한 사실(이하 ‘제1 사실’이라 한다), ② 2022.3.20."
343150,판례내용,98,"강당(체육관)에서 E를 이유 없이 배드민턴 채를 사용하여 폭행한 사실(이하 ‘제2 사실’이라 한다), ③ 2022.3.20."
343150,판례내용,99,"원고와 동급생인 H와 함께 E를 CCTV 사각지대로 데려간 후 쇠파이프로 E를 폭행한 사실(이하 ‘제3 사실’이라 한다), ④ 원고가 2022.3.30."
343150,판례내용,100,"기숙사에서 E를 옷걸이를 이용하여 폭행한 사실(이하 ‘제4 사실’이라 한다), ⑤ 2022.3.30."
343150,판례내용,101,"기숙사에서 피해학생들에게 게임을 하게 한 후 게임에서 진 학생을 배드민턴 채를 사용하여 폭행한 사실(이하 ‘제5 사실’이라 한다), ⑥ 2022.3.30."
343150,판례내용,102,"취침 시간에 F을 빗자루를 이용하여 발바닥을 때린 사실(이하 ‘제6 사실’이라 한다), ⑦ 2022.3.31."
343150,판례내용,103,"F에게 전화하여 “신고할 거면 더 해봐”라고 위협한 사실(이하 ‘제7 사실’이라 한다), ⑧ 2022.4.둘째 주에 기숙사에서 저녁 점호 후 F을 쇠 재질의 물건을 이용하여 옆구리를 폭행한 사실(이하 ‘제8 사실’이라 한다)이 있 고, 위 각 사실이 학교폭력에 해당함으로 전제로 하였다고 할 수 있다."
343150,판례내용,104,따라서 아래에서는 제1 내지 8 사실의 인정 여부 및 학교폭력 해당 여부에 관하여 살펴본다.
343150,판례내용,105,나)처분의 원인된 사실의 인정 여부
343150,판례내용,106,① 제1 사실에 대하여
343150,판례내용,107,"위에서 거시한 증거들과 변론 전체의 취지에 의하면, E와 F이 2022.4.1."
343150,판례내용,108,"작성한 각 사실확인서에 ‘원고가 2022년 3월 기숙사에서 E, F의 손등에 7kg의 아령을 떨어뜨려 폭행하였다’는 취지의 내용이 담겨 있고, 목격자가 2022.4.11."
343150,판례내용,109,"작성한 사실확인서에도 ‘원고가 E의 손등에 아령을 떨어뜨려 위 피해학생을 폭행하였다’는 취지의 내용이 담겨 있는 점, 또한 원고도 위 2022.4.13.자 사실확인서와 행정심판청구서에서 원고가 E와 F에게 1cm 높이에서 아령을 떨어뜨린 사실이 있다고 인정한 점, 원고의 위와 같은 행위로 E, F이 손등이 부어올랐고, 상당한 통증을 느낀 것으로 보이는 점 등을 알 수 있다."
343150,판례내용,110,"이와 같은 여러 사정 등에 비추어 보면, E와 F이 2022.4.1."
343150,판례내용,111,"작성한 각 사실확인서의 위 내용이 허위라고 보기 어렵고, 원고가 E, F에 대하여 제1 사실과 같이 폭행한 사실을 인정할 수 있다."
343150,판례내용,112,"② 제2, 3, 4 사실에 대하여"
343150,판례내용,113,"위에서 거시한 증거들과 변론 전체의 취지에 의하면, E가 2022.4.1."
343150,판례내용,114,"작성한 사실확인서에 ’원고가 3.20.강당에서 갑자기 오라고 하더니 1학년 대표로 맞자고 하고 배드민턴 채 뒷부분으로 E○○의 엉덩이를 2대 때렸고, 같은 날 CCTV가 없는 사각지대로 E○○를 끌고 가 대걸레 뒷부분으로 엉덩이 3대도 때렸으며, 원고가 3.30.기숙사에서 E○○가 취침번호를 잘못 불렀다고 옷걸이로 E○○의 엉덩이를 1대 때렸다‘는 내용이 기재되어 있는 점, 제3 사실과 관련된 원고의 행동에 가담한 것으로 보이는 원고와 동급생이던 H가 작성한 2022.4.5.자 사실확인서에도 ’원고와 H가 3.30.저녁 청소시간에 1학년 E○○를 CCTV가 없는 곳으로 오라고 하였고, H는 뒤에 서 있었다‘는 내용이 기재되어 있는 점, 제4 사실과 관련하여 목격자의 2022.4.11.자 사실확인서에 ’원고가 E○○가 대답을 잘못하였다는 등의 이유로 옷걸이로 E○○의 엉덩이를 때렸다‘는 내용이 기재되어 있는 점, 원고의 행정심판청구서에 제3 사실과 관련하여 ’E○○가 원고와 H를 보고 비웃어 감정을 참지 못하고 H와 함께 부러진 대걸레로 E○○를 한 대씩 툭 쳤다‘고 일부 사실을 자인한 부분이 있는 점 등을 알 수 있다."
343150,판례내용,115,"이와 같은 사정 등에 비추어 보면, 제2, 3, 4 사실에 관한 E의 위 2022.4.1.자 사실확인서 내용이 허위라고 할 수 없고, 제2, 3, 4 사실과 같은 원고의 E에 대한 폭행사실을 인정할 수 있다."
343150,판례내용,116,③ 제5 사실에 대하여
343150,판례내용,117,"위에서 거시한 증거들과 변론 전체의 취지에 의하면, G 작성의 2022.4.1.자 확인서에 ’원고가 3.30.기숙사 방에서 랜덤게임을 시키고 배드민턴 채로 우리를 때렸다.게임에서 지면 맞는 게임이다‘라고 기재되어 있고, E 작성의 2022.4.1.자 사실확인서에 ’원고가 3.30.1학년을 때리려고 배드민턴 채를 가져왔는데 쓸 데가 없다 고 하며 피해학생들에게 게임을 정하고 진 사람이 벌칙으로 맞자고 하였고, 게임에 진 피해학생들이 원고로부터 돌아가며 배드민턴 채 손잡이 부분으로 엉덩이를 맞았고, 그 후 E는 엉덩이가 부어 앉을 때마다 아팠다’고 기재되어 있으며, 그 기재 내용도 원고가 배드민턴 채로 피해학생들을 때린 경위 내지 이유가 비교적 상세하다고 할 수 있는 점, F의 2022.4.1.자 사실확인서에도 G와 E의 위 각 사실확인서와 거의 동일한 내용이 기재되어 있는 점, 이 사건 학교의 교사 L은 2022.3.31.경 피해학생들의 여자 담임 선생님으로부터 피해학생들이 학교폭력을 당한 신체 부위를 확인해달라는 취지의 부탁을 받고 F의 하체 부위를 확인하였는데, 그 당시 F의 엉덩이 부근에 매 맞은 자국이 육안으로 확인된 점, 또한 피해학생들이 원고가 시켜서 게임을 하다가 원고로부터 배드민턴 채의 손잡이 부분으로 엉덩이를 맞은 시기로 주장한 무렵에 G과 E의 엉덩이 부위를 촬영한 사진에 G과 E의 엉덩이에 매를 맞아 부어오른 상흔이 선명하게 남아 있는 점 등을 알 수 있다."
343150,판례내용,118,"이와 같은 여러 사정 등에 비추어 보면, 원고가 제5 사실과 같이 피해학생들을 폭행한 사실을 인정할 수 있다."
343150,판례내용,119,"④ 제6, 7, 8 사실에 대하여"
343150,판례내용,120,"위에서 거시한 증거들과 변론 전체의 취지에 의하면, F 작성의 2022.4.11.자 사실확인서에 제6 사실과 관련하여 ‘원고가 취침시간에 인원 체크를 하러 왔다가 빗자루로 F의 발바닥을 때렸다’고 기재되어 있고, F 작성의 2022.4.11.자 사실확인서에 제7 사실과 관련하여 ‘원고가 3.31.F에게 전화하여 신고할 거면 더 해봐라고 말하고 전화를 끊었다’라고 기재되어 있으며, M의 2022.4.13.자 사실확인서에 제8 사실과 관련하여 ‘4월 둘째 주에 저녁 점호 후 원고가 불러 원고의 방으로 갔는데, 원고가 F에게 원고의 허벅지에 있는 가위로 찔린 곳의 흉터를 보여주고 가위와 신발에 끼는 쇠(박차)중 무엇으로 맞을 거냐고 물어보았고, F이 가위는 아플 것 같아서 신발에 끼는 쇠를 골랐으며, 원고가 F을 바닥에 눕히고 F의 옆구리를 2대 때려서 F이 많이 아팠다’는 내용이 기재되어 있는 점, 원고의 위 행정심판청구서에 원고가 F에게 가위로 찔린 원고의 신체 부위 흉터를 보여준 사실은 인정한 점, 원고가 제6, 7 사실과 관련하여 원고가 F에게 ‘담배 피우지 마라’고 하면서 빗자루로 F의 발바닥을 쳤다거나, ‘선배한테 까불다가 혼난 것도 학교폭력으로 신고할 거면 해라’라고 한 것이라고 주장하고 있는 점 등을 감안하면, 제6, 7, 8 사실에 관한 F 작성의 위 각 사실확인서 내용이 허위라고 볼 수 없고, 원고가 제6, 7, 8 사실과 같이 F을 각 폭행한 사실을 인정할 수 있다."
343150,판례내용,121,다)학교폭력 해당 여부
