판례일련번호,구분,문장번호,내용
342731,판례내용,1,서 울 행 정 법 원
342731,판례내용,2,제 2 부
342731,판례내용,3,판 결
342731,판례내용,4,사 건 2021구합83055 국가인권위원회 결정 취소
342731,판례내용,5,원 고 주식회사 A
342731,판례내용,6,"소송대리인 변호사 최○, 김○, 이○, 정○"
342731,판례내용,7,피 고 국가인권위원회
342731,판례내용,8,소송대리인 법무법인 지향
342731,판례내용,9,"담당변호사 신○, 여○"
342731,판례내용,10,피고보조참가인 별지 1 목록 기재와 같다.
342731,판례내용,11,피고보조참가인들 소송대리인 법무법인 소○
342731,판례내용,12,담당변호사 신○
342731,판례내용,13,변 론 종 결 2023.8.31.
342731,판례내용,14,판 결 선 고 2023.10.5.
342731,판례내용,15,주 문
342731,판례내용,16,1.피고가 2021.6.29.
342731,판례내용,17,원고에 대하여 한 결정 중 주문 제2항 ‘피고보조참가인들에 대한 업무지원단 발령 취소 등 적절한 구제방안을 마련하여 시행할 것을 권고한다’ 부분을 취소한다.
342731,판례내용,18,"2.소송비용 중 보조참가로 인한 부분은 피고보조참가인들이, 나머지는 피고가 각 부담한다."
342731,판례내용,19,청 구 취 지
342731,판례내용,20,주문과 같다.
342731,판례내용,21,이 유
342731,판례내용,22,1.결정의 경위
342731,판례내용,23,가.원고는 1981.12.10.
342731,판례내용,24,"설립되어 약 2만 명 이상의 근로자를 고용하고 있는 회사로, 정보통신사업, 정보통신기기 매매업, 통신판매업 등을 영위하고 있다."
342731,판례내용,25,나.피고보조참가인(이하 ‘참가인’이라 한다)들은 2014.5.12.
342731,판례내용,26,"원고의 회사 경영효율화 및 사업합리화 계획의 일환으로 업무지원단에 전보발령(이하 ‘이 사건 전보발령’이라 한다)을 받은 근로자들로, 현재 원고의 직원으로 근무 중이거나 원고의 직원으로 근무하다가 퇴직한 사람들이다."
342731,판례내용,27,"다.참가인들은 2019.1.3., 2019.7.23."
342731,판례내용,28,및 2020.4.27.
342731,판례내용,29,피고에게 원고에 대한 아래와 같은 취지의 진정을 제기하였다.
342731,판례내용,30,"참가인들은 원고의 직원들로 B단체 등 원고에 비판적인 노동조합에 가입하여 활동하였다는 이유로 아래와 같은 인사상 불이익을 받고 있는바, 이는 고용과 관련하여 합리적 이유 없이 참가인들을 불리하게 대우하는 차별행위이다."
342731,판례내용,31,"가.원고는 2005년 B단체 회원, 명예퇴직거부자, 외주화 당시 전출거부자 등 1,002명을 인위적으로 퇴출시키기 위하여 불법적으로 ‘부진인력 퇴출 및 관리방안’을 수립하였고, 참가인 1 내지 16과 참가인 20은 B단체 활동을 하였다는 이유로 부진인력 대상에 선정되어 업무분장, 인사고과 등에서 불이익을 받았다."
342731,판례내용,32,"나.원고는 참가인들이 B단체, C새노동조합에 가입하여 활동하였다는 이유로 2014.5.12."
342731,판례내용,33,"이 사건 전보발령을 하여 거주지와 멀리 떨어진 오지의 지점에 배치하고 지점 직원들과 근무공간을 분리하여 격리시켰으며, 협력업체 직원들이 수행하던 모뎀회수 업무, 불량회선 점검업무 등을 수행하도록 하는 등 적절한 업무분장을 하지 않고 있으며, 수차례 전보신청을 하여도 받아주지 않는 등 현재까지도 지속적인 불이익을 주고 있다."
342731,판례내용,34,라.이에 대하여 피고는 2021.6.29.
342731,판례내용,35,"위 가.항에 대해서는 참가인 3 내지 7, 11, 13 내지 16, 20 총 11명이 부진인력 문건 관련 손해배상청구 소송의 원고들로서 법원의 화해권고결정에 따라 원고로부터 합의금을 수령하였으므로 법원 등 다른 구제절차를 밟은 경우에 해당하여 구 국가인권위원회법(2022.1.4."
342731,판례내용,36,"법률 제18721호로 개정되기 전의 것, 이하 같다)제32조 제1항 제5호에 따라 각하 결정을 하였고, 참가인 1, 2, 8, 9, 10, 12 총 6명은 부진인력 문건과 관련하여 원고로부터 합의금을 수령하였으므로 이미 피해회복이 이루어져 별도의 구제조치가 필요하지 않다고 인정하여 구 국가인권위원회법 제39조 제1항 제3호에 따라 기각 결정을 하였으나, 위 나.항(이하 참가인들의 진정 중 이 부분만을 ‘이 사건 진정’이라 한다)에 대해서는 아래와 같은 이유로 진정을 받아들여 구 국가인권위원회법 제44조 제1항 제1호에 따라 원고에게 ‘참가인들에 대한 업무지원단 발령 취소 등 적절한 구제방안을 마련하여 시행할 것을 권고한다’는 결정(이하 참가인들의 진정을 받아들여 원고에게 구제조치를 명한 위 부분만을 ‘이 사건 결정’이라 한다)을 하였다."
342731,판례내용,37,"참가인들이 모두 B단체 등 원고에 비판적인 활동을 하였다는 사실, 원고가 B단체 등 활동을 하는 직원들의 동향을 파악하여 의도적으로 인사관리를 해 온 사실, 업무지원단 발령 당시 전체 직원의 1%도 되지 않는 B단체 등 회원들이 업무지원단 291명 중 30%가 넘게 포함된 사실에 비추어 볼 때, 참가인들이 2014년 업무지원단에 발령난 데에는 참가인들의 B단체 등 활동이 원인이 되었을 개연성이 있다."
342731,판례내용,38,"그럼에도 원고는 직원들 중 누가 B단체 등 조합원인지 알지 못하며 당시 자료가 폐기되어 존재하지 않는다는 등 합리적 의심을 배척할 적극적 소명이나 관련 자료를 제출하지 않고 있는바, 참가인들에 대한 업무지원단 발령과 참가인들의 B단체 등 활동의 연관성을 인정할 수 있으며 그 밖에 다른 합리적 이유는 찾기 어렵다."
342731,판례내용,39,"이상을 종합할 때, 원고가 2014년 업무지원단 발령대상자에 참가인들을 포함시킨 것은 참가인들의 B단체 등 활동을 이유로 합리적 이유 없이 참가인들을 불리하게 대우한 차별행위에 해당한다."
342731,판례내용,40,이에 원고에게 참가인들에 대한 업무지원단 발령 취소 등 적절한 구제방안을 마련하여 시행할 것을 권고할 필요가 있다.
342731,판례내용,41,"[인정근거] 다툼 없는 사실, 갑 제1호증, 을가 제7, 9호증(가지번호 있는 경우 각 가지번호 포함, 이하 같다)의 각 기재, 변론 전체의 취지"
342731,판례내용,42,2.원고의 주장
342731,판례내용,43,가.이 사건 진정에는 아래와 같은 각하 사유가 존재한다.
342731,판례내용,44,그런데도 이 사건 진정을 받아들여 원고에게 구제조치를 명한 이 사건 결정은 위법하다.
342731,판례내용,45,1)이 사건 진정의 실질적인 쟁점은 이 사건 전보발령의 정당성이다.
342731,판례내용,46,"그런데 이 사건 전보발령에 따라 업무지원단으로 전보된 원고의 직원들은 서울중앙지방법원에 이 사건 전보발령의 효력 정지를 구하는 가처분을 신청하였으나, 2014.8.12."
342731,판례내용,47,"기각 결정을 받았고, 이에 관한 본안소송은 제기되지 아니하였다."
342731,판례내용,48,"그렇다면 위 기각 결정은 전보 발령의 정당성에 관한 법원의 사실상 종국결정에 해당한다고 보아야 하므로, 이 사건 진정은 제기될 당시 진정의 원인이 된 사실에 관하여 법원의 재판이 종결된 경우에 해당한다."
342731,판례내용,49,따라서 이 사건 진정에는 구 국가인권위원회법 제32조 제1항 제5호의 각하 사유가 존재한다.
342731,판례내용,50,2)원고는 2014.5.12.
342731,판례내용,51,"이 사건 전보발령을 하였는데, 참가인들은 그로부터 1년이 훨씬 경과한 2019년경부터 이 사건 진정을 제기하였다."
342731,판례내용,52,"따라서 이 사건 진정에는 구 국가인권위원회법 제32조 제1항 제4호 본문의 각하 사유가 존재하고, 같은 호 단서의 예외사유가 존재하는 경우에 해당하지도 않는다."
342731,판례내용,53,나.이 사건 전보발령은 아래와 같은 이유로 구 국가인권위원회법 제2조 제3호 (가)목에서 정한 차별행위에 해당하지 않는다.
342731,판례내용,54,그런데도 이 사건 전보발령이 차별행위에 해당한다는 이유로 원고에게 구제조치를 명한 이 사건 결정은 위법하다.
342731,판례내용,55,"1)참가인들이 이 사건 전보발령으로 근무하게 된 업무지원단은 다른 직원들과 비교하여 급여, 인사평가, 승진, 업무분장상 별다른 불이익이 없고, 직원들이 근무하기에 양호한 환경을 갖추고 있으며, 회사 내부 인사절차에 따라 전입․전출이 이루어지는 부서에 해당한다."
342731,판례내용,56,"업무지원단이 그 업무특성상 독립된 사무실을 사용하는 것이나, 업무지원단 발령으로 참가인들이 심리적 압박감을 느꼈다는 사정만으로는 업무지원단 발령이 근로자들에 대한 불리한 대우에 해당한다고 볼 수 없다."
342731,판례내용,57,따라서 원고가 이 사건 전보발령으로 참가인들을 불리하게 대우하였다고 볼 수 없다.
342731,판례내용,58,2)피고는 B단체 회원의 지위가 구 국가인권위원회법 제2조 제3호 (가)목에서 정한 차별금지 사유 중 ‘사회적 신분’ 또는 ‘그 밖의 사유’에 해당한다고 주장한다.
342731,판례내용,59,"사회적 신분은 사회에서 장기간 점하는 지위로서 일정한 사회적 평가를 수반하는 것인데, B단체는 근로자가 자발적 의사로 가입한 사적 단체이므로, 고정성을 지닌다고 보기 어렵고, B단체에 대하여 2000년 이래 현재까지 사회적 평가가 이루어졌다고 볼 근거도 없다."
342731,판례내용,60,"나아가 침익적 행정처분의 경우 지나친 확장해석이나 유추해석이 금지되므로, 엄밀한 논증 없이 ‘그 밖의 사유’에 해당한다고 볼 수도 없다."
342731,판례내용,61,따라서 이 사건 전보발령이 구 국가인권위원회법 제2조 제3호 (가)목에서 정한 차별금지 사유를 원인으로 한 것이라고 볼 수 없다.
342731,판례내용,62,"3)원고는 2014.4.30.경 경영상황 악화로 인한 사업합리화 조치로서 노사합의를 거쳐 특별명예퇴직, 조직개편을 시행하였고, 그로 인한 미보임 직원 1,201명이 발생하였다."
342731,판례내용,63,"원고는 최근 3년간의 인사고과 60%, 과거 징계전력 10%, 평소 근무태도 30%를 점수화하여 위 1,201명 중 고득점 순으로 910명을 추가로 지역본부에 전략배치하였고, 나머지 291명을 업무지원단으로 전보하는 이 사건 전보발령을 실시하였으므로, 이 사건 전보발령은 원고의 합리적인 인사명령에 해당한다."
342731,판례내용,64,그런데도 피고는 검증되지 않은 자료를 바탕으로 가정과 추측에 근거하여 이 사건 전보발령을 차별행위로 판단하였다.
342731,판례내용,65,다.행정처분이 적법하기 위해서는 명확성․특정성․이행가능성을 가지고 있어야 한다.
342731,판례내용,66,"그런데 피고는 이 사건 결정에서 ‘업무지원단 발령 취소 등 적절한 구제방안을 마련하여 시행할 것’을 권고하고 있는바, 위와 같은 권고는 그 내용이 불명확하고, 특히 참가인들 중 상당수가 퇴직한 점을 고려할 때 이행가능성도 없다."
342731,판례내용,67,따라서 이 사건 결정은 명확성․특정성․이행가능성을 결여한 것으로서 위법하다.
342731,판례내용,68,3.관계 법령
342731,판례내용,69,별지 2 기재와 같다.
342731,판례내용,70,4.인정사실
342731,판례내용,71,"갑 제1, 2, 4 내지 7, 9, 11, 12, 13, 15호증, 을가 제1, 5, 6, 9, 10, 11, 16호증, 을나 제1, 3, 4, 5호증의 각 기재에 변론 전체의 취지를 종합하면 아래와 같은 사실이 인정된다."
342731,판례내용,72,가.원고의 부진인력 관리 문건 작성 및 그에 관한 임금지급청구 소송 확정
342731,판례내용,73,"1)원고는 1981.12.공기업인 ‘D공사’로 설립되었다가 2002년경 민영화되었는데, 당시 향후 인건비 비율을 19% 이하로 낮추기로 공표하였다."
342731,판례내용,74,"2)이에 원고는 2003.9.경 직원 중 약 5,505명을 명예퇴직을 통해 퇴사시켰고, 이후에도 인력 감축을 위한 노력을 지속하여 왔다."
342731,판례내용,75,"3)원고의 본사 인력관리실 소속 직원은 2005년경 원고의 직원 중 1,002명을 부진인력[이른바 ‘CP’(C-Player)라고도 한다] 대상자로 선정하여 관리하는 ‘CP 문건’을 작성하였다."
342731,판례내용,76,4)CP 문건의 명단에 포함되어 있던 직원들은 2010.10.28.
342731,판례내용,77,"수원지방법원에 원고를 상대로 ‘원고가 2009년도 인사고과를 하면서 2005년경 선정한 부진인력 대상자들에게 F등급을 부여하여 각 1%씩 연봉을 삭감하였는바, 이는 전출거부자 등으로 구성된 부진인력 대상자들에 대한 사실상의 제재에 해당하는 등 부당하므로, 원고는 삭감한 임금 및 그에 대한 지연손해금을 지급하여야 한다’는 취지의 민사소송(이하 ‘관련 임금 지급청구 소송’이라 한다)을 제기하였으나, 2011.12.27."
342731,판례내용,78,청구기각 판결을 선고받았다(수원지방법원 2010가소84911호).
342731,판례내용,79,5)그런데 수원지방법원은 2013.1.29.
342731,판례내용,80,"위 사건의 항소심에서 아래와 같은 이유로 부진인력 대상자들에 대한 임금 삭감이 위법하다고 판단하였고, 이들에 대한 제1심 판결을 취소하고 임금지급 청구를 인용하였다(수원지방법원 2012나6377호)."
342731,판례내용,81,위 판결은 2015.6.24.
342731,판례내용,82,원고의 상고가 기각되어(대법원 2013다22195호) 확정되었다.
342731,판례내용,83,"○ 2005년 부진인력 대상자 명단에 기재된 1,002명 중 601명은 퇴직하였고, 나머지 401명의 2009년도 인사고과 비율은 그 외의 일반 직원의 인사고과보다 크게 불이익한 것으로 보여 유의미한 외형상의 격차가 존재한다."
342731,판례내용,84,"○ 위와 같은 격차가 원고의 부진인력에 대한 의도적 차별에 기인한 것인지 보건대, 원고의 본사 기획조정실 인력기획부 직원들은 2004.9.경 인건비 비율을 19% 이하로 낮추기 위한 대책을 강구하면서 대외비로 ‘중기 인적자원 관리계획’을 작성하고 이를 원고의 본사 임원에게 보고하였는데, 위 문건에는 ‘고비율/비효율적 인력조정 및 인력순환 정체로 발생한 문제를 해소하기 위해서는 일정수준 이하의 부진인력을 지속적으로 퇴출하기 위한 상시 인력순환 시스템 구축이 요구된다’, ‘합리적이고 객관적인 기준에 의한 수용도 높은 인력분류시스템으로 부진인력 Pool 대상자 선정이 필요하고, 부진인력으로 선정된 대상자에 대해서는 직무 재배치, 보상 차별화, 전직지원 등 다양한 관리방안을 통해 지속적으로 퇴출을 유도해야 한다’는 등의 내용이 포함되어 있다."
342731,판례내용,85,"○ 원고 본사의 인력관리실 인사팀 직원은 2005년경 ‘CP 문건’을 작성하여 상부에 보고하였는데, 위 자료에는 전국의 각 지역본부 및 지사로부터 취합하여 정리한 부진인력 관리 대상자 1,002명의 인적사항과 함께 ‘업무부진자․B단체․E안내원 출신자 중 해당 여부’ 등 이 표시되어 있었다."
342731,판례내용,86,"○ 원고의 충북본부 충주지사에서는 2007년경 ‘부진인력 퇴출 및 관리방안’ 등의 문서를 작성하여 대외비로 관리하였는데, 위 문건에는 기관별 퇴출목표 및 실적이 기재되어 있었고, 퇴출 및 관리대상 선정 사유로 ‘E 잔류자’, ‘B단체 관련자’, ‘간부직 명퇴거부자’, ‘업무부진자’ 등을 기재하였다."
342731,판례내용,87,나.이 사건 전보발령 경위
342731,판례내용,88,"1)원고는 정보통신사업분야의 규제 강화 및 사업자간 경쟁 심화 등으로 인하여 2013년 약 3,900억 원의 당기순손실을 기록하였고, 2014년 1분기에도 영업이익이 전년도에 비하여 58.2% 감소한 1,520억 원을 기록하였으며, 이에 따라 410억 원의 당기순 손실을 기록하였다."
342731,판례내용,89,"2)원고는 그 원인을 분석한 결과 2013년 말 기준 원고의 직원은 약 32,391명, 총 인건비는 2.6조 원, 인건비 비율이 18%로 경쟁사(F회사 6%, G회사 10%)에 비하여 그 비율이 훨씬 높고, 반면 1인당 영업이익은 0.1억 원으로 경쟁사(F회사 4.7억 원, G회사 0.8억 원)에 비하여 현저히 낮은 것으로 진단하였다."
342731,판례내용,90,3)이에 원고와 C노동조합은 2014.4.8.
342731,판례내용,91,"‘특별명예퇴직을 2014.4.30.자로 시행하고, 임금피크제를 2015.1.1.자로 도입하며, 대학생 자녀학자금 지원․대부제도 및 본인학자금 지원제도를 2014.6.1.자로 폐지하고, 사업합리화를 위하여 Mass영업․개통 /AS․Plaza 분야 업무를 폐지하여 해당 분야 잔류자에 대해서는 직무전환 교육 후 접점지역으로 재배치한다’는 등의 노사합의(갑 제4, 5, 6호증, 이하 ‘이 사건 노사합의’라 한다)를 하였다."
342731,판례내용,92,"4)원고는 2014.4.10.부터 2014.4.21.까지 근속 15년 이상 직원 약 23,000명을 대상으로 특별명예퇴직 대상자를 모집하였고, 그 결과 8,304명의 직원들이 사직의사를 표시하여 2014.4.30.자로 퇴사하였다(이하 ‘이 사건 명예퇴직’이라 한다)."
342731,판례내용,93,"또한 위 노사합의로 폐지되는 분야의 총 근로자 수는 약 9,400명에 해당하였고, 이에 원고는 대규모의 조직개편 및 인력 재배치를 실시해야 하는 입장에 놓이게 되었다."
342731,판례내용,94,5)이에 원고와 C노동조합은 2014.4.25.
342731,판례내용,95,"사업합리화에 따른 잔류인력 재배치와 관련하여 아래와 같은 내용의 부속합의를 하였다(갑 제7호증, 이하 ‘이 사건 부속합의’라 한다)."
342731,판례내용,96,"1.직원들의 희망직무 및 희망근무지 근무기회 부여를 위해, TM(Talent Market의 약자로, 각 부서에서 인력이 필요한 경우 원하는 경력, 직무 등을 지원자격으로 등록하면 지원자격을 충족하는 배치 희망자가 지원을 하고, 수요 부서가 지원인력 중에서 적합한 직원이 선발하여 배치하는 제도로 2009년부터 노사합의에 의하여 시행되었다."
342731,판례내용,97,이하 ‘TM’이라 한다)을 통해 배치하는 것을 원칙으로 한다.
342731,판례내용,98,2.TM으로 선발되지 않은 직원은 전사 직무별/지역별 인력수급현황 등을 종합적으로 고려하여 합리적인 기준에 따라 고객접점부서에 전략배치할 수 있다.
342731,판례내용,99,- 회사는 생산성 및 수익성 증대를 위한 조직을 신설하여 직원을 배치할 수 있다.
342731,판례내용,100,"- 희망직무, 희망근무지 등을 최대한 고려하여 배치하되, 부득이 거주지와 근무지가 멀어지는 경우 회사는 생활상 불이익을 최소화하기 위해 노력하고, 향후 TM 결과 및 업무 성과 등을 고려하여 근무지를 조정할 수 있다."
342731,판례내용,101,- 장애인과 보훈대상자는 기존 근무지 인접부서로 배치한다.
342731,판례내용,102,3.회사는 재배치된 인원이 새로운 업무에 신속히 적응할 수 있도록 직무전환교육 시행 등 최선의 노력을 다한다.
342731,판례내용,103,"6)조직개편 이후 5,293명의 미보임 직원이 발생하였고, 이에 위 직원들에 대한 2차례의 TM(1차 2014.4.29.부터 2014.4.30까지, 2차 2014.5.2.부터 2014.5.7.까지)을 통하여 4,092명을 재배치하였다."
342731,판례내용,104,"7)위와 같은 인력 재배치 결과 1,201명(= 5,293명 – 4,092명)의 미배치 잔류인력이 발생하였고, 원고는 2014.5.8."
342731,판례내용,105,"① 최근 3년간의 인사고과 60%, ② 과거 징계전력 10%, ③ 평소 근무태도 30%를 점수화하여 고득점 순으로 910명을 지역본부에 배치하였다."
342731,판례내용,106,"8)원고는 아래와 같은 업무를 수행하는 ‘업무지원단’을 신설하였고, 2014.5.12."
342731,판례내용,107,"지역본부에 배치하지 못하고 남은 291명(= 1,201명 – 910명)을 업무지원단으로 발령하는 이 사건 전보발령을 하였다."
342731,판례내용,108,수행직무 구체적 내용
342731,판례내용,109,네트워크 직영공사 및 시설관리 업무(2016년 이후부터는 수행하지 않음)
342731,판례내용,110,"(케이블 운영실태 점검업무)사옥 외부의 단자함, 전주 등 통신시설이 외관상 이상이 없는지 점검하고, 이상이 있을 경우 고장수리가 이루어지도록 유관부서 등에 전달하는 업무"
342731,판례내용,111,(무선품질 측정)무선통신신호가 미약한 음영지역을 찾아 조치가 이루어지도록 유관부서 등에 전달하는 업무
342731,판례내용,112,고객서비스 활동지원
342731,판례내용,113,(임대단말 회수 업무)고객이 임대단말기 회수를 요청하는 경우 고객의 장소로 찾아가 회수하는 업무
342731,판례내용,114,그룹사 상품판매 대행
342731,판례내용,115,"차량렌탈, 보안솔루션 등 Biz영업상품을 중심으로 상품판매 대행"
342731,판례내용,116,다.이 사건 전보발령에 대한 효력정지 가처분 기각결정
342731,판례내용,117,"1)업무지원단 발령자 중 182명(이 사건의 원고 1, 2, 4, 5, 6, 8 내지 11, 13 내지 19 총 16명도 포함되어 있다, 이하 이 항에서 ‘채권자’라 한다)은 2014.5.30."
342731,판례내용,118,"서울중앙지방법원에 이 사건 전보발령에 대한 효력정지 가처분 신청을 하였으나, 서울중앙지방법원은 2014.8.12."
342731,판례내용,119,"아래와 같은 이유로 가처분 신청을 기각하였다(서울중앙지방법원 2014카합818호, 이하 ‘이 사건 가처분 기각결정’이라 한다)."
342731,판례내용,120,○ 업무지원단은 명예퇴직과 지점통폐합으로 인하여 발생할 수 있는 업무의 공백을 보완하고 지원하는 업무를 위한 조직으로서 그 업무상 필요성을 부정하기 어렵다.
342731,판례내용,121,"○ 채권자들은 처음부터 전보대상 내지 퇴출대상으로서 TM의 기회가 박탈되었다고 주장하나, 직원이 TM에 지원하였다는 사정만으로 곧바로 당해 부서에 선발되는 것은 아니고, 채권자들 중 일부가 B단체 회원이었다는 이유로 처음부터 TM의 기회가 박탈되었다는 점이 소명되지 않는다."
342731,판례내용,122,○ 제출된 자료만으로는 이 사건 전보발령으로 인하여 채권자들의 출퇴근거리 및 시간에 상당한 불이익이 존재한다고 보기 어렵다.
342731,판례내용,123,"○ 채권자들에 대한 각 6회에 걸친 인사평가의 결과 A등급 0.4%, B등급 1.9%, C+등급 4.7%, C등급 28.4%, D등급 44.3%, F등급 20.3%이므로, 채권자들이 우수한 인사평가에도 불구하고 전보대상자로 선정된 것이라고 보기 어렵다."
342731,판례내용,124,"또한 전보발령은 원칙적으로 인사권자인 사용자의 권한에 속하여 업무상 필요한 범위 내에서 사용자는 상당한 재량이 인정되는 것이므로, 원고가 전보대상자 선정에 인사 마일리지 기준을 적용하였다거나 근무태도를 반영하였다고 하더라도 그러한 기준이 현저히 불합리하다는 특별한 사정이 없는 한 이러한 사정만을 들어 전보대상자 선정이 무효라고 볼 수는 없다."
342731,판례내용,125,2)이후 채권자들은 이 사건 가처분 기각결정에 대하여 항고하거나 이 사건 전보발령의 효력을 다투는 본안소송 등을 제기하지 않았다.
342731,판례내용,126,라.노사합의에 관한 손해배상청구 소송 경과
342731,판례내용,127,1)이 사건 노사합의에 따라 명예퇴직하거나 업무지원단으로 발령된 사람들 226명은 2014.7.4.
342731,판례내용,128,"서울중앙지방법원에 C노동조합 및 그 간부들을 상대로 ‘이 사건 노사합의를 체결하면서 조합원들의 의사를 수렴하기 위한 조합원 총회 절차를 거치지 않았고, 그 결과 C노동조합 소속 조합원들의 근로조건이 심각하게 훼손되고 절차적 권리를 침해당했다’고 주장하며 1인당 200만 원의 위자료 상당 손해배상금의 지급을 구하는 민사소송을 제기하였다(이하 ‘관련 손해배상청구 소송’이라 한다)."
