판례일련번호,구분,문장번호,내용
224619,판례내용,57,"① 관세법 시행령 제19조 제3항 제4호에서 ‘권리사용료가 저작권에 대하여 지급되는 때에는 수입물품에 컴퓨터소프트웨어 등이 수록되어 있는 경우' 물품관련성이 인정된다고 규정하고 있고, 관세법 시행령 제19조 제5항 제1호, 제2호에서 ’구매자가 수입물품을 구매하기 위하여 판매자에게 권리사용료를 지급하는 경우, 수입물품의 구매자와 판매자간의 약정에 따라 구매자가 수입물품을 구매하기 위하여 당해 판매자가 아닌 자에게 권리사용료를 지급하는 경우‘에 거래조건성이 인정된다고 규정하고 있다.이 사건 라이센스 계약에서는 이 사건 라이센서는 일정 기간 동안 저작권 있는 영상물을 국내 TV 등을 통해 방영할 수 있는 권리를 원고에게 부여하고, 원고는 그에 대한 대가로 이 사건 라이센스료를 지급하고 있는데, 이 사건 쟁점 물품에는 위와 같은 방영권 및 라이센스료 지불의 대상이 되는 저작물이 수록되어 있으므로, 이 사건 라이센스료는 이 사건 쟁점 물품과 관련된 것으로 보이고, 원고는 이 사건 라이센스료를 지급하지 않고서는 해외 제작사로부터 이 사건 쟁점 물품을 수입할 수 없으므로 거래조건성 역시 인정된다고 할 것이다."
224619,판례내용,58,"② 원고는, 이 사건 라이센스 계약에 따라 원고가 부여받은 방영권은 이 사건 라이센서의 저작물을 방송사업자의 포맷에 맞게 복제하고, 이를 공중 송신할 수 있는 권리가 복합적으로 구성되어 있는 권리이고, 이 사건 쟁점 물품에 수록된 저작물은 수입 후 그대로 다른 물품인 테이프에 복제되어 국내화 작업을 거치며, 이러한 작업을 거친 영상물이 원고가 운영하는 ‘△△△△△△’ 또는 원고가 위 영상물을 판매한 다른 방송사업자의 저장장치에 일시적으로 저장되었다가 방영되고, 이후 이 사건 쟁점 물품은 폐기 또는 반환되는바, 국내에서의 재현생산행위에 사용될 뿐인 이 사건 쟁점 물품에 대한 관계에 있어 이 사건 라이센스료는 재현생산행위에 대한 대가이거나 적어도 위 라이센스료에는 재현생산행위에 대한 대가가 포함되어 있다고 주장한다.그러나, ㉠ 방영권은 일반적으로 저작권 있는 영상물을 TV 등 영상매체를 통하여 방송할 수 있는 권리만을 의미하고, 위 권리에 영상물을 수입하여 다른 물품에 재현하는 것을 목적으로 하는 권리까지 포함하는 것은 아닌 점, ㉡ 이 사건 라이센스 계약에서도 이 사건 라이센서가 저작권을 보유한 영상물을 위 계약에 따라 TV 등 영상매체를 통하여 재생할 수 있는 권리를 원고에게 부여하고, 원고는 부여받은 위 권리에 대한 대가로 이 사건 라이센스료를 지급한다고 규정하고 있을 뿐인 점, ㉢ 달리 원고가 이 사건 라이센스 계약에서 이 사건 쟁점 물품에 수록된 영상물을 국내에서 구현하여 새로운 물품을 제조 내지 생산하기 위한 권리를 허여받은 바 없고, 이 사건 라이센스료 또한 원고에게 방영권이 부여된 기간 및 방영이 허락된 영상물의 범위 등을 고려하여 정하여졌을 뿐, 원고가 이 사건 쟁점 물품에 수록된 영상물을 수입 이후에 다른 물품에 재현생산하는 행위까지 고려되어 정하여진 것으로 보이지 않는 점, ㉣ 재현생산권은 특정한 고안이나 창안이 구현되어 있는 수입물품을 수입국에서 복제하여 새로운 물품을 생산할 수 있는 권리로서, 해당 권리를 사용하는 대가로 지급되는 권리사용료는 관세평가시 존재하지 않는 국내 복제물품에 관련되고 본질적으로는 수입물품에 관련되지 않는 것이므로, 관세법은 이러한 권리에 대한 대가를 가산요소에서 제외하는 것인 점, ㉤ 그런데, 이 사건 쟁점 물품에 수록된 영상물을 국내에서 다른 테이프에 복제한 뒤 더빙, 자막 삽입, 저장장치에 저장 등의 과정을 거치는 것은 이 사건 쟁점 물품에 수록되어 수입된 영상물을 국내에서 방영하기 위한 일련의 과정 내지 이 사건 라이센스 계약에 따라 부여받은 방영권의 행사에 불과할 뿐, 이를 이 사건 쟁점 물품에 담긴 특정한 고안이나 창안을 사용하여 관세평가시 존재하지 않던 새로운 물건을 생산하는 것이라고 평가할 수 없는 점, ㉥ 원고가 국내화 작업을 거친 이 사건 쟁점 물품 내 영상물을 다른 방송사업자를 통하여 방영하는 것 또한 이 사건 라이센스 계약에 따라 원고에게 부여된 방영권의 행사에 불과하고, 이 사건 라이센스 계약에서 국내화 작업을 거친 영상물이 저장된 매체를 판매할 권한을 원고에게 별도로 부여하거나 이 사건 라이센스료가 그에 대한 대가를 포함하고 있지도 않는바, 다른 방송사업자를 통한 방영을 위한 원고의 행위 내지 그 방영 과정 역시 재현생산행위에 해당한다고 할 수 없는 점, ㉦ 원고가 이 사건 쟁점 물품을 수입한 뒤 위 물품을 이용해 영상물을 국내에서 그대로 방영할 경우 이 사건 라이센스료는 과세가격에 가산되어야 할 것으로 보이는데, 위 영상물이 국내에서 테이프 등 다른 매체에 복사되었다거나 더빙, 자막 삽입 등의 국내화 작업을 거치거나 방송 송출을 위해 저장 장치에 저장 및 복제되는 과정을 거쳤다는 이유만으로 이 사건 라이센스료를 가산할 과세대상이 존재하지 않게 되었다고 하는 것은 부당해 보이는 점 등을 고려하면, 원고의 위와 같은 주장은 받아들이기 어렵다."
224619,판례내용,59,"③ 원고는, 원고의 재현생산권을 이 사건 라이센스 계약에서 별도로 명시하지 아니한 이유는 위 계약의 자막 삽입 및 편집 등에 관한 규정에서 원고의 재현생산행위를 당연히 전제하고 있기 때문이라고 주장한다.그러나, ㉠ 위에서 본 바와 같이 이 사건 쟁점 물품에 수록된 영상물의 국내 방영을 위한 원고의 행위를 관세법 시행령 제19조 제2항 괄호 부분에서 말하는 재현생산행위로 평가하기 어려운 점, ㉡ 재현생산에 관한 권리는 계약에 의해 별도로 부여되지 않는 이상 자동으로 취득되는 권리라고 볼 수 없고, WTO 관세평가협정 예해 19.1의 제5호에서도 ‘유보된 권리가 포함된 물품을 획득하였다는 자체로 그들 물품을 재현하는 권리가 항상 부여되는 것이 아니고, 대부분의 경우 그 권리는 특별한 계약을 통해 취득한다’고 하고 있는 점, ㉢ 이 사건 라이센스 계약에서는 ‘원고는 해당 영상물을 한국어 및(또는)영어를 사용하여 1개 국어 또는 2개 국어 버전으로 방영할 수 있고, 원고는 계약기간 동안 현재 합의된 영상물 목록에 포함된 영상물을 허락받은 언어로 방영하는 것이 허락되며, 원고는 영상물을 한국어로 방송하기 위하여 이를 자신의 단독 비용으로 한국어로 더빙 및(또는)자막 처리할 수 있다’고 규정하고 있는바, 이 사건 라이센스 계약 내지 라이센스료가 반드시 국내화 작업을 거친 영상물을 전제로 하는 것이 아닐 뿐만 아니라 한국어 방송을 위한 더빙 및 자막 처리는 원고가 자신의 비용으로 거칠 수 있는 과정에 불과한 점 등을 고려하면, 원고의 위와 같은 주장 역시 받아들이기 어렵다."
224619,판례내용,60,"④ 원고는, 이 사건 라이센스 계약에 의할 경우 이 사건 라이센서는 원고에게 애니메이션 등 영상물을 반드시 마스터 테이프에 저장하여 제공할 필요가 없고, 파일 형태로 인터넷을 통하여 전송하는 등 관세가 부과되지 않는 다른 방법을 통해 제공할 수 있으며, 그러한 경우에도 원고가 이 사건 라이센스료를 지급하여야 함을 고려할 때, 이 사건 쟁점 물품과 이 사건 라이센스료 사이에 관련성 및 거래조건성이 존재하지 않는다는 취지로 주장한다.그러나 관세법상 관세는 ‘수입물품’에 대하여 부과하도록 되어 있어, 물품의 수입 없이 온라인 전송되는 경우는 과세요건이 성립하지 아니하여 과세하지 아니하는 것이므로, 원고가 주장하는 위와 같은 사정만으로 이 사건 쟁점 물품에 대하여 과세하는 것이 타당하지 않다거나 이 사건 쟁점 물품과 이 사건 라이센스료 사이에 관련성 및 거래조건성이 존재하지 않는다고 할 수 없다."
224619,판례내용,61,"⑤ 원고는, 이 사건 유럽연합 공동체 관세법 해설자료 내용, 이 사건 국세예규심사위원회 의결사항 및 컴퓨터 소프트웨어 내지 기술사용료와 관련한 대법원 판례(대법원 1998.8.21."
224619,판례내용,62,"선고 97누13115호, 대법원 1992.7.14."
224619,판례내용,63,"선고 91누10763호)를 들어 이 사건 라이센스료가 재현생산권의 대가로서 이 사건 쟁점 물품의 과세가격에 포함될 수 없다고 주장한다.그러나, 유럽연합 공동체 관세법 해설자료는 위 공동체 관세법에 따라 유럽연합 관세평가위원회가 연구한 결과로서 그 결정 등은 공동체 규정의 통일적인 적용과 해석을 위한 자료이나 법률 문서(legal instruments)로는 채택되지 않은 것으로 보이고, 이 사건 쟁점 물품과 같은 매개체에 수록되어 있는 영상물 등과 관련한 권리사용료를 과세가격에 포함시킬지 여부는 국내법이 규정하는 바에 의하여야 할 것인데, 위에서 본 바와 같이 국내법에 의할 경우 이 사건 라이센스료는 이 사건 쟁점 물품의 과세가격에 가산되어야 하는 권리사용료에 해당한다.또한, 이 사건 국세예규심사위원회의 의결사항 및 원고가 들고 있는 대법원 판례는 문제가 된 라이센스료 내지 로열티가 재현생산권 또는 기술사용에 대한 대가로 지급된 경우에 관한 것이거나 수입물품이 ‘컴퓨터 소프트웨어’가 수록된 매개체에 관한 것으로, 이 사건 라이센스료가 재현생산권에 대한 대가로서 지급된 것인지 여부에 대하여 다툼이 있을 뿐 아니라, 라이센스료가 방영권에 대한 대가로 지급되고 이 사건 쟁점 물품에 수록된 저작물이 영상물인 이 사건과는 그 사안을 달리하므로, 위 의결사항 및 판례를 이 사건에 그대로 적용할 수 없다."
224619,판례내용,64,3.결론
224619,판례내용,65,그렇다면 원고의 청구는 이유 없으므로 이를 기각하기로 하여 주문과 같이 판결한다.
224619,판례내용,66,[별지 생략]
224619,판례내용,67,판사 윤○(재판장)김○ 강○
