판례일련번호,구분,문장번호,내용
238525,판례내용,71,"따라서 법인지방소득세 산정 시 세액공제를 허용하지 않겠다는 입법자의 의사가 지방재정 확충이라는 정당한 목적에서 비롯된 것으로 수단과의 합리적 비례관계가 인정되므로, 이 사건 처분이 응능부담원칙에 위배된다고 보기 어렵다."
238525,판례내용,72,다)소결론
238525,판례내용,73,"따라서 이 사건 조항에 따른 외국납부세액의 공제가 인정되지 않는다고 본 피고의 판단은 정당하고, 이를 다투는 원고의 주위적 주장은 이유 없다."
238525,판례내용,74,2)간접외국납부세액에 대한 추가 손금산입이 인정되는지 여부
238525,판례내용,75,가)관련 규정의 내용
238525,판례내용,76,"내국법인은 전 세계소득에 관하여 납세의무를 부담하는바, 내국법인의 국외원천소득에 대하여는 원천지국과 우리나라에 각 세금을 납부하여야 하므로 이중과세의 문제가 발생할 수 있다.이를 시정하기 위하여 구 법인세법 제57조 제1항은 내국법인의 국외원천소득에 부과된 직접 외국납부세액에 대하여 국외원천소득을 과세표준에 산입한 후 해당 사업연도의 법인세액에서 외국법인세액을 공제하거나(제1호), 외국법인세액을 해당 사업연도의 손금에 산입하여 과세표준을 산출하는 방법(제2호)으로 공제를 허용하고 있다.즉, 구 법인세법은 법인납세자로 하여금 외국납부세액이 사실상 과세표준에 포함됨을 전제로 하는 외국세액공제방법과 이를 포함하지 않는 외국세액손금산입방법 중 자신에게 유리한 하나의 방법을 선택하도록 규정하였다."
238525,판례내용,77,"이와 더불어 구 법인세법 제57조 제3항은 내국법인이 국외원천소득에 대하여 감면받은 간주외국납부세액에 대하여도 위와 같은 방법으로 공제를 허용하고 있고, 구 법인세법 제57조 제4항은 내국법인이 외국자회사를 통하여 투자한 후 받은 수입배당금액에 대응하여 납부된 간접 외국납부세액에 대하여도 위와 같은 방법으로 공제를 허용하고 있다.이처럼 외국법인세액을 법인세액에서 공제할 수 있도록 하는 구 법인세법 제57조 제1항, 제3항, 제4항은 동일한 소득에 대한 국가 간의 중복과세를 방지하여 내국법인의 조세부담을 감경하려는 데에 그 취지가 있다(대법원 1987.2.24."
238525,판례내용,78,선고 85누651 판결 등 참조).
238525,판례내용,79,"법인세 과세표준의 기준이 되는 내국법인의 각 사업연도 소득은 그 사업연도에 속하는 익금의 총액에서 그 사업연도에 속하는 손금의 총액을 공제한 금액이다(구 법인세법 제13조, 제14조)."
238525,판례내용,80,"익금은 자본 또는 출자의 납입 및 구 법인세법에서 규정하고 있는 것을 제외하고 해당 법인의 순자산을 증가시키는 거래로 인하여 발생하는 수익의 금액이고(제15조 제1항), 손금은 자본 또는 출자의 환급, 잉여금의 처분 및 구 법인세법에서 규정한 것은 제외하고 해당 법인의 순자산을 감소시키는 거래로 인하여 발생하는 손비의 금액이다(제19조 제1항)."
238525,판례내용,81,"그런데 내국법인이 구 법인세법 제57조에 따라 세액공제를 적용하는 경우 직접·간주외국납부세액은 손금에 산입되지 않고(제21조 제1호, 제57조 제1항 제1호, 제3항), 다만 내국법인이 세액공제방법을 선택한 경우 직접·간주 외국납부세액은 국외원천소득이 해당 사업연도의 과세표준에서 차지하는 비율을 곱하여 산출한 금액을 한도로 해당 사업연도의 법인세액에서 공제되며(제57조 제1항 제1호, 제3항), 손금산입방법을 선택한 경우 직접·간주외국납부세액은 손금으로 산입되어 과세표준에서 제외된다(제57조 제1항 제2호, 제3항)."
238525,판례내용,82,"그리고 간접외국납부세액은 그것이 내국법인의 순자산을 증가시키는 거래로 인하여 발생하는 이익이나 수입이 아니므로 그 성질상 익금에 산입되지 않아야 하나, 세액공제방법을 선택한 경우에는 간접 외국납부세액을 익금에 산입한 다음, 산출된 법인세액에서 공제된다(제15조 제2항 제2호, 제57조 제4항, 제1항 제1호)."
238525,판례내용,83,나)구체적인 판단
238525,판례내용,84,"관계 법령 등의 문언 내용과 취지를 비롯하여 앞서 든 증거들과 변론 전체의 취지를 종합하여 인정되는 아래와 같은 사정에 비추어 보면, 법인지방소득세 과세표준 산정 시 간접외국납부세액에 관하여 익금산입 취소 외에 추가로 손금산입이 인정되어야 한다고 볼 수 없다."
238525,판례내용,85,① 법인지방소득세에 관한 간접외국납부세액의 손금산입 규정의 존재 여부
238525,판례내용,86,"법인세 부담세액을 산정함에 있어 외국납부세액에 관한 세액공제방법을 채택한 납세자로서는 세액공제방법을 채택하고 있지 않은 법인지방소득세 과세표준을 산정함에 있어, 직접·간주외국납부세액은 손금으로 산입할 수 있고, 간접외국납부세액은 익금산입을 취소하여 이를 과세표준에서 제외하여야 함은 대법원 판결에 따른 관련 법리로 확립된 것으로 보이고, 이 사건에서도 당사자 사이에 다툼이 없다."
238525,판례내용,87,"그런데 구 법인세법 제57조 제1항(‘내국법인의 각 사업연도의 과세표준에 국외원천소득이 포함되어 있는 경우 제21조 제1호에도 불구하고 일정한 공제한도 내에서 외국법인세액을 법인세액에서 공제하거나 또는 손금에 산입하는 방법을 선택하여 적용받을 수 있다’는 취지), 제4항(‘간접외국납부세액은 제1항에 따른 세액공제 또는 손금산입되는 외국법인세액으로 본다’라는 취지)은 외국납부세액 공제가 인정되는 법인세에 관한 공제 규정에 해당할 뿐이다."
238525,판례내용,88,"이처럼 구 법인세법 제15조 제2항 제2호에 따른 간접외국납부세액의 익금산입 의제는 외국납부세액 공제를 위한 것에 불과하므로, 법인지방소득세에서 외국납부세액 공제가 인정되지 않는 이상, 성질상 익금에 해당하지 않는 간접외국납부세액의 익금산입 취소가 이루어져야 함은 당연하다.구 법인세법 제21조 제1호, 같은 법 시행령 제19조 제10호가 외국납부세액의 손금산입을 인정하는 것도 납세자가 법인세 세액공제방법 대신에 손금산입방법을 선택하였음을 전제한 것에 불과하다.여기서 더 나아가 법인지방소득세에 대하여도 위 규정들이 유추적용될 수 있다거나 완전한 이중과세 해소를 위한다는 명목하에 간접외국납부세액이 법인지방소득세의 과세표준에서 언제나 차감될 수 있다고 볼 수는 없고, 달리 이를 인정하는 명문의 규정을 찾아보기 어렵다(간접외국납부세액은 회계상 비용처리가 가능한 직접외국납부세액과 달리 외국법인세액이 차감된 후의 금원이 들어오는 것이므로, 내국법인의 관점에서는 회계상 비용으로 처리할 금액이 없어 구 법인세법 제21조에 따라 손금불산입될 금액이 존재한다고 보기 어려운 측면도 있으므로, 간주익금의 산입을 취소하는 외에 추가로 손금산입할 합리적인 근거가 부족하다)."
238525,판례내용,89,② 이중과세금지원칙 위반 여부
238525,판례내용,90,"법인세 세액 산정 시 외국납부세액에 관한 세액공제방법을 선택한 납세자의 경우 법인지방소득세 과세표준 산정 시 익금산입 취소 외에 간접외국납부세액의 추가적인 손금산입이 인정되지 않는다면, 이중과세의 문제를 야기하는 측면이 있음을 부인하기 어렵다."
238525,판례내용,91,"그러나 납세자가 일반적으로 유리한 세액공제방법을 스스로 선택하였을 뿐만 아니라, 법인지방소득세 외에 법인세를 포함하는 전체적인 세부담을 고려하면, 법인세 산정 시 외국납부세액의 세액공제방법을 선택한 납세자가 손금산입방법을 선택한 납세자보다 언제나 불리한 위치에 선다고 단정할 수 없다.세액공제방법을 선택한 납세자가 사후에 경정청구를 통하여 공제 한도가 없는 손금산입방법으로 변경할 수는 있으나, 원고가 밝히고 있듯이 위와 같은 경정청구로 세부담이 훨씬 증가하여 수정신고에 따른 추가납부가 수반된다는 점에서 합리적이지 못하다.아울러 개정 지방세법과 지방세특례제한법은 개인지방소득세 세액공제에 관한 규정을 두고 있으나, 소득세법은 법인세법과 달리 개인의 간접외국납부세액 공제에 관한 규정을 두고 있지 않아 외국법인의 개인주주는 간접외국납부세액공제를 받을 수 없다.또한 내국법인으로부터의 배당소득 이중과세 문제를 시정하기 위한 법인의 수입배당금 익금불산입 제도(지분율에 따른 익금불산입률의 차등 적용 등), 개인의 배당세액 공제제도(종합과세 기준금액에 미치지 못하는 경우에는 배당세액공제를 인정하지 않고, 계산식에서 법인세율을 10%로 의제하며 분리과세 시 부담세액을 상회할 경우 초과액의 환급을 배제함)등은 불완전한 경제적 이중과세 조정방법에 해당할 뿐이다[현행 법인세법은 2021.1.1."
238525,판례내용,92,"이후 개시하는 사업연도분부터 외국납부세액의 손금산입방법을 폐지하여 세액공제방법의 선택 여부만 가능하도록 개정되었으나, 만일 납세자가 공제한도나 해외사업 적자 등을 이유로 세액공제방법을 선택하지 않을 경우 외국납부세액의 손금산입을 할 수 있도록 되었다(법인세법 시행령 제19조 제10호)."
238525,판례내용,93,"나아가, 외국납부세액의 이월공제기간을 5년에서 10년으로 확대하고 외국법인세액이 이월공제기간 내에 공제받지 못한 경우 그 미공제액은 이월공제기간 종료일 다음 날이 속하는 사업연도의 소득금액 산정 시 손금에 산입할 수 있도록 개정하였다.한편 개인의 경우 사업소득 외 종합소득과 퇴직소득에 대한 외국납부세액은 한도 초과액의 이월이 가능하긴 하지만 공제한도가 설정된 세액공제방법에 의한 조정만이 허용되고 있다]."
238525,판례내용,94,"이처럼 이중과세 해소를 위한 과세체계는 조세정책상 가변적인 것임을 알 수 있는바, 이중과세의 조정장치가 입법자의 합리적인 재량의 범위 내에서 이루어진 것으로서 현저히 불합리한 조치라고 볼 수 없다면, 설령 완전한 조정조항을 두지 아니하여 일부 미흡한 점이 존재한다고 할지라도, 자의적인 입법조치로서 그에 관한 과세처분이 이중과세금지원칙 위반으로 위법하게 된다고 볼 것은 아니다.법인에 대한 경제적 이중과세의 조정방법으로 세액공제방법을 채택한 국가들은 일반적으로 간접외국납부세액공제 제도를 적용하게 되는바, 조세정책상의 이유로 법인지방소득세의 세액공제방법이 입법화되지 않은 국내 과세체계상, 위와 같은 부득이한 결과가 현저히 불합리한 조치에 해당한다고 평가할 것은 아니다.따라서 이 사건 처분이 이중과세금지원칙에 위반되는 자의적 처분에 해당한다고 볼 수 없다."
238525,판례내용,95,③ 이중과세의 문제가 완벽한 수준으로 해소되어야 하는지 여부
238525,판례내용,96,"담세능력에 따른 과세의 원칙이나 조세공평의 원칙이라 하여 예외 없이 절대적으로 관철되어야 한다고 할 수 없고, 합리적 이유가 있는 경우라면 납세자간의 차별취급도 예외적으로 허용된다.세법의 내용을 어떻게 정할 것인가에 관하여 입법자에게는 광범위한 형성의 자유가 인정되며, 더욱이 오늘날 조세입법자는 조세의 부과를 통하여 재정수입의 확보라는 목적 이외에도 국민경제적, 재정정책적, 사회정책적 목적달성을 위하여 여러 가지 관점을 고려할 수 있기 때문이다(헌법재판소 1999.11.25."
238525,판례내용,97,선고 98헌마55 결정 등 참조).
238525,판례내용,98,"원고의 예비적 주장의 논리는 납세자에게 불리한 이중과세의 문제가 언제나 완전히 해소되어야 함을 전제하는 것이다.그러나 국제적 이중과세 해소의 요건과 범위의 문제는 과세주권 내에서 조세정책적 사정을 고려한 입법자의 합리적 의사에 따라 정해질 유동적·가변적인 사항으로서 항시 완전한 조정방법이 논리필연적으로 도출될 수 있는 당위성이나 필연성의 문제라고 보기 어렵다.국제적 이중과세의 조정방법으로 대부분의 국가들은 비용공제법, 소득면제법, 세액공제법의 세 가지 방법을 적절히 활용하고 있는데, 각 나라별로 조세정책상의 이유로 각각의 요건과 대상 등에 일정한 제한을 부가하고 있어 누구에게나 공평하고도 완전한 이중과세의 효과를 가져오는 경우는 거의 없다.간접외국납부세액공제 조항을 두고 있는 여러 조세조약의 경우에도 지분 소유기간이나 지분 보유비율 등의 제한을 두고 있기도 하다.더구나 내국법인과 외국자회사는 독립된 기업에 해당하므로, 엄밀한 의미에서 국제적 이중과세로 보기 어렵고, 경제적 관점에서 동일 소득에 대한 경제적 이중과세의 문제에 해당할 뿐이다(이러한 특성은 직접외국납부세액 및 간주외국납부세액과 뚜렷한 차이에 해당한다)."
238525,판례내용,99,"OECD 모델 조세조약(2017.11.) 제23A조 및 제23B조에 관한 주석 서문은 국제적인 법적 이중과세의 문제와 구별되는 경제적 이중과세(economic double taxation)의 문제는 양자협상에 따라 처리하도록 명시하고 있을 뿐이다.UN 모델 조세조약 제23A조 및 제23B조에 관한 주석 역시 위 규정을 그대로 원용하고 있다.같은 맥락에서 위 조약 제23A조(소득공제법)및 제23B조(세액공제법)는 ‘소득의 수취인이 일방 체약국의 거주자라는 이유만으로 과세가 이루어졌다면 체약 상대국으로서는 이중과세 해소 의무를 부담하지 않는다’는 취지로 규정하고 있어 이 사건에 참조할 만하다.결국, 일반적으로 조세조약의 이중과세 조항은 국제적으로 발생하는 법률적 이중과세를 전제하고, 이는 동일 기간에 동일인의 동일 소득에 대하여 원천지국과 거주지국의 과세권이 중복되거나 경합되는 상태를 의미하므로, 엄밀한 의미에서 이 사건은 국제적 이중과세의 문제로 평가하기 어려운 측면이 있다.따라서 원고의 위 주장은 그대로 받아들이기 어렵다."
238525,판례내용,100,④ 현행 지방세법의 규정을 통한 입법자의 의사
238525,판례내용,101,"현행 지방세법 제103조의19 제1항은 ‘내국법인의 각 사업연도의 소득에 대한 법인지방소득세의 과세표준은 법인세법 제13조에 따라 계산한 법인세의 과세표준(조세특례제한법 및 다른 법률에 따라 과세표준 산정과 관련된 조세감면 또는 중과세 등의 조세특례가 적용되는 경우에는 이에 따라 계산한 법인세의 과세표준)과 동일한 금액으로 한다’고 규정하면서 제2항 전문에서 ‘제1항에도 불구하고 내국법인의 각 사업연도의 소득에 대한 법인세 과세표준에 국외원천소득이 포함되어 있는 경우로서 법인세법 제57조에 따라 외국 납부 세액공제를 하는 경우에는 같은 조 제1항에 따른 외국법인세액을 이 조 제1항에 따른 금액에서 차감한 금액을 법인지방소득세 과세표준으로 한다’고 규정하고 있다.즉, 법인지방소득세 과세표준은 법인세 과세표준과 동일한 금액으로 하되, 외국납부세액 공제가 인정되지 않는 특수한 과세체계를 고려하여 내국법인의 과세표준에 국외원천소득이 포함되어 있는 경우로서 법인세법에 따라 외국납부세액 공제를 하는 경우에는 법인지방소득세 과세표준에서 해당 외국납부세액을 차감하는 것으로 규정하고 있을 뿐이다.달리 간접외국납부세액의 경우 익금산입 취소에서 더 나아가 손금산입을 추가로 인정하고 있지 않음은 문언상 명백하다.지방세법 부칙(2020.12.29."
238525,판례내용,102,"제17769호) 제13조 역시 같은 취지로 법인지방소득세 과세표준에서 외국법인세액을 한 번씩만 차감하여 해당 사업연도의 법인지방소득세액을 계산할 것을 전제하고 있다.이와 같은 개정 이유에 관하여 행정안전부는 ‘구 지방세법 제103조의19의 규정이 법인세와 다른 과세표준을 둘 수 있는 것처럼 오해와 혼란을 초래하므로 법인세의 과세표준과 법인지방소득세의 과세표준이 동일함을 법령상 명확히 규정하여 불확실성을 해소하기 위하여 개정이 이루어졌다’고 설명하고 있다(지방세법 제103조의 19 규정을 개정하여 2019년 귀속분부터 법인지방소득세 과세표준은 법인세 과세표준과 동일한 금액임을 명확히 하였으나, 판례의 취지를 수용하는 차원에서 2020.12.29."
238525,판례내용,103,지방세법을 다시 개정하여 이에 관하여 소급적용하는 부칙 규정을 두게 되었다).
238525,판례내용,104,"따라서 위와 같은 규정들은 실무상 다툼이 있는 부분에 대하여 입법자의 의사를 확인적 차원에서 좀 더 구체적으로 명확하게 규정하게 된 것일 뿐, 반성적 고려에서 마련된 창설적 규정으로 이해하기 어렵다.만일 법인세 산정 시 납세자가 외국납부세액의 세액공제방법을 선택한 경우, 지방세특례제한법에서 법인지방소득세 과세표준 산정 시 외국납부세액의 세액공제방법을 규정하지 않았다고 하여 2014년 지방세법 개정 이래 현재에 이르기까지 입법자가 지방세법에서 법인지방소득세 과세표준에서 직접·간주외국납부세액의 손금산입을 허용함과 아울러 간접외국납부세액의 익금산입 취소 외에 추가로 그 손금산입을 허용하는 결과를 용인할 의사를 가졌다고 보기는 어렵다.또한 개정 지방세법이 종래 법인세의 부가세인 지방소득세로 부과되던 세금을 독립세인 법인지방소득세로 전환함으로써 지방세법만의 독자적인 과세체계를 확립할 목적이었다고 하여 달리 볼 수도 없다."
238525,판례내용,105,다)소결론
238525,판례내용,106,"따라서 간접외국납부세액에 관하여 추가로 손금산입이 인정되지 않는다고 본 피고의 판단은 정당하고, 이를 다투는 원고의 예비적 주장도 이유 없다."
238525,판례내용,107,"3)결국, 이 사건 처분에 이른 피고의 사실 인정과 법적 판단에 중대한 오류가 있다고 인정할 만한 객관적 사유를 찾아볼 수 없으므로, 이 사건 처분은 적법하다."
238525,판례내용,108,3.결론
238525,판례내용,109,"그렇다면 원고의 청구는 이유 없으므로, 이를 기각하기로 하여, 주문과 같이 판결한다."
238525,판례내용,110,[별지 생략]
238525,판례내용,111,판사 정○(재판장)김○ 지○
