판례일련번호,구분,문장번호,내용
348498,판례내용,1,수원고등법원
348498,판례내용,2,제 1 행정부
348498,판례내용,3,판결
348498,판례내용,4,사건 2022누14311 학교폭력조치없음처분변경청구
348498,판례내용,5,"원고, 항소인 A"
348498,판례내용,6,"피고, 피항소인 경기도군포의왕교육지원청 교육장"
348498,판례내용,7,소송대리인 법무법인 진○ 담당변호사 김○
348498,판례내용,8,제1심판결 수원지방법원 2022.9.21.
348498,판례내용,9,선고 2021구합1504 판결
348498,판례내용,10,변론 종결 2023.8.11.
348498,판례내용,11,판결 선고 2023.9.8.
348498,판례내용,12,주문
348498,판례내용,13,1.원고의 항소를 기각한다.
348498,판례내용,14,2.항소비용은 원고가 부담한다.
348498,판례내용,15,청구취지 및 항소취지
348498,판례내용,16,제1심판결을 취소한다.
348498,판례내용,17,피고가 2021.8.30.
348498,판례내용,18,"B, C에게 한 각 조치 없음 처분을 취소한다."
348498,판례내용,19,이유
348498,판례내용,20,1.제1심판결 인용
348498,판례내용,21,"이 법원의 판결이유는 원고가 새롭게 제기하는 주장에 대하여 아래 제2항에서 추가로 판단하는 외에는 제1심판결 이유와 같으므로 행정소송법 제8조 제2항, 민사소송법 제420조 본문에 따라 이를 인용한다."
348498,판례내용,22,2.추가 판단
348498,판례내용,23,가.원고 주장의 요지
348498,판례내용,24,1)절차적 하자
348498,판례내용,25,다음과 같은 이유에서 이 사건 처분은 절차적으로 위법하다.
348498,판례내용,26,"가)이 사건 학교 측은 2021.6.16.경 B, C의 학교폭력 사실을 인지하였음에도 이 에 대한 적절한 조치를 취하지 않았고, 그 후에도 B, C과 D 사이의 충분한 분리조치가 이루어지지 않았다."
348498,판례내용,27,이 사건 학교 측은 위원회가 개최되기 전 원고 측을 모욕하고 사건 무마를 강요하였다.
348498,판례내용,28,"나)위원회는 제출된 경위가 불분명한 자료를 토대로 심의를 하였고, 심의 과정에서 2021.6.7."
348498,판례내용,29,대화 등 원고가 학교폭력이라고 주장한 사실들 중 일부가 누락되어 판단되지 않았다.
348498,판례내용,30,2)실제적 하자
348498,판례내용,31,"B, C은 2021.6.7."
348498,판례내용,32,"단체 채팅방에 D을 초대하여 D에 관한 허위사실을 유포하였고, 이러한 행위는 학교폭력 중 ‘사이버 따돌림’에 해당한다."
348498,판례내용,33,"B, C의 행위를 학교폭력이 아닌 것으로 판단한 이 사건 처분은 실체적으로 위법하다."
348498,판례내용,34,나.절차적 하자 여부에 관한 판단
348498,판례내용,35,"제1심판결이 인정한 사실 및 사정에다가 갑 제11, 16호증, 을 제1 내지 10호증(가지번호 포함)의 각 기재와 변론 전체의 취지에 의하여 인정할 수 있는 다음과 같은 사실 및 사정을 종합하여 보면, 원고가 주장하는 여러 사정을 모두 고려하더라도 이 사건 처분이 절차적으로 위법하다고 할 수 없다."
348498,판례내용,36,원고의 이 부분 주장은 받아들일 수 없다.
348498,판례내용,37,"① 학교폭력예방법 제14조 제6항은 ‘학교의 장은 학교폭력 사태를 인지한 경우 지체 없이 전담기구 또는 소속 교원으로 하여금 가해 및 피해 사실 여부를 확인하도록 하고, 전담기구로 하여금 학교 장의 자체해결 부의 여부를 심의하도록 한다’라고 정하고, 제13조의2는 ‘피해학생 및 그 보호자가 심의위원회 개최를 원하지 아니하는 경미한 학교폭력의 경우(2주 이상의 신체적ㆍ정신적 치료가 필요한 진단서를 발급받지 않은 경우, 재산상 피해가 없거나 즉각 복구된 경우, 학교폭력이 지속적이지 않은 경우, 학교폭력에 대한 신고, 진술, 자료제공 등에 대한 보복행위가 아닌 경우에 모두 해당하여야 한다)학교의 장은 학교폭력사건을 자체적으로 해결할 수 있다’라고 정한다."
348498,판례내용,38,"이 사건 학교폭력 사안 최초 신고일을 원고가 주장하는 2021.6.16.로 보더라도, 당시 코로나19 상황과 그로 인한 원격수업 일정 등을 고려하면, B, C, D과의 면담, 각 학생 학부모와의 전화를 통한 의사 확인 등을 하다가 1학년 출석수업이 시작된 2021.7.7."
348498,판례내용,39,"면담을 통해 가해 및 피해 사실 여부를 확인하고, 경미한 학교폭력에 해당하지 않는다고 볼 사유가 없는 이 사건에서 학교 장의 자체해결 절차 진행을 위한 D 및 원고의 심의위원회 개최 요구 의사를 확인하는 과정에서 학교폭력 사안 접수, 위원회 보고가 지연되었더라도 이를 부당하다고 볼 수 없다."
348498,판례내용,40,② 학교폭력예방법 제16조 제1항 단서는 ‘학교의 장은 학교폭력사건을 인지한 경우 피해학생의 반대의사 등 대통령령으로 정하는 특별한 사정이 없으면 지체 없이 가해자와 피해학생을 분리하여야 한다’라고 정한다.
348498,판례내용,41,위와 같은 가해자와 피해학생 즉시분리 제도는 2020.12.22.
348498,판례내용,42,"법률 제17668호로 학교폭력예방법이 일부 개정되면서 도입되었고, 부칙 제1, 3조에 따라 2021.6.23."
348498,판례내용,43,시행 후 학교의 장이 학교폭력사건을 인지한 경우부터 적용된다.
348498,판례내용,44,"원고가 주장하는 최초 학교폭력 신고일은 2021.6.16.로 당시 가해자와 피해학생 즉시분리 제도 시행 전이어서 이 사건 학교 측에 B, C과 D을 분리하여야 할 법적 의무가 있었다고 볼 수 없다."
348498,판례내용,45,한편 D이 2021.7.9.
348498,판례내용,46,"B, C에 대한 분리조치를 반대하는 의사를 표시하여(원고 역시 2021.7.20."
348498,판례내용,47,이 사건 학교 교감 등에게 분리조치를 반대하는 의사를 직접 전달하였다)분리조치 예외사유에 해당한다.
348498,판례내용,48,이러한 원고 측의 의사표시가 진정한 의사에 반하는 것이라고 볼 아무런 자료가 없다.
348498,판례내용,49,"③ 이 사건 학교의 교감, 담당교사 등은 처음에는 B, C과 D의 행위를 학교폭력 사안이 아닌 학생들 사이의 단순한 갈등 양상으로 판단하였다."
348498,판례내용,50,"특히 담당교사는 위원회가 개최될 경우 관련 학생들이 입게 될 물리적, 정신적 피해 등을 염려하였던 것으로 보인다."
348498,판례내용,51,"러한 사정과 뒤에서 볼 여러 사정을 더하여 보면, 그러한 판단이 불합리하다거나 부당하다고 보이지 않는다."
348498,판례내용,52,"이 사건 학교와 피고 측이 원고와 D에게 B, C과의 화해 및 관계회복을 여러 차례 권유하였고, 이는 원고가 그러한 의사가 없음을 표시하였음에도 계속되었다.하지만 그러한 사정만으로 이 사건 학교와 피고 측이 이 사건을 부당하게 축소․무마하려고 하였다고 보이지 않고, 달리 이를 알 수 있는 자료가 없다."
348498,판례내용,53,원고의 주장과 같이 이 사건 학교와 피고 측이 그 과정에서 원고에게 모욕적인 언행을 하였다고 하더라도 이 사건 학교폭력 사안과 무관한 것이어서 이 사건 처분과 관련한 절차적 위법으로 볼 수 없다.
348498,판례내용,54,④ 이 사건 학교의 학교폭력 담당교사는 2021.7.9.
348498,판례내용,55,"D의 종국적인 신고의사를 확인하였고, 결국 위원회가 개최되어 심의, 의결 및 이 사건 처분이 이루어졌다."
348498,판례내용,56,"설령 학교폭력 신고 절차가 지연되었거나 그동안 적절한 조치가 취해지지 않았다고 하더라도, 그로 인하여 원고 측의 권리가 침해되었다거나 B, C에 대한 조사 절차 등이 부실해졌다고 보기 어려우며, 나아가 이 사건 처분의 기초가 된 위원회의 심의, 의결은 독립적으로 이루어지는 것이어서 이 사건 학교가 한 조치 등의 잘못이 위원회의 심의, 의결에 영향을 미친다고 볼 수 없다."
348498,판례내용,57,"⑤ 이 사건 처분 과정에서 원고와 D은 자료 제출 및 의견 진술 기회가 충분히 보장되었고, 위원회는 2021.6.7."
348498,판례내용,58,"대화도 학교폭력에 해당한다는 주장을 포함하여 원고의 주장 모두를 반영하여 심의하고, 의결한 것으로 보인다."
348498,판례내용,59,그렇다면 이 사건 학교가 작성한 보고서에 기재되지 않은 2021.6.7.
348498,판례내용,60,"대화에 관한 부분도 위원회가 심의한 것이고, 다만 최종 의결 내용 중 그에 관한 사실 판단이 언급되지 않았다고 하더라도 이를 이 사건 처분을 취소할 정도의 하자라고 볼 수 없다."
348498,판례내용,61,다.실체적 하자 여부에 관한 판단
348498,판례내용,62,"1)학교폭력예방법은 학교폭력의 예방과 대책에 필요한 사항을 규정함으로써 피해 학생의 보호, 가해학생의 선도․교육 및 피해학생과 가해학생 간의 분쟁조정을 통하여 학생의 인권을 보호하고 학생을 건전한 사회구성원으로 육성함을 목적으로 하면서(제1조), 학교폭력을 ‘학교 내외에서 학생을 대상으로 발생한 상해, 폭행, 감금, 협박, 약취․유인, 명예훼손․모욕, 공갈, 강요․강제적인 심부름 및 성폭력, 따돌림, 사이버 따돌림, 정보통신망을 이용한 음란․폭력 정보 등에 의하여 신체․정신 또는 재산상의 피해를 수반하는 행위’로 정의하고 있다(제2조 제1호)."
348498,판례내용,63,"여기서 사이버 따돌림이란 ‘인터넷, 휴대전화 등 정보통신기기를 이용하여 학생들이 특정 학생들을 대상으로 지속적, 반복적으로 심리적 공격을 가하거나, 특정 학생과 관련된 개인정보 또는 허위사실을 유포하여 상대방이 고통을 느끼도록 하는 모든 행위’를 말한다(제2조 제1호의3)."
348498,판례내용,64,"한편 학교폭력예방법 각 규정들의 내용, 형식 및 취지 등에 비추어 보면, 교육전문가로 구성된 심의위원회가 학교폭력으로 신고된 사안에 대하여 교육목적과 내부질서 유지를 위하여 한 판단은 가능한 존중되어야 한다."
348498,판례내용,65,"2)제1심판결이 인정한 사실 및 사정에다가 앞서 든 증거, 갑 제13, 14, 19호증의 각 기재와 변론 전체의 취지에 의하여 인정할 수 있는 다음과 같은 사실 및 사정을 종합하여 보면, 원고가 주장하는 여러 사정을 모두 고려하더라도 이 사건 처분에 실체적 위법이 있다고 볼 수 없다."
348498,판례내용,66,"① 위원회 심의 과정에서 C은 B로부터 ‘D이 자신에 대해 일진이라는 취지의 언급을 하였다’라는 말을 들었다고 진술하였고, B도 D으로부터 ‘C이 일진이다’라는 취지의 말을 들었다고 진술하였다."
348498,판례내용,67,반면 D은 B에게 위와 같은 언급을 하지 않았다고 진술하였다.
348498,판례내용,68,"한편 B는 D과 갈등을 빚게 된 이유로 ‘D이 C에 대해 뒷담화를 하였고 그런 말을 들어주는 것이 힘들었다’고 진술하였고, 이에 대해 D은 ‘자신이 생각하기에는 자신이 한 말이 뒷담화가 아닌 것 같았지만 B에게 사과를 하였다’는 취지로 진술하였다."
348498,판례내용,69,"D은 과거 친구에게 C과 C의 남자친구를 언급한 사실이 있고, B는 2021.4.29.경 D이 포함된 단체 채팅방에서 C과 C의 남자친구에 대하여 부정적인 내용의 메시지를 올렸으며, D 역시 이에 동조하는 반응을 하였다."
348498,판례내용,70,C은 2021.6.7.
348498,판례내용,71,단체 채팅방에 D을 초대하여 ‘D이 다른 친구들에게 자신에 대해서 부정적으로 이야기한 것을 들었다’며 그러한 사실이 있는지 물었다.
348498,판례내용,72,C은 친구들로부터 자신이 일진이라는 소문이 퍼지고 있다는 말을 들었다고 진술하였다.
348498,판례내용,73,"위와 같은 B가 C에게 D의 말을 전하게 된 과정과 당시 상황 등에 비추어 보면, D이 C에 대해 어떠한 표현으로든 부정적인 언급을 하였다고 보는 것이 타당하다."
348498,판례내용,74,"그렇다면 B가 D의 말을 전하는 과정에서 ‘일진’이라는 단어를 임의로 추가하였다고 하더라도, B가 D에 관한 허위사실을 유포하였다고 단정할 수 없고, 원고가 주장하는 다른 표현 역시 마찬가지이다(원고는 B, C 측이 자신과 관련한 허위사실도 유포하였다고 주장하나, 원고에 관한 허위사실 유포는 이 사건 학교폭력 사안과 무관하다)."
348498,판례내용,75,"② B, C은 2021.6.7."
348498,판례내용,76,단체 채팅방에 D의 동의를 받지 않은 채 D을 초대하였다.
348498,판례내용,77,"하지만 B, C이 D을 초대한 이유는 D의 어머니인 원고가 자신들 사이에서 발생한 갈등 양상에 개입한 상황에서, 각자 보호자의 도움 없이 자신들만의 대화로 갈등 문제를 해결해보려고 하였기 때문으로 보인다."
348498,판례내용,78,"B, C이 대화 중 일부 비속어를 사용하였지만 그러한 표현들이 일반적인 학생들이 사용하는 범위를 넘어선 욕설이나 폭언이라고 보이진 않고, 대화에서 D을 따돌리겠다는 의도가 있었다고 보이지도 않는다."
348498,판례내용,79,"D은 단체 채팅방에서 B, C의 대화 말미에 간단한 대응만을 하였고 이후에는 그들 사이에 대화가 계속되지 않아, D이 단체 채팅방 개설로 학습권을 침해받았다거나 B, C의 행위에 지속성, 반복성이 있다고 보기 어렵다."
348498,판례내용,80,"대화 중 원고는 B와 전화 통화를 하였는데, 성인인 원고와 미성년자인 B와의 관계, 통화 전후의 사정 및 통화 내용을 고려하면, D이 당시 B, C으로부터 일방적으로 심리적 공격을 당했다고 보기도 어렵다."
348498,판례내용,81,"B, C 측이 단체 채팅방 개설 경위에 대해 사실과 일부 다르게 진술하였다고 하더라도 달리 볼 수 없다."
348498,판례내용,82,"③ D이 B, C의 행위로 인해 심리적으로 공격받고 정신적 고통을 받았다고 느꼈더라도, 그러한 주관적 사정만으로 B, C의 행위가 학교폭력예방법이 정한 ‘사이버 따돌림’에 해당한다고 단정할 수 없다."
348498,판례내용,83,"④ 교육전문가인 위원회 위원들은 원고와 B, C 측이 제출한 자료, 진술한 의견 등을 충분히 심의하여 의결하였고, 피고는 그 의결에 따라 이 사건 처분을 하였다."
348498,판례내용,84,원고가 제출한 자료들만으로는 그 과정에서 위원회와 피고가 편파적인 입장을 취하였다거나 권한을 남용하였다고 보기 어렵다.
348498,판례내용,85,3.결론
348498,판례내용,86,"그렇다면 제1심판결은 정당하고, 원고의 항소는 이유 없어 기각한다."
348498,판례내용,87,재판장 판사 노○
348498,판례내용,88,판사 박○
348498,판례내용,89,판사 정○
