판례일련번호,구분,문장번호,내용
346297,판례내용,1,서 울 행 정 법 원
346297,판례내용,2,제 5
346297,판례내용,3,부
346297,판례내용,4,판 결
346297,판례내용,5,사 건
346297,판례내용,6,2022구합64556 옥외집회금지통고처분취소
346297,판례내용,7,원 고
346297,판례내용,8,A단체
346297,판례내용,9,"소송대리인 변호사 박○, 조○"
346297,판례내용,10,피 고
346297,판례내용,11,서울용산경찰서장
346297,판례내용,12,소송대리인 정부법무공단 담당변호사 문○
346297,판례내용,13,변 론 종 결
346297,판례내용,14,2023.3.9.
346297,판례내용,15,판 결 선 고
346297,판례내용,16,2023.3.30.
346297,판례내용,17,주 문
346297,판례내용,18,1.피고가 2022.4.20.
346297,판례내용,19,원고에게 한 옥외집회금지 통고처분을 취소한다.
346297,판례내용,20,2.소송비용은 피고가 부담한다.
346297,판례내용,21,청 구 취 지
346297,판례내용,22,주문과 같다.
346297,판례내용,23,이 유
346297,판례내용,24,YTXX
346297,판례내용,25,○ 집회명칭
346297,판례내용,26,: B
346297,판례내용,27,○ 개최일시
346297,판례내용,28,: 2022.5.14.
346297,판례내용,29,14:00 ~ 19:00
346297,판례내용,30,○ 개최장소
346297,판례내용,31,": 1)집회 : 용산역 광장, 녹사평역 앞 이태원 광장"
346297,판례내용,32,2)행진 : 용산역 광장 => C건물 => 삼각지역 => 녹사평역 => 이태원광장
346297,판례내용,33,○ 예상인원
346297,판례내용,34,: 500명
346297,판례내용,35,1.처분의 경위
346297,판례내용,36,가.원고는 2022.4.19.
346297,판례내용,37,피고에게 아래와 같은 내용의 옥외집회 및 행진을 신고하였
346297,판례내용,38,다.
346297,판례내용,39,나.위 개최장소(이하 ‘이 사건 집회장소’라고 한다)의 100미터 이내에는 대통령 집무
346297,판례내용,40,실이 위치하여 있다.
346297,판례내용,41,다.피고는 2022.4.20.
346297,판례내용,42,원고에게 이 사건 집회장소 중 일부(이태원로 상 국방부 앞
346297,판례내용,43,구간)가 집회 및 시위에 관한 법률(이하 ‘집시법’이라고 한다)제11조 제3호에 규정한
346297,판례내용,44,‘대통령 관저’의 경계지점으로부터 100미터 이내의 장소로서 옥외집회가 금지되는 곳이
346297,판례내용,45,라는 이유를 들어 행진부분을 금지하는 통고처분(이하 ‘이 사건 처분’이라고 한다)을
346297,판례내용,46,하였다.
346297,판례내용,47,"[인정근거] 다툼 없는 사실, 갑 제1호증의 1 내지 제3호증, 을 제1, 2호증의 각 기재,"
346297,판례내용,48,변론 전체의 취지
346297,판례내용,49,2.이 사건 처분의 적법 여부
346297,판례내용,50,가.원고의 주장
346297,판례내용,51,대통령 집무실은 집시법 제11조 제3호의 ‘대통령 관저’에 포함되지 아니하므로 원
346297,판례내용,52,고가 신고한 집회를 금지하는 이 사건 처분은 위법하다.
346297,판례내용,53,나.관계법령
346297,판례내용,54,별지 기재와 같다.
346297,판례내용,55,다.판단
346297,판례내용,56,1)관련법리
346297,판례내용,57,"침익적 행정처분의 근거가 되는 행정법규는 엄격하게 해석ㆍ적용하여야 하고,"
346297,판례내용,58,행정처분의 상대방에게 불리한 방향으로 지나치게 확장해석하거나 유추해석하여서는
346297,판례내용,59,"안 되며, 그 입법 취지와 목적 등을 고려한 목적론적 해석이 전적으로 배제되는 것은"
346297,판례내용,60,아니라 하더라도 그 해석이 문언의 통상적인 의미를 벗어나서는 안 될 것이다(대법원
346297,판례내용,61,2008.2.28.
346297,판례내용,62,"선고 2007두13791, 13807 판결 등 참조)."
346297,판례내용,63,2)구체적 판단
346297,판례내용,64,"위 법리에 따라 살피건대, 앞서 든 증거에 변론 전체의 취지를 보태어 알 수 있"
346297,판례내용,65,"는 다음과 같은 사정들을 종합하면, 대통령 집무실은 집시법 제11조 제3호의 ‘대통령"
346297,판례내용,66,"관저’에 해당한다고 해석할 수 없으므로, 이 사건 집회장소는 집시법에서 집회를 금지"
346297,판례내용,67,한 장소에 해당하지 아니한다.
346297,판례내용,68,가)‘장관급 이상의 고위직 공무원들이 살도록 마련한 집’이라는 관저(官邸)의 사
346297,판례내용,69,"전적 정의에 비추어 볼 때, 집시법 제11조 제3호에서 말하는 ‘대통령 관저’란 대통령이"
346297,판례내용,70,일상생활을 영위하는 주거장소를 가리킨다고 보는 것이 문언의 통상적인 의미에 부합
346297,판례내용,71,하는 해석이다.
346297,판례내용,72,"특히 동아시아 한자문화권에서 기원을 찾을 수 있는 ‘관저’의 개념을 따져볼 때,"
346297,판례내용,73,"이는 오로지 사무집행만을 위하여 만들어진 하나의 독립된 청사가 아니라, 상당한 범"
346297,판례내용,74,위의 부지를 갖춘 소위 고관대작의 거주지로서 숙식 등 일상생활을 영위하는 주거건물
346297,판례내용,75,에 더하여 일정한 사무를 보거나 사람을 접견할 수 있는 부속건물 혹은 시설로 구성된
346297,판례내용,76,"일단의 특정 장소를 총체적으로 가리키는 단어라고 봄이 상당하므로, ‘관저’의 핵심은"
346297,판례내용,77,"일상 영위를 위한 주거 기능에 있고, 그 밖의 사무집행, 접견 수행 등의 기능은 어디까"
346297,판례내용,78,지나 부수적인 요소에 그친다고 할 것이다.따라서 주거 기능만이 가능한 관저는 존재
346297,판례내용,79,"할 수 있어도, 반면에 ‘직무 수행만 할 수 있고 일상생활을 영위할 수 없는 관저’라는"
346297,판례내용,80,개념은 처음부터 상정하기 어렵다.
346297,판례내용,81,국유재산법 제6조 제2항 제1호 및 같은 법 시행령 제4조 제2항 제1호도 ‘대통령 관
346297,판례내용,82,저’를 주거용 재산으로 분류하여 관저의 사전적 정의를 충실히 따르고 있다.
346297,판례내용,83,나)이와 달리 어떠한 법률용어가 사전적 정의를 벗어난 고유의 의미로 사용된
346297,판례내용,84,"것이라고 해석할 수 있으려면, 해당 용어가 사용된 법령의 구조와 체계에 그러한 이례"
346297,판례내용,85,적인 해석의 근거가 분명하게 드러나야 한다.
346297,판례내용,86,"그런데 오히려 ① 집시법 제11조는 대통령 외의 헌법기관인 국회의장, 대법원장,"
346297,판례내용,87,"헌법재판소장의 경우, 그들의 주거공간에 해당하는 ‘공관’을 어떠한 경우에도 집회를"
346297,판례내용,88,"불허하는 절대적인 집회금지장소로 규정하는 한편(제3호), 그들이 직무를 수행하는 공"
346297,판례내용,89,"간○ 국회의사당, 대법원, 헌법재판소는 그 기능이나 안녕을 침해할 우려가 없다고 인"
346297,판례내용,90,"정되는 때에는 집회를 허용하는 상대적인 집회금지장소로 정함으로써(제1호, 제2호),"
346297,판례내용,91,"기본적으로 공직자의 주거공간과 직무공간을 이원화하는 체계를 취하고 있는 점, ②"
346297,판례내용,92,"집시법은 ‘대통령 관저’를 제3의 집회금지장소로 분류하는 별도의 조문을 두지 않고,"
346297,판례내용,93,"제11조 제3호에서 국회의장, 대법원장, 헌법재판소장의 주거공간인 ‘공관’과 나란히 열"
346297,판례내용,94,"거하고 있는 점, ③ 더욱이 구 대통령 등의 경호에 관한 법률 시행령(2022.5.9."
346297,판례내용,95,대통
346297,판례내용,96,령령 제32633호로 개정되기 전의 것)제4조에서는 ‘대통령관저’와 ‘대통령집무실’이라는
346297,판례내용,97,"용어를 명백히 구분하여 사용한 점 등을 고려하면, ‘대통령 관저’에 대통령 집무실이"
346297,판례내용,98,필연적으로 포함된다고 해석할 만한 법체계상의 근거가 있다고 보기도 어렵다.
346297,판례내용,99,다)집시법이 제정된 이래로 최근까지도 대통령의 주거공간과 집무실은 사실상
346297,판례내용,100,"하나의 시설 내에 있었으므로, 대통령의 주거공간에 대한 집회만을 금지하더라도 집무"
346297,판례내용,101,실까지 동시에 보호할 수 있었다.
346297,판례내용,102,그렇다면 현재까지 대통령 집무실에 관하여는 집회 금지 여부를 명시적으로 규
346297,판례내용,103,"정한 별도의 법률조항이 제정된 바 없다고 하더라도, 이를 들어 집시법에서 ‘대통령 관"
346297,판례내용,104,저’라는 단어를 대통령의 주거공간과 집무실을 모두 포괄하는 의미로 사용한 것이라고
346297,판례내용,105,"추단할 수는 없고, 관련 입법자료를 살펴보아도 그와 같은 입법자의 의도를 단정할 만"
346297,판례내용,106,한 내용을 찾아보기 어렵다.
346297,판례내용,107,"오히려 과거의 구 집시법에서는 중앙관서, 서울특별시청, 부산시청, 도청, 역 등"
346297,판례내용,108,각종 행정관서도 집회금지장소로 규정하고 있다가 1989년 개정법으로 그 규정을 모두
346297,판례내용,109,"삭제하였는데, 이는 입법부 및 사법부와 비교하였을 때 행정부는 본질적인 기능 면에"
346297,판례내용,110,서 국민의 접근성을 보다 완화하여 그 목소리를 들어야 한다는 관점에 따라 행정관서
346297,판례내용,111,에 대하여는 집회제한을 철폐하는 입법적 결단을 내린 것이라 풀이된다.
346297,판례내용,112,"위와 같은 입법연혁에 비추어 보면, 현 시점에서 행정부의 수반인 대통령이 직"
346297,판례내용,113,무를 수행하는 공간인 대통령 집무실이 당연히 집회금지장소인 ‘대통령 관저’에 포함된
346297,판례내용,114,다고 해석하기는 더욱 어렵다 할 것이다.
346297,판례내용,115,"라)피고는, ① 청와대의 사전적 정의는 ‘서울 경복궁 뒤 북악산 기슭에 있는 우"
346297,판례내용,116,"리나라 대통령 관저’인데, 청와대에는 대통령의 주거공간과 집무실이 같은 시설 내에"
346297,판례내용,117,"위치하여 있었으므로, 일반적인 ‘관저’와는 달리 ‘대통령 관저’라는 단어는 주거공간과"
346297,판례내용,118,"집무실을 아우르는 의미를 갖는 것이고, ② 집시법은 제정 당시에 대통령의 주거공간"
346297,판례내용,119,과 집무실이 같은 건물 내에 있었던 특수한 상황을 감안하여 대통령에 대하여는 주거
346297,판례내용,120,"공간과 집무실을 포함하는 개념인 ‘대통령 관저’라는 용어를 사용한 것이며, 이와 구분"
346297,판례내용,121,"하여 국회의장, 대법원장, 헌법재판소장의 주거공간은 일반적인 단어인 ‘공관’으로 지칭"
346297,판례내용,122,한 것이라고 주장한다.
346297,판례내용,123,그러나 피고가 주장하는 청와대의 사전적 정의와 집시법의 입법취지를 고려하더
346297,판례내용,124,"라도, 앞서 본 바와 같이 ‘대통령 관저’는 대통령의 주거공간과 집무실이 결합되어 있"
346297,판례내용,125,"는 일정한 장소를 뜻하는 것이라 볼 수 있을 뿐이고, 나아가 주거공간의 소재지와는"
346297,판례내용,126,온전히 분리되어 전혀 다른 장소에서 직무공간의 기능만을 수행하는 현재의 대통령 집
346297,판례내용,127,무실까지 ‘대통령 관저’에 포함된다고 해석할 근거는 부족하다.
346297,판례내용,128,마)피고는 수상(총리)의 주거공간과 집무실을 아울러 ‘수상관저’라고 지칭하는
346297,판례내용,129,"일본의 사례를 지적하고 있으나, 이러한 언어는 각 나라 고유의 정치․역사․문화․생"
346297,판례내용,130,"활양식을 기반으로 형성된 산물이라 할 것이므로, 단지 우리나라와 일본이 동일한 한"
346297,판례내용,131,자문화권에 속한다는 이유로 일본의 용○에 견주어 우리나라의 법률용어를 해석하는
346297,판례내용,132,것은 타당하다고 보기 어렵다.
346297,판례내용,133,"바)집시법 제11조 제3호의 ‘대통령 관저’에서 대통령 집무실을 제외한다면, 집"
346297,판례내용,134,"시법 제11조에 열거된 국회의사당, 대법원, 헌법재판소 등 다른 헌법기관의 직무공간과"
346297,판례내용,135,는 달리 대통령 집무실에 대하여는 상대적인 집회금지마저도 불가능하게 되어 보호의
346297,판례내용,136,"공백 내지 불균형이 발생하므로, 대통령 집무실을 ‘대통령 관저’에 포함시키는 목적론"
346297,판례내용,137,적 해석이 필요하다고 볼 여지도 있다.
346297,판례내용,138,YTXX
346297,판례내용,139,그러나 대통령은 헌법상 국민의 대표기관이자 국가의 원수이고 행정부의 수반으
346297,판례내용,140,"로서 국회의원, 법관, 헌법재판관에게 부여된 헌법상의 지위, 역할, 권한과 근본적인 차"
346297,판례내용,141,"이가 있다.또한 집시법이 국회의사당, 대법원, 헌법재판소를 집회금지장소로 규정한"
346297,판례내용,142,것은 그 시설 내에 있는 공직자 개인의 점용상태를 보호하려는 것이기보다는 국회 내
346297,판례내용,143,"의사 진행, 법정 내 재판 진행 등 해당 장소가 담당하는 기능의 성격과 본질을 중시한"
346297,판례내용,144,결과로 볼 수 있다.위와 같이 대통령과 다른 헌법기관 간의 차이를 고려하지 않고 일
346297,판례내용,145,률적으로 대통령 집무실과 위 각 기관의 보호 필요성이 동일하다고 단정할 수 없다.
346297,판례내용,146,"또한 집시법 제11조에 규정한 집회금지장소가 아니더라도, 집시법은 ① 집단적"
346297,판례내용,147,"인 폭행, 협박, 손괴, 방화 등으로 공공의 안녕 질서에 직접적인 위협을 끼칠 것이 명"
346297,판례내용,148,"백한 집회, ② 총포, 폭발물, 도검, 철봉, 곤봉, 돌덩이 등 다른 사람의 생명을 위협하거"
346297,판례내용,149,나 신체에 해를 끼칠 수 있는 기구를 휴대하거나 사용하는 집회 또는 다른 사람에게
346297,판례내용,150,"이를 휴대하게 하거나 사용하게 하는 집회, ③ 신고한 목적, 일시, 장소, 방법 등의 범"
346297,판례내용,151,위를 뚜렷이 벗어나는 집회 등을 금지하거나 해산명령의 대상으로 정하고 있는바(제5
346297,판례내용,152,"조 제1항, 제8조 제1항, 제16조 제4항, 제20조), 대통령 집무실의 기능을 해할 우려가"
346297,판례내용,153,"높은 유형의 집회들은 여전히 허용되지 아니하고, 대통령 등의 경호에 관한 법률에서"
346297,판례내용,154,"도 위와 같은 폭력적인 범죄행위에 대처할 수 있는 조항을 두고 있으므로, 대통령 집"
346297,판례내용,155,무실 인근에서의 집회가 허용된다 하더라도 대통령의 직무 집행이라는 헌법적 기능은
346297,판례내용,156,충분히 보호될 수 있다고 판단된다.
346297,판례내용,157,나아가 ① 집회의 자유는 국민의 집단적 의사표현을 보호함으로써 민주주의의
346297,판례내용,158,"근간을 이루는 기본권이므로, 절대적인 집회금지장소를 확장하는 것은 특히 신중을 기"
346297,판례내용,159,"하여야 할 문제인 점, ② 대통령이 사인의 지위에서 누리는 주거의 안정과 평온은 가"
346297,판례내용,160,"급적 보장되어야 하더라도, 이와 별개로 국민의 의사에 귀를 기울이며 소통에 임하는"
346297,판례내용,161,"것은 대통령이 일과 중에 집무실에서 수행하여야 할 주요 업무로 볼 수 있는 점, ③"
346297,판례내용,162,따라서 대통령 집무실을 반드시 대통령의 주거공간과 동등한 수준의 집회금지장소로
346297,판례내용,163,"지정할 필요가 있다고 보기 어려운 점 등을 더하여 본다면, 절대적 집회금지장소로 규"
346297,판례내용,164,정된 ‘대통령 관저’에 대통령 집무실까지 포함시켜 해석할 충분한 이유를 찾기 어렵다.
346297,판례내용,165,더욱이 위와 같은 확대해석의 필요성은 결국 대통령의 주거공간과 집무실의 분
346297,판례내용,166,"리 여하에 따라 좌우될 수밖에 없으므로, 이러한 가변적인 필요에 맞추어 집시법을 해"
346297,판례내용,167,석하는 것은 법적 안정성을 심히 저해하는 결과를 낳을 수 있어 지양함이 상당하다.
346297,판례내용,168,라.소결
346297,판례내용,169,그렇다면 이 사건 처분은 처분사유가 존재하지 아니하여 위법하므로 취소되어야
346297,판례내용,170,한다.
346297,판례내용,171,3.결론
346297,판례내용,172,원고의 청구는 이유 있으므로 이를 인용하기로 하여 주문과 같이 판결한다.
346297,판례내용,173,재판장 판사
346297,판례내용,174,김○
346297,판례내용,175,판사
346297,판례내용,176,김○
346297,판례내용,177,판사
346297,판례내용,178,손○
346297,판례내용,179,YTXX
346297,판례내용,180,[별지]
346297,판례내용,181,관계 법령
346297,판례내용,182,■ 집회 및 시위에 관한 법률
346297,판례내용,183,제5조(집회 및 시위의 금지)
346297,판례내용,184,① 누구든지 다음 각 호의 어느 하나에 해당하는 집회나 시위를 주최하여서는 아니 된다.
346297,판례내용,185,"2.집단적인 폭행, 협박, 손괴, 방화 등으로 공공의 안녕 질서에 직접적인 위협을 끼칠 것이 명백한"
346297,판례내용,186,집회 또는 시위
346297,판례내용,187,제8조(집회 및 시위의 금지 또는 제한 통고)
346297,판례내용,188,① 제6조 제1항에 따른 신고서를 접수한 관할경찰관서장은 신고된 옥외집회 또는 시위가 다음 각 호
346297,판례내용,189,의 어느 하나에 해당하는 때에는 신고서를 접수한 때부터 48시간 이내에 집회 또는 시위를 금지할
346297,판례내용,190,"것을 주최자에게 통고할 수 있다.다만, 집회 또는 시위가 집단적인 폭행, 협박, 손괴, 방화 등으로"
346297,판례내용,191,공공의 안녕 질서에 직접적인 위험을 초래한 경우에는 남은 기간의 해당 집회 또는 시위에 대하여
346297,판례내용,192,신고서를 접수한 때부터 48시간이 지난 경우에도 금지 통고를 할 수 있다.
346297,판례내용,193,"1.제5조 제1항, 제10조 본문 또는 제11조에 위반된다고 인정될 때"
346297,판례내용,194,제11조(옥외집회와 시위의 금지 장소)
346297,판례내용,195,누구든지 다음 각 호의 어느 하나에 해당하는 청사 또는 저택의 경계 지점으로부터 100 미터 이내의 장
346297,판례내용,196,소에서는 옥외집회 또는 시위를 하여서는 아니 된다.
346297,판례내용,197,"1.국회의사당.다만, 다음 각 목의 어느 하나에 해당하는 경우로서 국회의 기능이나 안녕을 침해할"
346297,판례내용,198,우려가 없다고 인정되는 때에는 그러하지 아니하다.
346297,판례내용,199,가.국회의 활동을 방해할 우려가 없는 경우
346297,판례내용,200,나.대규모 집회 또는 시위로 확산될 우려가 없는 경우
346297,판례내용,201,"2.각급 법원, 헌법재판소.다만, 다음 각 목의 어느 하나에 해당하는 경우로서 각급 법원, 헌법재판소"
346297,판례내용,202,의 기능이나 안녕을 침해할 우려가 없다고 인정되는 때에는 그러하지 아니하다.
346297,판례내용,203,가.법관이나 재판관의 직무상 독립이나 구체적 사건의 재판에 영향을 미칠 우려가 없는 경우
346297,판례내용,204,나.대규모 집회 또는 시위로 확산될 우려가 없는 경우
346297,판례내용,205,"3.대통령 관저, 국회의장 공관, 대법원장 공관, 헌법재판소장 공관"
346297,판례내용,206,"4.국무총리 공관.다만, 다음 각 목의 어느 하나에 해당하는 경우로서 국무총리 공관의 기능이나 안"
346297,판례내용,207,녕을 침해할 우려가 없다고 인정되는 때에는 그러하지 아니하다.
346297,판례내용,208,가.국무총리를 대상으로 하지 아니하는 경우
346297,판례내용,209,YTXX
346297,판례내용,210,나.대규모 집회 또는 시위로 확산될 우려가 없는 경우
346297,판례내용,211,"5.국내 주재 외국의 외교기관이나 외교사절의 숙소.다만, 다음 각 목의 어느 하나에 해당하는 경우로서 외교기관 또는 외교사절 숙소의 기능이나 안녕을 침해할 우려가 없다고 인정되는 때에는 그러하지 아니하다."
346297,판례내용,212,가.해당 외교기관 또는 외교사절의 숙소를 대상으로 하지 아니하는 경우
346297,판례내용,213,나.대규모 집회 또는 시위로 확산될 우려가 없는 경우
346297,판례내용,214,다.외교기관의 업무가 없는 휴일에 개최하는 경우
346297,판례내용,215,제16조(주최자의 준수 사항)
346297,판례내용,216,④ 집회 또는 시위의 주최자는 다음 각 호의 어느 하나에 해당하는 행위를 하여서는 아니 된다.
346297,판례내용,217,"1.총포, 폭발물, 도검, 철봉, 곤봉, 돌덩이 등 다른 사람의 생명을 위협하거나 신체에 해를 끼칠 수"
346297,판례내용,218,있는 기구를 휴대하거나 사용하는 행위 또는 다른 사람에게 이를 휴대하게 하거나 사용하게 하
346297,판례내용,219,는 행위
346297,판례내용,220,"2.폭행, 협박, 손괴, 방화 등으로 질서를 문란하게 하는 행위"
346297,판례내용,221,"3.신고한 목적, 일시, 장소, 방법 등의 범위를 뚜렷이 벗어나는 행위"
346297,판례내용,222,제20조(집회 또는 시위의 해산)
346297,판례내용,223,① 관할경찰관서장은 다음 각 호의 어느 하나에 해당하는 집회 또는 시위에 대하여는 상당한 시간 이
346297,판례내용,224,내에 자진 해산할 것을 요청하고 이에 따르지 아니하면 해산을 명할 수 있다.
346297,판례내용,225,"1.제5조 제1항, 제10조 본문 또는 제11조를 위반한 집회 또는 시위"
346297,판례내용,226,2.제6조 제1항에 따른 신고를 하지 아니하거나 제8조 또는 제12조에 따라 금지된 집회 또는 시위
346297,판례내용,227,5.제16조 제4항 각 호의 어느 하나에 해당하는 행위로 질서를 유지할 수 없는 집회 또는 시위
346297,판례내용,228,② 집회 또는 시위가 제1항에 따른 해산 명령을 받았을 때에는 모든 참가자는 지체 없이 해산하여야
346297,판례내용,229,한다.
346297,판례내용,230,■ 국유재산법
346297,판례내용,231,제6조(국유재산의 구분과 종류)
346297,판례내용,232,② 행정재산의 종류는 다음 각 호와 같다.
346297,판례내용,233,1.공용재산: 국가가 직접 사무용ㆍ사업용 또는 공무원의 주거용(직무 수행을 위하여 필요한 경우로서 대통령령으로 정하는 경우로 한정한다)으로 사용하거나 대통령령으로 정하는 기한까지 사용하기로 결정한 재산
346297,판례내용,234,■ 국유재산법 시행령
346297,판례내용,235,YTXX
346297,판례내용,236,제4조(국유재산의 구분)
346297,판례내용,237,"② 법 제6조 제2항 제1호에서 ""대통령령으로 정하는 경우""란 다음 각 호의 어느 하나에 해당하는 목"
346297,판례내용,238,적으로 사용하거나 사용하려는 경우를 말한다.
346297,판례내용,239,1.대통령 관저
346297,판례내용,240,■ 구 대통령 등의 경호에 관한 법률 시행령(2022.5.9.
346297,판례내용,241,대통령령 제32633호로 개정되기 전의 것)
346297,판례내용,242,제4조(경호구역)
346297,판례내용,243,"① 법 제5조 제1항에 따른 대통령경호처(이하 ""경호처""라 한다)의 경호구역 중 대통령집무실ㆍ대통령"
346297,판례내용,244,"관저 등은 내곽구역과 외곽구역으로 나누며, 그 범위는 부도와 같다."
346297,판례내용,245,② 제1항에 따른 대통령집무실ㆍ대통령관저 등을 제외한 각종 행사장ㆍ유숙지 등에 대한 경호구역은
346297,판례내용,246,"행사의 성격, 경호위해요소 등을 고려하여 처장이 지정한다.끝."
346297,판례내용,247,YTXX
