판례일련번호,구분,문장번호,내용
339501,판례내용,1,광주지방법원
339501,판례내용,2,제1행정부
339501,판례내용,3,판결
339501,판례내용,4,사건 2023구합12231 장기요양기관 지정취소처분 취소
339501,판례내용,5,원고 사회복지법인 A
339501,판례내용,6,"소송대리인 법무법인(유한)맥, 담당변호사 문○, 이○"
339501,판례내용,7,피고 무안군수
339501,판례내용,8,소송대리인 변호사 추○
339501,판례내용,9,변론 종결 2024.4.25.
339501,판례내용,10,판결 선고 2024.7.11.
339501,판례내용,11,주문
339501,판례내용,12,1.피고가 2023.4.6.
339501,판례내용,13,원고에 대하여 한 장기요양기관 지정취소처분을 취소한다.
339501,판례내용,14,2.소송비용은 피고가 부담한다.
339501,판례내용,15,청구 취지
339501,판례내용,16,주문과 같다.
339501,판례내용,17,이유
339501,판례내용,18,1.처분의 경위
339501,판례내용,19,가.원고는 노인전문요양시설 설치․운영 등을 목적으로 하는 사회복지법인으로 전남 무안군 B에 있는 ‘C요양원’(이하 ‘이 사건 요양원’이라 한다)을 운영하고 있다.
339501,판례내용,20,이 사건 요양원은 노인복지법에 따른 노인요양시설로서 노인장기요양법에 따라 피고로부터 장기요양기관으로 지정받았다.
339501,판례내용,21,나.2022.6.30.
339501,판례내용,22,"이 사건 요양원에서 학대가 발생하였다는 신고가 D기관(이하 ‘이 사건 기관’이라 한다)에 접수되었고, 이후에도 2022.11.17.까지 이 사건 기관, 무안군 E과 주무부서, 국민신문고 등에 이 사건 요양원의 수급자들 중 23명에 대한 학대의심 2차 내지 6차 신고가 접수되었다."
339501,판례내용,23,"이에 피고와 이 사건 기관은 2022.7.7.부터 2022.11.18.까지 6차례의 합동조사를, 2022.8.24.부터 2022.12.6.까지 8차례의 합동조사를 각 실시하였다."
339501,판례내용,24,"다.이 사건 기관은 위 조사결과를 바탕으로 수급자들 중 19명에 대한 신체적 학대 12건, 성적 학대 13건, 방임 6건 총 31건의 학대 의심사례를 적발하였고, 자체사례회의 및 사례판정위원회의 심의를 거쳐 이 사건 요양원에서 아래 5의 가.5)표의 ‘수급자’란 기재 각 수급자에 대해 같은 표 ‘위반행위’란 기재 각 위반행위(이하 ‘이 사건 각 위반행위’라 한다)를 하였다고 인정하고, 이 사건 각 위반행위는 같은 표 ‘학대유형’란 기재 각 학대유형에 해당한다고 판정(이하 ‘이 사건 판정’이라 한다)하였다."
339501,판례내용,25,라.피고는 2023.3.17.
339501,판례내용,26,"이 사건 판정에 근거하여 원고에게 시설거주자에 대한 학대 등 인권침해 발생, 수급자의 신체적 학대 및 방임행위를 처분의 원인이 되는 사실로 하여 사회복지사업법 제40조 제1항 제4호 위반을 사유로 한 개선명령, 노인장기요양보험법 제37조 제1항 제6호 위반을 사유로 한 지정취소 처분을 할 예정임을 사전통지(이 사건 사전통지‘라 한다)하였다."
339501,판례내용,27,마.피고는 2023.3.29.
339501,판례내용,28,청문(이하 ’이 사건 청문‘이라 한다)절차를 거쳐 2023.4.6.
339501,판례내용,29,원고에 대하여 장기요양기관 지정취소처분(이하 ’이 사건 처분‘이라 한다)을 하였다.
339501,판례내용,30,"[인정 근거] 다툼 없는 사실, 갑 제1, 2, 4호증, 을 제1 내지 5호증의 각 기재 또는 영상, 변론 전체의 취지"
339501,판례내용,31,2.원고 주장의 요지
339501,판례내용,32,이 사건 처분은 아래와 같은 이유에서 위법하므로 취소되어야 한다.
339501,판례내용,33,가.절차적 위법
339501,판례내용,34,"피고는 이 사건 사전통지시 이 사건 각 처분의 원인이 되는 사실에 대하여 구체적으로 밝히지 않았고, 이에 원고가 정보공개청구를 통해 관련 자료를 확인한 후 의견제출을 할 수 있도록 예정된 청문기일(2023.3.29."
339501,판례내용,35,")의 연기를 요청하였으나 피고가 그 연기신청을 불허하여 결국 이 사건 각 처분의 원인이 되는 사실에 대한 반박 기회를 상실한 채 청문에 참석하게 되었으므로, 이 사건 처분은 원고의 의견제출 기회를 박탈한 절차적 하자가 있다."
339501,판례내용,36,나.실체적 위법
339501,판례내용,37,1)처분사유의 부존재
339501,판례내용,38,원고는 수급자들을 신체적․성적․방임 학대한 사실이 없으므로 이 사건 각 처분사유의 대상이 된 이 사건 각 학대행위는 사실과 다르거나 노인장기요양보험법 제37조 제1항 제6호 각목의 사유에 해당하지 않는다.
339501,판례내용,39,"이 사건 요양원은 2022년경 시설장이 교체되었는데, 전 시설장인 F(이 사건 요양원의 시설장인 G의 딸이다), 사무국장 H, 퇴직한 직원들이 이 사건 요양원의 운영을 방해할 목적으로 악의적으로 이 사건 요양원 이 수급자들을 학대하고 있다는 거짓신고를 하였고, 현장조사시 마치 수급자들이 학대를 당하는 것처럼 상황을 연출한 것에 불과하다."
339501,판례내용,40,2)재량권 일탈․남용
339501,판례내용,41,"피고는 이 사건 요양원에서 성적 학대가 있었음을 전제로 노인장기요양보호법 시행규칙 제29조(이하 ’이 사건 시행규칙 규정‘이라 한다), [별표2] 2.가.13)."
339501,판례내용,42,"나)의 ’수급자에게 성적 수치심을 주는 성폭행, 성희롱 등의 행위‘에 해당한다고 보아 이 사건 처분을 하였다."
339501,판례내용,43,"그러나 이성에 의한 기저귀 케어, 신체부위 노출이라는 각 위반행위는 그 위법성의 정도가 매우 가볍고, 원고가 이 사건 각 위반행위에 관하여 형사처벌을 받지도 아니한 점, 이 사건 처분에 앞서 원고나 그 대표자가 노인장기요양보험법 위반 행위로 형사처벌이나 행정처분을 받은 사실 없이 성실히 이 사건 요양원을 운영해온 점, 이 사건 요양원의 장기요양기관 지정취소시 수급자들의 타 요양원으로의 전원 및 고용된 직원들의 퇴사로 인한 생계곤란 문제가 발생하게 되는 점에 비추어 보면 이 사건 요양원의 장기요양기관 지정을 취소한 이 사건 처분은 지나치게 가혹하다."
339501,판례내용,44,"반면 이 사건 처분으로 얻게 되는 공익은 없거나 미미하므로, 이 사건 처분은 비례․평등의 원칙에 위배되어 재량권을 일탈․남용한 위법이 있다."
339501,판례내용,45,3.관계 법령
339501,판례내용,46,별지 관계 법령 기재와 같다.
339501,판례내용,47,4.절차적 하자의 존부
339501,판례내용,48,가.관련 법리
339501,판례내용,49,행정절차법 제23조 제1항은 행정청의 자의적 결정을 배제하고 당사자로 하여금 행정구제절차에서 적절히 대처할 수 있도록 하는 데 그 취지가 있다.
339501,판례내용,50,"그러므로 처분에서 기재된 내용과 관계 법령 및 당해 처분에 이르기까지의 전체적인 과정 등을 종합적으로 고려하여, 처분 당시 당사자가 어떠한 근거와 이유로 처분이 이루어진 것인지를 충분히 알 수 있어서, 그에 불복하여 행정구제절차로 나아가는 데에 별다른 지장이 없었던 것으로 인정되는 경우에는, 처분서에 처분의 근거와 이유가 구체적으로 명시되어 있지 않았다 하더라도, 그로 말미암아 그 처분이 위법한 것으로 된다고 할 수는 없다(대법원 2019.1.31."
339501,판례내용,51,선고 2016두65718 판결 등 참조).
339501,판례내용,52,나.구체적 판단
339501,판례내용,53,"앞서 든 증거 및 변론 전체의 취지를 더하여 인정되는 다음과 같은 사실 및 사정들을 종합하면, 이 사건 처분이 행정절차법 제21조 제1항, 제3항, 제22조 제3항을 위반한 위법한 처분이라고 볼 수 없다."
339501,판례내용,54,원고의 주장은 이유 없다.
339501,판례내용,55,"1)이 사건 사전통지서에는 그 처분의 원인이 되는 사실에 ‘시설거주자에 대한 학대 등 인권침해 발생’, ‘수급자의 신체적 학대 및 방임 행위’가 기재되어 있었고, 그 법적 근거로 사회복지사업법 제40조 제1항 제4호, 노인장기요양보험법 제37조 제1항 제6호가 기재되어 있었으므로 원고로서는 이 사건 사전통지를 통해 이 사건 처분의 원인 이 되는 사실과 처분의 내용, 법적 근거 등 행정절차법 제21조 제1항에서 정한 사항을 모두 파악할 수 있었다."
339501,판례내용,56,2)피고는 2023.3.27.
339501,판례내용,57,원고로부터 이 사건 처분에 관한 정보공개청구를 받고 바로 다음 날인 2023.3.28.
339501,판례내용,58,이 사건 처분의 근거가 된 이 사건 기관의 노인학대 사례판정서(이하 ‘이 사건 판정서’라 한다)를 제공하였다.
339501,판례내용,59,"이 사건 판정서에는 학대가 의심된 수급자들의 인적사항과 그 학대유형, 이 사건 각 위반행위의 내용이 상세히 기재되어 있었다."
339501,판례내용,60,3)원고는 2023.3.29.
339501,판례내용,61,"이 사건 청문에 출석하여 이 사건 판정서의 내용 숙지가 부족하니 2023.3.31.까지 그 의견제출서를 제출하겠다고 진술하였고, 이후 2023.3.31."
339501,판례내용,62,"피고에게 의견제출서를 제출하였으며, 이 사건 처분은 그로부터 6일 뒤인 2023.4.6."
339501,판례내용,63,이루어졌다.
339501,판례내용,64,"따라서 원고가 이 사건 청문 당시에는 제대로 된 의견을 개진하지 못하였다고 하더라도, 이후 이 사건 처분에 앞서 자신의 의견 및 유리한 자료가 담긴 의견 제출서를 제출할 수 있는 기회가 부여되었고, 피고는 원고의 의견제출서 등을 검토한 후 이 사건 처분에 이른 것으로 보이는 점에 비추어 보면, 이 사건 처분에 원고의 의견제출 기회를 박탈한 절차적 하자가 있다고 보기 어렵다."
339501,판례내용,65,5.실체적 하자의 존부
339501,판례내용,66,가.처분사유의 존부
339501,판례내용,67,1)관계 규정 및 판정지표
339501,판례내용,68,"노인장기요양보험법 제37조 제1항 본문은 “시장은 장기요양기관이 다음 각 호의 어느 하나에 해당하는 경우 그 지정을 취소하거나 6개월의 범위에서 업무정지를 명할 수 있다.”라고 규정하고, 각 호 중 제6호는 “장기요양기관의 종사자 등이 다음 각 목의 어느 하나에 해당하는 행위를 한 경우.다만, 장기요양기관의 장이 그 행위를 방지하기 위하여 해당 업무에 관하여 상당한 주의와 감독을 게을리하지 아니한 경우는 제외한다.”라고 규정하고 있다."
339501,판례내용,69,"같은 호 (가)목은 “수급자의 신체에 폭행을 가하거나 상해를 입히는 행위”, (나)목은 “수급자에게 성적 수치심을 주는 성폭행, 성희롱 등의 행위”, (다)목은 “자신의 보호․감독을 받는 수급자를 유기하거나 의식주를 포함한 기본적 보호 및 치료를 소홀히 하는 방임행위“를 각 규정하고 있다."
339501,판례내용,70,"I기관에서 제공하는「노인학대 관련 자료」에 따르면 노인학대는 형태적으로 신체적 학대, 성적 학대, 방임학대 등으로 분류되고, 2022 노인보호전문기관 업무수행지침 중 노인복지 생활시설 학대 판정지표(이하 ’이 사건 판정지표‘라 한다)에서는 특히 노인복지 생활시설에서의 학대에 관한 상세한 기준을 제공하고 있으므로, 아래에서는 이 사건에서 문제된 신체적 학대, 성적 학대, 방임 학대의 정의 및 그 내용에 관하여 살펴본다."
339501,판례내용,71,2)신체적 학대의 정의 및 내용
339501,판례내용,72,노인장기요양보험법에 따라 장기요양급여 제공기준 및 급여비용 산정방법 등의 사항을 규정함을 목적으로 하는 장기요양급여 제공기준 및 급여비용 산정방법 등에 관한 고시 제43조 제3항에서는 ’시설급여기관은 급여제공과정에서 수급자를 격리하거나 억제대 등을 사용하여 묶는 등 신체를 제한하여서는 아니 된다.
339501,판례내용,73,"다만, 수급자 또는 시설급여기관 종사자 등의 생명이나 신체에 위험을 초래할 가능성이 현저히 높은 경우에 한해 수급자 본인의 치료 또는 보호를 도모하는 목적으로 신체적 제한이 행해질 수 있다."
339501,판례내용,74,"이 경우 시설급여기관의 장은 수급자 본인이나 가족에게 이 사실을 통지하여 동의를 받고, 수급자의 심신상태, 신체적 제한을 가한 시간, 신체적 제한을 가할 수밖에 없는 사유 등을 급여제공기록지에 자세히 기재ㆍ관리한다‘고 규정하고 있다."
339501,판례내용,75,"I기관에서 제공하는「노인학대 관련 자료」에 의하면, ① 노인의 신체 일부 또는 모두를 사용하지 못하게 장치(예: 끈으로 묶어두기, 수갑채우기, 손․발목 묶기 등)를 설치하는 경우, ② 노인에게 의료적으로 불필요한 약물이나 주사를 강제로 복용․투입하게 하는 행위가 신체적 학대에 포함된다."
339501,판례내용,76,"또한 이 사건 판정지표에서는 억제대로 노인의 신체를 구속하는 행위, 노인에게 강제적으로 불필요한 약물이나 의료처치를 하여 생명을 저해하는 행위를 각 신체적 학대에 해당한다고 정하고 있다."
339501,판례내용,77,"억제대로 노인의 신체를 구속하는 행위의 대표적 행위에는 ① 생명 유지 또는 치료 목적 외에 억제대(벨트, 조끼, 장갑 등)를 사용하는 행위, ② 보호자에게 사전 동의와 사후 정황보고 또는 본인 동의 없이 억제대를 사용하는 행위, ③ 전신 억제대를 사용하는 행위, ④ 장시간 억제대를 사용하는 행위가 각 포함된다."
339501,판례내용,78,"노인에게 강제적으로 불필요한 약물이나 의료처치를 하여 생명을 저해하는 행위에는 ① 수면제, 신경안정제, 항우울제 등을 강제로 먹이는 행위, ② 강제로 불필요한 의료처치를 하는 행위 등이 포함된다."
339501,판례내용,79,3)성적 학대의 정의 및 내용
339501,판례내용,80,"I기관에서 제공하는「노인학대 관련 자료」에 의하면, 성적 학대의 대표적인 행위에는 ① 성적 언행 등으로 노인에게 굴욕감이나 혐오감을 느끼게 하는 행위, ② 사람들이 보고 있음에도 불구하고 노인의 성적 부위를 드러내고 옷 또는 기저귀를 교체하는 행위, ③ 원하지 않거나, 판단능력이 부족한 노인임에도 불구하고 노인의 성적 신체부위 전체 또는 일부를 노출시켜 놓는 행위 등으로 노인에게 성적 수치심을 주는 표현이나 행동을 하는 것이 포함된다."
339501,판례내용,81,"이 사건 판정지표에 의하면, 성적 학대인 ’노인에게 성적 수치심을 주는 표현이나 행동을 하는 것‘이란 ① 목욕, 기저귀교체 등에 대해 동성자의 케어를 원함에도 불구하고 이를 조치하지 않는 경우, ② 옷을 입히지 않고 그대로 두거나 알몸 또는 성적 부위를 가리지 않은 채로 두는 경우, ③ 성적 신체 부위를 드러내고 기저귀를 교체(예: 가림막 미설치 및 가림막 미사용)하는 경우를 의미한다."
339501,판례내용,82,4)방임 학대의 정의 및 내용
339501,판례내용,83,"I기관에서 제공하는「노인학대 관련 자료」에 의하면, 방임에 의한 학대란 ① 거수급자 학대유형 위반행위 이 법원의 판단 K 신체적 학대 2022.11.18."
339501,판례내용,84,"긴박하거나 대체할 수 없는 상황이 아니었음에도 보호자 동의 없이 손모아장갑으로 손목을 결박함 원고는 K이 장루백에서 배변을 집어먹는 행위를 방복하여 끼우게 된 것이라고 주장하고 있는바 장기간 손모아장갑을 사용하였던 것으로 보이는 데, 갑 제9호증, 을 제37호증의1의 각 기재와 영상 및 변론 전체의 취지에 의하면, K은 치매 등 질환으로 인지기능이 저하된 상태이고, 보호자는 휠체어안전벨트, 침대난간 올리기, 격리에 대해서만 동의서 작성하였을 뿐 손 장갑 사용에 대한 동의는 한 사실이 없는데, 이 사건 전문기관의 조사원이 2022.11.18."
339501,판례내용,85,"현장조사 중 K이 손모아장갑을 한 사실을 확인하였고, 그럼에도 불구하고 신체구속의 사유와 그 제한시간 등을 급여제공기록지에 전혀 기재하지 않았으므로, 설령 수급자의 보호를 도모하는 목적이 있었다고 하더라도 이는 ‘억제대로 노인의 신체를 구속하는 행위’로서 신체적 학대에 해당한다고 봄이 타당함.처분사유 인정됨."
339501,판례내용,86,성적 학대 2022.7.21.
339501,판례내용,87,및 2022.8.24.
339501,판례내용,88,"가림막 없이 성적 부위를 노출한 채 둠을 제37호증의1의 기재 및 영상, 이 법원 증인 J의 증언, 변론 전체의 취지에 의하면, 이 사건 전문기관 조사원은 2022.7.21."
339501,판례내용,89,및 2022.8.24.
339501,판례내용,90,"현장조사 중 K이 기저귀가 벌려진 채 침상에 누워 둔부가 노출된 것을 직접 확인하였는바 그 사실이 인정되고, 생활실에 동성의 수급자만 있다고 하더라도 성적 부위를 노출시켜두는 행위는 수급자로 하여금 성적 수치심을 느끼게 하는 행위로서 성적 학대에 해당한다고 봄이 타당함.처분사유 인정됨."
339501,판례내용,91,"사전에 수급자 본인이나 보호자에게 동성 요양보호사 선호 여부의 확인, 이성 요양보호사 서비스 제공에 대한 동의 등을 받지 않고 2022.6.8, 같은 달 20일, 2022.7.15, 같은 달 16, 17, 20일, 2022.8.6, 같은 달 8, 15, 21, 25일 성별이 다른 남성 요양보호사가 엉덩이 상처 통풍, 기저귀 케어, 목욕서비스를 실시하도록 함을 제37호증의1의 기재 및 영상, 이 법원 증인 J의 증언, 변론 전체의 취지에 의하면, 이 사건 전문기관의 조사원은 2022.7.21."
339501,판례내용,92,"남성 요양보호사가 L의 기저귀를 교체하는 모습을 직접 목격하였고, 그 케어 관찰일지에는 2022.7.15."
339501,판례내용,93,"엉덩이 상처 통풍, 2022.8.8."
339501,판례내용,94,"기저귀 체크를 한 사람이 남성요양보호사인 M, N인 것으로 기록되어 있으며, 이 사건 요양원의 시설장인 G는 2022.7.21."
339501,판례내용,95,"이 사건 전문기관 조사원과의 대면상담시 ‘N 요양보호사(남성)가 일부러 여성방을 가서 기저귀 케어를 한다’고 진술하였던 점, 이 사건 전문기관의 조사원은 2022.6.8, 같은 달 20일, 2022.7.15, 같은 달 16, 17, 20일, 2022.8.6, 같은 달 8, 15, 21, 25일경 남성요양보호사의 케어가 이루어진 사실을 장기요양급여제공기록지를 통해 확인했던 것으로 보이는 점이 인정되므로, 위 각 일자에 성별이 다른 남성요양보호사로부터 엉덩이 상처 통풍, 기저귀 케어를 실시하도록 한 사실이 인정되고, 이에 대해 본인이나 보호자의 동의를 받았다고 볼 자료가 없으므로, 위 각 행위는 수급자에게 성적 수치심을 주는 행위로서 성적 학대에 해당한다고 봄이 타당함.처분사유 인정됨."
339501,판례내용,96,"방임 학대 좌측 둔부에 4cm 가량의 피부 괴사 발생하였으나 적절한 치료를 하지 않고, 보호자에게도 알리지 않음.을 제37호증의1의 기재와 영상 및 변론 전체의 취지에 의하면, K의 좌측 둔부에 상처를 최초로 발견한 것은 2022.10.21.이고, 담당 요양보호사들은 지속적으로 그 상처를 소독하며 관리해온 사실, K은 평소 피부질환을 앓고 있었는데, 의료인이 아닌 요양보호사로서는 바로 괴사를 판단하기 곤란하였을 것으로 보이는 점, 이에 단순한 피부질환 또는 상처로 오인하여 보존적 치료를 계속하면서 보호자에게 미처 알리지 못한 것으로 보일 뿐인 점 등이 인정되므로, 위 사실과 사정을 종합하면 이 사건 요양원이 K에 대해 의료적 처치 및 보호를 소홀히 하였고 그것이 방임에 해당한다고 보기 어려움.처분사유 인정되지 않음."
339501,판례내용,97,M 방임 학대 평소 앉아있기 힘들어함에도 2022.7.21.
339501,판례내용,98,"이 사건 요양원 복도에서 4시간(10:00~14:00)동안 휠체어에 앉혀 통풍케어하여 부적절한 돌봄을 제공함.을 제37호증의2의 기재와 영상, 변론 전체의 취지에 의하면, M은 2021.1.경부터 등 부위 피부발진으로 인한 관리를 받아왔는데, 2022.7.21."
339501,판례내용,99,"이 사건 전문기관의 조사원이 현장조사 중 M이 이 사건 요양원의 복도에서 4시간(10:00 ~ 14:00)동안 휠체어에 앉은 채 통풍케어를 하고 있음을 직접 확인하였던 점에 비추어 위 사실이 인정되고, 같은 달 24.경 작성된 관찰일지에는 ‘M이 등 부위 피부발진으로 휠체어에서 통풍하면 불편해하며 침상으로 가려하며 짜증을 내서 침상에서 통풍’하였다고 기재되어 있는 점, M은 현장조사시 대화가 불가능하여 질문에 답을 하지 못하는 건강 상태였던 점 등에 비추어 보면 M의 등에 발진이 있었다고 하더라도 앉아있기 힘들어하며 자신의 의사를 제대로 표현하기도 어려운 고령의 노인을 3~4시간 이상 휠체어에 앉혀 복도에 두는 것은 피부발진의 치료목적을 벗어난 것으로, ‘부적절한 돌봄을 제공한 경우’에 해당한다고 봄이 타당함.처분사유 인정됨."
339501,판례내용,100,"망 K 방임 학대 미골에 욕창이 발생하였으나 적절한 치료를 하지 않고, 보호자에게도 알리지 않음.을 제37호증의3의 기재 및 영상, 변론 전체의 취지에 의하면, 보호자는 망 K이 2022.7.18."
339501,판례내용,101,다른 요양기관으로 전원한 후 미골에 욕창이 발생한 사실을 인지하게 되었고 이 사건 요양원으로부터는 이를 전달받지 못하였던 사실은 인정됨.
339501,판례내용,102,"그러나 같은 증거에 의하면, 망 K은 2022.7.8."
339501,판례내용,103,"및 같은 달 14.목욕케어를 받았으므로 그 무렵 욕창이 발생하였다면 간호일지, 관찰일지, 장기요양 제공기록지에 욕창에 관련된 내용이 기재되었으리라 보임에도 아무런 내용이 없는 점, 망 K을 담당하였던 이 사건 요양원의 종전 요양보호사(퇴사)는 ‘2022.7.12."
339501,판례내용,104,"방을 옮길 때까지는 욕창이 없었다’는 취지로 이 사건 전문기관 조사원에게 진술하였던 점, 2022.7.21."
339501,판례내용,105,"보호자가 촬영한 사진에 비추어 욕창이 오래전 발생하였던 것으로 보이지는 않는 점 등에 비추어 보면, 이 사건 요양원이 의료적 처치나 보호를 소홀히 한 것이 욕창 발생의 원인이라거나 욕창 발생 후 제대로 된 처치를 하지 않았음을 인정하기 부족하고, 욕창 발생 직후 전원한 것으로 보여 단순 실수로 욕창에 대해 설명하지 못하였을 가능성도 배제할 수 없으므로, 결국 위 사실만으로는 이 사건 요양원이 망 K에게 의료적 처치 및 보호를 소홀히 하여 방임학대하였음을 인정하기 부족하고, 달리 이를 인정할 증거가 없으므로 처분사유 인정되지 않음."
339501,판례내용,106,망 O 방임 학대 2022.7.9.
339501,판례내용,107,"04:00경 낙상사고 발생 후 적절한 조치를 취하지 않아 사망에 이르게 하였음.갑 제17호증의1, 을 제37호증의4의 각 기재 및 변론 전체의 취지에 의하면, 이 사건 요양원은 2022.7.9."
