판례일련번호,구분,문장번호,내용
343150,판례내용,122,"이 사건 처분의 전제 사실인 제1 내지 8 사실이 모두 인정되고, 위 인정사실에 의하면, 원고는 2022.3.경 이 사건 학교의 2학년에 재학하면서 당시 이 사건 학교에 갓 입학하여 기숙사 생활을 시작한 1학년인 피해학생들을 생활 지도를 한다는 명목을 내세우거나 별다른 이유 없이 청소시간이나 취침시간을 이용해 아령이나 대걸레 자루, 빗자루, 옷걸이, 배드민턴 채 손잡이를 이용하여 반복적으로 폭행하고, 피해학생들이 원고를 학교폭력으로 신고하지 못하도록 하는 언동을 하였으며, 원고가 이와 같은 행위로 학교폭력으로 신고를 당하여 조사를 받고 있는 과정에서 이 사건 학교장이 원고에 대하여 피해학생들에 대한 접촉ㆍ협박 및 보복행위 금지의 긴급조치를 한 상황임에도, 원고는 피해학생들과 이 사건 기숙사 생활을 계속하고 있는 것을 이용하여 F을 다시 폭행하였고, 피해학생들은 원고의 위와 같은 폭력행위로 상당한 정도의 신체적ㆍ정신적으로 고통을 겪은 것으로 보인다."
343150,판례내용,123,따라서 제1 내지 8 사실과 같은 원고의 피해학생들에 대한 위와 같은 폭행행위는 피해학생들에게 신체적ㆍ정신적으로 고통을 주는 학교폭력에 해당한다고 함이 타당하다.
343150,판례내용,124,따라서 원고의 사실오인 주장은 이유 없다.
343150,판례내용,125,마.재량권의 일탈·남용 주장에 대한 판단
343150,판례내용,126,1)관련법리
343150,판례내용,127,"학교폭력예방법 제17조 제1항에 의하면, 심의위원회는 피해학생의 보호와 가해학생의 선도·교육을 위하여 대통령령으로 정한 각 조치별 적용 기준에 따라 피해학생에 대한 서면사과, 전학 등 위 규정 각 호에서 정하고 있는 가해학생에 대한 조치 중 어느 하나 또는 여러 조치의 병과를 교육장에게 요청하여야 한다."
343150,판례내용,128,"같은 법 제17조 제1항의 위임에 따른 학교폭력예방법 시행령 제19조는 조치별 적용 기준에 대해 ‘가해학생이 행사한 학교폭력의 심각성‧지속성‧고의성(제1호)’, ‘가해학생의 반성 정도(제2호)’, ‘해당 조치로 인한 가해학생의 선도 가능성(제3호)’, ‘가해학생 및 보호자와 피해학생 및 보호자 간의 화해의 정도(제4호)’, ‘피해학생이 장애학생인지 여부(제5호)’를 고려하여 결정하고, 그 세부적인 기준은 교육부장관이 정하여 고시하도록 위임하고 있다."
343150,판례내용,129,"위 각 규정의 내용, 형식 및 체계 등에 비추어 보면, 심의위원회가 학교폭력 가해학생에 대하여 어떠한 조치를 할 것인지, 여러 조치를 병과할 것인지 여부는 재량행위에 속한다고 할 것이고, 따라서 폭력예방법 제17조 제1항에 근거한 심의위원회의 요청에 따른 교육장의 학교폭력 가해학생에 대한 조치가 사회통념상 현저하게 타당성을 잃어 재량권을 일탈·남용하였는지 여부는 학교폭력의 내용과 성질, 조치를 통하여 달성하고자 하는 목적 등을 종합하여 신중하게 판단하여야 한다."
343150,판례내용,130,2)구체적 판단
343150,판례내용,131,"위에서 인정된 사실, 앞서 거시한 증거들 및 변론 전체의 취지에 의하여 알 수 있는 다음의 사정을 종합하여 보면, 원고가 주장하는 사정을 모두 고려하더라도 이 사건 처분이 사회통념상 현저하게 타당성을 잃어 재량권을 일탈ㆍ남용하였다고 보기 어렵다."
343150,판례내용,132,따라서 원고의 이 부분 주장도 이유 없다.
343150,판례내용,133,"○ 이 사건 심의위원회는 원고에 대한 조치별 적용기준에 대하여 협의를 하여 학교폭력의 심각성 4점(매우높음), 지속성 4점(매우높음), 고의성 4점(매우높음), 가해학생의 반성 정도 4점(없음), 화해 정도 4점(없음)합계 20점으로 평가하였다."
343150,판례내용,134,"이 사건 고시 제2조 제1항 관련 [별표]에 의하면, 위 판정 점수는 제9호 퇴학처분을 할 수 있는 판정 점수 범위 내에 해당한다."
343150,판례내용,135,"따라서 이 사건 처분은 이 사건 고시에서 정한 가해학생 조치별 적용 세부 기준과 학교폭력예방법 제17조의 규정에 따른 것이라 할 수 있고, 이 사건 고시에서 정한 가해학생 조치별 적용 세부 기준이 그 자체로 헌법 또는 법률에 합치되지 않다거나 이 사건 처분이 그 처분사유가 된 사실의 내용 및 관계 법령의 규정 내용에 비추어 볼 때 현저히 부당하다고 보기 어렵다."
343150,판례내용,136,"○ 이 사건 심의위원회는, 진단서는 제출되지 않았으나 배드민턴 채, 대걸레 자루, 아령 등 물건을 이용하여 폭력을 행사한 점과 주간 뿐 아니라 야간에도 이런 일이 발생한 점, 피해학생들이 제출한 사진에 비추어 피해학생들이 느낀 공포심이 상당했을 것으로 보이는 점, 처벌불원서를 강압적인 분위기에서 작성하도록 강요했다는 피해학생들의 주장이 있었던 점에서 학교폭력의 심각성을 매우 높다고 만장일치로 판단하였다."
343150,판례내용,137,"또한 원고가 장난을 빙자하여 습관적인 폭력을 지속했던 점, 원고가 피해학생들에 대하여 수회 폭력을 행사했던 것으로 보이고, 두 번의 접촉금지 조치를 했는데도 지키지 않고 폭력을 행사하였으며, 사과를 하고 다시 폭력을 행사하고, 다시 사과하고 다시 폭력을 행사하였던 점 등에서 학교폭력의 지속성을 매우 높다고 만장일치로 판단하였다."
343150,판례내용,138,"나아가 원고가 이 사건 학교 내 CCTV 유무를 확인하여 없는 곳에서 피해학생들 일부에 대하여 폭력을 행사하고, 기숙사 방에서 피해학생들에게 게임을 시키면서 피해학생들을 때릴 수 있는 조건을 만들어서 폭행한 점, 원고가 피해학생들로 하여금 처벌불원서를 반 강제로 작성하게 했던 점에서 학교폭력의 고의성에 대해서도 매우 높다고 만장일치로 판단하였고, 원고가 두 번의 접촉금지 조치를 받고도 지키지 않고 폭력을 행사하였고, 게임이나 장난이었다고 주장하는 점에서 반성 정도가 없다고 만장일치로 판단하였다."
343150,판례내용,139,"마지막으로, 피해학생들에 대한 피해 회복이 이루어지지 않았고, 원고가 피해학생들로 하여금 처벌불원서를 반 강제로 작성하게 했던 점, 피해학생들이 원고와의 완벽한 분리를 원하고 같이 있고 싶지 않다고 했으며 사과를 받아줄 마음이 없다고 분명하게 이야기한 점에서 화해 정도도 없다고 만장일치로 판단하였다."
343150,판례내용,140,"원고와 피해학생들의 관계, 원고의 피해학생들에 대한 폭행이 일어난 장소나 시간, 폭행의 사유 등에 비추어 보면, 이 사건 심의위원회가 위와 같이 판단한 것이 아무런 근거가 없고 사회통념상 현저히 타당성을 잃었다고 할 수 없다."
343150,판례내용,141,"특히 원고는 피해학생들에 대한 행위를 학교폭력으로 인식하지 못하고 도리어 이를 피해학생들이 원했다거나, 한 대 ‘툭’ 치는 정도였다는 식으로 자신의 행동을 합리화 내지 정당화하기 위한 변명을 하기에 급급한 태도를 보여 온 점, 이 사건 학교장이 원고에 대하여 긴급하게 피해학생들에 대한 접촉금지 등의 조치를 하였음에도 원고가 피해학생들과 수시로 접촉하고, 그 과정에서 피해학생들에게 처벌불원서를 작성받으려고 하다가 처벌불원서 작성을 주저하는 피해학생들을 심리적으로 압박한 것으로 보이는 점 등을 감안하면, 원고에게 개전의 가능성이 있다고 보기 어려우므로, 원고에 대한 퇴학처분조치를 경감할 사유가 있다고도 볼 수 없다."
343150,판례내용,142,따라서 원고에 대한 퇴학처분조치인 이 사건 처분이 최소침해의 원칙에 반한다고 할 수 없다.
343150,판례내용,143,"○ 이 사건 심의위원회가 원고에 대한 퇴학처분조치 결정을 함에 있어 위 조치 결정 이유의 사안개요란 적시된 사실관계 이외에도 원고가 피해학생들에게 강제로 기절놀이를 시키고, 피해학생들로부터 강압적으로 처벌불원서를 받았다는 점 등을 고려하였다 하더라도, 이 사건 심의위원회의 심의 과정에서 이루어진 피해학생들과 그 보호자들의 진술, 원고와 원고의 보호자의 진술 등에 의하면 이 사건 심의위원회가 고려한 이러한 사정들이 인정되고, 이 사건 심의위원회는 원고의 학교폭력의 지속성, 원고의 반성정도, 피해학생들과의 화해정도를 판단하기 위해 이러한 사정 등을 고려한 것이라고 할 수 있어, 이 사건 처분에 오류가 있다고 할 수는 없다."
343150,판례내용,144,"○ 이 사건 처분으로 인한 원고의 불이익이 중대하다고 할 수 있으나, 이 사건 처분으로 인해 원고가 입게 된 불이익을 고려하더라도, 원고의 학교폭력의 유형 등에 비추어 보면 원고의 피해학생들에 대한 학교폭력의 정도가 중하고, 이 사건 처분으로 달성하고자 하는 피해학생의 보호, 가해학생의 선도․교육 등을 통하여 학생의 인권을 보호하고 학생을 건전한 사회구성원으로 육성하고자 하는 공익이 원고의 위 불이익보다 결코 가볍지 아니하므로, 이 사건 처분이 비례의 원칙에 반한다고 할 수 없다."
343150,판례내용,145,3.결론
343150,판례내용,146,"그렇다면, 원고의 청구는 이유 없으므로 이를 기각하기로 하여, 주문과 같이 판결한다."
343150,판례내용,147,재판장 판사 김○
343150,판례내용,148,판사 김○
343150,판례내용,149,판사 임○
