판례일련번호,구분,문장번호,내용
344419,판례내용,1,서 울 고 등 법 원
344419,판례내용,2,제 9 - 3 행 정 부
344419,판례내용,3,판 결
344419,판례내용,4,사 건 2023누55926 환지예정지 지정처분 무효확인 등 청구의 소
344419,판례내용,5,"원고, 항소인 A종교단체 B교회"
344419,판례내용,6,소송대리인 법무법인(유한)로고스
344419,판례내용,7,"담당변호사 김○, 오○,1)정○"
344419,판례내용,8,"피고, 피항소인 C마을 도시개발구역 도시개발사업조합"
344419,판례내용,9,소송대리인 법무법인(유한)태평양
344419,판례내용,10,"담당변호사 박○, 이○"
344419,판례내용,11,제1 심판결 서울행정법원 2023.8.10.
344419,판례내용,12,선고 2022구합71745 판결
344419,판례내용,13,변 론 종 결 2024.1.18.
344419,판례내용,14,판 결 선 고 2024.3.14.
344419,판례내용,15,주 문
344419,판례내용,16,1.원고의 항소를 모두 기각한다.
344419,판례내용,17,2.항소비용은 원고가 부담한다.
344419,판례내용,18,청구취지․항소취지
344419,판례내용,19,1)2024.2.29.
344419,판례내용,20,"담당변호사 지정이 철회되었지만, 변론종결 당시를 기준으로 표시한다."
344419,판례내용,21,제1심판결을 취소한다.
344419,판례내용,22,"주위적으로, 피고가 2022.6.7."
344419,판례내용,23,"서울 서초구 D 대 2,910㎡의환지예정지로 C마을 도시개발구역 E블럭 내 총 6필지 2,171㎡를 지정한 처분이 무효임을 확인한다."
344419,판례내용,24,"예비적으로, 위 처분을 취소한다."
344419,판례내용,25,이 유
344419,판례내용,26,"1.처분의 경위, 피고의 본안전항변에 대한 판단, 절차상 하자 존재 여부에 대한 판단"
344419,판례내용,27,"이 법원이 이 부분에 관해 적을 이유는 제1심판결 이유 제1항, 제2항 및 제3의 가.1)항, 제3의 나.1)항 기재와 같다."
344419,판례내용,28,"그러므로 행정소송법 제8조 제2항, 민사소송법 제420조 본문에 따라 이를 그대로 인용한다(제1심판결의 별지 포함.여기서 설정된 약칭도 그대로 사용한다)."
344419,판례내용,29,2.이 사건 환지예정지에 교회를 지을 수 없어 위법하다는 주장에 대한 판단
344419,판례내용,30,가.원고의 주장 요지
344419,판례내용,31,"마을 조성 단계에서부터 존속해 온 교회에 대해 종교용지 대신 제1종 전용주거지역 내 택지를 환지함으로써 교회가 더 이상 존속할 수 없게 하는 것은, 환지원칙에 위배됨과 아울러 헌법이 보장하는 종교의 자유에 기한 기본권을 침해하는 것이다(이 사건 환지예정지는 이 사건 사업구역 제1종 전용주거지역에 포함되어 있어 교회를 지을수 없을 뿐만 아니라, 위치도 이 사건 사업구역의 중심부에서 벗어나 있다)."
344419,판례내용,32,선행 고시는 그와 같은 종교용지 조성에 관한 내용을 부당하게 제외하여 위법하다.
344419,판례내용,33,그와 같은 하자는 이 사건 처분에 승계된다.
344419,판례내용,34,"원고가 환지계획 인가 신청 단계에서야 계획에 관한 통지를 받았던 이상, 원고로서는 선행 고시의 위법을 독립한 사유로주장할 수 있다."
344419,판례내용,35,이와 같은 개발계획의 수립 및 실시계획의 인가는 얼마든지 변경이 가능하다.
344419,판례내용,36,피고는 이처럼 종교용지 조성이 포함된 내용으로 변경된 개발계획․실시계획에 기하여원고가 계속 사역할 수 있도록 교회 건물을 지을 수 있는 토지를 이 사건 토지의 환지예정지로 지정하는 등의 방식으로 이 사건 처분을 했어야 한다.
344419,판례내용,37,이를 간과한 이 사건처분은 위법하다.
344419,판례내용,38,나.관계 법령
344419,판례내용,39,"1)제1, 2고시 관련 : 도시개발구역 지정 ․ 변경 및 시행자 지정"
344419,판례내용,40,도시개발법은 계획적인 도시개발이 필요하다고 인정되는 때에 특별시장 등이 도시개발구역을 지정할 수 있다고 규정한다(제3조 제1항).
344419,판례내용,41,지정권자는 도시개발구역을 지정하려면 해당 도시개발구역에 대한 도시개발사업의 계획(이하 “개발계획”이라 한다)을 수립하여야 한다(제4조 제1항).
344419,판례내용,42,지정권자는 직접 또는 일정한 자의 요청을 받아 개발계획을 변경할 수 있다(제4조 제3항).
344419,판례내용,43,"개발계획에는 도시개발구역의 명칭․위치 및 면적,도시개발구역의 지정 목적과 도시개발사업의 시행기간, 도시개발사업의 시행자 및 시행방식, 인구수용계획, 토지이용계획 등이 포함되어야 한다(제5조 제1항)."
344419,판례내용,44,"지정권자는도시개발구역을 지정한 경우 대통령령으로 정하는 바에 따라 이를 관보나 공보에 고시하고, 대도시 시장인 지정권자는 관계 서류를 일반에게 공람시켜야 한다(제9조 제1항)."
344419,판례내용,45,도시개발구역이 지정ㆍ고시된 경우 해당 도시개발구역은 국토의 계획 및 이용에 관한법률에 따른 도시지역과 대통령령으로 정하는 지구단위계획구역으로 결정되어 고시된것으로 본다(제9조 제2항).
344419,판례내용,46,"도시개발구역의 전부를 환지 방식으로 시행하는 경우, 도시개발구역의 토지 소유자 또는 도시개발구역의 토지 소유자가 도시개발을 위하여 설립한 조합을 시행자로 지정한다(제11조 제1항 단서 및 같은 항 제5호, 제6호)."
344419,판례내용,47,2)제3고시 관련 : 실시계획 인가 ․ 변경
344419,판례내용,48,"도시개발법은 시행자가 도시개발사업에 관한 실시계획을 작성하여야 하고, 이 경우 실시계획에는 지구단위계획이 포함되어야 한다고 규정한다(제17조 제1항)."
344419,판례내용,49,시행자는그 실시계획에 관해 지정권자의 인가를 받아야 한다.
344419,판례내용,50,"지정권자가 실시계획을 작성․인가한 경우 이를 관보나 공보에 고시하고, 대도시 시장인 지정권자는 일반에게 관계 서류를 공람시켜야 한다(제18조 제1항)."
344419,판례내용,51,이에 따라 실시계획을 고시한 경우 그 고시된 내용 중 국토의 계획 및 이용에 관한 법률에 따라 도시ㆍ군관리계획(지구단위계획을 포함)으로 결정하여야 하는 사항은 같은 법에 따른 도시ㆍ군관리계획이 결정되어 고시된것으로 본다(제18조 제2항).
344419,판례내용,52,"도시개발법 제17조 제1항의 위임에 따른 도시개발법 시행령은, 위와 같은 실시계획이 개발계획에 맞게 작성되어야 한다고 규정한다(제38조 제1항)."
344419,판례내용,53,실시계획 작성에 필요한 세부적 사항은 국토교통부장관이 정한다(제38조 제3항).
344419,판례내용,54,다시 그 위임에 따른 구도시개발업무지침(2022.6.22.
344419,판례내용,55,"국토교통부훈령 제1531호로 개정되기 전의 것.이하 ‘도시개발업무치침’이라고만 한다)은 제3편 제2장에서 실시계획인가신청을 위한 첨부 도면 및 서류로 위치도, 토지관련서류, 계획평면도, 인․허가의제 법률에 따른 실시설계도, 사업비 및 자금조달계획, 환지 방식으로 시행할 경우 시행자별 규약, 시행규정, 조례, 부담률 계산서 등을 규정하고 있다."
344419,판례내용,56,"3)이 사건 신청, 이 사건 인가, 이 사건 처분 관련 : 환지계획, 환지예정지 지정도시개발법은 시행자가 도시개발사업을 환지 방식으로 시행하려면, 환지 설계(제1호), 필지별로 된 환지 명세(제2호), 필지별과 권리별로 된 청산 대상 토지 명세(제3호), 체비지 또는 보류지의 명세(제4호), 입체 환지용 건축물의 명세와 공급 방법·규모에 관한 사항(제5호), 그 밖에 국토교통부령으로 정하는 사항(제6호)이 포함된 환지계획을 작성해야 한다고 규정한다(제28조 제1항)."
344419,판례내용,57,"환지계획은 종전의 토지와 환지의 위치ㆍ지목ㆍ면적ㆍ토질ㆍ수리ㆍ이용 상황ㆍ환경, 그 밖의 사항을 종합적으로 고려하여 합리적으로 정하여야 한다(제28조 제2항)."
344419,판례내용,58,"행정청이 아닌 시행자가 제28조에 따라 환지계획을 작성한 경우에는, 특별자치도지사 등의 인가를 받아야 한다(제29조 제1항)."
344419,판례내용,59,시행자는 도시개발사업의 시행을 위하여 필요하면 도시개발구역의 토지에 대하여 환지예정지를 지정할 수 있다(제35조 제1항).
344419,판례내용,60,다.선행 고시의 하자가 이 사건 처분에 승계되는지 여부 등에 대한 판단
344419,판례내용,61,"1)나.항 기재 법령을 살펴보면, 이 사건 사업과 같은 도시개발사업은 ⓐ 도시개발구역 지정 및 변경(개발계획 수립, 제1, 2고시) → ⓑ 실시계획의 작성․인가 및 변경(제3고시) → ⓒ 환지계획의 작성․인가(이 사건 신청, 이 사건 인가)→ ⓓ 환지예정지 지정(이 사건 처분)순으로 여러 단계의 행정처분을 거쳐 진행된다."
344419,판례내용,62,"2)ⓐ 도시개발구역 지정(개발계획 수립)은 도시개발법 제4조 제1항 등에 따른 것으로, 도시개발구역의 명칭․위치와 면적, 도시개발사업 시행자 및 시행방식 등을 정하는 처분이다."
344419,판례내용,63,"이를 통해 원칙적으로, 해당 도시개발구역이 국토의 계획 및 이용에 관한법률(이하 ‘국토계획법’이라 한다)에 따른 도시지역과 대통령령으로 정하는 지구단위계획구역으로 결정․고시된 것과 같이 간주하는 도시계획 의제의 효력이 발생한다."
344419,판례내용,64,"반면ⓑ 도시개발법 제17조 제1항에 따른 실시계획의 인가는, 개발계획 수립에 따른 특정사업을 구체화하여 이를 실현하는 것으로서, 도시개발구역 내 개별 토지의 구체적 이용계획, 기반시설 설치 계획 등을 정하는 처분으로 이해된다.실시계획을 고시한 경우,그 고시된 내용 중 국토계획법에 따라 도시․군관리계획이 결정․고시된 것으로 보는도시․군관리계획 의제의 효력이 발생한다."
344419,판례내용,65,"한편 ⓒ 도시개발법 제29조 제1항에 따른환지계획의 인가는, 위와 같은 개발계획․실시계획을 전제로 토지의 소유권 등을 권리자 의사와 관계없이 강제적으로 교환․분합하는 공용환지의 계획에 대한 승인 처분이라고 할 수 있다.환지계획은 환지예정지 지정이나 환지처분의 근거가 될 뿐, 그 자체가 직접 토지소유자 등의 법률상의 지위를 변동시키거나 또는 환지예정지 지정이나 환지처분과 다른 고유한 법률효과를 수반하는 것은 아니다(대법원 1999.8.20."
344419,판례내용,66,선고 97누6889 판결 참조).
344419,판례내용,67,"3)한편 구 택지개발촉진법 제3조에 따른 건설교통부장관의 택지개발예정지구 지정 처분과 같은 법 제8조에 따른 건설교통부장관의 택지개발사업 시행자에 대한 택지개발계획 승인 처분이 서로 독립한 행정처분이라는 취지로 판시한 대법원 1996.3.22.선고 95누10075 판결은, 이 사건과 비교하여 그 입법의 목적이나 법적 성격, 절차적유사성 등에서 상당 부분 공통된다."
344419,판례내용,68,따라서 이 사건에 의미 있는 선례라고 할 수 있다.
344419,판례내용,69,"나아가 도시개발법은 앞서 본 대로 도시개발계획구역 지정․고시 단계에서는 국토계획법상 도시계획 의제의 효력을, 실시계획 인가․고시 단계에서는 국토계획법상도시․군관리계획 의제의 효력을 각 부여한다."
344419,판례내용,70,"이처럼 도시개발법상 도시개발사업에관한 단계적 규율 내용은, 국토계획법상 도시․군(관리)계획의 내용이나 체계와 밀접하게 연결되어 있다."
344419,판례내용,71,그런데 대법원 2017.7.18.
344419,판례내용,72,"선고 2016두49938 판결은 국토계획법상 도시․군계획시설결정과 실시계획인가는 단계적 행정절차에서 별도의 요건과 절차에 따라 별개의 법률효과를 발생시키는 독립적 행정처분으로서, 선행처분에 하자가 있더라도 그것이 당연 무효가 아닌 한 원칙적으로 후행처분에 승계되지 않는다는 법리를판시하였다."
344419,판례내용,73,"국토계획법에서 정하는 사업 관련 처분의 단계적 진행과정, 그 법적 성격이나 입법 목적 및 체계 등과 비교하면, 도시개발법상 도시개발구역 지정 처분, 실시계획 인가 처분과 그 이후 처분 사이의 관계도 위 법리와 크게 다르지 않다."
344419,판례내용,74,"4)이와 같은 각 처분의 내용, 효과, 법적 성격 및 관련 법령과 판례의 입장 등을종합하면, ⓐ 도시개발계획구역 지정(개발계획 수립)처분과 ⓑ 실시계획의 인가 처분은, ⓒ 환지계획 인가 처분이나 ⓓ 이 사건 처분(환지예정지 지정 처분)과의 관계에서,후자가 전자의 처분을 전제로 하는 것이지만 각각 단계적으로 별개의 법률효과를 발생하는 독립한 행정처분이라고 해석함이 타당하다."
344419,판례내용,75,즉 ⓐ / ⓑ / ⓒ~ⓓ의 관계가 된다.
344419,판례내용,76,"그러므로 개발계획 수립이나 실시계획 인가(변경)처분상의 하자가 중대․명백하여 당연 무효라는 특별한 사정이 없는 한, 거기에 위법사유가 있다고 하더라도 그 하자가후행 처분인 환지계획 인가 처분 내지는 이에 기한 환지예정지 지정 처분에 승계된다고 할 수 없다."
344419,판례내용,77,"5)원고는 이와 관련하여, 서울특별시장이 피고의 제안에 따라 이 사건 사업구역에 편입된 토지에 주택건설용지, 근린생활시설용지, 도시기반시설용지를 조성하면서도종교용지는 조성하지 않는 내용으로 제1, 2고시를 하였으므로, 그 하자가 제3고시, 이사건 인가 및 이 사건 처분에 승계된다는 취지의 주장도 전개하였다.그런데 제1, 2고시 과정에서 피고의 제안에 따라 종교용지 조성이 제외된 것인지 여부는, 이 사건 기록에 나타난 증거들만으로는 명확하게 판단할 수 없다."
344419,판례내용,78,"종교용지를 조성하지 않는 내용으로 개발계획, 실시계획이 작성된 것을 두고, 아래 라.항에서 보는 것처럼 그것이도시개발법령에 위배되거나 헌법상 종교의 자유를 침해하는 위법․위헌의 처분이라고보기는 어렵다."
344419,판례내용,79,"설령 그러한 위법․위헌의 소지가 있다고 가정하더라도, 그와 같은 하자가 중대․명백하여 당연 무효에 이른다고 보기는 더더욱 힘들다."
344419,판례내용,80,6)한편 원고는 이 사건 신청 단계에서야 이 사건 사업의 환지계획 등을 통지받았다(따라서 원고는 그와 같은 위법 사유를 독립하여 주장할 수 있다)는 취지로도 주장한다.
344419,판례내용,81,"그러나 원고가 현실적으로 이 사건 사업의 내용을 인지한 시점은 그 주장과 같다 해도, 이미 그 이전의 개발계획 수립, 실시계획 수립․인가 단계에서 각각 그 내용을 관보․공보에 고시하거나 관계 서류를 일반에 공람하는 절차가 규정되어 있음을 고려하면[위 나.1), 2)항 참조], 원고 주장의 사정을 들어 선행처분의 후행처분에 대한구속력을 부정할 수 없다."
344419,판례내용,82,"한편 대법원은 선행처분의 후행처분에 대한 구속력에 관한 예외적 법리, 즉 선행처분과 후행처분이 서로 독립하여 별개의 효과를 목적으로 하는 경우에도 선행처분의 불가쟁력이나 구속력이 그로 인하여 불이익을 입게 되는 자에게 수인한도를 넘는가혹함을 가져오며 그 결과가 당사자에게 예측 가능한 것이 아닌 경우 국민의 재판받을 권리를 보장하고 있는 헌법의 이념에 비추어 선행처분의 후행처분에 대한 구속력은부정된다는 법리를 판시한 적이 있다(대법원 2013.3.14."
344419,판례내용,83,선고 2012두6964 판결2)참조).
344419,판례내용,84,"그러나 이 사건은 이 판례와 그 사안을 달리 하므로, 위와 같은 예외적 법리에 포섭되는 경우라고 볼 수도 없다."
344419,판례내용,85,"7)원고의 주장처럼 이미 고시된 실시계획이라 하더라도, 그 변경은 특별한 사정이 없는 한 가능하다."
344419,판례내용,86,"하지만 이 사건 사업의 실시계획이 일응 고시․확정된 이상, 실시계획의 후발적 변경은 어디까지나 그 계획의 인가(변경)권자인 행정청의 직권에 의해서만 가능하다(처분의 직권취소에 관한 행정기본법 제18조 제1항, 적법한 처분의 철회에 관한 행정기본법 제19조 참조)."
344419,판례내용,87,2)甲을 친일반민족행위자로 결정한 친일반민족행위진상규명위원회의 최종발표(선행처분)에따라 지방보훈지청장이 독립유공자 예우에 관한 법률 적용 대상자로 보상금 등의 예우를받던 甲의 유가족 乙 등에 대하여 독립유공자법 적용배제자 결정(후행처분)을 한 사안에관한 것이다.
344419,판례내용,88,"이는 그 실시계획과 같은 행정처분이 ‘위법’한 것인지 여부를 가려 이를 취소할 수 있는 법원의 ‘쟁송취소’(행정소송법 제29, 30조 참조)와는 엄연히 구별된다."
344419,판례내용,89,"그러므로 실시계획에 관하여 향후 행정청의 직권취소․변경이가능하다고 해서, 실시계획상 하자가 이 사건 처분에 승계된다는 쟁송취소 관련 주장의 논거로 삼기는 적합하지 않다."
344419,판례내용,90,"8)결국 선행 고시(제1, 2고시)의 위법이 이 사건 처분에 그대로 승계된다거나, 이사건 처분의 취소를 구하는 원고가 선행 고시의 위법을 독립적 위법사유로 주장할 수있다는 원고의 주장은 받아들일 수 없다."
344419,판례내용,91,라.환지원칙(종교의 자유)에 위배되는지 여부에 대한 판단
344419,판례내용,92,"1)도시개발법은 “환지계획은 종전의 토지와 환지의 위치ㆍ지목ㆍ면적ㆍ토질ㆍ수리ㆍ이용 상황ㆍ환경, 그 밖의 사항을 종합적으로 고려하여 합리적으로 정하여야 한다.”고 정한다(제28조 제2항)."
344419,판례내용,93,"그 위임에 따른 도시개발법 시행규칙은, 시행자가 환지계획을 작성할 때 실시계획 인가 사항, 환지계획구역의 시가화 정도, 토지의 실제 이용현황과 경제적 가치 등을 종합적으로 고려하여야 한다든가(제27조 제1항), 환지의 위치는 환지 전 토지의 용도, 보유 기간, 위치, 권리가액, 청산금 규모 등을 고려하여 정한다(제27조 제4항 제1호."
344419,판례내용,94,평면 환지의 경우)는 내용 등을 정하고 있다.
344419,판례내용,95,"2)이를 살펴보면, 환지계획에서 고려할 요소들로 종전 토지의 “이용 상황․환경”이나 환지 전 토지의 “토지의 실제 이용 현황”, “용도” 등이 열거되어 있기는 하다."
344419,판례내용,96,"하지만 ① 위 규정만을 들어, 환지 전 토지가 교회 등의 종교시설로 사용되었으면 환지(예정지)가 될 토지 역시 교회 등의 종교시설로 사용할 수 있도록 정하라는 취지라고곧바로 해석하기는 힘들다."
344419,판례내용,97,"위 법령은 그 밖에도, 종전 토지의 위치․지목․면적․권리가액․청산금 규모(경제적 가치)등을 종합적으로 고려할 것을 주문하고 있기 때문이다.② 도시개발법 제28조 제2항의 규정은 결국 환지계획을 “합리적으로” 정하라는 취지이다."
344419,판례내용,98,"그런데 원고의 교회를 이 사건 사업 이후에도 존치하는 것이 “합리적”인지 여부에 관해서는, 피고의 조합원들 사이에서도 그 의견이 다를 수 있다.그것이 환지 방식 도시개발사업에서의 공익성에 부합하는 것인지 여부 또한, 그 판단 기준을 구체화하는 더 이상의 성문 법령을 찾기 힘든 상황에서 누구도 섣불리 단정하기 어렵다."
344419,판례내용,99,③도시개발법은 도시개발에 필요한 사항을 규정하여 “계획적이고 체계적인 도시개발을도모하고 쾌적한 도시환경의 조성과 공공복리의 증진에 이바지”함을 목적으로 하는 법률이다.(제1조).
344419,판례내용,100,"이처럼 도시개발법은, 종교활동의 보장이나 종교시설의 존치 등과는 다소 거리가 있는 입법 목적을 제시하고 있다."
344419,판례내용,101,④ 위 법령에서는 “실시계획 인가 사항”을환지계획의 고려 대상 중 하나로 명시하고 있다.
344419,판례내용,102,"이와 관련하여, 환지계획 인가 여부를결정하는 행정청은 특별한 사정이 없는 한 환지계획이 실시계획의 구조나 기준 등에부합하는지 여부를 판단하는 것으로 충분하고, 그 사업의 공익성 여부나 사업 수행에따른 이익 형량을 다시 할 필요가 없다고 보이기도 한다.3)"
344419,판례내용,103,3)헌법 제20조 제1항은 종교의 자유를 기본권으로 명시하고 있다.
344419,판례내용,104,"하지만 그렇다고 해서, 원고가 반드시 이 사건 사업구역 내에서만 교회 부지 내지 그 건물을 소유하는 방식으로 종교 활동을 하도록 보장한다고 할 수는 없다(서울고등법원 2020.12.18.선고 2019누60907 판결 참조).4)"
344419,판례내용,105,"갑 제30호증을 비롯한 원고 제출 증거들에 의하면, 원고가 1965년 설립되어 60년 가까이 한센인들과 지역 주민들을 위한 돌봄․구제에 힘써 왔고, 이를 주도했던 A○ 기념비가 있는 사실을 인정할 수 있다."
344419,판례내용,106,"하지만 그 증거들만으로는 나아가, 원고소유의 이 사건 토지상 교회 건물이 역사적 건축물 등과 같은 보존․유지의 대상이라거나, 우리 사회공동체 구성원들 사이에서 이미 관습화된 문화요소로 인식되고 받아들여져 문화적 가치로 성숙한 종교적인 유형물에 해당한다5)고 인정하기에 부족하며 달리 이를 인정할 증거가 없다."
344419,판례내용,107,"원고가 내세우는 전통사찰의 보존 및 지원에 관한 법률이 정하는 ‘전통사찰’이 되려면 “역사적으로 볼 때 시대적 특색을 뚜렷하게 지니고 있다고 인정되는 사찰” 등의 요건을 충족해야 하고, 문화체육관광부장관의 지정이라는 공식적 행정처분이 필요하다(제4조 제2항).6)이를 고려하면, 교회 건물의 존치나 이 사건 사업구역 내 교회 건물의 신설을 위해 이 사건 사업 구역 내에 종교부지를 조성하지 않았다고 해서 ‘전통사찰’의 경우와 비교해 불평등한 취급을 했다고 보기도 곤란하다."
344419,판례내용,108,"4)서울특별시 지침인 ‘AF 지구 등 종교시설 처리방안’(갑 제23호증)에는, 종교시설은 우선적으로 존치되도록 검토한다든가, 이전이 불가피한 경우 존치에 준하는 이전계획을 수립하라는 등의 내용이 담겨 있다."
344419,판례내용,109,"국민권익위원회에 제출한 원고의 민원에대해, 원고가 환지계획의 변경을 요청하는 경우 피고가 변경의 적정성 등을 종합적으로 검토하여 원고와 협의하겠다는 의사를 표시했던 것으로 보이기도 한다(갑 제24호증)."
344419,판례내용,110,다만 위 지침은 일종의 권고 방침에 불과하다.
344419,판례내용,111,"거기에 어떠한 법적 구속력이 있다고 볼 수 없다.환지계획 변경에 관한 피고의 의사표시는 일종의 ‘협의’로서, 곧바로원․피고 사이의 법률관계에 대한 법적 효력을 발생시키는 것도 아니다."
344419,판례내용,112,5)결국 이 사건 처분이 환지원칙이나 헌법상 종교의 자유 규정에 위배된다는 취지인 원고의 주장도 받아들일 수 없다.
344419,판례내용,113,3.획지면적 상향이 위법하다는 주장에 대한 판단
344419,판례내용,114,"원고의 이 부분 주장은, 획지 규모가 당초 제1, 2종 전용주거지역 공히 600㎡ 이상으로 책정되었는데 2021.3.25."
344419,판례내용,115,"공동주택 건축이 가능한 제2종 전용주거지역의 최소획지 규모를 4,000㎡ 이상으로 대폭 상향시킴으로써, 비교적 넓은 토지를 소유한 원고를 비롯한 토지 소유자들(원주민들)이 제2종 전용주거지역을 배정받을 수 없도록 한것이 위법하다는 취지로 이해된다.7)"
344419,판례내용,116,도시개발법은 ‘개발계획’에 “토지이용계획”이 포함되어야 한다고 규정한다(제5조 제1항 제7호).
