판례일련번호,구분,문장번호,내용
339501,판례내용,108,"04:00경 망 O이 침대에서 낙상하자 날이 밝은 후 바로 병원 응급실로 데려가 진료를 받게 하였고, 이틀 뒤에도 진료를 받도록 하였는데, 최초 내원한 병원의 의사는 ‘부종이나 외상이 없다’고 진단하였으며, 이틀 뒤에도 ‘엑스레이, ct 촬영 결과 별다른 이상이 없다’는 소견을 밝혔던 점, 이 사건 요양원은 사고 발생 당일 그 사실을 보호자에게 알렸고, 이후 지속적으로 망 O의 상태를 관찰하며 돌보았던 것으로 보이는 점, G는 위 처분사유에 관하여 업무상과실치사혐의로 조사를 받았으나 불송치결정을 받은 점 등이 인정되므로, 이에 비추어 보면, 이 사건 의료기관이 망 O가 응급상황임에도 즉각 병원으로 이송하지 않거나 병원 치료를 받지 않게 하여 의료적 처치 및 보호를 소홀히 하였고, 이로 인해 망 O이 사망에 이르게 하였음을 인정하기 부족하고, 달리 이를 인정할 증거가 없으므로 처분사유 인정되지 않음."
339501,판례내용,109,망 P 성적 학대 2022.7.21.
339501,판례내용,110,"둔부를 가림막으로 가리지 않은 채 기저귀를 벌린 채 침상에 누워있도록 함.을 제37호증의5의 기재와 영상 및 변론 전체의 취지에 의하면, G는 이 사건 전문기관의 조사시 망 P에게 가림막 없이 기저귀케어를 제공한 사실을 인정하였고, 이 사건 전문기관 조사원은 2022.7.21."
339501,판례내용,111,"현장조사시 P의 기저귀가 벌려진 채 침상에 누워 둔부가 노출된 것을 직접 확인하였는바 그 사실이 인정되고, 이러한 행위는 성적 수치심을 느끼게 하는 행위로서 성적 학대에 해당함.처분사유 인정됨."
339501,판례내용,112,"사전에 수급자 본인이나 보호자에게 동성 요양보호사 선호 여부의 확인, 이성 요양보호사 서비스 제공에 대한 동의 등을 받지 않고 2022.8.24."
339501,판례내용,113,"남성요양보호사가 기저귀 교체 등 케어하게 함.을 제37호증의5의 기재와 영상 및 변론 전체의 취지에 의하면, 망 P의 생활실(Q방) 방배정표에 2022.8.21."
339501,판례내용,114,"및 같은 달 25일 담당 요양보호사가 남성으로 배정되어 있었고, 이 사건 전문기관의 조사원은 ‘P에 대한 장기요양급여제공 기록지에 의하면 2022.8.15."
339501,판례내용,115,"남성요양보호사가 옷 갈아입히기, 몸단장, 기저귀 케어를 실시한 것으로 확인된다’는 조사서를 작성하였던 점, 원고도 남성요양보호사에 의한 케어가 불가피하다고 주장할 뿐 케어한 사실 자체를 부인하지는 않는 점, 그럼에도 보호자로부터 동의를 받았다고 볼 자료는 없고, 원고는 보호자가 이를 묵인하였다고 주장할 뿐인 점에 비추어 보면, 2022.8.15, 같은 달 21일, 25일경 이루어진 각 행위가 인정되고, 위 각 행위는 수급자에게 성적 수치심을 주는 행위로서 성적학대에 해당한다고 봄이 타당함.처분사유 인정됨."
339501,판례내용,116,"신체적 학대 퇴소한 다른 수급자의 처방약을 복용하게 하여 불필요한 의료처치를 함.을 제37호증의5의 기재 및 영상, 변론 전체의 취지에 의하면 원래 처방받은 퇴소한 다른 수급자 인 K의 이름을 지우고 P의 이름을 기재한 약봉투 사진이 첨부되어 있고, 이 사건 요양원의 전 요양보호사가 ‘G로부터 퇴소한 다른 수급자의 처방약을 P에게 투약하라고 지시를 받은 사실이 있다’고 진술한 사실은 인정됨."
339501,판례내용,117,"그러나 그 진술을 뒷받침할 증거 및 그와 같은 지시를 할 필요가 있었다고 볼 아무런 자료는 없으며, P가 실제로 약을 복용하지도 않았던 것으로 보이는 점 등에 비추어 보면, 이 사건 요양원이 퇴소한 다른 수급자의 처방약을 망 P에게 불필요하게 복용하게 하여 신체적 학대를 하였음을 인정하기 부족함.처분사유 인정되지 않음."
339501,판례내용,118,"N 성적 학대 사전에 수급자 본인이나 보호자에게 동성 요양보호사 선호 여부의 확인, 이성 요양보호사 서비스 제공에 대한 동의 등을 받지 않고 기저귀케어와 목욕서비스 등을 제공하였음.을 제37호증의6의 기재 및 변론 전체의 취지에 의하면, N은 이 사건 전문기관 조사원과의 대면 상담시 ‘남자 요양보호사가 들어와 기저귀 케어를 했다’고 진술하였고, G는 이에 대해 2022.8.24."
339501,판례내용,119,"‘동의를 받은 사실이 없다’고 진술하였으며, 생활실(R방)의 배치표상 2022.8.21."
339501,판례내용,120,"및 같은 달 31.경 남성요양보호사가 홀로 야간근무를 하였고, 장기요양급여제공 기록지에도 2022.8.24.부터 28.까지 남성요양보호사가 옷 갈아입히기, 몸단장, 기저귀 케어 실시하였다고 기록되어 있는 점에 비추어 보면, 위 각 일자에 N나 보호자의 동의 없이 기저귀케어, 목욕서비스 등을 남성 요양보호사로부터 받게 한 사실이 인정되고, 위 각 행위는 수급자에게 성적 수치심을 주는 행위로서 성적학대에 해당한다고 봄이 타당함.처분사유 인정됨."
339501,판례내용,121,신체적 학대 2022.11.18.
339501,판례내용,122,"침대 난간 높이를 높게 하거나 철창을 설치하여 침대 밖으로 나오지 못하게 함으로써 신체를 구속함.을 제37호증의6의 기재와 영상 및 변론 전체의 취지에 의하면, 이 사건 요양원은 2022.11.18."
339501,판례내용,123,자고 있는 N의 침상 한쪽에 철제 난간을 설치해 둔 사실이 인정됨.
339501,판례내용,124,"그러나 그 난간의 형태와 기능에 비추어 N의 신체를 직접 구속하거나 밖으로 나오지 못하게 하기 위한 목적으로 보이지 않고, 이로 인해 N이 신체 일부 또는 모두를 사용하지 못한 것으로 보기도 어려우며, 원고는 N이 수면시 자주 침대에서 떨어져 철제난간을 설치한 것이라고 주장하고 있는 점, 이 사건 전문기관 조사원은 2022.11.18."
339501,판례내용,125,"이를 목격한 외에 다른 현장조사일에는 철제 난간을 사용한 것을 보지 못하였으므로 장시간 이유 없이 억제대를 사용한 것으로 보기도 어려운 점 등에 비추어 보면, 비록 이 사건 요양원이 신체구속사유와 그 시간을 별도로 급여제공기록지에 기록하지 않았다고 하더라도 이를 두고 신체적 학대라고 볼 수는 없으므로, 처분사유 인정되지 않음."
339501,판례내용,126,"P 성적 학대 사전에 수급자 본인이나 보호자에게 동성 요양보호사 선호 여부의 확인, 이성 요양보호사 서비스 제공에 대한 동의 등을 받지 않고 2022.8.남성요양보호사로부터 기저귀케어 등 받게 하여 성적 학대.을 제37호증의 7의 기재 및 변론 전체의 취지에 의하면, P은 이 사건 전문기관 조사원과의 대면 상담시 ‘남성요양보호사가 기저귀를 교체한 사실이 있고, 싫지만 어쩔 수 없다’고 진술하였으며, G는 이에 대해 2022.8.24."
339501,판례내용,127,‘동의를 받은 사실이 없다’고 진술하였음.
339501,판례내용,128,생활실(S방)의 배치표상 2022.8.21.
339501,판례내용,129,"및 같은 달 31일 남성요양보호사가 홀로 야간근무를 하였고, 이 사건 전문기관 조사원이 2022.8.24."
339501,판례내용,130,남성요양보호사가 P의 기저귀 케어를 하는 사실을 직접 목격하였던 점이 인정됨.
339501,판례내용,131,"따라서 위 각 일자에 P의 동의 없이 남성 요양보호사로부터 기저귀케어를 받게 한 사실이 인정되고, 위 각 행위는 수급자인 P에게 성적 수치심을 주는 행위로서 성적학대에 해당한다고 봄이 타당함.처분사유 인정됨."
339501,판례내용,132,"L 성적학대 사전에 수급자 본인이나 보호자에게 동성 요양보호사 선호 여부의 확인, 이성 요양보호사 서비스 제공에 대한 동의 등을 받지 않고 2022.8.남성요양보호사로부터 기저귀케어 등 받게 하여 성적 학대.을 제37호증의 8의 기재 및 변론 전체의 취지에 의하면, L은 이 사건 전문기관 조사원과의 대면 상담시 ‘남성요양보호사가 기저귀를 교체한 사실이 있고, 악을 썼으나 다시 또 와서 교체하였다’고 진술하였으며, G는 2022.8.24."
339501,판례내용,133,‘동의를 받은 사실이 없다’고 진술하였음.
339501,판례내용,134,"생활실(R방)의 배치표상 담당 요양보호사로 남성요양보호사가 배정되었고, 이 사건 전문기관 조사원은 2022.8.21."
339501,판례내용,135,"및 같은 달 25경 남성요양보호사가 L의 옷 갈아입히기, 기저귀케어 등을 실시하였다고 기록된 사실을 확인하고 이를 조사보고서에 기재한 사실이 인정되므로, 위 각 일자에 수급자 본인 또는 보호자의 동의 없이 남성 요양보호사로부터 기저귀케어를 받게 한 사실이 인정되고, 이러한 행위는 수급자에게 성적 수치심을 주는 행위로서 성적학대에 해당한다고 봄이 타당함.처분사유 인정됨."
339501,판례내용,136,"T 성적 학대 사전에 수급자 본인이나 보호자에게 동성 요양보호사 선호 여부의 확인, 이성 요양보호사 서비스 제공에 대한 동의 등을 받지 않고 2022.8.남성요양보호사로부터 기저귀케어 등 받게 하여 성적 학대.을 제37호증의 9의 기재 및 변론 전체의 취지에 의하면, T의 보호자는 ‘이성으로부터 기저귀케어를 받는다는 것에 동의한 사실이 없고, 동의하고 싶지 않다’고 진술하였음에도, 생활실(R방)의 배치표상 담당 요양보호사로 남성요양보호사가 배정되었고, 이 사건 전문기관 조사원은 2022.8.24."
339501,판례내용,137,"내지 28.까지 남성요양보호사가 옷 갈아입히기, 몸단장, 기저귀 케어 실시하였다고 기록된 사실을 확인하였던 점이 인정되므로, 위 각 일자에 수급자 본인 또는 보호자의 동의 없이 남성 요양보호사로부터 기저귀케어를 받게 한 사실이 인정되고, 이러한 행위는 수급자에게 성적 수치심을 주는 행위로서 성적학대에 해당한다고 봄이 타당함.처분사유 인정됨."
339501,판례내용,138,"신체적 학대 보호자에게 사전 동의와 사후 정황 보고 또는 본인 동의 없이 억제대를 사용하여 신체를 구속함.을 제37호증의 9의 기재와 영상, 변론 전체의 취지에 의하면, 이 사건 요양원에서 2022.10.23."
339501,판례내용,139,"T의 낙상사고 발생 직후 침대 한 면에 나무 합판을 설치하였고, 이 사건 전문기관 조사원이 2022.11.1."
339501,판례내용,140,"나무합판이 설치된 모습을, 2022.12.6.에 는 철제 난간이 설치된 모습을 목격한 사실은 인정됨."
339501,판례내용,141,"그러나 같은 증거에 의하면, 2022.10.23."
339501,판례내용,142,"나무합판을 설치한 것은 T이 침대에서 낙상하자 다시 떨어지지 않도록 한 조치로서, 한쪽 면에만 설치하였으며, 그 형태와 기능에 비추어 T의 신체를 구속하거나 가두는 것은 아닌 점, 원고는 이후에도 낙상을 방지하기 위해 요양보호사가 자리를 비울 경우 등에만 합판이나 철제난간을 사용한 것일 뿐이라고 주장하고 있고, T은 낙상사고로 고관절 골절상을 입었으므로 이후 낙상 예방을 위한 조치는 수급자 본인의 치료 또는 보호를 도모하는 목적으로 볼 수 있는 점 등에 비추어 보면, 이 사건 요양원이 급여제공기록지에 이를 별도로 작성하지는 않았다거나 보호자에게 그 사실을 제대로 알리지 않은 업무처리상 잘못이 있다고 하더라도 이를 두고 T의 신체를 구속하거나 감금하여 신체적 학대를 하였다고 볼 수는 없으므로, 처분사유 인정되지 않음."
339501,판례내용,143,방임 학대 2022.10.23.
339501,판례내용,144,"23:28경 침대에서 낙상사고 발생하였음에도 즉시 병원에 이송하지 않아 의료적 처치 및 보호를 소홀히 함.을 제37호증의 9의 기재와 영상, 변론 전체의 취지에 의하면, T은 98세의 고령으로 치매 등 질환을 겪고 있으며, 과거 대퇴부 골절 이력이 있고, 이 사건 요양원의 요양보호사는 사고 직후 그 사실을 알게 되었던 사실이 인정됨."
339501,판례내용,145,"그렇다면 이 사건 요양원으로서는 T의 연령과 의사소통능력, 질환 등을 고려하여 즉시 병원에 내원하도록 하였어야 함에도, 아무런 조치 없이 T을 침상 위로 올린 후 나무합판을 가지고 와서 떨어지지 않도록 조치하였고, 다음 날 15시경에야 보호자에게 낙상사실을 알리고 종합병원에 내원하도록 하였으며, T은 종합병원에서 고관절 골절 진단을 받고 입원할 정도의 상태였던 점이 인정되므로, 위와 같은 사실 및 사정에 의하면 이 사건 요양원이 T에게 의료적 처치 및 보호를 소홀히 하여 방임에 이르렀다고 봄이 타당함.처분사유 인정됨.U 성적 학대 사전에 수급자 본인이나 보호자에게 동성 요양보호사 선호 여부의 확인, 이성 요양보호사 서비스 제공에 대한 동의 등을 받지 않고 2022.8.남성요양보호사로부터 기저귀케어 등을 받게 하여 성적 학대에 해당한다고 봄이 타당함.제37호증의10의 기재 및 변론 전체의 취지에 의하면, U의 보호자는 ‘이성으로부터 기저귀케어를 받는다는 것에 동의한 사실이 없고, 알게 되어 매우 불쾌하다’고 진술하였는데, 이 사건 전문기관 조사원은 2022.8.24."
339501,판례내용,146,현장조사 중 생활실(V방)의 배치표상 담당 요양보호사로 남성요양보호사가 배정된 사실 및 8월 근무편성표상 2022.8.21.
339501,판례내용,147,"및 같은 달 31.남성요양보호사가 홀로 야간근무를 한 사실을 확인하였던 점이 인정됨.남성요양보호사가 여성 수급자의 생활실을 담당하게 하여 성적 학대거나 단독으로 야간근무할 경우 기저귀케어를 포함한 업무가 당연히 수반될 것으로 보이고, 한편 원고 주장과 같이 입소자의 며느리인 P이 실제로 U의 방에 배치되었다고 볼 자료는 제출되지 않은 점에 비추어 보면, 위 각 일자에 수급자 본인 또는 보호자의 동의 없이 남성 요양보호사로부터 기저귀케어를 받게 한 사실이 인정되고, 이러한 행위는 수급자에게 성적 수치심을 주는 행위로서 성적학대에 해당한다고 봄이 타당함.처분사유 인정됨."
339501,판례내용,148,"신체적 학대 보호자에게 사전 동의와 사후 정황 보고 또는 본인 동의 없이 억제대를 사용하여 신체를 구속함.갑 제14호증, 을 제37호증의10의 각 기재 및 영상에 의하면, 이 사건 요양원에서 2022.11.1, 같은 달 18.및 2022.12.6."
339501,판례내용,149,U의 침상 한쪽에 나무합판 또는 철제난간을 설치한 사실은 인정됨.그러나 U은 2022.10.26.
339501,판례내용,150,"걷던 중 넘어진 사고로 고관절에 금이 가게 되었으므로, 이후 낙상 예방을 위한 조치는 수급자 본인의 치료 또는 보호를 도모하는 목적으로 볼 수 있는 점, U의 침상에 설치된 나무합판, 철제 난간의 형태, 기능, 위치에 비추어볼 때 U의 신체가 이로 인해 직접 구속된다고 볼 수 없고, 이 사건 요양원이 U의 보호자에게 그 사실을 알리며 동의를 받았던 점에 비추어 보면, 이 사건 요양원이 급여제공기록지에 이를 별도로 기재하지 않았다고 하더라도 이를 두고 U의 신체를 구속하거나 감금하여 신체적 학대를 하였다고 볼 수는 없으므로, 처분사유 인정되지 않음."
339501,판례내용,151,방임 학대 2022.10.26.
339501,판례내용,152,"14:36경 오후 프로그램 마친 후 보행보조기 이용하여 생활실로 이동하던 중 낙상하였으나 즉시 병원에 이송하지 않고 의료적 처치 및 보호를 소홀히 함.을 제37호증의10의 각 기재와 영상 및 변론 전체의 취지에 의하면, U은 2022.10.26."
339501,판례내용,153,"14:35경 보행보조기를 이용하여 걷던 중 오른쪽으로 쓰러졌고, 이 사건 요양원의 요양보호사는 즉시 낙상을 인지하여 U의 상태를 살폈으며, 다음 날 보호자에게 이를 알리고 종합병원 외래진료를 받게 한 사실, 담당 요양보호사는 지속적으로 U의 상태를 관찰하였으며, 같은 달 31.종합병원의 외래진료를 받게 하고 엑스레이 촬영결과 고관절에 금이 홀히 함 간 것을 확인하게 되었던 사정이 인정되는바, 위 사실과 사정들을 종합하면 이 사건 요양원이 U의 의료적 처치나 보호를 소홀히 하였고 그 정도가 방임으로 인한 학대에 이르렀다고 보기는 어려움.처분사유 인정되지 않음."
339501,판례내용,154,"망 W 성적 학대 사전에 수급자 본인이나 보호자에게 동성 요양보호사 선호 여부의 확인, 이성 요양보호사 서비스 제공에 대한 동의 등을 받지 않고 2022.8.남성요양보호사로부터 기저귀케어 등을 받게 하여 성적 학대에 해당한다고 봄이 타당함.제37호증의 11의 기재 및 변론 전체의 취지에 의하면, 이 사건 요양원은 망 W의 보호자에게 이성에 의한 기저귀케어 서비스 동의를 받지 않았고, 이 사건 전문기관의 조사원은 2022.8.24."
339501,판례내용,155,"남성요양보호사가 기저귀케어를 하고 있음을 직접 목격하였으며, 2022.8.생활실(V방)의 배치표상 담당 요양보호사로 남성요양보호사가 배정되었고, 2022.8.21 및 31.에는 남성요양보호사 홀로 야간근무를 실시하였던 점, 장기요양급여제공 기록지에 2022.8.24.부터 28.까지 옷 갈아입히기, 몸단장, 기저귀 케어를 남성요양보호사가 실시하였다고 기록되어 있는 점 등이 인정되므로, 위 각 일자에 수급자 본인 또는 보호자의 동의 없이 남성 요양보호사로부터 기저귀케어를 받게 한 사실이 인정되고, 이러한 행위는 수급자에게 성적 수치심을 주는 행위로서 성적학대에 해당한다고 봄이 타당함.처분사유 인정됨."
339501,판례내용,156,"신체적 학대 보호자에게 사전 동의와 사후 정황 보고 또는 본인 동의 없이 억제대를 사용하여 신체를 구속함.을 제37호증의 11의 기재와 영상 및 변론 전체의 취지에 의하면, 2022.11.17."
339501,판례내용,157,"망 W의 침상에 철제난간이 설치되어 있는 사진과 함께 그 사실에 대한 신고가 접수되었고, 다음 날 이 사건 전문기관의 현장조사시에도 그 철제 난간이 유지되고 있었던 사실, 망 W의 보호자 중 1인은 ‘낮에 설치하는 것에 대해서는 동의한 사실이 없다’고 진술하였던 점은 인정됨.그러나 한쪽 면에만 설치하였으며, 그 형태와 기능에 비추어 망 W의 신체가 직접 구속되거나 감금된 것이라고 보기 어렵고, 망 W의 당시 연령(90세)과 건강상태(치매 등 질환으로 의사소통 불가하였음)를 고려하였을 때 낙상을 방지하기 위한 보호 목적으로 사용되었을 가능성을 배제할 수 없는데, 피고가 제출한 자료만으로는 이 사건 요양원에서 지속적으로 위 철제난간을 사용하였는지 및 필요성의 존부에 대해서는 알 수 없는 점 등에 비추어 보면, 처분사유가 인정된다고 볼 수 없음."
339501,판례내용,158,"망 P 성적 학대 사전에 수급자 본인이나 보호자에게 동성 요양보호사 선호 여부의 확인, 이성 요양보호사 서비스 제공에 대한 동의 등을 받지 않고 2022.8.남성요양보호사로부터 기저귀케어 등을 받게 하여 성적 학대에 해당한다고 봄이 타당함.을 제37호증의 12의 기재와 영상, 변론 전체의 취지에 의하면, 망 P의 보호자는 ‘이성으로부터 기저귀케어를 받는다는 것에 동의한 사실이 없고, 알게 되어 매우 불쾌하다’고 진술하였는데, 이 사건 전문기관 조사원은 2022.8.24."
339501,판례내용,159,"현장조사 중 생활실(V방)의 배치표상 담당 요양보호사로 남성요양보호사가 배정된 사실을 확인하였고, 8월 근무편성표상 2022.8.21."
339501,판례내용,160,"및 같은 달 31.남성요양보호사가 홀로 야간근무를 한 사실이 확인되었던 점, 특히 장기요양급여제공 기록지에 2022.8.24.부터 27.까지 옷 갈아입히기, 몸단장, 기저귀 케어를 남성요양보호사가 실시하였다고 기록되어 있는 점이 인정되는바, 위 각 일자에 수급자 본인 또는 보호자의 동의 없이 남성 요양보호사로부터 기저귀케어를 받게 한 사실이 인정되고, 이러한 행위는 수급자에게 성적 수치심을 주는 행위로서 성적학대에 해당한다고 봄이 타당함.처분사유 인정됨."
339501,판례내용,161,"신체적 학대 보호자에게 사전 동의와 사후 정황 보고 또는 본인 동의 없이 손모아장갑을 사용하여 신체구속함.을 제37호증의 12의 기재 및 변론 전체의 취지에 의하면, 2022.11.17."
339501,판례내용,162,"이 사건 요양원의 전 사무국장이 P이 하루종일 손모아장갑을 끼고 있다는 내용으로 신고하면서 사진을 촬영하여 보낸 사실은 인정되나, 다음 날 이루어진 현장조사시에는 망 P이 손모아장갑을 착용하고 있지 않았고, 이 사건 전문기관의 조사원이 2022.11.17."
339501,판례내용,163,"손모아장갑을 착용하게 한 경위나 동의여부에 대해 G, 보호자 등에게 질의하는 등 별도의 조사를 거친 것으로 보이지도 않아 위 사정만으로는 이 사건 요양원이 보호자나 망 P의 동의 없이 손모아장갑을 착용하게 하여 신체를 구속한 사실을 인정하기 부족하고, 달리 이를 인정할 증거가 없음.처분사유 인정되지 않음."
339501,판례내용,164,"망 N 성적 학대 사전에 수급자 본인이나 보호자에게 동성 요양보호사 선호 여부의 확인, 이성 요양보호사 서비스 제공에 대한 동의 등을 받지 않고 2022.8.남성요양보호사로부터 기저귀케어와 목욕서비스를 받게 하여 성적 학대에 해당한다고 봄이 타당함.을 제37호증의 13의 기재 및 변론 전체의 취지에 의하면, 망 N의 보호자는 이성으로부터의 기저귀 케어에 대해 동의한 사실이 없고, 이 사건 전문기관 조사원은 2022.8.24."
339501,판례내용,165,"현장조사 중 생활실(R방)의 배치표상 담당 요양보호사로 남성요양보호사가 배정된 사실을 확인하였으며, 망 N에 대한 장기요양급여제공 기록지에 2022.8.21."
339501,판례내용,166,"및 25.옷 갈아입히기, 몸단장, 기저귀 케어를 남성요양보호사가 실시하였다고 기록되어 있었던 점 등이 인정됨.이에 비추어 보면, 위 각 일자에 수급자 본인 또는 보호자의 동의 없이 남성 요양보호사로부터 기저귀케어 등을 받게 한 사실이 인정되고, 이러한 행위는 수급자에게 성적 수치심을 주는 행위로서 성적학대에 해당한다고 봄이 타당함.처분사유 인정됨."
339501,판례내용,167,"X 성적 학대 사전에 수급자 본인이나 보호자에게 동성 요양보호사 선호 여부의 확인, 이성 요양보호사 서비스 제공에 대한 동의 등을 받지 않고 2022.8.남성요양보호사로부터 기저귀케어와 목욕서비스를 받게 하여 성적 학대에 해당한다고 봄이 타당함.을 제37호증의 14의 기재 및 변론 전체의 취지에 의하면, X의 보호자는 이성으로부터의 기저귀케어에 대해 동의한 사실이 없고, 이 사건 전문기관 조사원은 2022.8.24."
339501,판례내용,168,"현장조사 중 생활실(R방)의 배치표상 담당 요양보호사로 남성요양보호사가 배정된 사실을 확인하였으며, 8월 근무편성표상 2022.8.21."
339501,판례내용,169,"및 25.담당 요양보호사로 남성이 배정되어 있음 확인하였으며, 원고도 이에 대한 반박으로 기저귀케어 사실을 부인하는 것이 아니라 불가피한 상황이라고만 주장하고 있는 점 등에 비추어 보면, 위 각 일자에 수급자 본인 또는 보호자의 동의 없이 남성 요양보호사로부터 기저귀케어를 받게 한 사실이 인정되고, 이러한 행위는 수급자에게 성적 수치심을 주는 행위로서 성적학대에 해당한다고 봄이 타당함.처분사유 인정됨."
