판례일련번호,구분,문장번호,내용
300529,판례내용,1,사 건 2013누20325 취득세등과세처분취소
300529,판례내용,2,"원고, 항소인 주식회사 지사환경"
300529,판례내용,3,소송대리인 법무법인 A
300529,판례내용,4,"피고, 피항소인 부산광역시 강서구청장"
300529,판례내용,5,소송대리인 법무법인 B
300529,판례내용,6,제1 심판 결 부산지방법원 2013.8.23.
300529,판례내용,7,선고 2013구합452 판결
300529,판례내용,8,변 론 종 결 2014.2.26.
300529,판례내용,9,판 결 선 고 2014.3.26.
300529,판례내용,10,주 문
300529,판례내용,11,1.원고의 항소를 기각한다.
300529,판례내용,12,2.항소 비용은 원고가 부담한다.
300529,판례내용,13,청구취지 및 항소취지
300529,판례내용,14,제1심 판결을 취소한다.
300529,판례내용,15,제1심 판결을 취소한다.피고가 2011.4.11.
300529,판례내용,16,"원고에 대하여 한 취득세 103,530,710원, 농어촌특별세 10,353,050원, 등록세 77,648,020원, 지방교육세 14,423,260원(각 가산세 포함)의 각 부과처분을 취소한다."
300529,판례내용,17,1.처분의 경위
300529,판례내용,18,가.원고는 주식회사 화원의 사업 부문 중 폐기물 최종 처리 사업 부문 등을 2009.3.31.
300529,판례내용,19,분할하여 설립된 법인이다.
300529,판례내용,20,나.주식회사 화원의 소유인 부산 강서구 지사 동 잡종지 이 2009.4.30.
300529,판례내용,21,**** *** (㎡ 하이 사건 토지라고 한다)에 관하여 회사 분할을 원인으로 한 원고 명의 ‘ ’ 2009.3.31.
300529,판례내용,22,의 소유권 이전 등기가 마쳐졌다.
300529,판례내용,23,다.원고는 피고에 대하여 법인세법 제 조 제 항 각 호의 요건을 갖춘 2009.4.28.
300529,판례내용,24,"46 1 분할로 인하여 이 사건 토지를 취득하였다는 이유로 이 사건 토지에 대한 취득세 및 등록세 전액에 관하여 지방세 감면 신청을 하였고 이에 피고는 이 사건 토지에 대한, 취득세 농어촌 특별세 등록세 지방 교육세 등을 부과하지 아니하였다."
300529,판례내용,25,라.그런데 피고는 세무 조사를 실시하여 원고가 이 사건 토지를 취득한 2010.10.20.
300529,판례내용,26,"후 분할 등기일에 속하는 사업 연도의 종료일까지 분할 법인으로부터 승계받은 사업을 계속하지 않았다는 이유로 이 사건 토지의 취득 가액 원을 과, 2011.4.11."
300529,판례내용,27,"3,687,779,905 세 표준으로 하여 취득세 원 농어촌 특별세 원 등록세 103,530,710, 10,353,050, 원 지방 교육세 원 합계 원을 부과하였다.이하 이사 77,648,020, 14,423,260 205,955,040 (‘건 처분이라고 한다’)."
300529,판례내용,28,"인정 근거 [ ] 다툼 없는 사실 갑 제 내지 호 증 을 제 호 증 이하 특별히 가지 번호를, 1 5, 1 (기재하는 것 이외에는 가지 번호 포함 각 기재 변론 전체의 취지),"
300529,판례내용,29,2.처분의 적법 여부
300529,판례내용,30,가.원고의 주장.원고는 분할 등기일이 속한 사업 연도의 종료일까지 주식회사 화원으로부터 승계 1)받은 폐기물 처리 사업을 계속하여 영위함으로써 구조세 특례 제한법 법률 제 (2010.1.1.
300529,판례내용,31,"호로 개정되기 전의 것 이하 같다 제 조 제 항 제 호 제 조 제 항 제 호 9921, ) 119 1 10, 120 1 9 에서 정한 취득세 등록세 감면 요건을 충족하였으므로 이와 달리 본 이 사건 처분은, 위법하다 이하 주장이라고 한다 (‘ ’)."
300529,판례내용,32,"① 이 사건 처분은 이 사건 토지의 취득 당시 이미 감면된 취득세 등록세에 대하 2), 여사 후에 추징하는 추징 처분이므로 해당 법령에 별도의 추징 근거가 있어야 하는데, 구조세 제한 특례법이 법률 제 호로 개정되면서 비로소 추징 규정이 생 2010.1.1."
300529,판례내용,33,"9221 겼을 뿐 원고가 취득세 등록세를 감면받을 당시 적용되던 구조세 제한 특례법에는 추, 징 규정이 없었음에도 피고가 위와 같이 개정된 법률을 소급 적용하여 추징한 이 사건 처분은 위법하다 이하 주장이라고 한다 (‘ ’)."
300529,판례내용,34,② 나 관련 법령.별지 관련 법령 기재와 같다.
300529,판례내용,35,다 판단.
300529,판례내용,36,1)원고의 주장에 관한 판단
300529,판례내용,37,"① 가 구조세 특례 제한법 제 조 제 항 제 호 제 조 제 항 제 호는 법인세법 ) 119 1 10, 120 1 9 ‘제 조 제 항 각 호 물적 분할의 경우에는 동법 제 조 제 항의 요건을 갖춘 분할로 46 1 (47 1)인하여 취득하는 재산에 관한 등기의 경우 취득세와 등록세를 면제한다고 되어있고’, 구법인세법 법률 제 호로 개정되기 전의 것 이하 같다 제 조 제 (2009.12.31."
300529,판례내용,38,"9898, ) 46 1 항은 분할 등기일 현재 년 이상 계속하여 사업을 영위한 내국 법인이 대통령령이 정하 ‘5는 바에 따라 분할하는 것일 것 제 호 분할 법인 또는 소멸한 분할 합병의 상대 방법인 (1), 의 주주가 분할 신설 법인 또는 분할 합병의 상대 방법인으로부터 받은 분할 대가의 전액이 주식이고 그 주식이 분할 법인 또는 소멸한 분할 합병의 상대 방법인의 주주가 소유하던 주식의 비율에 따라 배정될 것 제 호 분할 신설 법인 또는 분할 합병의 상대 방법인이 분 (2), 할 등기일이 속하는 사업 연도의 종료일까지 분할 법인 또는 소멸한 분할 합병의 상대 방법인으로부터 승계받은 사업을 계속 영위할 것 제 호를 분할의 요건으로 규정하면서 (3)’, 같은 법 제 조 제 항에서 위 제 항의 규정을 적용함에 있어서 승계받은 사업의 계속 46 4 1 또는 폐지에 관한 판정 기준에 관하여 필요한 사항은 대통령령으로 정하도록 하고 있다."
300529,판례내용,39,이에 따라 구법인세법 시행령 대통령령 제 호로 개정되기 전의 .
300529,판례내용,40,(2010.6.8.
300529,판례내용,41,"22184 것 제 조 제 항 제 조 제 항은 분할 신설 법인이 승계한 사업용 고정 자산 가액의 분 ) 80 3, 83 4 2 이상의 처분하거나 승계한 해당 사업에 직접 사용하지 아니하는 경우 승계한 사 1 업을 계속하지 아니하는 것으로 본다고 규정하고 있다."
300529,판례내용,42,"한편 조세 법률주의의 원칙상과세요건이거나 비과세요건 또는 조세 감면 요건을, 막론하고 조세 법규의 해석은 특별한 사정이 없는 한 법문대로 해석할 것이고 합리적 이유 없이 확장 해석하거나 유추 해석하는 것은 허용되지 아니하며 특히 감면 요건 규정, 가운데 명백히 특혜 규정이라고 볼 수 있는 것은 엄격하게 해석하는 것이 조세 공평의 원칙에도 부합한다 대법원 선고 두 판결 등 참조 (2003.1.24."
300529,판례내용,43,2002 9537).
300529,판례내용,44,"나 위 관련 규정 및 법리에 비추어 이 사건에 관하여 보건대 앞서 든 증거 갑 제), , 내지 호 증의 각 기재에 변론 전체의 취지를 종합하면 분할 회사인 주식회사 화 6 18, ① 원은 이 사건 토지를 취득한 후 인 이 사건 토지에 폐기물 처리장을 설치 2006.12.29."
300529,판례내용,45,"하기 위하여 주식회사 한가람과 사이에 매립 시설 설계 측량 및 지질 조사 협의 내용 변, , , 경 인허가에 관한 용역 계약을 체결한 사실 주식회사 화원의 사업 부문 , , 2009.3.31."
300529,판례내용,46,"② 중 폐기물 최종 처리 사업 부문 등을 분할하여 원고가 설립되었고 이 사건 , 2009.4.30."
300529,판례내용,47,토지에 관하여 회사 분할을 원인으로 한 원고 명의의 소유권 이전 등기가 마 2009.3.31.
300529,판례내용,48,"쳐진 사실 주식회사 화원은 위 회사 분할 이후 인 주식회사 한가람과 , 2009.11.20."
300529,판례내용,49,"③ 사이에 위 용역 계약을 합의 해지한 사실 그 후 원고는 경주 주식회사 삼영 , 2009.12.④ 기술과 사이에 이 사건 토지에 관한 토목 설계 및 실시 계획 인가에 관한 용역 계약을 체 결하고 계약금 만원을 지급한 사실 원고는 경부산광 2010.3.10."
300529,판례내용,50,"2,750 , 2009.11.⑤ 역 시장에게 이 사건 토지에 폐기물 매립장을 조성하는 내용의 도시 계획 시설 사업 폐기물 (처리 시설 사업 시행자 지정 및 실시 계획 인가 신청서를 제출하였는데 그 신청서에 첨부된 ) , 사업 계획서에는 사업 착수 예정일이 로 처리업 허가 신청 예정일이 로 2010.3., 2010.4.기재되어 있는 사실 부산 진해 경제 자유 구역 청장은 원고를 도시 계획 시설 , 2010.4.8."
300529,판례내용,51,"사업 폐기물 처리 시설의 사업 시행자로 정하되 인가 고시일로부터 일이내에 공사 이행 ( ) , 14 보증금을 현금 또는 이행 보증서로 제출할 것을 내용으로 하는 도시 계획 시설 사업 폐기 (물 처리 시설 사업 시행자 지정 및 실시 계획 인가를 원고에게 통보한 사실 이에 따라 ) , ⑦ 원고는 경부산 진해 경제 자유 구역 청장에게 서울 보증 보험 주식회사가 발행한 2010.4.27."
300529,판례내용,52,"인허가 보증 보험 증권을 제출한 후 폐기물 처리 사업 계획서가 적합하다는 내용의 통보를 , 받은 사실을 인정할 수 있다."
300529,판례내용,53,"위 인정 사실에 의하면 분할 신설 법인인 원고는 분할 법인인 주식회사 화원으로,부터 폐기물 처리 사업 등을 승계한 이후 분할 등기일이 속하는 사업 연도의 종료일인 에 이르기까지 주식회사 삼영 기술과 사이에 이 사건 토지에 관한 토목 설 2009.12.31."
300529,판례내용,54,"계 및 실시 계획 인가에 관한 용역 계약을 체결하고 해당 관청에도시 계획 시설 사업 폐기 (물 처리 시설 사업 시행자 지정 및 실시 계획 인가 신청서 만을 제출하였을 뿐 그때까지 이 ) , 사건 토지에 폐기물 매립장을 설치하기 위한 공사에 착수하지 아니하였음은 물론이고 해당 관청으로부터 사업 시행자 지정 및 실시 계획 인가도 받지 못하였다는 것인 바 이러, 한 사정이라면 원고가 분할 등기일이 속하는 사업 연도의 종료일인 까지 이 2009.12.31."
300529,판례내용,55,사건 토지를 폐기물 처리 사업에 직접 사용하였다고 보기 어렵고 달리 이를 인정할 만 한 증거가 없다.
300529,판례내용,56,"따라서 이 사건 토지의 취득은 구조세 특례 제한법 제 조 제 항 제 호 제 119 1 10, 조 제 항 제 호가 정한 취득세 및 등록세의 감면 요건에 해당하지 않는다고 할 것 120 1 9 이므로 원고의 이 부분 주장은 이유 없다, ."
300529,판례내용,57,2)원고의 주장에 관한 판단
300529,판례내용,58,"② 가 추징 처분은 일단 감면 요건에 해당하면 그 세액을 감면한 후에 당초의 감면 취 ) 지에 합당한 사용을 하느냐에 대한 사후 관리의 측면에서 규정한 것으로서 본래의 부과 처분과는 그 요건을 달리하는 별개의 처분이라 할 것이므로 추징 처분이 해당 법에서 , 규정한 추징 요건을 갖추지 못하였다면 그 추징 처분은 위법한 처분이 되는 것이고 감, 면 요건을 갖추지 못하여 본래의 부과 처분을 할 사유가 있다고 하더라도 그와 같은 사 정이 위법한 추징 처분을 적법한 것으로 보아야 할 사유가 될 수는 없다 대법원 (1998.선고 누 판결 등 참조 8.21.97 1846)."
300529,판례내용,59,"위와 같은 법리에 비추어 볼 때 이 사건의 선결적 쟁점은 이 사건 처분이 이미, 감면된 세액을 사후에 추징하는 추징 처분인지 아니면 본래의 부과 처분인지 여부에 있 다고 할 것이고 이는 결국 구조세 특례 제한법 제 조 제 항 제 호 제 조 제 항 , 119 1 10 120 1 제 호 등의 해석 문제인 바 그 판단을 위해서는 취득세 등의 감면 및 추징 세액의 신고 9, , , 납부에 관한 법령상의 여러 규정의 전체 내용과 그 규정 형식 입법 목적 및 취지 등을 , 종합적으로 고려하여야 할 것이다."
300529,판례내용,60,"나 구조세 특례 제한법 제 조 제 항 제 호 제 조 제 항 제 호는 법인세법 ) 119 1 10 120 1 9 ‘제 조 제 항 각 호 물적 분할의 경우에는 동법 제 조 제 항의 요건을 갖춘 분할로 46 1 (47 1)인하여 취득하는 재산에 대하여는 취득세 등록세를 면제하고 있고 구법인세법 제 ’, , 46 조 제 항 제 호는 분할 신설 법인 또는 분할 합병의 상대 방법인이 분할 등기일이 속하는 1 3 ‘사업 연도의 종료일까지 분할 법인 또는 소멸한 분할 합병의 상대 방법인으로부터 승계받 은 사업을 계속 영위할 것을 그 요건으로 하고 있음은 앞서 본 바와 같다 ’."
300529,판례내용,61,"위와 같은 법령 규정의 내용과 그 형식을 종합해 보면 문리 해석상 구조세 특, 례 제한법 제 조 제 항 제 호 제 조 제 항 제 호에 의하여 취득세 등록세가 감 119 1 10 120 1 9 , 면되는 것은 어디까지나 분할 신설 법인이 회사 분할로 취득하는 재산으로서 분할 신설 법 인이 분할 등기일이 속하는 사업 연도의 종료일까지 분할 법인으로부터 승계받은 사업을 계속하여 영위하여야만 비로소 해당 재산이 감면 대상에 해당하게 되고 그 기간이 경과할 때까지는 과세가 유예되며 반면 그 기간이 경과할 때까지 사업을 계속 영위하지 아니하는 경우에는 감면 대상에서 제외되어 그 시점부터 취득세 등의 부과 대상이 된다 고 해석하는 것이 조세 법률 엄격 해석의 원칙에 부합한다."
300529,판례내용,62,"즉 분할 신설 법인이 분할 등 기일이 속하는 사업 연도의 종료일까지 분할 법인으로부터 승계받은 사업을 계속 영위하였는지 여부는 해당 토지의 취득세 등의 감면 여부를 판단하기 위한 감면 요건에 해당 하는 것으로서 구조세 특례 제한법 제 조 제 항 제 호 제 조 제 항 제 호는 토 119 1 10 120 1 9 지 취득일로부터 분할 등기일이 속하는 사업 연도의 종료일까지 취득세 등의 부과 또는 면제 결정을 일시 유예하는 것으로 보아야 하고 이와 달리 토지의 취득과 동시에 취, 득세 등이 감면되었다가 사후에 이미 감면된 세액을 추징하는 추징 요건으로 보기 는 어렵다."
300529,판례내용,63,"따라서 분할 신설 법인이 회사 분할로 취득한 토지에 대하여 분할 등기일이 속하는 사업 연도의 종료일까지 분할 전 회사로부터 승계받은 사업을 계속 영위하지 아니하면, 당해 토지는 구조세 특례 제한법 제 조 제 항 제 호 제 조 제 항 제 호에 의하 119 1 10 120 1 9 여 처음부터 취득세 등 감면 대상에서 배제되는 것으로서 이 경우에 과세 관청이 하는 , 취득세 등 부과 처분은 추징 처분이 아닌 본래의 부과 처분이라고 할 것이다."
300529,판례내용,64,다 결국 이 사건 처분은 분할 신설 법인인 원고가 분할 등기일이 속하는 사업 연도 의 종료일인 까지 분할 법인 주식회사 화원으로부터 승계한 폐기물 처리사 2009.12.31.
300529,판례내용,65,"업을 계속 영위하지 못함에 따라 구조세 특례 제한법 제 조 제 항 제 호 제 조 119 1 10 120 제 항 제 호 등의 규정에 따라 취득세 등록세 등의 부과 대상이 된 이 사건 토지에 대해 취득세 등록세를 부과 고지한 본래의 처분에 해당한다고 할 것이므로 이 사건, 처분이 이미 감면된 조세에 대한 별도의 추징 처분임을 전제로 한 원고의 이 부분 주장은 나머지 점에 관하여 더 나아가 살펴볼 필요 없이 이유 없다."
300529,판례내용,66,3.결론
300529,판례내용,67,"그렇다면 원고의 청구는 이유 없어 이를 기각할 것인 바 제 심 판결은 이와 결론을 , , 1 같이 하여 정당하므로 원고의 항소는 이유 없어 이를 기각하기로 하여 주문과 같이 판, 결한다."
300529,판례내용,68,재판장 판사 구○
300529,판례내용,69,판사 문○
300529,판례내용,70,판사 김○
300529,판례내용,71,관련 법령
