판례일련번호,구분,문장번호,내용
342596,판례내용,1,서 울 고 등 법 원
342596,판례내용,2,제 9 - 1 행 정 부
342596,판례내용,3,판 결
342596,판례내용,4,사 건 2023누35434 건축허가처분 무효확인의 소
342596,판례내용,5,"원고, 항소인"
342596,판례내용,6,1.A
342596,판례내용,7,2.B
342596,판례내용,8,3.C
342596,판례내용,9,4.D
342596,판례내용,10,5.E
342596,판례내용,11,6.F
342596,판례내용,12,원고들 소송대리인 법무법인 기회 담당변호사 배○
342596,판례내용,13,"피고, 피항소인 파주시장"
342596,판례내용,14,소송대리인 법무법인 통일 담당변호사 김○
342596,판례내용,15,피고보조참가인 N(개명 전 이름 G)
342596,판례내용,16,제1 심판결 의정부지방법원 2023.2.9.
342596,판례내용,17,선고 2021구합16524 판결
342596,판례내용,18,변 론 종 결 2024.1.11.
342596,판례내용,19,판 결 선 고 2024.3.14.
342596,판례내용,20,주 문
342596,판례내용,21,1.원고들의 항소를 모두 기각한다.
342596,판례내용,22,2.항소비용은 보조참가로 인한 부분을 포함하여 모두 원고들이 부담한다.
342596,판례내용,23,청구취지․항소취지
342596,판례내용,24,제1심판결을 취소한다.
342596,판례내용,25,피고가 2020.11.23.
342596,판례내용,26,피고보조참가인에게 한 건축신고 수리 처분은 무효임을 확인한다.
342596,판례내용,27,이 유
342596,판례내용,28,1.기초적 사실관계
342596,판례내용,29,"가.피고보조참가인(이하 ‘참가인’이라고만 한다)은 2020.10.경 피고에게, 파주시 H 외 1필지(이하 ‘이 사건 토지’라 한다."
342596,판례내용,30,아울러 특정 토지를 표시할 때에는 그 지번으로 만 표기한다)지상에 단독주택(이하 ‘이 사건 주택’이라 한다)을 신축하기 위하여 건축 신고서를 제출(이하 ‘이 사건 신청’이라 한다)하였다.
342596,판례내용,31,참가인은 이에 따른 개발행위 허가(토지형질변경)도 신청하였다.
342596,판례내용,32,"나.이 사건 토지는 인접한 I 토지(답 78㎡) 및 그 토지와 이어진 J 토지(도로 109㎡), K 토지(도로 74㎡)를 통해 공로(公路)인 O 토지와 연결된다."
342596,판례내용,33,구체적 위치는 아래 그림과 같다.
342596,판례내용,34,"I, J, K 토지는 사유(私有) 도로이다.이를 통틀어 ‘진입로 토지’라 한다."
342596,판례내용,35,다.원고들과 참가인은 진입로 토지의 각 일부 지분에 관한 공유지분권자이다.
342596,판례내용,36,"① 이 사건 토지와 인접한 I 토지의 경우 그중 원고 A이 21/78, 원고 B이 19/78, 원고 C가 18.5/78, 참가인이 1/78 지분을 갖고 있다."
342596,판례내용,37,"② J 토지의 경우 그중 원고 E이 20/109, 원고 A이 1/109, 원고 D이 25/109, 원고 B이 1/109, 원고 F이 12/109, 원고 C가 6/109, N이 1/109의 각 지분을 갖고 있다."
342596,판례내용,38,"③ K 토지의 경우 그중 원고 E이 14/74, 원고 A이 1/74, 원고 D이 15/74, 원고 B이 1/74, 원고 F이 22/148, 원고 C가 4.5/74, 참가인이 1/74 지분을 갖고 있다."
342596,판례내용,39,라.원고 E은 2000년경 J 토지 지하에 K 토지를 거쳐 공공하수도(O 토지 지하에 위치)로 이어지는 개인 배수설비와 오수처리 시설을 설치하였다.
342596,판례내용,40,원고 A은 2004년경 자기 소유의 L 토지 지상에 단독주택을 신축할 당시 I 토지 지하에 하수도법 등에 따라 배수설비와 오수처리 시설을 설치하였다.
342596,판례내용,41,다른 원고들도 위 각 배수설비에 자신들의 하수관을 연결하는 방법으로 이를 설치․사용하고 있다.
342596,판례내용,42,마.피고는 이 사건 신청에 대해 2020.11.23.경 “단지내 배수관은 최종방류구에 연결하되 하수도법 제29조 규정에 의거 타인 소유의 하수관 또는 배수시설을 사용할 시에는 사용 동의를 득하여 동의서를 제출하여야 한다.”는 등의 조건(이하 ‘이 사건 조건’이라 한다)을 붙여 건축신고를 수리하였다(이하 ‘이 사건 처분’이라 한다).
342596,판례내용,43,"바.원고 A, C 등은 2021.11.5."
342596,판례내용,44,참가인을 상대로 I 토지 지하에 설치한 배수설비를 철거하라는 민사소송을 제기하였다(의정부지방법원 고양지원 2021가합77374.이하 ‘관련 민사소송’이라 한다).
342596,판례내용,45,위 법원은 2023.4.14.
342596,판례내용,46,그 청구를 받아들이는 판결을 선고하였다(이하 ‘관련 민사판결’이라 한다).
342596,판례내용,47,이에 참가인이 항소하여 현재 위 소송이 항소심 계속 중이다(서울고등법원 2023나2016760).
342596,판례내용,48,"[인정근거] 다툼 없는 사실, 갑 제1 ~ 10호증, 갑 제33, 35호증, 을가 제1, 2, 5, 6호증(가지번호 있는 것은 각 가지번호 포함.이하 같다)의 각 기재, 변론 전체의 취지"
342596,판례내용,49,2.관계 법령
342596,판례내용,50,별지 기재와 같다.
342596,판례내용,51,3.본안전항변에 대한 판단(이 사건 소의 원고 적격)
342596,판례내용,52,가.피고의 주장 요지
342596,판례내용,53,"이 사건 토지에 인접하지 않은 진입로 토지인 J, K 토지를 참가인과 공유하는 관계에 불과한 원고 D, E, F(이하 ‘원고 D 등’이라 한다)은 이 사건 처분의 직접 상대방이 아닌 제3자로서, 이 사건 처분의 무효 확인을 구할 직접적․구체적인 법률상 이익이 없다."
342596,판례내용,54,이 사건 소 중 원고 D 등의 청구에 해당하는 소는 부적법하다.
342596,판례내용,55,나.관계되는 법리
342596,판례내용,56,"행정처분의 직접 상대방이 아닌 제3자라 하더라도, 당해 행정처분으로 인해 법률상 보호되는 이익을 침해당한 경우에는 그 처분의 무효 확인을 구하는 행정소송을 제기하여 그 당부의 판단을 받을 자격이 있다."
342596,판례내용,57,"여기에서 말하는 법률상 보호되는 이익이란, 당해 처분의 근거 법규 및 관련 법규에 의해 보호되는 개별적ㆍ직접적ㆍ구체적 이익이 있는 경우를 말한다."
342596,판례내용,58,"공익보호의 결과로 국민 일반이 공통적으로 가지는 일반적ㆍ간접적ㆍ추상적 이익이 생기는 경우에는, 법률상 보호되는 이익이 있다고 할 수 없다(대법원 2006.3.16."
342596,판례내용,59,선고 2006두330 전원합의체 판결 등 참조).
342596,판례내용,60,다.판단
342596,판례내용,61,"원고 D 등이 다른 원고들과 마찬가지로 참가인이 배수설비 설치를 위해 그 사용이 수반될 수밖에 없는 토지들(K 토지, J 토지)의 공동소유자라는 사실은 앞서 본 대로이다."
342596,판례내용,62,"나아가 아래와 같은 사실․사정들 내지 관계 법령을 종합하여 위 나.항 기재 법리에 비추어 보면, 원고 D 등은 이 사건 처분의 근거 법규와 관련 법규에 의하여 보호되는 개별적ㆍ직접적ㆍ구체적 이익을 가진다."
342596,판례내용,63,따라서 원고 D 등은 이 사건 처분의 무효 확인을 구할 법률상 이익을 갖는 사람들로서 이 사건 소의 원고 적격을 인정할 수 있다.
342596,판례내용,64,피고의 본안전항변은 받아들이지 않는다.
342596,판례내용,65,1)이 사건 처분의 직접적 근거 법령은 건축법 제14조이다(을가 제6호증).
342596,판례내용,66,건축물의 건축을 하려면 허가권자의 개발행위 허가를 받아야 한다.
342596,판례내용,67,[국토의 계획 및 이용에 관한 법률(이하 ‘국토계획법’이라 한다)제56조 제1항 제1호].
342596,판례내용,68,"이 경우 건축법상 건축신고가 수리되면, 국토계획법 제56조에 따른 개발행위 허가를 받은 것으로 본다(건축법 제14조 제2항, 제11조 제5항 제3호)."
342596,판례내용,69,"이 경우 허가권자는 신청 내용이 “주변 지역의 토지 이용실태 또는 토지이용계획, 건축물의 높이, 토지의 경사도, 수목의 상태, 물의 배수, 하천ㆍ호소ㆍ습지의 배수 등 주변 환경이나 경관과 조화를 이룰 것”이라는 기준(국토 계획법 제58조 제1항 제4호) 등에 맞는 경우에만 개발행위 허가를 하여야 한다."
342596,판례내용,70,2)이에 대한 구체적인 개발행위 허가 기준은 국토계획법 제58조 제3항의 위임에 따른 국토계획법 시행령 제56조 제1항과 [별표 1의2]에서 규정한다.
342596,판례내용,71,이 사건 처분 당시 시행 중이던 구 국토계획법 시행령(2021.1.5.
342596,판례내용,72,"대통령령 제31380호로 개정되기 전의 것, 이하 ‘구 국토계획법 시행령’이라 한다)[별표 1의2] 1 – 라.항목에서는 “개발행위로 인하여 당해 지역 및 그 주변지역에 대기오염․수질오염․토질오염․소음․진동․분진 등에 의한 환경오염․생태계파괴․위해발생 등이 발생할 우려가 없을 것."
342596,판례내용,73,"다만 환경오염․생태계파괴․위해발생 등의 방지가 가능하여 환경오염의 방지, 위해의 방지, 조경, 녹지의 조성, 완충지대의 설치 등을 허가의 조건으로 붙이는 경우에는 그러하지 아니하다.”는 등의 기준을 규정하고 있다."
342596,판례내용,74,구 국토계획법 시행령 [별표 1의2] 2 - (가)- (2)항목에서는 “도로․수도 및 하수도가 설치되지 아니한 지역에 대하여는 건축물의 건축(건축을 목적으로 하는 토지의 형질변경을 포함한다)을 허가하지 아니할 것.
342596,판례내용,75,"다만, 무질서한 개발을 초래하지 아니하는 범위 안에서 도시․군계획조례가 정하는 경우에는 그러하지 아니하다.”는 등의 기준이 명시되어 있다."
342596,판례내용,76,파주시 도시계획조례 제21조 제1호는 “신청지역에 신청인이 인접의 기존시설과 연계되는 도로․상수도 및 하수도를 설치할 것을 조건으로 하는 경우 등에는 하수도 등이 설치되지 아니한 지역에 대해서도 무질서한 개발을 초래하지 아니하는 범위에서 건축물의 건축 및 건축을 목적을 하는 토지의 형질변경을 허가할 수 있다.”고 규정한다.
342596,판례내용,77,"3)한편 하수도법 제29조는 “배수설비를 설치하거나 이를 관리하는 자가 타인의 토지 또는 배수설비를 사용하지 아니하고는 하수를 공공하수도에 유입시키기 곤란하거나 이를 관리할 수 없는 때에는 타인의 토지에 배수설비를 설치하거나 타인이 설치한 배수설비를 사용할 수 있다.”(제1항), “제1항의 규정에 따라 타인의 토지를 사용하고자 하는 자는 해당 토지의 소유자나 이해관계인과 미리 협의하여야 하며, 그 사용으로 인하여 발생하는 손실에 대하여는 상당한 보상을 하여야 한다.”(제3항)고 규정한다."
342596,판례내용,78,4)결국 국토계획법이 정한 용도지역 내 토지의 형질변경행위를 수반하는 건축신고의 수리는 건축법 제14조에 의한 건축신고 수리와 국토계획법 제56조 제1항의 개발행위 허가의 성질을 아울러 가진다.
342596,판례내용,79,한편 하수도법 제29조는 타인의 토지 이용을 수반하는 배수설비의 설치․사용과 관련하여 직접 공법적인 규율 사항을 명시하고 있다.
342596,판례내용,80,"따라서 개발행위 허가의 대상에 관한 국토계획법 제56조 제1항은 물론, 개발행위 허가의 기준에 관한 국토계획법 제58조 제1, 3항과 그 위임에 따른 구 국토계획법상 위 규정들, 그리고 하수도법 제29조 등이 모두 이 사건 처분의 관련 법규에 해당한다."
342596,판례내용,81,"5)나아가 위와 같은 관계 법령의 문언, 체계 및 취지 등을 종합하면, 건축법이나 국토계획법, 그 하위 법령과 파주시 도시계획조례가 하수도 등이 설치되지 않은 지역에 대한 건축물의 건축(토지형질변경)을 불허 대상으로 보면서도 예외적으로 인접 기존 시설과 연계되는 하수도 등을 설치할 것을 조건으로 하는 경우에 이를 허용한다고 규정한 취지, 하수도법이 타인의 토지에 배수설비를 설치하거나 타인이 설치한 배수설비를 사용할 때 그 토지 소유자 등과의 협의나 손실보상을 규정한 취지는, 도시의 무질서한 개발을 방지하고 토지의 계획적인 이용․개발을 도모한다는 공익성 확보와 아울러, 해당 주거지역 내에 거주하는 인근 주민의 배수 상황을 포함한 거주의 안녕과 건전한 생활환경을 보호하여 국민의 삶의 질을 향상시키는 데에도 그 목적이 있다고 해석할 수 있다(헌법 제35조 제3항 등 참조)."
342596,판례내용,82,특히 직접적인 생활환경 침해를 입으리라 고 예상되는 일정한 범위 내의 기존 배수설비 소유자나 이해관계인들(기존 배수설비가 위치한 토지의 공동소유자 등)이 이전과 비교하여 수인(受忍) 한도를 넘는 생활환경 침해를 받지 않고 쾌적한 환경에서 생활할 수 있는 개별적 이익까지도 보호하려는 데에 그 입법의 취지가 있다고 볼 수 있다.
342596,판례내용,83,6)원고들은 참가인의 이 사건 신청이 수리됨으로써 자신들이 공유하는 토지에 설치된 배수설비 등의 설치․사용을 수인해야 하는 지위에 있다.
342596,판례내용,84,원고 D 등이 공유하는 토지가 이 사건 토지에 바로 인접해 있지 않다고 해서 달리 볼 것은 아니다.
342596,판례내용,85,"위와 같은 법리에 비추어 보면, 원고 D 등이 이 사건 처분의 무효 확인에 관해 가지는 이익은 일반적ㆍ간접적ㆍ추상적 이익을 넘어, 이 사건 처분의 근거 법규 및 관련 법규에 의해 보호되는 개별적ㆍ직접적ㆍ구체적 이익 즉 법률상 보호되는 이익에 해당한다고 봄이 마땅하다."
342596,판례내용,86,4.본안에 관한 원고들의 주장 요지
342596,판례내용,87,"이 사건 처분은 아래와 같은 이유로 위법하고, 그 하자의 정도가 중대ㆍ명백하므로 무효이다."
342596,판례내용,88,"가.참가인은 이 사건 토지 지상에 있는, 하수관과 연결되어 있지 않은 맨홀 사진을 첨부하여 마치 하수도가 연결된 토지인 것처럼 이 사건 신청을 하였다."
342596,판례내용,89,하지만 이 사건 토지에는 실제로 하수관 등이 연결되어 있지 않았다.
342596,판례내용,90,그러므로 이 사건 처분은 하수도 등이 설치되지 않은 지역에 대한 건축 허가에 해당하여 위법하다.
342596,판례내용,91,나.참가인은 I 토지 지하에 원고들이 설치․관리하는 배수관을 원고들의 동의나 사용승낙 없이 무단으로 연결하였다.
342596,판례내용,92,"참가인은 건축허가를 받기 위해 파주시 건축 조례 제26조 제2항에 따라 진입로 토지 소유자인 원고들의 서면동의서를 제출해야 함에도, 이를 제출하지 않았다."
342596,판례내용,93,"피고는 이를 현장조사를 통해 바로잡을 수 있었음에도, 개발행위 허가 전 반드시 실시해야 할 현장조사를 제대로 실시하지 않았거나, 실사보고서를 허위로 작성하는 등 이를 방치한 결과 참가인의 건축신고를 잘못 수리하였다."
342596,판례내용,94,위와 같은 하자가 있는 이 사건 처분은 위법하다.
342596,판례내용,95,"다.건축법 제2조 제1항 제11호, 건축법 시행령 제3조의3 제2호에 의하면, 진입로 토지, P 토지, Q 토지와 같이 막다른 도로이고 그 길이가 총 35m 이상인 경우 건축법상 적법한 도로가 되기 위해서는 그 도로의 너비가 6m 이상이어야 한다."
342596,판례내용,96,그런데 위 도로들의 실제 총 길이는 108m이지만 실질적 너비는 4m에 불과하다.
342596,판례내용,97,이 사건 처분은 건축법상 허가할 수 없는 토지에 대한 건축 허가에 해당하여 위법하다.
342596,판례내용,98,"라.참가인이 I 토지 등을 통행로로 이용해 주택을 건축하기 위해서는, 파주시 건축 조례 제26조에 따라 통행로 소유자의 동의서를 제출해야 한다."
342596,판례내용,99,그럼에도 피고는 이를 제출받지 않은 채 이 사건 처분을 했으므로 위법하다.
342596,판례내용,100,5.본안 청구에 관계되는 법리
342596,판례내용,101,"행정행위가 당연 무효라고 하기 위해서는, 행정행위에 위법사유가 있고 그 하자가 법규의 중요한 부분을 위반한 중대한 것으로서 객관적으로 명백한 경우여야 한다(대법원 2005.6.24."
342596,판례내용,102,선고 2004두10968 판결 등 참조).
342596,판례내용,103,한편 행정처분의 당연 무효를 주장하여 그 무효의 확인을 구하는 행정소송에서는 원고에게 그 행정처분이 무효인 사유를 주장ㆍ증명할 책임이 있다(대법원 2010.5.13.
342596,판례내용,104,선고 2009두3460 판결 등 참조).
342596,판례내용,105,6.본안 청구에 대한 판단
342596,판례내용,106,"앞서 본 인정사실과 증거들에 변론 전체의 취지를 더하여 인정․추론할 수 있는 아래 사실․사정들을 종합하면, 원고들이 제출한 증거들만으로는 이 사건 처분에 그 주장과 같은 하자가 있다고 할 수 없으며, 설령 하자가 있다고 보더라도 그 하자가 중대․명백하여 무효라고 인정하기에는 부족하며 달리 이를 인정할 증거가 없다."
342596,판례내용,107,"가.앞서 본 대로 건축법 제11조, 제14조와 구 국토계획법 시행령 제56조 제1항 및 [별표1의2] 개발행위 허가기준, 파주시 도시계획조례 제21조에 의하면, 허가권자(신고 수리권자)는 신청인이 인접의 기존 시설과 연계되는 하수도 등을 설치할 것을 조건으로 하는 경우, 하수도 등이 설치되지 않은 지역에 대해서도 무질서한 개발을 초래하지 않는 범위에서 건축물의 건축이나 그 건축에 수반되는 토지의 형질변경을 허가할 수 있다."
342596,판례내용,108,"참가인이 이 사건 주택을 신축하기 위해 이 사건 신청을 할 당시, 이 사건 토지에는 하수도 등이 설치되지 않았다."
342596,판례내용,109,"다만 이 사건 토지에 인접한 I 토지 지하에는, 원고 A이 그 이전에 설치한 배수시설이 있었다."
342596,판례내용,110,"따라서 이 사건 토지에 하수도 등이 설치되지 않았다는 사정만을 들어 곧바로, 피고가 이 사건 신청을 수리해서는 안 될 의무가 있었다고 해석할 수는 없다."
342596,판례내용,111,"진입로 토지를 포함한 주위의 토지 현황, 현재 이 사건 토지 주변에서의 배수설비 상황, 피고의 배수설비 설치 및 사용개시에 대한 신고수리 사례, 이 사건 신청의 목적․내용 등을 고려할 때, 이 사건 신청이 ‘무질서한 개발을 초래’하는 경우에 해당한다고 보기도 어렵다."
342596,판례내용,112,"나.원고들이 가장 억울해 하는 점들 중 하나는 아마도 앞서 4항에서 본 것처럼, 이 사건 신청의 수리로 인해 그 토지의 사용을 수인해야 하는 소유자들인 원고들의 사용승낙이나 동의가 없었는데도 이 사건 신청이 수리되었고, 이에 기해 참가인이 배수설비 등의 공사를 강행함으로써 원고들이 그 소유의 토지 내지 그 지상의 주택 등을 사용하는 데에 생활상의 각종 불편이 심각하게 초래되었다는 점일 것이다."
342596,판례내용,113,"다만 행정소송인 이 사건 소송의 소송물 즉 이 사건 처분이 당연 무효인지 여부는 관련 민사소송에서의 사법적(私法적) 논의․쟁점과 별개로, 앞서 본 근거 법령이나 관련 법규의 해석 등에 따라 공법적으로 판단할 수밖에 없다."
342596,판례내용,114,이러한 견지에서 본다.
342596,판례내용,115,"하수도법 제29조 제3항에서 배수설비 설치를 위해 타인의 토지를 사용할 때 해당 토지의 소유자 등과 미리 “협의하여야” 한다고 규정한 것이 원고들 주장처럼 해당 토지 소유자의 ‘동의’를 반드시 얻어야 한다는 뜻이라는 점에 관해서는, 이론(異論)의 여지가 충분하다."
342596,판례내용,116,"다만 원고들 주장처럼 새긴다 하더라도, 피고는 이 사건 처분에 이 사건 조건 즉 “하수도법 제29조 규정에 의거 타인 소유의 하수관 또는 배수시설을 사용할 시에는 사용 동의를 득하여 동의서를 제출”할 것을 조건으로 삼아 이 사건 처분을 발령하였다."
342596,판례내용,117,이처럼 행정처분 당시로는 충족되지 않았으나 장래 충족될 가능성이 있는 요건에 관해 이 사건 조건과 같은 부관(附款)을 붙여 허가․수리하는 내용의 행정처분을 하는 것이 ‘위법’하다고 볼 만한 법적 근거는 찾기 어렵다.
342596,판례내용,118,"구 국토계획법 시행령은 앞서 본 대로, 개발행위로 인해 소음․진동․분진 등의 발생 우려가 있더라도 그로 인한 환경오염의 방지 등을 허가의 조건으로 붙이는 경우에는 개발행위 허가를 할 수 있다는 취지를 규정하고 있다."
342596,판례내용,119,"행정행위의 부관이 행정행위의 효과를 제한하는 기능만 갖는 것이 아니라 행정행위의 요건을 충족시키는 기능을 갖는다는 점을 고려하더라도, 그와 같은 부관을 붙인 행정행위가 위법하다고 할 수 없다."
342596,판례내용,120,"아울러 원고들이 참가인의 배수설비 설치 공사에 관해 반대한다는 뜻을 명확히 표명하거나 그럼에도 참가인이 진입로 토지에 관한 공사를 강행한 것은 이 사건 처분 이후의 사정들이므로, 처분 발령 당시까지의 사정을 기준으로 그 처분의 위법 여부를 가려야 하는 이 사건에서 의미 있는 판단요소가 된다고 보기 어렵다."
342596,판례내용,121,"원고들은 관련 민사판결(관련 민사소송에서의 제1심판결)에서 배수설비의 철거를 명함에 따라 이 사건 조건은 효력이 없다는 취지로도 주장하지만, 민사법적 법률관계를 다룬 관련 민사판결이 선고되었다(더구나 항소심 계속 중이다)는 사정이 이 사건 조건 내지 이 사건 처분의 효력에 어떤 영향을 미칠 수는 없다."
342596,판례내용,122,"피고가 이 사건 처분을 하면서 이 사건 조건을 붙인 것은, 건축신고 수리 처분과 실질적 관련이 있는 의무를 부과한 것으로서 부당결부금지 원칙에 반한다고 볼 수도 없다."
342596,판례내용,123,"다.한편 진입로 토지에 관한 원고들의 동의 여부가 표시되지 않은 상황이었음에도, 피고 담당 공무원이 작성한 현장조사보고서에 ’I 토지 배수연결 동의 있음.그런데 이미 설치 연결된 듯(현장확인결과 포장되어 있어 현황도로로 판단)‘ 등의 기재가 있다고 보이기는 한다."
342596,판례내용,124,"다만 피고는 그와 같이 잘못된 정보를 기초로 무조건적인 수리 처분을 하는 대신, 사용동의서 제출 의무를 참가인에게 부과하는 내용의 이 사건 조건을 붙여 이 사건 처분을 하였다."
342596,판례내용,125,이는 이 사건 처분 발령 당시에 사용 대상 토지 소유자의 동의서가 제출되지 않았음을 당연히 전제한다.
342596,판례내용,126,"그러므로 원고 주장과 같이 현장 확인 내지 현장조사보고서 작성 단계에서 잘못이 있었다고 보더라도, 그것이 대법원 2020.7.23."
342596,판례내용,127,"선고 2019두31839 판결의 사안처럼 허가 기준 충족 여부의 심사를 누락한 것이라거나, 이 사건 처분의 절차적 하자에 해당한다고 보기는 어렵다."
342596,판례내용,128,"설령 그것이 하자라고 가정하더라도, 그 하자가 중대․명백하다고 보기는 더욱 힘들다."
342596,판례내용,129,"(원고들은 이와 같은 사정 등을 내세우면서 제1심에서부터 줄곧 담당 공무원에 대한 증인신문을 지속적으로 요구하거나, 이에 관한 탄원서 등을 제출하였다."
342596,판례내용,130,"이 사건 변론이나 기록 전체의 취지에 비추어 참가인과 담당 공무원 사이의 유착을 의심하는 원고들의 심정을 헤아릴 수 있는 여지가 전혀 없는 것은 아니지만, 위와 같은 사실․사정 등을 고려하면 이 사건 처분이 당연 무효인지 여부가 문제되는 이 사건에서 담당 공무원에 대한 증인 신청이 이 사건의 결론을 좌우할 수 있는 유효․적절한 증거방법이라고 볼 수는 없다)."
342596,판례내용,131,라.건축법 제44조는 “건축물의 대지는 2m 이상이 도로에 접하여야 한다.
