판례일련번호,구분,문장번호,내용
238525,판례내용,1,【원    고】 엘지디스플레이 주식회사 (소송대리인 법무법인 정안 담당변호사 박○ 외 2인)
238525,판례내용,2,【피    고】 서울특별시 영등포구청장 (소송대리인 법무법인 린○ 담당변호사 김○)
238525,판례내용,3,【변론종결】2021.12.9.
238525,판례내용,4,【주    문】
238525,판례내용,5,1.원고의 청구를 기각한다.
238525,판례내용,6,2.소송비용은 원고가 부담한다.
238525,판례내용,7,【청구취지】  피고가 2020.4.6.
238525,판례내용,8,원고에게 한 [별지1] 목록 기재 각 법인지방소득세 경정거부처분을 모두 취소한다.
238525,판례내용,9,【이    유】1.처분의 경위
238525,판례내용,10,"가.원고는 디스플레이 및 관련 제품의 생산·판매 등을 영위할 목적으로 1985.2.경 설립된 회사로서 중국 등 해외 자회사로부터 배당금과 기타 사용료 등을 수취해 오고 있고, 서울 영등포구 본점(이하 ‘서울 사업장’이라 한다)과 4개의 지점(대전, 구미시, 파주시, 청주시)등 총 5곳의 국내 사업장을 두고 있다."
238525,판례내용,11,나.지방세법이 2014.1.1.
238525,판례내용,12,"법률 제12153호로 개정·시행됨에 따라 국세 부가세 방식의 지방소득세는 독립세 방식으로 전환하였고, 법인지방소득세의 세액공제·감면을 정비하면서 지방세법이 그에 관한 사항을 지방세특례제한법에서 정하도록 하였으나, 같은 날 법률 제12175호로 개정·시행된 지방세특례제한법 이래로 외국납부세액공제에 대하여는 법인지방소득세 감면·공제에 관한 별도의 규정을 두지 않고 있다.그에 따라 원고는 아래 〈표1〉 기재와 같이 2014년부터 2017년까지 중국 등 해외 자회사들로부터 수취한 배당소득과 그에 대한 (직접·간접·간주)외국납부세액에 대해 외국납부세액공제를 적용하지 않은 채, 2014 ~ 2017년 귀속 법인지방소득세를 국내 사업장 5곳에 각 안분하여 서울 사업장 등에 대한 법인지방소득세를 (수정)신고·납부하였다."
238525,판례내용,13,〈표1〉 (단위: 원)
238525,판례내용,14,다.원고는 2020.2.7.
238525,판례내용,15,"피고에게 서울 사업장에 대하여 2014년 귀속 법인지방소득세의 경우 전체 외국납부세액의 손금산입 방식으로, 2015 ~ 2017년 귀속 법인지방소득세의 경우 중국 배당 관련 외국납부세액의 세액공제 방식으로 하여 감액된 세액 합계 1,549,721,453원(= 2014년 92,531,092원 + 2015년 367,085,668원 + 2016년 197,724,334원 + 2017년 892,380,359원, 가산세 포함)의 환급을 구하는 경정청구를 하였다."
238525,판례내용,16,라.피고는 2020.4.6.
238525,판례내용,17,"원고에게 경정청구 거부통지(이하 ‘당초 거부처분’이라 한다)를 하였는데, 그 이유는 다음과 같다.즉, ‘2014.1.1."
238525,판례내용,18,"개정된 지방세법은 법인지방소득세에 대하여 법인세 납부세액의 10%를 지방소득세로 납부하던 종전의 부가세 방식에서 독립세 방식으로 전환하였는데, 이는 지방자치단체의 과세자율성을 강화하고 그 세수가 지방자치단체의 재정으로 편입되게 하기 위함이다.이에 따라 지방소득세 자체의 세액공제 및 세액감면 조항을 신설하였는데, 개인지방소득세에 대하여는 지방세법 제94조를 두어 지방세특례제한법으로 개인지방소득세 산출세액에서 공제할 수 있도록 하였고, 지방세특례제한법에 감면 및 공제 특례 등을 상세히 규정하였다.반면에, 법인지방소득세에 대하여는 지방세법 제103조의22에서 지방세특례제한법으로 정하도록 규정하였으나 지방세특례제한법에는 제167조 조합법인 등에 대한 법인지방소득세 특례 규정 외에는 법인지방소득세의 감면 및 공제 특례에 대한 규정이 없다.따라서 외국납부세액 전액은 손금산입, 간접외국납부세액은 익금산입된 법인세 과세표준을 법인지방소득세의 과세표준으로 하여 신고·납부한 법인지방소득세는 정당하다’는 취지이다."
238525,판례내용,19,마.이후 피고는 ‘법인지방소득세 과세표준 산정 시 외국납부세액을 제외하는 것이 타당하다’는 취지의 하급심판결이 대법원 심리불속행 상고기각으로 확정됨에 따라 원고가 납부한 법인지방소득세의 과세표준에서 외국납부세액을 제외하기로 하여 2020.10.27.
238525,판례내용,20,"당초 거부처분 중 일부인 법인지방소득세 본세 합계 503,194,380원(= 2014년 51,928,890원 + 2015년 93,501,440원 + 2016년 77,057,610원 + 2017년 280,706,440원, 환급가산금 별도 합산)부분을 직권으로 취소하고, 같은 날 원고에게 위 취소액에 관한 환급통지를 하였다.이후 피고는 2020.10.30."
238525,판례내용,21,"위 직권 취소에 관련된 법인지방소득세 가산세 합계 56,191,000원(= 2014년 12,092,770원 + 2015년 20,983,320원 + 2016년 9,667,640원 + 2017년 13,447,270원, 환급가산금 별도 합산)을 추가로 환급하였다."
238525,판례내용,22,바.원고는 이 사건 소송절차에서 당초 거부처분에 대응하는 경정청구금액에서 위와 같은 직권 취소금액을 모두 차감하되 간접외국납부세액의 손금산입 누락의 위법을 주장함과 아울러 가산세 부분에 대한 거부처분은 전부 소멸한 것으로 보아 경정청구금액을 [별지1] 목록 기재와 같이 본세로만 구성하여 청구취지를 변경하였다(원고가 구하는 바에 따라 당초 거부처분 중 위와 같이 감액된 경정청구세액에 대응하는 부분을 이하 ‘이 사건 처분’이라 한다).
238525,판례내용,23,"[인정 근거] 다툼 없는 사실, 갑 제1 ~ 9, 11 ~ 17호증, 을 제1 ~ 6호증의 각 기재(가지번호 있는 것은 각 가지번호 포함, 이하 같다), 변론 전체의 취지"
238525,판례내용,24,2.이 사건 처분의 적법 여부
238525,판례내용,25,가.원고의 주장
238525,판례내용,26,"1)‘대한민국 정부와 중화인민공화국 정부 간의 소득에 대한 조세의 이중과세회피와 탈세방지를 위한 협정’(이하 ‘한·중 조세조약’이라 한다), 한·중 조세조약 제2의정서, 지방세특례제한법 제3조에 따라 법인지방소득세 세액 산정 시 중국에서 납부한 세액의 공제가 인정되어야 한다([별지1] 기재 주위적 주장이다.다만 2014년 귀속분은 손금산입방식을 전제한 것으로서 주위적·예비적 주장에 따른 각 청구금액이 동일하다)."
238525,판례내용,27,"2)설령, 한·중 조세조약에 따른 공제가 직접 인정되지 않는다고 할지라도, 적어도 법인세 과세표준에 익금산입되었던 간접외국납부세액에 대하여는 익금에서 공제한 후, 추가로 손금산입하는 방법으로 법인지방소득세 과세표준을 산정하여야 한다([별지2] 예비적 주장)."
238525,판례내용,28,"그럼에도 이와 달리 이루어진 이 사건 처분은 위법하므로, 취소되어야 한다."
238525,판례내용,29,나.관계 법령
238525,판례내용,30,[별지3] ‘관계 법령’ 기재와 같다.
238525,판례내용,31,다.판단
238525,판례내용,32,1)한·중 조세조약에 따라 외국납부세액공제가 직접 인정되는지 여부
238525,판례내용,33,가)관련 규정의 내용
238525,판례내용,34,"1994년 발효된 한·중 조세조약은 원천지국에서 얻은 소득에 대하여 거주지국과 원천지국이 모두 과세권을 행사할 경우 이중과세의 문제가 발생하므로 거주지국의 과세권과 원천지국의 과세권을 적정하게 배분·조정하고자 체결된 것으로 볼 수 있다.구체적으로 제23조 제1항은 한국 거주자의 이중과세 회피방법에 관한 규정을 두었는데, 이는 2006년 발효된 ‘대한민국 정부와 중화인민공화국 정부 간의 소득에 대한 조세의 이중과세회피와 탈세방지를 위한 협정의 제2의정서’(이하 ‘제2의정서’라 한다)제4조(이하 ‘이 사건 조항’이라 한다)로 대체되었다.위 조항은 ""한국 거주자의 경우, 이중과세는 다음과 같이 회피된다.한국 외의 국가에서 납부하는 조세에 대하여 한국의 조세로부터 세액공제의 허용에 관한 한국세법의 규정(이 항의 일반적인 원칙에 영향을 미치지 아니한다)에 따를 것을 조건으로, 중국 내에서의 원천소득에 관하여, 직접적이든 공제에 의하여서든 중국의 법과 협정에 따라 납부하는 중국조세(배당의 경우 배당이 지급되는 이윤에 대하여 납부할 조세를 제외한다)는 동 소득에 관하여 납부하는 한국조세로부터 세액공제를 허용한다.그러나 그 공제세액은 중국 내에서의 원천소득이 한국의 조세납부 대상이 되는 전체소득에서 차지하는 비율에 해당하는 한국의 조세액의 부분을 초과하지 아니한다[(가)목]."
238525,판례내용,35,"중국 거주자인 회사가 한국 거주자이면서 동 중국회사 주식의 10퍼센트 이상을 소유한 회사에게 지급하는 배당의 경우, 세액공제를 함에 있어(이 항 나목의 규정에 따라 공제가 허용되는 중국의 조세에 추가하여)배당을 지급한 동 중국회사가 동 배당을 지급하는 이익과 관련하여 납부하는 중국조세를 고려하여야 한다[(나)목]."
238525,판례내용,36,"""라고 규정하고 있다."
238525,판례내용,37,"위와 같은 조세조약을 비롯한 국제조약의 해석에 관한 일반적 원칙은 ‘조약법에 관한 비엔나협약(Vienna Convention on the Law of Treaties, 이하 ‘비엔나 협약’이라 한다)제31조에서 규정하고 있다.즉 ‘조약은 전문 및 부속서를 포함한 조약문의 문맥 및 조약의 대상과 목적에 비추어, 그 조약의 문면에 부여되는 통상적 의미에 따라 성실하게 해석되어야 한다.조약의 해석상 문맥은 조약문 외에 조약의 체결과 관련하여 당사국 사이에 이루어진 그 조약에 관한 합의 등을 포함한다.아울러 조약을 해석할 때에는 문맥과 함께 조약의 해석 또는 그 조약규정의 적용에 관한 당사국 사이의 추후의 합의, 조약의 해석에 관한 당사국의 합의를 확정하는 그 조약 적용에 있어서의 추후의 관행 등을 참작하여야 한다’고 규정하고 있다(영문본은 [별지3] ‘관계 법령’ 말미 참조)."
238525,판례내용,38,"또한 조세법규의 해석은 특별한 사정이 없는 한 법문대로 해석할 것이고 합리적 이유 없이 확장해석하거나 유추해석하는 것은 허용되지 아니하는바, 이러한 해석 원칙은 법률과 같은 효력을 가지는 조세조약의 해석과 적용에 있어서도 그대로 적용된다."
238525,판례내용,39,"한편 지방세특례제한법 제3조 제1항은 ""이 법, 지방세기본법, 지방세징수법, 지방세법, 조세특례제한법 및 조약에 따르지 아니하고는 지방세법에서 정한 일반과세에 대한 지방세 특례를 정할 수 없다.""라고 규정하여 지방세 특례의 법적 근거 중 하나로 조약을 명시하고 있다.국내법에 추가하여 조세조약에 이중과세 조정·배제에 관한 규정을 두는 취지는 상대국 세제와의 불일치에 대처하는 한편 이중과세 조정·배제를 위한 조치의 적용요건 등을 완화하여 국제교류를 활성화하기 위한 데 있다.경제협력개발기구(OECD) 모델 조세조약 및 국제연합(UN) 모델 조세조약에는 국제적 이중과세 조정을 위한 조치로 자본수입 중립성에 친화적인 국외소득면제 방식과 자본수출 중립성에 친화적인 외국세액공제 방식을 규정하여 각 나라가 선택하도록 권고하고 있으나, 실제로는 각 나라별로 일정한 제한과 요건을 가감하거나 두 제도를 병용하며 실정에 맞게 운용해 가고 있다(참고로 일본은 2009년 법인세법을 개정하여 간접외국납부세액공제 제도를 폐지하고 외국자회사 배당 익금불산입 제도를 도입하였다)."
238525,판례내용,40,"이중과세금지원칙은 조세공평주의 및 실질과세원칙의 구체적인 심사와 판단을 돕는 파생원칙으로서, 그 헌법적 기초는 헌법 제11조 제1항에서 찾을 수 있다.이와 같은 이중과세의 조정에 있어 어느 정도의 공제와 한도를 둘 것인지 여부 등은 국가의 재정상황, 국민의 소득수준, 사회의 관행, 세율과 같은 제반 재정적·사회경제적 요인에 따라 결정될 것으로서, 이는 원칙적으로 입법자의 입법형성 재량에 기초한 정책적 판단에 맡겨져 있다(헌법재판소 2001.11.29."
238525,판례내용,41,선고 99헌바120 결정 등 참조).
238525,판례내용,42,나)구체적인 판단
238525,판례내용,43,"관계 법령 등의 문언 내용과 취지를 비롯하여 앞서 든 증거들과 변론 전체의 취지를 종합하여 인정되는 아래와 같은 사정에 비추어 보면, 이 사건 조항에 따라 법인지방소득세 산출세액에서 외국납부세액의 공제가 곧바로 인정된다고 볼 수 없다."
238525,판례내용,44,① 조약의 문언과 체약국의 의사를 고려한 해석
238525,판례내용,45,"2010년 이전 지방세법상 ‘소득할(법인세할)주민세’는 법인세법의 규정에 따라 부과되는 법인세액을 과세표준으로 하여 해당 시·군 내에서 법인세의 납세의무가 있는 법인에게 부과하는 것인 점, 주민세는 조약 체결 당시 중국의 대상 조세로 명시된 지방소득세에 대응하는 성격을 가진 세목에 해당하는 점, 그리고 한·중 조세조약 제2조, 제2의정서 제2조, 법인세법 시행령 제94조 제1항 등의 내용과 취지를 아울러 고려할 때, 법인지방소득세는 종전의 법인세할 주민세가 지방세법 개편 등을 거쳐 변경된 세목으로서 실질적 성격의 변함이 없고, 지방자치단체가 법인의 소득을 과세표준으로 하여 부과한 조세에 해당하므로, 위 조약의 대상 조세에 포함된다."
238525,판례내용,46,"이 사건 조항은 한국 거주자의 이중과세 회피방법에 대하여 ‘세액공제 허용에 관한 한국세법의 규정에 따를 것을 조건으로 한국의 조세로부터 세액공제가 허용된다’고 규정하고 있다.당초 한·중 조세조약 제23조 제1항에서 ‘세액공제에 관한 한국세법의 규정에 따를 것을 조건으로’라고 명시한 부분이 제2의정서 체결로 이 사건 조항의 ‘세액공제의 허용에 관한 한국세법의 규정에 따를 것을 조건으로’라는 부분으로 체약국의 의사가 구체화된 것으로 보인다.이 사건 조항의 문맥과 그 문언의 통상적 의미 및 체약당사국의 의사 등을 종합적으로 고려할 때, 이 사건 조항은 세액공제를 허용하는 국내 조세법률을 전제로 하여서만 위 조항에 따른 세액공제가 가능하다는 선언적 취지로 이해함이 타당하고, 관련 국내 세법의 내용을 확인하는 효력밖에 없다.따라서 세액공제에 관한 이 사건 조항의 취지에 벗어나지 않는 한, 그 상세 내용은 국내 세법이 정하는 바에 따라야 한다."
238525,판례내용,47,"일반적으로 조세조약이 자기집행력을 갖고 국내세법에 대한 특별법의 지위에 있다고 할지라도, 동일한 조세조약 내에서 개별 조항의 구체적인 문언에 따라 직접적인 적용가능성 여부가 달라질 수 있다.조세조약의 해당 조항에서 국내 세법에 따를 것을 조건으로 명시한 경우에는 적어도 국내 세법에 관련 허용 규정이 일반적으로 마련되어 있거나 입법자의 반대의사가 나타나지 않은 경우에만 이를 직접 적용할 수 있다고 해석하는 것이 타당하다.이러한 관점에서 볼 때, 원고가 원용한 대법원 1995.8.25."
238525,판례내용,48,"선고 94누7843 판결 등의 사안은 국내 신법 개정에서 입법자의 뚜렷한 반대의사가 나타나지 않은 상황에서 국내 세법에 관련 제도의 일반적 허용 규정이 마련되어 있음에도 국내법에 구체적인 방법과 절차 규정 등이 흠결된 것에 불과하거나 조약 우선 적용에 관한 명문의 국내법 규정이 존재하여 조세조약의 직접 적용이 가능한 사안에 해당하므로, 이 사건에 그대로 참조하기에 적절하지 않다.이와 달리 ‘이 사건 조항은 자기집행력을 지닌 특별법적 지위에 있으므로 외국납부세액 공제 규정의 유무와 상관없이 무조건 직접 적용될 수 있다’는 취지의 원고 주장은 받아들이기 어렵다."
238525,판례내용,49,그런데 구 지방세법(2017.12.30.
238525,판례내용,50,"법률 제15335호로 개정되기 전의 것, 이하 ‘개정 지방세법’이라 한다)제103조의22 제1항 전문은 ‘내국법인의 각 사업연도의 소득에 대한 법인지방소득세의 세액공제 및 세액감면에 관한 사항은 지방세특례제한법에서 정한다’고 규정하였으나, 지방세특례제한법에서는 일반법인의 법인지방소득세 감면 및 공제에 관한 특례 규정을 마련하지 않았다.즉, 입법자는 2014.1.1."
238525,판례내용,51,"개정 지방세특례제한법으로 조합법인 등의 법인지방소득세 과세특례 규정(제167조)과 거주자의 종합소득 외국납부세액공제 규정(제97조)을 마련하였고, 2014.12.31."
238525,판례내용,52,"개정 시 개인지방소득세의 세액공제 규정(제167조의2)을 마련하였을 뿐, 그 외 일반법인의 법인지방소득세에 대한 감면 및 공제 특례를 규정하지 않았다[간접외국납부세액에 대한 과세특례를 규정하였다가 2011.12.31."
238525,판례내용,53,법인세법 개정에 따라 삭제된 구 조세특례제한법(2011.12.31.
238525,판례내용,54,법률 제11133호로 개정되기 전의 것)제104조의6의 규정 취지와 같이 이 사건에 특별히 적용할 만한 명문의 특례 규정을 찾아볼 수 없다].
238525,판례내용,55,이는 2014년 지방세법 개정 당시 지방세 세수 증대를 통한 지방 재정 확충이라는 입법목적을 달성하기 위하여 법인지방소득세 산정 시 외국납부세액 공제를 인정하지 않겠다는 입법자의 결단에서 비롯된 것으로 볼 여지가 충분하다.지방세 세수 증대를 위하여 2014.1.1.
238525,판례내용,56,개정 지방세특례제한법이 제168조 ~ 제180조에서 지방소득세 특례제한의 다수 규정을 신설하였다는 점에서도 이러한 의사를 엿볼 수 있다.
238525,판례내용,57,"따라서 2014년 이래 현재까지 법인지방소득세의 세액공제에 관하여는 이를 허용하는 국내 법령이 마련되어 있지 않은 이상, 이 사건 조항에 따라 곧바로 법인지방소득세 산출세액에서 세액공제가 허용된다고 볼 수 없다."
238525,판례내용,58,② 이중과세금지원칙 위반 여부
238525,판례내용,59,"소득세, 법인세, 개인지방소득세와 달리 법인지방소득세에서 외국납부세액 공제를 인정하지 않는 것은 과세형평과 이중과세의 문제를 야기한다는 비판이 제기될 수 있다.그러나 과세형평과 이중과세의 정당화 문제는 경제정책적·사회형성적 목적 등에 의하여 합리성이 인정되는가에 따라 판단되는 것일 뿐, 논리필연적으로 도출될 수 있는 당위성의 문제라고 보기 어렵다.이러한 이중과세의 문제점을 제거하고 이를 조정하는 데에는 여러 가지 선택 가능성이 있고, 그중에서 어떤 선택을 할 것인가는 입법자가 제반 사정을 참작하여 결정할 수 있다.그리하여 국제적 이중과세나 국내법상 이중과세의 문제를 해소·방지하기 위하여 채택된 조세조약 등 법적 장치 대부분은 불완전한 이중과세 조정방법에 해당할 뿐이다(오늘날 대부분의 국가에서 채택한 배당소득에 대한 이중과세 조정장치는 과세공평, 조세중립성을 도모한다는 측면보다는 투자의 촉진, 주식시장의 활성화 등 정책적 목적 달성에 더 큰 주안점을 두는 추세이다)."
238525,판례내용,60,"더구나 외국 법인세는 국외 모든 사업장의 소득과 결손을 가감하여 과세되는 것이 아니라 국외 사업장이 있는 나라별로 각 그 나라의 세법에 따라 과세될 뿐만 아니라, 국제적 중복과세 방지를 위한 조약이 체결되더라도 그 내용은 나라마다 다를 수가 있음을 고려하면 더욱 그러하다."
238525,판례내용,61,"후술하는 바와 같이 법인지방소득세 과세표준에서 외국납부세액을 차감하는 것에서 더 나아가 세액공제방법의 선택권을 납세자에게 부여하지 않았다는 이유만으로 입법재량의 한계를 현저히 벗어난 자의적인 조세정책적 입법조치에 해당한다고 단정할 수 없다[개정 지방세법 제103조의19, 제103조의20의 신설로, 내국법인의 각 사업연도 소득에 대한 법인지방소득세 과세표준은 구 법인세법(2017.12.19."
238525,판례내용,62,"법률 제15222호로 개정되기 전의 것, 이하 같다)제13조에 따라 계산한 금액으로 하되, 표준세율을 별도로 정하고 지방자치단체의 조례로 표준세율의 100분의 50의 범위 내에서 세율을 가감할 수 있도록 하여 법인지방소득세는 종전 부가세 방식 때보다 세부담이 증가하는 방향으로 개정되었다.이는 종전의 감면·공제조항을 삭제한 때문이 아니라, 지방자치단체의 과세자율성을 강화하는 독립세 방식의 법인지방소득세 과세표준을 새로이 정비하는 입법조치에 따른 결과일 뿐이다.또한 납세자가 법인세 부담세액 산정 시 외국납부세액 처리에 관하여 일반적으로 유리한 세액공제방법을 스스로 선택한 결과에서 비롯된 것에 불과하다]."
238525,판례내용,63,따라서 이 사건 조항에 따른 세액공제를 인정하지 않는다고 하여 이 사건 처분이 이중과세금지원칙에 위반된다고 볼 것은 아니다.
238525,판례내용,64,③ 비엔나 협약 위반 여부
238525,판례내용,65,"우리나라가 한·중 조세조약의 취지에 따라 이중과세 방지를 위하여 소득세법 제57조, 법인세법 제57조, 지방세특례제한법 제97조 등에서 외국납부세액 공제제도를 마련하여 운용하고 있고 외국납부세액은 법인세 등에서 충분히 공제가 가능한 이상, 지방 재정 확충을 위하여 법인지방소득세에 한하여 외국납부세액 공제를 허용하지 않는다 하여 비엔나 협약 제62조나 국제법 위반의 문제가 초래된다고 보기도 어렵다."
238525,판례내용,66,④ 신뢰보호원칙 위반 여부
238525,판례내용,67,"조세법의 영역에 있어서는 국가가 조세·재정정책을 탄력적·합리적으로 운용할 필요성이 매우 큰 만큼, 조세에 관한 법규·제도는 신축적으로 변할 수밖에 없다는 점에서 납세자로서는 구법 질서에 의거한 신뢰를 바탕으로 적극적으로 새로운 법률관계를 형성하였다는 등의 특별한 사정이 없는 한, 원칙적으로 현재의 세법 체계가 변함없이 유지되리라고 기대하거나 신뢰할 수는 없다.이 사건에서 원고가 종전의 부가세 방식의 지방소득세 체계 존속에 대하여 가진 신뢰는 단순한 기대에 불과할 뿐이고, 법적으로 보호할 정당한 신뢰가 형성되었다거나 기존의 법에 의하여 이미 형성된 원고의 법적 지위가 부당하게 박탈되었음을 뒷받침할 만한 객관적인 자료를 찾아볼 수 없다."
238525,판례내용,68,따라서 2014년 지방세법 개편으로 지방소득세제가 독립세 방식으로 전환하였고 그 과정에서 법인지방소득세 세액을 산정할 때 법인세 세액감면·공제액을 제외하는 것으로 개정 입법이 이루어졌다고 하여 이 사건 처분이 신뢰보호원칙에 위배된다고 보기 어렵다.
238525,판례내용,69,⑤ 응능부담원칙 위반 여부
238525,판례내용,70,"응능부담원칙은 조세법 영역에서 조세평등주의가 구현되어야 한다는 헌법상의 공평과세원칙을 달리 표현한 것으로서, 그 자체로 모든 세법영역에서 절대적으로 예외 없이 관철되어야 하는 원칙이라고 볼 수 없다.조세정책상의 합리적 필요 등 다른 요청에 의하여 특정한 납세의무자를 차별하더라도 이를 전적으로 위법하다고 평가할 것은 아니다."
