결정례일련번호,구분,문장번호,내용
150092,전문,1,사 건 2019헌마65 기본권 침해 위헌확인
150092,전문,2,청 구 인 김 ○ 태
150092,전문,3,[주 문]
150092,전문,4,이 사건 심판청구를 각하한다.[이 유]
150092,전문,5,"헌법소원심판은 헌법상 보장된 기본권을 침해받은 자가 청구할 수 있으므로(헌법재판소법 제68조 제1항), 헌법소원심판의 청구인은 자신의 기본권에 대한 공권력주체의 제한 행위가 위헌적인 것임을 구체적으로 명확하게 주장하여야 하며, 헌법소원의 청구인이 기본권침해의 가능성을 확인할 수 있을 정도의 구체적 주장을 하지 않고 막연하고, 모호한 주장만을 하는 경우 그 헌법소원은 부적법하다(헌재 2005.2.3."
150092,전문,6,2003헌마544 참조).
150092,전문,7,"청구인은 개헌을 반대하는 정당 또는 무책임한 정당 등의 해산을 요구한다는 취지의 모호한 주장만 할 뿐, 특정한 공권력 행사의 주체나 일자를 전혀 특정하지 않고 그로 인하여 자신의 어떠한 기본권이 침해되었는지에 대하여도 밝히지 않는 등 기본권침해의 가능성을 확인할 수 있을 정도의 구체적인 주장을 하지 않고 있으므로 이와 같은 심판청구는 부적법하다.설령, 청구인이 개헌을 하지 않은 국가의 직무유기를 문제 삼는 것으로 보더라도, 청구인은 이와 동일한 주장을 하며 헌법소원심판청구를 하였다가 헌법소원심판청구의 대상이 될 수 없다는 이유로 각하결정을 받았는바(헌재 2018.12.10."
150092,전문,8,"2018헌마1144), 이 사건 심판청구는 위 결정에서 판시한 적법요건의 흠결을 보완하지 아니한 채 동일한 내용의 심판청구를 되풀이한 것으로서 헌법재판소법 제39조의 일사부재리 원칙에 위배되어 부적법하다.그렇다면 이 사건 심판청구는 부적법하므로 헌법재판소법 제72조 제3항 제4호에 따라 이를 각하하기로 하여 관여 재판관 전원의 일치된 의견으로 주문과 같이 결정한다."
