결정례일련번호,구분,문장번호,내용
142100,전문,1,사 건 2017헌마1158 기본권 침해 위헌확인
142100,전문,2,청 구 인 전 ○ 산
142100,전문,3,[주 문]
142100,전문,4,이 사건 심판청구를 각하한다.[이 유]
142100,전문,5,"청구인은 관련 재판에서 유죄 판결이 확정되기 전에 집행유예취소 인용결정에 대한 재항고를 기각한 대법원 2017모2274 결정의 취소를 구하는 취지의 이 사건 헌법소원심판을 청구하였다.원칙적으로 법원의 재판을 대상으로 하는 헌법소원심판 청구는 허용되지 아니하고(헌법재판소법 제68조 제1항 본문), 헌법재판소가 위헌으로 결정한 법령을 적용함으로써 국민의 기본권을 침해한 재판에 대하여만 헌법재판소법 제68조 제1항에 의한 헌법소원심판을 청구할 수 있는데, 위 2017모2274 사건의 재판은 헌법소원심판의 대상이 될 수 있는 예외적인 재판에 해당하지 않으므로, 위 재판의 취소를 구하는 청구는 부적법하다.그렇다면 이 사건 심판청구는 부적법하므로 헌법재판소법 제72조 제3항 제1호 후문에 따라 이를 각하하기로 하여 관여 재판관 전원의 일치된 의견으로 주문과 같이 결정한다."
