결정례일련번호,구분,문장번호,내용
54876,전문,1,사 건 2017헌마476 부동산소유권이전등기등에관한특별조치법 등 위헌확인
54876,전문,2,청 구 인 한 ○ 권
54876,전문,3,[주 문]
54876,전문,4,이 사건 심판청구를 각하한다.[이 유]
54876,전문,5,"헌법재판소법 제68조 제1항에 따른 헌법소원의 심판은 기본권의 침해사유가 있음을 안 날부터 90일 이내에, 그 사유가 있는 날부터 1년 이내에 청구하여야 하며(헌법재판소법 제69조 제1항), 법령에 대한 헌법소원은 법령시행과 동시에 기본권의 침해를 받게 되는 경우에는 그 법령이 시행된 사실을 안 날부터 90일 이내에, 법령이 시행된 날부터 1년 이내에 헌법소원을 청구하여야 하고, 법령이 시행된 뒤에 비로소 그 법령에 해당하는 사유가 발생하여 기본권의 침해를 받게 되는 경우에는 그 사유가 발생하였음을 안 날부터 90일 이내에, 그 사유가 발생한 날부터 1년 이내에 헌법소원을 청구하여야 한다(헌재 2007.7.26."
54876,전문,6,2006헌마1164).
54876,전문,7,"청구인은 ‘부동산소유권 이전등기 등에 관한 특별조치법’에 대하여 이 사건 헌법소원심판을 청구하였으나, 청구인이 조부와 부가 공동 소유한 토지가 위 법에 따라 이전되었다고 주장하는 1980년으로부터 1년이 지난 2017.4.28."
54876,전문,8,"이 사건 헌법소원심판을 청구하였으므로, 이 사건 심판청구는 청구기간을 준수하지 못하여 부적법하다.이 사건 심판청구는 부적법하므로 헌법재판소법 제72조 제3항 제2호에 따라 이를 각하한다."
