결정례일련번호,구분,문장번호,내용
145771,전문,1,사 건 2018헌마158 농어촌 등 보건의료를 위한 특별조치법 제7조 제1항 위헌확인
145771,전문,2,청 구 인 박 ○ 태
145771,전문,3,[주 문]
145771,전문,4,이 사건 심판청구를 각하한다.[이 유]
145771,전문,5,"청구인은 2017년 4월부터 한의사로서 공중보건의사로 근무하는 사람이다.청구인은 공중보건의사의 의무복무기간은 교육소집기간 외에 3년으로 변화가 없었으나, 현역병의 복무기간은 여러 차례 단축되어 평등권이 침해되었다고 주장하면서, 공중보건의사의 의무복무기간을 정한 ‘농어촌 등 보건의료를 위한 특별조치법’ 제7조 제1항에 대하여 2018.2.12."
145771,전문,6,"헌법소원심판을 청구하였다.법령에 대한 헌법소원은, 자신에게 법령에 해당하는 사유가 발생하였음을 안 날부터 90일 이내에, 그 사유가 발생한 날부터 1년 이내에 헌법소원을 청구하여야 한다.‘농어촌 등 보건의료를 위한 특별조치법’ 제7조 제1항은 2016.5.29."
145771,전문,7,"법률 제14183호로 개정되어 2016.11.30.부터 시행되었다.청구인은 2017년 4월 경 공중보건의사가 되어 위 조항으로 인한 기본권의 제한을 받게 되었고, 그 뒤로 공중보건의사나 현역병의 복무기간이 변경되지 않았다.따라서 청구인이 공중보건의사로서 병역의무를 이행하기로 선택하여 복무하기 시작한 때 공중보건의사의 복무기간 및 현역병과 공중보건의사의 복무기간이 다르다는 사실을 알았다고 인정되고, 이 때로부터 90일이 지난 뒤 이루어진 이 사건 심판청구는 청구기간이 지나 부적법하다.그렇다면 이 사건 심판청구는 부적법하므로 각하하기로 하여 관여 재판관 전원의 일치된 의견으로 주문과 같이 결정한다."
